paperId,url,title,abstract,year,referenceCount,citationCount,influentialCitationCount,isOpenAccess,fieldsOfStudy/0,authors/0/authorId,authors/0/name,authors/1/authorId,authors/1/name,authors/2/authorId,authors/2/name,authors/3/authorId,authors/3/name,authors/4/authorId,authors/4/name,authors/5/authorId,authors/5/name,authors/6/authorId,authors/6/name,fieldsOfStudy/1,fieldsOfStudy/2,authors/7/authorId,authors/7/name,fieldsOfStudy/3,authors/8/authorId,authors/8/name,authors/9/authorId,authors/9/name,authors/10/authorId,authors/10/name,authors/11/authorId,authors/11/name,authors/12/authorId,authors/12/name,authors/13/authorId,authors/13/name,authors/14/authorId,authors/14/name,authors/15/authorId,authors/15/name,authors/16/authorId,authors/16/name
d474299d7a51b89a1d7394d426cf881a89b8013d,https://www.semanticscholar.org/paper/d474299d7a51b89a1d7394d426cf881a89b8013d,Efficient distribution-free learning of probabilistic concepts,"A model of machine learning in which the concept to be learned may exhibit uncertain or probabilistic behavior is investigated. Such probabilistic concepts (or p-concepts) may arise in situations such as weather prediction, where the measured variables and their accuracy are insufficient to determine the outcome with certainty. It is required that learning algorithms be both efficient and general in the sense that they perform well for a wide class of p-concepts and for any distribution over the domain. Many efficient algorithms for learning natural classes of p-concepts are given, and an underlying theory of learning p-concepts is developed in detail.<<ETX>>",1990,28,433,41,false,Computer Science,2056642528,M. Kearns,1716301,R. Schapire,,,,,,,,,,,,,,,,,,,,,,,,,,,,,,,,,
c8e4d8ded0624f13cd7763b8e7a62fe7e36da6d3,https://www.semanticscholar.org/paper/c8e4d8ded0624f13cd7763b8e7a62fe7e36da6d3,Generalizing from a Few Examples: A Survey on Few-Shot Learning,"Machine learning has been highly successful in data-intensive applications but is often hampered when the data set is small. Recently, Few-Shot Learning (FSL) is proposed to tackle this problem. Using prior knowledge, FSL can rapidly generalize to new tasks containing only a few samples with supervised information. In this paper, we conduct a thorough survey to fully understand FSL. Starting from a formal definition of FSL, we distinguish FSL from several relevant machine learning problems. We then point out that the core issue in FSL is that the empirical risk minimized is unreliable. Based on how prior knowledge can be used to handle this core issue, we categorize FSL methods from three perspectives: (i) data, which uses prior knowledge to augment the supervised experience; (ii) model, which uses prior knowledge to reduce the size of the hypothesis space; and (iii) algorithm, which uses prior knowledge to alter the search for the best hypothesis in the given hypothesis space. With this taxonomy, we review and discuss the pros and cons of each category. Promising directions, in the aspects of the FSL problem setups, techniques, applications and theories, are also proposed to provide insights for future research.",2019,193,838,60,false,Computer Science,2115793087,Yaqing Wang,3259992,Quanming Yao,145193332,J. Kwok,1726587,L. Ni,,,,,,,,,,,,,,,,,,,,,,,,,,,,,
a3046db7e02e302fe9661074e238be790f52c3b0,https://www.semanticscholar.org/paper/a3046db7e02e302fe9661074e238be790f52c3b0,"Feature Extraction, Construction and Selection: A Data Mining Perspective","From the Publisher: 
The book can be used by researchers and graduate students in machine learning, data mining, and knowledge discovery, who wish to understand techniques of feature extraction, construction and selection for data pre-processing and to solve large size, real-world problems. The book can also serve as a reference book for those who are conducting research about feature extraction, construction and selection, and are ready to meet the exciting challenges ahead of us.",1998,0,1025,26,true,Computer Science,2146397025,Huan Liu,1748072,H. Motoda,,,,,,,,,,,,,,,,,,,,,,,,,,,,,,,,,
ca4b40a6a28d057e74882b16f7b84520e347e37b,https://www.semanticscholar.org/paper/ca4b40a6a28d057e74882b16f7b84520e347e37b,Machine Learning,,2017,42,64,1,false,,2571273,I. E. Naqa,30436861,M. Murphy,,,,,,,,,,,,,,,,,,,,,,,,,,,,,,,,,
d050a486dfaf0d0de7af14a5af5ff5a29a151b67,https://www.semanticscholar.org/paper/d050a486dfaf0d0de7af14a5af5ff5a29a151b67,Alleviating naive Bayes attribute independence assumption by attribute weighting,"Despite the simplicity of the Naive Bayes classifier, it has continued to perform well against more sophisticated newcomers and has remained, therefore, of great interest to the machine learning community. Of numerous approaches to refining the naive Bayes classifier, attribute weighting has received less attention than it warrants. Most approaches, perhaps influenced by attribute weighting in other machine learning algorithms, use weighting to place more emphasis on highly predictive attributes than those that are less predictive. In this paper, we argue that for naive Bayes attribute weighting should instead be used to alleviate the conditional independence assumption. Based on this premise, we propose a weighted naive Bayes algorithm, called WANBIA, that selects weights to minimize either the negative conditional log likelihood or the mean squared error objective functions. We perform extensive evaluations and find that WANBIA is a competitive alternative to state of the art classifiers like Random Forest, Logistic Regression and A1DE.",2013,49,157,13,false,Mathematics,33899189,Nayyar Zaidi,1838956,J. Cerquides,2170598,Mark James Carman,1726660,Geoffrey I. Webb,,,,,,,Computer Science,,,,,,,,,,,,,,,,,,,,,,
a9c8124b18c0e843878f2df4d49da6f250dc06e7,https://www.semanticscholar.org/paper/a9c8124b18c0e843878f2df4d49da6f250dc06e7,Decomposition of Uncertainty in Bayesian Deep Learning for Efficient and Risk-sensitive Learning,"© 2018 35th International Conference on Machine Learning, ICML 2018. All rights reserved. Bayesian neural networks with latent variables are scalable and flexible probabilistic models: They account for uncertainty in the estimation of the network weights and, by making use of latent variables, can capture complex noise patterns in the : data. Using these models we show how to per- ∗ form and utilize a decomposition of uncertainty in • aleatoric and epistemic components for decision making purposes. This allows us to successfully identify informative points for active learning of functions with heteroscedastic and bimodal noise. ' t Using the decomposition we further define a novel risk-sensitive criterion for reinforcement learning to identify policies that balance expected cost, model-bias and noise aversion.",2017,42,200,16,false,Computer Science,3407086,Stefan Depeweg,1388574431,José Miguel Hernández-Lobato,1388372395,Finale Doshi-Velez,1699265,S. Udluft,,,,,,,,,,,,,,,,,,,,,,,,,,,,,
78989616eeeac55b202e3e4205225e7135054185,https://www.semanticscholar.org/paper/78989616eeeac55b202e3e4205225e7135054185,An Introduction to Deep Learning for the Physical Layer,"We present and discuss several novel applications of deep learning for the physical layer. By interpreting a communications system as an autoencoder, we develop a fundamental new way to think about communications system design as an end-to-end reconstruction task that seeks to jointly optimize transmitter and receiver components in a single process. We show how this idea can be extended to networks of multiple transmitters and receivers and present the concept of radio transformer networks as a means to incorporate expert domain knowledge in the machine learning model. Lastly, we demonstrate the application of convolutional neural networks on raw IQ samples for modulation classification which achieves competitive accuracy with respect to traditional schemes relying on expert features. This paper is concluded with a discussion of open challenges and areas for future investigation.",2017,75,1446,140,true,Computer Science,1388350203,Tim O'Shea,1749686,J. Hoydis,,,,,,,,,,,Mathematics,,,,,,,,,,,,,,,,,,,,,,
1b570ed4b58908444465823880cb88fbb812b4fc,https://www.semanticscholar.org/paper/1b570ed4b58908444465823880cb88fbb812b4fc,Evading Machine Learning Malware Detection,"Machine learning is a popular approach to signatureless malware detection because it can generalize to never-beforeseen malware families and polymorphic strains. This has resulted in its practical use for either primary detection engines or supplementary heuristic detections by anti-malware vendors. Recent work in adversarial machine learning has shown that models are susceptible to gradient-based and other attacks. In this whitepaper, we summarize the various attacks that have been proposed for machine learning models in information security, each which require the adversary to have some degree of knowledge about the model under attack. Importantly, even when applied to attacking machine learning malware classifier based on static features for Windows portable executable (PE) files, these attacks, previous attack methodologies may break the format or functionality of the malware. We investigate a more general framework for attacking static PE anti-malware engines based on reinforcement learning, which models more realistic attacker conditions, and subsequently has provides much more modest evasion rates. A reinforcement learning (RL) agent is equipped with a set of functionality-preserving operations that it may perform on the PE file. It learns through a series of games played against the anti-malware engine which sequence of operations is most likely to result in evasion for a given malware sample. Given the general framework, it is not surprising that the evasion rates are modest. However, the resulting RL agent can succinctly summarize blind spots of the anti-malware model. Additionally, evasive variants generated by the agent may be used to harden machine learning anti-malware engine via adversarial training.",2017,25,111,10,false,,2639880,H. Anderson,,,,,,,,,,,,,,,,,,,,,,,,,,,,,,,,,,,
5fea87373f3e21ffd6d277474f5d707f5f4f422a,https://www.semanticscholar.org/paper/5fea87373f3e21ffd6d277474f5d707f5f4f422a,Machine learning approach for text and document mining,"Text Categorization (TC), also known as Text Classification, is the task of automatically classifying a set of text documents into different categories from a predefined set. If a document belongs to exactly one of the categories, it is a single-label classification task; otherwise, it is a multi-label classification task. TC uses several tools from Information Retrieval (IR) and Machine Learning (ML) and has received much attention in the last years from both researchers in the academia and industry developers. In this paper, we first categorize the documents using KNN based machine learning approach and then return the most relevant documents.",2014,24,227,5,true,Computer Science,2859448,Vishwanath Bijalwan,2132235638,P. Kumari,34970250,Jordán Pascual Espada,2408385,V. B. Semwal,,,,,,,,,,,,,,,,,,,,,,,,,,,,,
58532d01140efd38c4d911e984e0845539d2db39,https://www.semanticscholar.org/paper/58532d01140efd38c4d911e984e0845539d2db39,SFO: A Toolbox for Submodular Function Optimization,"In recent years, a fundamental problem structure has emerged as very useful in a variety of machine learning applications: Submodularity is an intuitive diminishing returns property, stating that adding an element to a smaller set helps more than adding it to a larger set. Similarly to convexity, submodularity allows one to efficiently find provably (near-) optimal solutions for large problems. We present SFO, a toolbox for use in MATLAB or Octave that implements algorithms for minimization and maximization of submodular functions. A tutorial script illustrates the application of submodularity to machine learning and AI problems such as feature selection, clustering, inference and optimized information gathering.",2010,16,103,4,false,Mathematics,145343838,Andreas Krause,,,,,,,,,,,,,Computer Science,,,,,,,,,,,,,,,,,,,,,,
34fa2515a259b4ff2aecb100a35e56019d62cd66,https://www.semanticscholar.org/paper/34fa2515a259b4ff2aecb100a35e56019d62cd66,Hyperparameter Optimization,,2019,170,84,0,true,Computer Science,2868444,Matthias Feurer,144661829,F. Hutter,,,,,,,,,,,,,,,,,,,,,,,,,,,,,,,,,
d4849d29b27a8e5230edafe4cd4cdda395fb24d4,https://www.semanticscholar.org/paper/d4849d29b27a8e5230edafe4cd4cdda395fb24d4,Meta optimization: improving compiler heuristics with machine learning,"Compiler writers have crafted many heuristics over the years to approximately solve NP-hard problems efficiently. Finding a heuristic that performs well on a broad range of applications is a tedious and difficult process. This paper introduces Meta Optimization, a methodology for automatically fine-tuning compiler heuristics. Meta Optimization uses machine-learning techniques to automatically search the space of compiler heuristics. Our techniques reduce compiler design complexity by relieving compiler writers of the tedium of heuristic tuning. Our machine-learning system uses an evolutionary algorithm to automatically find effective compiler heuristics. We present promising experimental results. In one mode of operation Meta Optimization creates application-specific heuristics which often result in impressive speedups. For hyperblock formation, one optimization we present in this paper, we obtain an average speedup of 23% (up to 73%) for the applications in our suite. Furthermore, by evolving a compiler's heuristic over several benchmarks, we can create effective, general-purpose heuristics. The best general-purpose heuristic our system found for hyperblock formation improved performance by an average of 25% on our training set, and 9% on a completely unrelated test set. We demonstrate the efficacy of our techniques on three different optimizations in this paper: hyperblock formation, register allocation, and data prefetching.",2003,25,306,20,false,Computer Science,1652011517,M. Stephenson,1709150,Saman P. Amarasinghe,150220413,M. Martin,1401846156,U. O'Reilly,,,,,,,,,,,,,,,,,,,,,,,,,,,,,
819167ace2f0caae7745d2f25a803979be5fbfae,https://www.semanticscholar.org/paper/819167ace2f0caae7745d2f25a803979be5fbfae,The Limitations of Deep Learning in Adversarial Settings,"Deep learning takes advantage of large datasets and computationally efficient training algorithms to outperform other approaches at various machine learning tasks. However, imperfections in the training phase of deep neural networks make them vulnerable to adversarial samples: inputs crafted by adversaries with the intent of causing deep neural networks to misclassify. In this work, we formalize the space of adversaries against deep neural networks (DNNs) and introduce a novel class of algorithms to craft adversarial samples based on a precise understanding of the mapping between inputs and outputs of DNNs. In an application to computer vision, we show that our algorithms can reliably produce samples correctly classified by human subjects but misclassified in specific targets by a DNN with a 97% adversarial success rate while only modifying on average 4.02% of the input features per sample. We then evaluate the vulnerability of different sample classes to adversarial perturbations by defining a hardness measure. Finally, we describe preliminary work outlining defenses against adversarial samples by defining a predictive measure of distance between a benign input and a target classification.",2015,40,2879,398,true,Computer Science,1967156,Nicolas Papernot,144061974,P. Mcdaniel,1680133,S. Jha,2623167,Matt Fredrikson,144643812,Z. B. Celik,144231976,A. Swami,,,Mathematics,,,,,,,,,,,,,,,,,,,,,,
18dd17656c42322e943deaedc4eee6400debe7c2,https://www.semanticscholar.org/paper/18dd17656c42322e943deaedc4eee6400debe7c2,FedML: A Research Library and Benchmark for Federated Machine Learning,"Federated learning is a rapidly growing research field in the machine learning domain. Although considerable research efforts have been made, existing libraries cannot adequately support diverse algorithmic development (e.g., diverse topology and flexible message exchange), and inconsistent dataset and model usage in experiments make fair comparisons difficult. In this work, we introduce FedML, an open research library and benchmark that facilitates the development of new federated learning algorithms and fair performance comparisons. FedML supports three computing paradigms (distributed training, mobile on-device training, and standalone simulation) for users to conduct experiments in different system environments. FedML also promotes diverse algorithmic research with flexible and generic API design and reference baseline implementations. A curated and comprehensive benchmark dataset for the non-I.I.D setting aims at making a fair comparison. We believe FedML can provide an efficient and reproducible means of developing and evaluating algorithms for the federated learning research community. We maintain the source code, documents, and user community at this https URL.",2020,161,207,33,false,Computer Science,31927890,Chaoyang He,2239461,Songze Li,144491689,Jinhyun So,2116031156,Mi Zhang,2109798334,Hongyi Wang,2118775509,Xiaoyang Wang,2927870,Praneeth Vepakomma,Mathematics,,2034349211,Abhishek Singh,,49660254,Han Qiu,2144035454,Li Shen,144259957,P. Zhao,1505828520,Yan Kang,1614034792,Yang Liu,145711633,R. Raskar,153096457,Qiang Yang,145599558,M. Annavaram,121011351,S. Avestimehr
154887a2a15e6f6ea2a26c2bfdf1d755a434f472,https://www.semanticscholar.org/paper/154887a2a15e6f6ea2a26c2bfdf1d755a434f472,Prototype vector machine for large scale semi-supervised learning,"Practical data mining rarely falls exactly into the supervised learning scenario. Rather, the growing amount of unlabeled data poses a big challenge to large-scale semi-supervised learning (SSL). We note that the computational intensiveness of graph-based SSL arises largely from the manifold or graph regularization, which in turn lead to large models that are difficult to handle. To alleviate this, we proposed the prototype vector machine (PVM), a highly scalable, graph-based algorithm for large-scale SSL. Our key innovation is the use of ""prototypes vectors"" for efficient approximation on both the graph-based regularizer and model representation. The choice of prototypes are grounded upon two important criteria: they not only perform effective low-rank approximation of the kernel matrix, but also span a model suffering the minimum information loss compared with the complete model. We demonstrate encouraging performance and appealing scaling properties of the PVM on a number of machine learning benchmark data sets.",2009,24,95,5,true,Computer Science,2152986588,Kai Zhang,145193332,J. Kwok,35170576,B. Parvin,,,,,,,,,,,,,,,,,,,,,,,,,,,,,,,
d411a4a89f6648198dc171eadcad654921426ddc,https://www.semanticscholar.org/paper/d411a4a89f6648198dc171eadcad654921426ddc,Robust extreme learning machine,,2013,36,133,6,false,Mathematics,2858250,Punyaphol Horata,2376043,S. Chiewchanwattana,1888267,K. Sunat,,,,,,,,,Computer Science,,,,,,,,,,,,,,,,,,,,,,
3ced109e0c16014cf4cdd677aeb1b95acf1c35d6,https://www.semanticscholar.org/paper/3ced109e0c16014cf4cdd677aeb1b95acf1c35d6,How to represent crystal structures for machine learning: Towards fast prediction of electronic properties,"High-throughput density functional calculations of solids are highly time-consuming. As an alternative, we propose a machine learning approach for the fast prediction of solid-state properties. To achieve this, local spin-density approximation calculations are used as a training set. We focus on predicting the value of the density of electronic states at the Fermi energy. We find that conventional representations of the input data, such as the Coulomb matrix, are not suitable for the training of learning machines in the case of periodic solids. We propose a novel crystal structure representation for which learning and competitive prediction accuracies become possible within an unrestricted class of spd systems of arbitrary unit-cell size.",2013,42,291,4,true,Computer Science,51257580,K. T. Schutt,50359998,H. Glawe,3468686,F. Brockherde,50750682,A. Sanna,116099820,K. Muller,145191157,E. Gross,,,Physics,,,,,,,,,,,,,,,,,,,,,,
724a2430522c7c398c01f90330f41e187c6a7243,https://www.semanticscholar.org/paper/724a2430522c7c398c01f90330f41e187c6a7243,Gaussian Processes for Ordinal Regression,"We present a probabilistic kernel approach to ordinal regression based on Gaussian processes. A threshold model that generalizes the probit function is used as the likelihood function for ordinal variables. Two inference techniques, based on the Laplace approximation and the expectation propagation algorithm respectively, are derived for hyperparameter learning and model selection. We compare these two Gaussian process approaches with a previous ordinal regression method based on support vector machines on some benchmark and real-world data sets, including applications of ordinal regression to collaborative filtering and gene expression analysis. Experimental results on these data sets verify the usefulness of our approach.",2005,55,448,59,false,Mathematics,2057046890,Wei Chu,1744700,Zoubin Ghahramani,,,,,,,,,,,Computer Science,,,,,,,,,,,,,,,,,,,,,,
8cdaef7f852bf5c4b87a5f9f740d15f221be0a5a,https://www.semanticscholar.org/paper/8cdaef7f852bf5c4b87a5f9f740d15f221be0a5a,Machine Learning and Portfolio Optimization,"The portfolio optimization model has limited impact in practice because of estimation issues when applied to real data. To address this, we adapt two machine learning methods, regularization and cross-validation, for portfolio optimization. First, we introduce performance-based regularization PBR, where the idea is to constrain the sample variances of the estimated portfolio risk and return, which steers the solution toward one associated with less estimation error in the performance. We consider PBR for both mean-variance and mean-conditional value-at-risk CVaR problems. For the mean-variance problem, PBR introduces a quartic polynomial constraint, for which we make two convex approximations: one based on rank-1 approximation and another based on a convex quadratic approximation. The rank-1 approximation PBR adds a bias to the optimal allocation, and the convex quadratic approximation PBR shrinks the sample covariance matrix. For the mean-CVaR problem, the PBR model is a combinatorial optimization problem, but we prove its convex relaxation, a quadratically constrained quadratic program, is essentially tight. We show that the PBR models can be cast as robust optimization problems with novel uncertainty sets and establish asymptotic optimality of both sample average approximation SAA and PBR solutions and the corresponding efficient frontiers. To calibrate the right-hand sides of the PBR constraints, we develop new, performance-based k-fold cross-validation algorithms. Using these algorithms, we carry out an extensive empirical investigation of PBR against SAA, as well as L1 and L2 regularizations and the equally weighted portfolio. We find that PBR dominates all other benchmarks for two out of three Fama-French data sets. 
 
This paper was accepted by Yinyu Ye, optimization.",2018,72,125,9,true,Mathematics,103243641,Gah-Yi Ban,22702756,N. E. Karoui,40447874,Andrew E. B. Lim,,,,,,,,,Computer Science,,,,,,,,,,,,,,,,,,,,,,
bd9ecc05a12563445a2ef4fe758a39d7f2bcda0d,https://www.semanticscholar.org/paper/bd9ecc05a12563445a2ef4fe758a39d7f2bcda0d,DeltaGrad: Rapid retraining of machine learning models,"Machine learning models are not static and may need to be retrained on slightly changed datasets, for instance, with the addition or deletion of a set of data points. This has many applications, including privacy, robustness, bias reduction, and uncertainty quantifcation. However, it is expensive to retrain models from scratch. To address this problem, we propose the DeltaGrad algorithm for rapid retraining machine learning models based on information cached during the training phase. We provide both theoretical and empirical support for the effectiveness of DeltaGrad, and show that it compares favorably to the state of the art.",2020,68,57,7,false,Computer Science,3037003,Yinjun Wu,2694895,Edgar Dobriban,49702692,S. Davidson,,,,,,,,,Mathematics,,,,,,,,,,,,,,,,,,,,,,
ffb9404d53b5cfcecf8fc7dbf85257c560f135a4,https://www.semanticscholar.org/paper/ffb9404d53b5cfcecf8fc7dbf85257c560f135a4,Machine learning in materials science,,2019,145,152,3,true,,2141564635,Jing Wei,2048654183,Xuan Chu,93425239,Xiangyu Sun,2113451966,Kun Xu,48470691,H. Deng,1940653397,Jigen Chen,6095903,Zhongming Wei,,,47805251,M. Lei,,,,,,,,,,,,,,,,,,,
