paperId,url,title,abstract,year,referenceCount,citationCount,influentialCitationCount,isOpenAccess,fieldsOfStudy/0,authors/0/authorId,authors/0/name,authors/1/authorId,authors/1/name,authors/2/authorId,authors/2/name,authors/3/authorId,authors/3/name,authors/4/authorId,authors/4/name,authors/5/authorId,authors/5/name,authors/6/authorId,authors/6/name,fieldsOfStudy/1,fieldsOfStudy/2,authors/7/authorId,authors/7/name,fieldsOfStudy/3,authors/8/authorId,authors/8/name,authors/9/authorId,authors/9/name,authors/10/authorId,authors/10/name,authors/11/authorId,authors/11/name,authors/12/authorId,authors/12/name,authors/13/authorId,authors/13/name,authors/14/authorId,authors/14/name,authors/15/authorId,authors/15/name,authors/16/authorId,authors/16/name
c9742f2fcf29f759f02ec0446c019eec5372a771,https://www.semanticscholar.org/paper/c9742f2fcf29f759f02ec0446c019eec5372a771,On Kernel Methods for Relational Learning,"Kernel methods have gained a great deal of popularity in the machine learning community as a method to learn indirectly in high-dimensional feature spaces. Those interested in relational learning have recently begun to cast learning from structured and relational data in terms of kernel operations. 
 
We describe a general family of kernel functions built up from a description language of limited expressivity and use it to study the benefits and drawbacks of kernel learning in relational domains. Learning with kernels in this family directly models learning over an expanded feature space constructed using the same description language. This allows us to examine issues of time complexity in terms of learning with these and other relational kernels, and how these relate to generalization ability. The tradeoffs between using kernels in a very high dimensional implicit space versus a restricted feature space, is highlighted through two experiments, in bioinformatics and in natural language processing.",2003,28,151,8,false,Mathematics,2019029,Chad M. Cumby,144590225,D. Roth,,,,,,,,,,,Computer Science,,,,,,,,,,,,,,,,,,,,,,
9ae9d2b060e50094be7e473e449f192403019225,https://www.semanticscholar.org/paper/9ae9d2b060e50094be7e473e449f192403019225,Multitask learning and benchmarking with clinical time series data,,2017,94,502,86,true,Mathematics,144787340,Hrayr Harutyunyan,1729527,Hrant Khachatrian,2107807,David C. Kale,143728483,A. Galstyan,,,,,,,Computer Science,Biology,,,Medicine,,,,,,,,,,,,,,,,,,
033f7570be9877c5a4bcbb71f6aec8f95cee3608,https://www.semanticscholar.org/paper/033f7570be9877c5a4bcbb71f6aec8f95cee3608,To understand deep learning we need to understand kernel learning,"Generalization performance of classifiers in deep learning has recently become a subject of intense study. Deep models, typically over-parametrized, tend to fit the training data exactly. Despite this ""overfitting"", they perform well on test data, a phenomenon not yet fully understood. 
The first point of our paper is that strong performance of overfitted classifiers is not a unique feature of deep learning. Using six real-world and two synthetic datasets, we establish experimentally that kernel machines trained to have zero classification or near zero regression error perform very well on test data, even when the labels are corrupted with a high level of noise. We proceed to give a lower bound on the norm of zero loss solutions for smooth kernels, showing that they increase nearly exponentially with data size. We point out that this is difficult to reconcile with the existing generalization bounds. Moreover, none of the bounds produce non-trivial results for interpolating solutions. 
Second, we show experimentally that (non-smooth) Laplacian kernels easily fit random labels, a finding that parallels results for ReLU neural networks. In contrast, fitting noisy data requires many more epochs for smooth Gaussian kernels. Similar performance of overfitted Laplacian and Gaussian classifiers on test, suggests that generalization is tied to the properties of the kernel function rather than the optimization process. 
Certain key phenomena of deep learning are manifested similarly in kernel methods in the modern ""overfitted"" regime. The combination of the experimental and theoretical results presented in this paper indicates a need for new theoretical ideas for understanding properties of classical kernel methods. We argue that progress on understanding deep learning will be difficult until more tractable ""shallow"" kernel methods are better understood.",2018,57,296,27,false,Computer Science,145520115,Mikhail Belkin,143791100,Siyuan Ma,151213231,Soumik Mandal,,,,,,,,,Mathematics,,,,,,,,,,,,,,,,,,,,,,
b96472233dbe7ec745bcb4304d5de86a2ca03778,https://www.semanticscholar.org/paper/b96472233dbe7ec745bcb4304d5de86a2ca03778,Combining linguistic and machine learning techniques for email summarization,"This paper shows that linguistic techniques along with machine learning can extract high quality noun phrases for the purpose of providing the gist or summary of email messages. We describe a set of comparative experiments using several machine learning algorithms for the task of salient noun phrase extraction. Three main conclusions can be drawn from this study: (i) the modifiers of a noun phrase can be semantically as important as the head for the task of gisting, (ii) linguistic filtering improves the performance of machine learning algorithms, (iii) a combination of classifiers improves accuracy.",2001,40,66,4,true,Computer Science,2295928,S. Muresan,2601166,E. Tzoukermann,1761739,Judith L. Klavans,,,,,,,,,,,,,,,,,,,,,,,,,,,,,,,
475eb84d8e056aeec4b994e94df2be50fa38dfbc,https://www.semanticscholar.org/paper/475eb84d8e056aeec4b994e94df2be50fa38dfbc,GraphLab: A New Parallel Framework for Machine Learning,,2010,0,469,55,false,Computer Science,1680638,Y. Low,2119113835,Joseph Gonzalez,1717990,Aapo Kyrola,1741745,D. Bickson,1730156,Carlos Guestrin,1695576,J. Hellerstein,,,,,,,,,,,,,,,,,,,,,,,,,
892edbdb6e424cd8c1d6f23a2c9d77fffef7d45c,https://www.semanticscholar.org/paper/892edbdb6e424cd8c1d6f23a2c9d77fffef7d45c,Machine Learning Approach to Modeling Sediment Transport,"Inaccuracies of sediment transport models largely originate from our limitation to describe the process in precise mathematical terms. Machine learning (ML) is an alternative approach to reduce the inaccuracies of sedimentation models. It utilizes available domain knowledge for selecting the input and output variables for the ML models and uses modern regression techniques to fit the measured data. Two ML methods, artificial neural networks and model trees, are adopted to model bed-load and total-load transport using the measured data. The bed-load transport models are compared with the models due to Bagnold, Einstein, Parker et al., and van Rijn. The total-load transport models are compared with the models due to Ackers and White, Bagnold, Engelund and Hansen, and van Rijn. With the chosen data sets on bed-load and total-load transport the ML models provided better accuracy than the existing ones.",2007,45,177,11,false,Engineering,95970828,B. Bhattacharya,50784215,R. Price,1895474,D. Solomatine,,,,,,,,,,,,,,,,,,,,,,,,,,,,,,,
09c5931307cba3f80d3ecc14d02eecfa46463cfe,https://www.semanticscholar.org/paper/09c5931307cba3f80d3ecc14d02eecfa46463cfe,MLPACK: a scalable C++ machine learning library,"MLPACK is a state-of-the-art, scalable, multi-platform C++ machine learning library released in late 2011 offering both a simple, consistent API accessible to novice users and high performance and flexibility to expert users by leveraging modern features of C++. MLPACK provides cutting-edge algorithms whose benchmarks exhibit far better performance than other leading machine learning libraries. MLPACK version 1.0.3, licensed under the LGPL, is available at http://www.mlpack.org.",2012,17,159,17,false,Computer Science,34658148,Ryan R. Curtin,3264504,J. R. Cline,2101842823,N. P. Slagle,1769646,William B. March,2944292,P. Ram,144447714,Nishant A. Mehta,1703070,Alexander G. Gray,,,,,,,,,,,,,,,,,,,,,,,
b21917c1980df0fa5a8a74bcd29136cdd9b4b993,https://www.semanticscholar.org/paper/b21917c1980df0fa5a8a74bcd29136cdd9b4b993,Active Learning with Support Vector Machine Applied to Gene Expression Data for Cancer Classification,"There is growing interest in the application of machine learning techniques in bioinformatics. The supervised machine learning approach has been widely applied to bioinformatics and gained a lot of success in this research area. With this learning approach researchers first develop a large training set, which is a time-consuming and costly process. Moreover, the proportion of the positive examples and negative examples in the training set may not represent the real-world data distribution, which causes concept drift. Active learning avoids these problems. Unlike most conventional learning methods where the training set used to derive the model remains static, the classifier can actively choose the training data and the size of training set increases. We introduced an algorithm for performing active learning with support vector machine and applied the algorithm to gene expression profiles of colon cancer, lung cancer, and prostate cancer samples. We compared the classification performance of active learning with that of passive learning. The results showed that employing the active learning method can achieve high accuracy and significantly reduce the need for labeled training instances. For lung cancer classification, to achieve 96% of the total positives, only 31 labeled examples were needed in active learning whereas in passive learning 174 labeled examples were required. That meant over 82% reduction was realized by active learning. In active learning the areas under the receiver operating characteristic (ROC) curves were over 0.81, while in passive learning the areas under the ROC curves were below 0.50.",2004,32,177,5,false,Computer Science,49421151,Y. Liu,,,,,,,,,,,,,Medicine,,,,,,,,,,,,,,,,,,,,,,
971766088dfaf63fb55e6f0190b14f28f2c98ad0,https://www.semanticscholar.org/paper/971766088dfaf63fb55e6f0190b14f28f2c98ad0,A Survey of Data Mining and Machine Learning Methods for Cyber Security Intrusion Detection,"This survey paper describes a focused literature survey of machine learning (ML) and data mining (DM) methods for cyber analytics in support of intrusion detection. Short tutorial descriptions of each ML/DM method are provided. Based on the number of citations or the relevance of an emerging method, papers representing each method were identified, read, and summarized. Because data are so important in ML/DM approaches, some well-known cyber data sets used in ML/DM are described. The complexity of ML/DM algorithms is addressed, discussion of challenges for using ML/DM for cyber security is presented, and some recommendations on when to use a given method are provided.",2016,116,862,42,false,Computer Science,2343019,A. Buczak,1922657,Erhan Guven,,,,,,,,,,,,,,,,,,,,,,,,,,,,,,,,,
76cb5a926a789e1f28035fcc7fa01d5900df6d0e,https://www.semanticscholar.org/paper/76cb5a926a789e1f28035fcc7fa01d5900df6d0e,Perceptron-based learning algorithms,"A key task for connectionist research is the development and analysis of learning algorithms. An examination is made of several supervised learning algorithms for single-cell and network models. The heart of these algorithms is the pocket algorithm, a modification of perceptron learning that makes perceptron learning well-behaved with nonseparable training data, even if the data are noisy and contradictory. Features of these algorithms include speed algorithms fast enough to handle large sets of training data; network scaling properties, i.e. network methods scale up almost as well as single-cell models when the number of inputs is increased; analytic tractability, i.e. upper bounds on classification error are derivable; online learning, i.e. some variants can learn continually, without referring to previous data; and winner-take-all groups or choice groups, i.e. algorithms can be adapted to select one out of a number of possible classifications. These learning algorithms are suitable for applications in machine learning, pattern recognition, and connectionist expert systems.",1990,26,519,33,false,Computer Science,2889692,S. I. Gallant,,,,,,,,,,,,,Medicine,,,,,,,,,,,,,,,,,,,,,,
22adb2413901b74128f2a02584dafa77afbd8d60,https://www.semanticscholar.org/paper/22adb2413901b74128f2a02584dafa77afbd8d60,Highly Accurate Machine Fault Diagnosis Using Deep Transfer Learning,"We develop a novel deep learning framework to achieve highly accurate machine fault diagnosis using transfer learning to enable and accelerate the training of deep neural network. Compared with existing methods, the proposed method is faster to train and more accurate. First, original sensor data are converted to images by conducting a Wavelet transformation to obtain time-frequency distributions. Next, a pretrained network is used to extract lower level features. The labeled time-frequency images are then used to fine-tune the higher levels of the neural network architecture. This paper creates a machine fault diagnosis pipeline and experiments are carried out to verify the effectiveness and generalization of the pipeline on three main mechanical datasets including induction motors, gearboxes, and bearings with sizes of 6000, 9000, and 5000 time series samples, respectively. We achieve state-of-the-art results on each dataset, with most datasets showing test accuracy near 100%, and in the gearbox dataset, we achieve significant improvement from 94.8% to 99.64%. We created a repository including these datasets located at mlmechanics.ics.uci.edu.",2019,0,422,24,false,Computer Science,9122533,Siyu Shao,143953836,S. McAleer,35374692,Ruqiang Yan,144902513,P. Baldi,,,,,,,,,,,,,,,,,,,,,,,,,,,,,
799f927692a6c08c5e630bea78c087c5051528fc,https://www.semanticscholar.org/paper/799f927692a6c08c5e630bea78c087c5051528fc,Self-Directed Learning,"A widely advocated idea in education is that people learn better when the flow of experience is under their control (i.e., learning is self-directed). However, the reasons why volitional control might result in superior acquisition and the limits to such advantages remain poorly understood. In this article, we review the issue from both a cognitive and computational perspective. On the cognitive side, self-directed learning allows individuals to focus effort on useful information they do not yet possess, can expose information that is inaccessible via passive observation, and may enhance the encoding and retention of materials. On the computational side, the development of efficient “active learning” algorithms that can select their own training data is an emerging research topic in machine learning. This review argues that recent advances in these related fields may offer a fresh theoretical perspective on how people gather information to support their own learning.",2012,161,567,56,false,Medicine,3013567,T. Gureckis,3164019,D. Markant,,,,,,,,,,,Computer Science,,,,,,,,,,,,,,,,,,,,,,
cb2c9086eb239132a49f695f5b93b5bdb391ad92,https://www.semanticscholar.org/paper/cb2c9086eb239132a49f695f5b93b5bdb391ad92,"Yes, Machine Learning Can Be More Secure! A Case Study on Android Malware Detection","To cope with the increasing variability and sophistication of modern attacks, machine learning has been widely adopted as a statistically-sound tool for malware detection. However, its security against well-crafted attacks has not only been recently questioned, but it has been shown that machine learning exhibits inherent vulnerabilities that can be exploited to evade detection at test time. In other words, machine learning itself can be the weakest link in a security system. In this paper, we rely upon a previously-proposed attack framework to categorize potential attack scenarios against learning-based malware detection tools, by modeling attackers with different skills and capabilities. We then define and implement a set of corresponding evasion attacks to thoroughly assess the security of Drebin, an Android malware detector. The main contribution of this work is the proposal of a simple and scalable secure-learning paradigm that mitigates the impact of evasion attacks, while only slightly worsening the detection rate in the absence of attack. We finally argue that our secure-learning approach can also be readily applied to other malware detection tasks.",2017,50,216,24,true,Computer Science,2272441,Ambra Demontis,40631285,Marco Melis,1684175,B. Biggio,3248803,Davide Maiorca,79405068,Dan Arp,144825749,K. Rieck,2338858,I. Corona,,,1779484,G. Giacinto,,1710171,F. Roli,,,,,,,,,,,,,,,,
1f2b459bb644fcaf61118dbf31db5856f9f991de,https://www.semanticscholar.org/paper/1f2b459bb644fcaf61118dbf31db5856f9f991de,Machine Learning: ECML 2002,,2002,0,116,1,true,Computer Science,1720466,Tapio Elomaa,1712654,H. Mannila,143785973,Hannu (TT) Toivonen,,,,,,,,,,,,,,,,,,,,,,,,,,,,,,,
96752dc3a8c3edff8ef69b9c0fdeff9bde2b48f1,https://www.semanticscholar.org/paper/96752dc3a8c3edff8ef69b9c0fdeff9bde2b48f1,Named Entity Recognition: A Maximum Entropy Approach Using Global Information,"This paper presents a maximum entropy-based named entity recognizer (NER). It differs from previous machine learning-based NERs in that it uses information from the whole document to classify each word, with just one classifier. Previous work that involves the gathering of information from the whole document often uses a secondary classifier, which corrects the mistakes of a primary sentence-based classifier. In this paper, we show that the maximum entropy framework is able to make use of global information directly, and achieves performance that is comparable to the best previous machine learning-based NERs on MUC-6 and MUC-7 test data.",2002,13,328,10,true,Computer Science,3024630,Hai Leong Chieu,34789794,H. Ng,,,,,,,,,,,,,,,,,,,,,,,,,,,,,,,,,
53a95417d35d9f11b00c39ecd1f1809a98b20707,https://www.semanticscholar.org/paper/53a95417d35d9f11b00c39ecd1f1809a98b20707,XCS and GALE: A Comparative Study of Two Learning Classifier Systems on Data Mining,,2001,46,124,2,false,Computer Science,1399458171,Ester Bernadó-Mansilla,1822628,Xavier Llorà,1690014,J. M. Guiu,,,,,,,,,,,,,,,,,,,,,,,,,,,,,,,
3ec6b1aeddce8c350a4f8ea3ba7ffcfd73b57ed2,https://www.semanticscholar.org/paper/3ec6b1aeddce8c350a4f8ea3ba7ffcfd73b57ed2,High-Dimensional Statistics,"Recent years have witnessed an explosion in the volume and variety of data collected in all scientific disciplines and industrial settings. Such massive data sets present a number of challenges to researchers in statistics and machine learning. This book provides a self-contained introduction to the area of high-dimensional statistics, aimed at the first-year graduate level. It includes chapters that are focused on core methodology and theory - including tail bounds, concentration inequalities, uniform laws and empirical process, and random matrices - as well as chapters devoted to in-depth exploration of particular model classes - including sparse linear models, matrix models with rank constraints, graphical models, and various types of non-parametric models. With hundreds of worked examples and exercises, this text is intended both for courses and for self-study by graduate students and researchers in statistics, machine learning, and related fields who must understand, apply, and adapt modern statistical methods suited to large-scale data.",2019,410,548,93,false,Computer Science,1721860,M. Wainwright,,,,,,,,,,,,,,,,,,,,,,,,,,,,,,,,,,,
e78a35a75dc10f366da57b490679bb38a46da531,https://www.semanticscholar.org/paper/e78a35a75dc10f366da57b490679bb38a46da531,Incremental Learning from Noisy Data,,1986,34,244,17,true,Computer Science,2620923,J. C. Schlimmer,144297714,R. Granger,,,,,,,,,,,,,,,,,,,,,,,,,,,,,,,,,
2f178781b6e1a05df8840a90c56ef1e0ea3c961d,https://www.semanticscholar.org/paper/2f178781b6e1a05df8840a90c56ef1e0ea3c961d,Model learning,Model learning emerges as an effective method for black-box state machine models of hardware and software components.,2017,91,176,13,false,Computer Science,1678787,F. Vaandrager,,,,,,,,,,,,,,,,,,,,,,,,,,,,,,,,,,,
8cec80e8752952188dba7ec407366e0962e3d4a6,https://www.semanticscholar.org/paper/8cec80e8752952188dba7ec407366e0962e3d4a6,Co-EM support vector learning,"Multi-view algorithms, such as co-training and co-EM, utilize unlabeled data when the available attributes can be split into independent and compatible subsets. Co-EM outperforms co-training for many problems, but it requires the underlying learner to estimate class probabilities, and to learn from probabilistically labeled data. Therefore, co-EM has so far only been studied with naive Bayesian learners. We cast linear classifiers into a probabilistic framework and develop a co-EM version of the Support Vector Machine. We conduct experiments on text classification problems and compare the family of semi-supervised support vector algorithms under different conditions, including violations of the assumptions underlying multi-view learning. For some problems, such as course web page classification, we observe the most accurate results reported so far.",2004,30,201,6,false,Computer Science,1765114,Ulf Brefeld,1751348,T. Scheffer,,,,,,,,,,,,,,,,,,,,,,,,,,,,,,,,,
b89458a474fa27c2f399d93b08ba24855b75e4df,https://www.semanticscholar.org/paper/b89458a474fa27c2f399d93b08ba24855b75e4df,Domain Adaptation Extreme Learning Machines for Drift Compensation in E-Nose Systems,"This paper addresses an important issue known as sensor drift, which exhibits a nonlinear dynamic property in electronic nose (E-nose), from the viewpoint of machine learning. Traditional methods for drift compensation are laborious and costly owing to the frequent acquisition and labeling process for gas samples' recalibration. Extreme learning machines (ELMs) have been confirmed to be efficient and effective learning techniques for pattern recognition and regression. However, ELMs primarily focus on the supervised, semisupervised, and unsupervised learning problems in single domain (i.e., source domain). To our best knowledge, ELM with cross-domain learning capability has never been studied. This paper proposes a unified framework called domain adaptation extreme learning machine (DAELM), which learns a robust classifier by leveraging a limited number of labeled data from target domain for drift compensation as well as gas recognition in E-nose systems, without losing the computational efficiency and learning ability of traditional ELM. In the unified framework, two algorithms called source DAELM (DAELM-S) and target DAELM (DAELM-T) are proposed in this paper. In order to perceive the differences among ELM, DAELM-S, and DAELM-T, two remarks are provided. Experiments on the popular sensor drift data with multiple batches collected using E-nose system clearly demonstrate that the proposed DAELM significantly outperforms existing drift-compensation methods without cumbersome measures, and also bring new perspectives for ELM.",2015,37,237,25,true,Engineering,36685537,Lei Zhang,66396175,D. Zhang,,,,,,,,,,,Computer Science,,,,,,,,,,,,,,,,,,,,,,
eec5eec17b214799ba1ca27c5917b28e92cd444c,https://www.semanticscholar.org/paper/eec5eec17b214799ba1ca27c5917b28e92cd444c,A statistical learning learning model of text classification for support vector machines,"This paper develops a theoretical learning model of text classification for Support Vector Machines (SVMs). It connects the statistical properties of text-classification tasks with the generalization performance of a SVM in a quantitative way. Unlike conventional approaches to learning text classifiers, which rely primarily on empirical evidence, this model explains why and when SVMs perform well for text classification. In particular, it addresses the following questions: Why can support vector machines handle the large feature spaces in text classification effectively? How is this related to the statistical properties of text? What are sufficient conditions for applying SVMs to text-classification problems successfully?",2001,22,229,14,false,Computer Science,1680188,T. Joachims,,,,,,,,,,,,,,,,,,,,,,,,,,,,,,,,,,,
cabd6bbdd2be9996dd7473185c9eaf104980fe21,https://www.semanticscholar.org/paper/cabd6bbdd2be9996dd7473185c9eaf104980fe21,An Efficient Approach for Assessing Hyperparameter Importance,"The performance of many machine learning methods depends critically on hyperparameter settings. Sophisticated Bayesian optimization methods have recently achieved considerable successes in optimizing these hyperparameters, in several cases surpassing the performance of human experts. However, blind reliance on such methods can leave end users without insight into the relative importance of different hyperparameters and their interactions. This paper describes efficient methods that can be used to gain such insight, leveraging random forest models fit on the data already gathered by Bayesian optimization. We first introduce a novel, linear-time algorithm for computing marginals of random forest predictions and then show how to leverage these predictions within a functional ANOVA framework, to quantify the importance of both single hyperparameters and of interactions between hyperparameters. We conducted experiments with prominent machine learning frameworks and state-of-the-art solvers for combinatorial problems. We show that our methods provide insight into the relationship between hyperparameter settings and performance, and demonstrate that--even in very highdimensional cases--most performance variation is attributable to just a few hyperparameters.",2014,55,314,23,false,Computer Science,144661829,F. Hutter,2470869,H. Hoos,1388404060,Kevin Leyton-Brown,,,,,,,,,,,,,,,,,,,,,,,,,,,,,,,
