paperId,url,title,abstract,year,referenceCount,citationCount,influentialCitationCount,isOpenAccess,fieldsOfStudy/0,authors/0/authorId,authors/0/name,authors/1/authorId,authors/1/name,authors/2/authorId,authors/2/name,authors/3/authorId,authors/3/name,authors/4/authorId,authors/4/name,authors/5/authorId,authors/5/name,authors/6/authorId,authors/6/name,fieldsOfStudy/1,fieldsOfStudy/2,authors/7/authorId,authors/7/name,fieldsOfStudy/3,authors/8/authorId,authors/8/name,authors/9/authorId,authors/9/name,authors/10/authorId,authors/10/name,authors/11/authorId,authors/11/name,authors/12/authorId,authors/12/name,authors/13/authorId,authors/13/name,authors/14/authorId,authors/14/name,authors/15/authorId,authors/15/name,authors/16/authorId,authors/16/name
0cb7ebc80fadaa775c3ca64da8930384d910f00e,https://www.semanticscholar.org/paper/0cb7ebc80fadaa775c3ca64da8930384d910f00e,Predicting the Price of Bitcoin Using Machine Learning,"The goal of this paper is to ascertain with what accuracy the direction of Bitcoin price in USD can be predicted. The price data is sourced from the Bitcoin Price Index. The task is achieved with varying degrees of success through the implementation of a Bayesian optimised recurrent neural network (RNN) and a Long Short Term Memory (LSTM) network. The LSTM achieves the highest classification accuracy of 52% and a RMSE of 8%. The popular ARIMA model for time series forecasting is implemented as a comparison to the deep learning models. As expected, the non-linear deep learning methods outperform the ARIMA forecast which performs poorly. Finally, both deep learning models are benchmarked on both a GPU and a CPU with the training time on the GPU outperforming the CPU implementation by 67.7%.",2018,56,335,26,true,Computer Science,46391717,S. Mcnally,2059704800,Jason Roche,2452441,Simon Caton,,,,,,,,,,,,,,,,,,,,,,,,,,,,,,,
b34fc78de28be598e21118d7cb9d84d63374addc,https://www.semanticscholar.org/paper/b34fc78de28be598e21118d7cb9d84d63374addc,Analysis of Dimensionality Reduction Techniques on Big Data,"Due to digitization, a huge volume of data is being generated across several sectors such as healthcare, production, sales, IoT devices, Web, organizations. Machine learning algorithms are used to uncover patterns among the attributes of this data. Hence, they can be used to make predictions that can be used by medical practitioners and people at managerial level to make executive decisions. Not all the attributes in the datasets generated are important for training the machine learning algorithms. Some attributes might be irrelevant and some might not affect the outcome of the prediction. Ignoring or removing these irrelevant or less important attributes reduces the burden on machine learning algorithms. In this work two of the prominent dimensionality reduction techniques, Linear Discriminant Analysis (LDA) and Principal Component Analysis (PCA) are investigated on four popular Machine Learning (ML) algorithms, Decision Tree Induction, Support Vector Machine (SVM), Naive Bayes Classifier and Random Forest Classifier using publicly available Cardiotocography (CTG) dataset from University of California and Irvine Machine Learning Repository. The experimentation results prove that PCA outperforms LDA in all the measures. Also, the performance of the classifiers, Decision Tree, Random Forest examined is not affected much by using PCA and LDA.To further analyze the performance of PCA and LDA the eperimentation is carried out on Diabetic Retinopathy (DR) and Intrusion Detection System (IDS) datasets. Experimentation results prove that ML algorithms with PCA produce better results when dimensionality of the datasets is high. When dimensionality of datasets is low it is observed that the ML algorithms without dimensionality reduction yields better results.",2020,44,245,7,true,Computer Science,38608914,G. T. Reddy,49247239,M. S. K. Reddy,51017707,K. Lakshmanna,46234199,Rajesh Kaluri,32336300,D. Rajput,144369609,Gautam Srivastava,37022396,T. Baker,,,,,,,,,,,,,,,,,,,,,,,
9da1310a7158854a8070d9207d7042c9fff4f6ba,https://www.semanticscholar.org/paper/9da1310a7158854a8070d9207d7042c9fff4f6ba,Machine Learning: ECML 2003,,2003,19,95,0,true,Computer Science,1730104,N. Lavrac,1767339,D. Gamberger,1755851,H. Blockeel,1735220,L. Todorovski,,,,,,,,,,,,,,,,,,,,,,,,,,,,,
fb144a1d31aec3b2bece6a59bd11a876a9fafb34,https://www.semanticscholar.org/paper/fb144a1d31aec3b2bece6a59bd11a876a9fafb34,Exploiting Open-Endedness to Solve Problems Through the Search for Novelty,"This paper establishes a link between the challenge of solving highly ambitious problems in machine learning and the goal of reproducing the dynamics of open-ended evolution in artificial life. A major problem with the objective function in machine learning is that through deception it may actually prevent the objective from being reached. In a similar way, selection in evolution may sometimes act to discourage increasing complexity. This paper proposes a single idea that both overcomes the obstacle of deception and suggests a simple new approach to open-ended evolution: Instead of either explicitly seeking an objective or modeling a domain to capture the open-endedness of natural evolution, the idea is to simply search for novelty. Even in an objective-based problem, such novelty search ignores the objective and searches for behavioral novelty. Yet because many points in the search space collapse to the same point in behavior space, it turns out that the search for novelty is computationally feasible. Furthermore, because there are only so many simple behaviors, the search for novelty leads to increasing complexity. In fact, on the way up the ladder of complexity, the search is likely to encounter at least one solution. In this way, by decoupling the idea of open-ended search from only artificial life worlds, the raw search for novelty can be applied to real world problems. Counterintuitively, in the deceptive maze navigation task in this paper, novelty search significantly outperforms objective-based search, suggesting a surprising new approach to machine learning.",2008,39,494,90,false,Computer Science,39799304,J. Lehman,1846883,Kenneth O. Stanley,,,,,,,,,,,,,,,,,,,,,,,,,,,,,,,,,
5396e9858d70f09bf42f251621b5f2816a9cb660,https://www.semanticscholar.org/paper/5396e9858d70f09bf42f251621b5f2816a9cb660,Cover trees for nearest neighbor,"We present a tree data structure for fast nearest neighbor operations in general n-point metric spaces (where the data set consists of n points). The data structure requires O(n) space regardless of the metric's structure yet maintains all performance properties of a navigating net (Krauthgamer & Lee, 2004b). If the point set has a bounded expansion constant c, which is a measure of the intrinsic dimensionality, as defined in (Karger & Ruhl, 2002), the cover tree data structure can be constructed in O (c6n log n) time. Furthermore, nearest neighbor queries require time only logarithmic in n, in particular O (c12 log n) time. Our experimental results show speedups over the brute force search varying between one and several orders of magnitude on natural machine learning datasets.",2006,29,845,94,true,Computer Science,2624289,A. Beygelzimer,144695232,S. Kakade,144162125,J. Langford,,,,,,,,,Mathematics,,,,,,,,,,,,,,,,,,,,,,
4ec06dda674cd5f93351f0ab5871391671f9b974,https://www.semanticscholar.org/paper/4ec06dda674cd5f93351f0ab5871391671f9b974,Medical Image Analysis using Convolutional Neural Networks: A Review,,2017,142,509,11,true,Computer Science,9514351,A. Qayyum,144608640,S. Anwar,144974259,Muhammad Majid,1387433697,M. Awais,3436574,M. Alnowami,,,,,Medicine,,,,,,,,,,,,,,,,,,,,,,
3558dc0a0139d6a3dd48458d207c497db027ab1b,https://www.semanticscholar.org/paper/3558dc0a0139d6a3dd48458d207c497db027ab1b,Thirty Years of Machine Learning: The Road to Pareto-Optimal Wireless Networks,"Future wireless networks have a substantial potential in terms of supporting a broad range of complex compelling applications both in military and civilian fields, where the users are able to enjoy high-rate, low-latency, low-cost and reliable information services. Achieving this ambitious goal requires new radio techniques for adaptive learning and intelligent decision making because of the complex heterogeneous nature of the network structures and wireless services. Machine learning (ML) algorithms have great success in supporting big data analytics, efficient parameter estimation and interactive decision making. Hence, in this article, we review the thirty-year history of ML by elaborating on supervised learning, unsupervised learning, reinforcement learning and deep learning. Furthermore, we investigate their employment in the compelling applications of wireless networks, including heterogeneous networks (HetNets), cognitive radios (CR), Internet of Things (IoT), machine to machine networks (M2M), and so on. This article aims for assisting the readers in clarifying the motivation and methodology of the various ML algorithms, so as to invoke them for hitherto unexplored services as well as scenarios of future wireless networks.",2019,380,230,7,true,Computer Science,145210497,JingJing Wang,1750017,Chunxiao Jiang,50024622,Haijun Zhang,145659296,Yong Ren,66073306,Kwang-Cheng Chen,1730180,L. Hanzo,,,,,,,,,,,,,,,,,,,,,,,,,
c0e5a471179d2d8c7025febe77a90c3a99c7c9fa,https://www.semanticscholar.org/paper/c0e5a471179d2d8c7025febe77a90c3a99c7c9fa,Learning With $\ell ^{1}$-Graph for Image Analysis,"The graph construction procedure essentially determines the potentials of those graph-oriented learning algorithms for image analysis. In this paper, we propose a process to build the so-called directed ¿1-graph, in which the vertices involve all the samples and the ingoing edge weights to each vertex describe its ¿1-norm driven reconstruction from the remaining samples and the noise. Then, a series of new algorithms for various machine learning tasks, e.g., data clustering, subspace learning, and semi-supervised learning, are derived upon the ¿1-graphs. Compared with the conventional k -nearest-neighbor graph and ¿-ball graph, the ¿1-graph possesses the advantages: (1) greater robustness to data noise, (2) automatic sparsity, and (3) adaptive neighborhood for individual datum. Extensive experiments on three real-world datasets show the consistent superiority of ¿1-graph over those classic graphs in data clustering, subspace learning, and semi-supervised learning tasks.",2010,25,567,51,false,Mathematics,2055922779,Bin Cheng,1706007,Jianchao Yang,143653681,Shuicheng Yan,145692782,Yun Fu,153652752,Thomas S. Huang,,,,,Computer Science,Medicine,,,,,,,,,,,,,,,,,,,,,
07a04fa73ae666e730b6f50e2c9c96d0a11cff94,https://www.semanticscholar.org/paper/07a04fa73ae666e730b6f50e2c9c96d0a11cff94,Advances in Machine Learning,,2021,16,44,1,false,Computer Science,1733088,M. Someren,,,,,,,,,,,,,,,,,,,,,,,,,,,,,,,,,,,
4603c2513605d18d8f7318c455aae32f20e0ecfc,https://www.semanticscholar.org/paper/4603c2513605d18d8f7318c455aae32f20e0ecfc,Ultra-Strong Machine Learning: comprehensibility of programs learned with ILP,,2018,56,84,8,true,Computer Science,145147566,S. Muggleton,1727734,Ute Schmid,26755201,Christina Zeller,1403549560,Alireza Tamaddoni-Nezhad,143862012,Tarek R. Besold,,,,,,,,,,,,,,,,,,,,,,,,,,,
0d24a0695c9fc669e643bad51d4e14f056329dec,https://www.semanticscholar.org/paper/0d24a0695c9fc669e643bad51d4e14f056329dec,An Actor-Critic Algorithm for Sequence Prediction,"We present an approach to training neural networks to generate sequences using actor-critic methods from reinforcement learning (RL). Current log-likelihood training methods are limited by the discrepancy between their training and testing modes, as models must generate tokens conditioned on their previous guesses rather than the ground-truth tokens. We address this problem by introducing a \textit{critic} network that is trained to predict the value of an output token, given the policy of an \textit{actor} network. This results in a training procedure that is much closer to the test phase, and allows us to directly optimize for a task-specific score such as BLEU. Crucially, since we leverage these techniques in the supervised learning setting rather than the traditional RL setting, we condition the critic network on the ground-truth output. We show that our method leads to improved performance on both a synthetic task, and for German-English machine translation. Our analysis paves the way for such methods to be applied in natural language generation tasks, such as machine translation, caption generation, and dialogue modelling.",2016,49,505,68,false,Computer Science,3335364,Dzmitry Bahdanau,2616163,Philemon Brakel,36303818,Kelvin Xu,1996705,Anirudh Goyal,2054294,Ryan Lowe,145134886,Joelle Pineau,1760871,Aaron C. Courville,Mathematics,,1751762,Yoshua Bengio,,,,,,,,,,,,,,,,,,,
b4b1cbd74029f46ef9b462290a46111217552761,https://www.semanticscholar.org/paper/b4b1cbd74029f46ef9b462290a46111217552761,Understanding the Effect of Accuracy on Trust in Machine Learning Models,"We address a relatively under-explored aspect of human-computer interaction: people's abilities to understand the relationship between a machine learning model's stated performance on held-out data and its expected performance post deployment. We conduct large-scale, randomized human-subject experiments to examine whether laypeople's trust in a model, measured in terms of both the frequency with which they revise their predictions to match those of the model and their self-reported levels of trust in the model, varies depending on the model's stated accuracy on held-out data and on its observed accuracy in practice. We find that people's trust in a model is affected by both its stated accuracy and its observed accuracy, and that the effect of stated accuracy can change depending on the observed accuracy. Our work relates to recent research on interpretable machine learning, but moves beyond the typical focus on model internals, exploring a different component of the machine learning pipeline.",2019,31,197,12,false,Computer Science,2053888438,M. Yin,4006636,Jennifer Wortman Vaughan,1831395,H. Wallach,,,,,,,,,,,,,,,,,,,,,,,,,,,,,,,
9b2e7d31d5d90f6962d4d512834cf25555ee8f05,https://www.semanticscholar.org/paper/9b2e7d31d5d90f6962d4d512834cf25555ee8f05,Improved Rooftop Detection in Aerial Images with Machine Learning,,2003,102,78,6,true,Computer Science,1715421,M. Maloof,1713919,P. Langley,1738591,T. Binford,144862593,R. Nevatia,47829236,S. Sage,,,,,Engineering,,,,,,,,,,,,,,,,,,,,,,
fee8f63972906214b77f16cfeca0b93ee8f36ba2,https://www.semanticscholar.org/paper/fee8f63972906214b77f16cfeca0b93ee8f36ba2,Fairness in Machine Learning: A Survey,"As Machine Learning technologies become increasingly used in contexts that affect citizens, companies as well as researchers need to be confident that their application of these methods will not have unexpected social implications, such as bias towards gender, ethnicity, and/or people with disabilities. There is significant literature on approaches to mitigate bias and promote fairness, yet the area is complex and hard to penetrate for newcomers to the domain. This article seeks to provide an overview of the different schools of thought and approaches to mitigating (social) biases and increase fairness in the Machine Learning literature. It organises approaches into the widely accepted framework of pre-processing, in-processing, and post-processing methods, subcategorizing into a further 11 method areas. Although much of the literature emphasizes binary classification, a discussion of fairness in regression, recommender systems, unsupervised learning, and natural language processing is also provided along with a selection of currently available open source libraries. The article concludes by summarising open challenges articulated as four dilemmas for fairness research.",2020,263,172,18,false,Computer Science,2452441,Simon Caton,152864672,C. Haas,,,,,,,,,,,Mathematics,,,,,,,,,,,,,,,,,,,,,,
961d0f3d0c852055a202ef315b02cd69863098e9,https://www.semanticscholar.org/paper/961d0f3d0c852055a202ef315b02cd69863098e9,"Artificial intelligence, machine learning and deep learning","It is increasingly recognized that artificial intelligence has been touted as a new mobile. Because of the high volume of data that being generated by devices, sensors and social media users, the machine can learn to distinguish the pattern and makes a reasonably good prediction. This article will explore the use of machine learning and its methodologies. Furthermore, the field of deep learning which is being exploited in many leading IT providers will be clarified and discussed.",2017,49,94,2,false,Computer Science,31807503,Pariwat Ongsulee,,,,,,,,,,,,,,,,,,,,,,,,,,,,,,,,,,,
ec01eea9da194367ee762651922256e1e130f948,https://www.semanticscholar.org/paper/ec01eea9da194367ee762651922256e1e130f948,Mahout in Action,"SummaryMahout in Action is a hands-on introduction to machine learning with Apache Mahout. Following real-world examples, the book presents practical use cases and then illustrates how Mahout can be applied to solve them. Includes a free audio- and video-enhanced ebook. About the TechnologyA computer system that learns and adapts as it collects data can be really powerful. Mahout, Apache's open source machine learning project, captures the core algorithms of recommendation systems, classification, and clustering in ready-to-use, scalable libraries. With Mahout, you can immediately apply to your own projects the machine learning techniques that drive Amazon, Netflix, and others. About this BookThis book covers machine learning using Apache Mahout. Based on experience with real-world applications, it introduces practical use cases and illustrates how Mahout can be applied to solve them. It places particular focus on issues of scalability and how to apply these techniques against large data sets using the Apache Hadoop framework.This book is written for developers familiar with Java - no prior experience with Mahout is assumed. What's InsideUse group data to make individual recommendations Find logical clusters within your data Filter and refine with on-the-fly classification Free audio and video extrasTable of ContentsMeet Apache Mahout PART 1 RECOMMENDATIONS Introducing recommenders Representing recommender data Making recommendations Taking recommenders to production Distributing recommendation computations PART 2 CLUSTERING Introduction to clustering Representing data Clustering algorithms in Mahout Evaluating and improving clustering quality Taking clustering to production Real-world applications of clustering PART 3 CLASSIFICATION Introduction to classification Training a classifier Evaluating and tuning a classifier Deploying a classifier Case study: Shop It To Me",2011,8,422,25,false,Computer Science,2060860697,Sean Owen,2066132164,Robin Anil,115377844,T. Dunning,98009014,Ellen Friedman,,,,,,,,,,,,,,,,,,,,,,,,,,,,,
7715bb1070691455d1fcfc6346ff458dbca77b2c,https://www.semanticscholar.org/paper/7715bb1070691455d1fcfc6346ff458dbca77b2c,An Efficient Explanation of Individual Classifications using Game Theory,We present a general method for explaining individual predictions of classification models. The method is based on fundamental concepts from coalitional game theory and predictions are explained with contributions of individual feature values. We overcome the method's initial exponential time complexity with a sampling-based approximation. In the experimental part of the paper we use the developed method on models generated by several well-known machine learning algorithms on both synthetic and real-world data sets. The results demonstrate that the method is efficient and that the explanations are intuitive and useful.,2010,30,404,45,false,Mathematics,1738288,E. Štrumbelj,143986204,I. Kononenko,,,,,,,,,,,Computer Science,,,,,,,,,,,,,,,,,,,,,,
f63487b3fda2d96d8b3e97391448c76e00f2353c,https://www.semanticscholar.org/paper/f63487b3fda2d96d8b3e97391448c76e00f2353c,Hacking smart machines with smarter ones: How to extract meaningful data from machine learning classifiers,"Machine Learning (ML) algorithms are used to train computers to perform a variety of complex tasks and improve with experience. Computers learn how to recognize patterns, make unintended decisions, or react to a dynamic environment. Certain trained machines may be more effective than others because they are based on more suitable ML algorithms or because they were trained through superior training sets. Although ML algorithms are known and publicly released, training sets may not be reasonably ascertainable and, indeed, may be guarded as trade secrets. While much research has been performed about the privacy of the elements of training sets, in this paper we focus our attention on ML classifiers and on the statistical information that can be unconsciously or maliciously revealed from them. We show that it is possible to infer unexpected but useful information from ML classifiers. In particular, we build a novel meta-classifier and train it to hack other classifiers, obtaining meaningful information about their training sets. This kind of information leakage can be exploited, for example, by a vendor to build more effective classifiers or to simply acquire trade secrets from a competitor's apparatus, potentially violating its intellectual property rights.",2013,88,316,34,true,Computer Science,1700850,G. Ateniese,1686516,L. Mancini,2549445,A. Spognardi,31637585,Antonio Villani,2776964,Domenico Vitali,152837742,G. Felici,,,Mathematics,,,,,,,,,,,,,,,,,,,,,,
1a57fe1d21957c500cdf9abc19eaf97c54d294aa,https://www.semanticscholar.org/paper/1a57fe1d21957c500cdf9abc19eaf97c54d294aa,Applications of Artificial Intelligence in Machine Learning: Review and Prospect,"Machine learning is one of the most exciting recent technologies in Artificial Intelligence. Learning algorithms in many applications that’s we make use of daily. Every time a web search engine like Google or Bing is used to search the internet, one of the reasons that works so well is because a learning algorithm, one implemented by Google or Microsoft, has learned how to rank web pages. Every time Facebook is used and it recognizes friends' photos, that's also machine learning. Spam filters in email saves the user from having to wade through tons of spam email, that's also a learning algorithm. In this paper, a brief review and future prospect of the vast applications of machine learning has been made.",2015,61,133,3,true,Computer Science,48144656,S. Das,51053725,Aritra Dey,23707007,A. Pal,7695838,N. Roy,,,,,,,,,,,,,,,,,,,,,,,,,,,,,
f9613c28ffed1ed9f3a9b5ce45a87192904f05f7,https://www.semanticscholar.org/paper/f9613c28ffed1ed9f3a9b5ce45a87192904f05f7,Introduction to Deep Learning,"Modeling data via artificial neural networks (ANN) is not a new concept. Most of the underlying techniques have been known since the 1940s. It has to be pointed out though that a series of recent advances in how the networks are trained and utilized form the foundation of today's Deep Learning ecosystem. It is a fair statement that the recent advances brought forward by Deep Learning reflect a new era in Machine Learning (ML) that revolutionized many domains of signal and information processing. This holds true beyond the commonly discussed speech and object recognition science but also branches into computer vision, natural language processing, or information retrieval related fields.",2018,29,147,10,false,Computer Science,2066657497,M. Pantoja,65806742,A. Behrouzi,96710633,D. Fabris,,,,,,,,,,,,,,,,,,,,,,,,,,,,,,,
9815ac82b583ea50c03d4791a88520515b22e024,https://www.semanticscholar.org/paper/9815ac82b583ea50c03d4791a88520515b22e024,Mapping Species Distributions: Spatial Inference and Prediction,"Part I. History and Ecological Basis of Species' Distribution Modeling: 1. Species distribution modeling 2. Why do we need species' distribution models? 3. Ecological understanding of species' distributions Part II. The Data Needed for Modeling Species' Distributions 4. Data for species' distribution models: the biological data 5. Data for species' distribution models: the environmental data Part III. An Overview of the Modeling Methods: 6. Statistical models - modern regression 7. Machine learning methods 8. Classification, similarity and other methods for presence-only data Part IV. Model Evaluation and Implementation: 9. Model evaluation 10. Implementation of species' distribution models.",2010,0,1937,248,false,Biology,144735103,J. Franklin,2109506351,Jennifer A. Miller,,,,,,,,,,,,,,,,,,,,,,,,,,,,,,,,,
7a0ae56fe2f5434fc1de4969867881a65680ab82,https://www.semanticscholar.org/paper/7a0ae56fe2f5434fc1de4969867881a65680ab82,Learning to see,"The mind cannot make sense of the visual world out of raw image data alone. In an approach to visual processing known as learning from examples, computational neural networks and physiological studies suggest how neurons and machines adapt to novel images on the basis of past experience.",1996,6,318,0,false,Computer Science,1685292,T. Poggio,1740300,D. Beymer,,,,,,,,,,,,,,,,,,,,,,,,,,,,,,,,,
