paperId,url,title,abstract,year,referenceCount,citationCount,influentialCitationCount,isOpenAccess,fieldsOfStudy/0,fieldsOfStudy/1,authors/0/authorId,authors/0/name,authors/1/authorId,authors/1/name,authors/2/authorId,authors/2/name,authors/3/authorId,authors/3/name,authors/4/authorId,authors/4/name,authors/5/authorId,authors/5/name,fieldsOfStudy/2,authors/6/authorId,authors/6/name,authors/7/authorId,authors/7/name,authors/8/authorId,authors/8/name,authors/9/authorId,authors/9/name,authors/10/authorId,authors/10/name,authors/11/authorId,authors/11/name,authors/12/authorId,authors/12/name
c1eea18c70325f1ae381b3efa7d6dc50c649c69c,https://www.semanticscholar.org/paper/c1eea18c70325f1ae381b3efa7d6dc50c649c69c,Intelligent Parkinson Disease Prediction Using Machine Learning Algorithms,"Diagnosis of the Parkinson disease through machine learning approache provides better understanding from PD dataset in the present decade. Orange v2.0b and weka v3.4.10 has been used in the present experimentation for the statistical analysis, classification, Evaluation and unsupervised learning methods. Voice dataset for Parkinson disease has been retrieved from UCI Machine learning repository from Center for Machine Learning and Intelligent Systems. The dataset contains name, MDVP:Fo(Hz), MDVP:Fhi(Hz), MDVP:Flo(Hz), MDVP:Jitter(%), MDVP: Jitter(Abs), MDVP:RAP, MDVP:PPQ, Jitter:DDP, MDVP:Shimmer, MDVP:Shimmer(dB), Shimmer:APQ3, Shimmer:APQ5, MDVP:APQ, Shimmer:DDA, NHR, HNR, status, RPDE, DFA, spread1, spread2, D2, PPE attributes. The parallel coordinates shows higher variation in Parkinson disease dataset. SVM has shown good accuracy (88.9%) compared to Majority and k-NN algorithms. Classification algorithm like Random Forest has shown good accuracy (90.26) and Naive Bayes has shown least accuracy (69.23. Higher number of clusters in healthy dataset in Fo and less number in diseased data has been predicted by Hierarchal clustering and SOM.",2013,15,54,2,false,Computer Science,,2151493349,M. Rao,9293181,G. V. L. Narayana,144350988,D. Kaladhar,145014843,T. Vital,,,,,,,,,,,,,,,,,,,
66773ecea49a061fd5dd6561e0e36afa8cae54ba,https://www.semanticscholar.org/paper/66773ecea49a061fd5dd6561e0e36afa8cae54ba,Security analysis of online centroid anomaly detection,"Security issues are crucial in a number of machine learning applications, especially in scenarios dealing with human activity rather than natural phenomena (e.g., information ranking, spam detection, malware detection, etc.). In such cases, learning algorithms may have to cope with manipulated data aimed at hampering decision making. Although some previous work addressed the issue of handling malicious data in the context of supervised learning, very little is known about the behavior of anomaly detection methods in such scenarios. In this contribution, we analyze the performance of a particular method--online centroid anomaly detection--in the presence of adversarial noise. Our analysis addresses the following security-related issues: formalization of learning and attack processes, derivation of an optimal attack, and analysis of attack efficiency and limitations. We derive bounds on the effectiveness of a poisoning attack against centroid anomaly detection under different conditions: attacker's full or limited control over the traffic and bounded false positive rate. Our bounds show that whereas a poisoning attack can be effectively staged in the unconstrained case, it can be made arbitrarily difficult (a strict upper bound on the attacker's gain) if external constraints are properly used. Our experimental evaluation, carried out on real traces of HTTP and exploit traffic, confirms the tightness of our theoretical bounds and the practicality of our protection mechanisms.",2010,69,96,5,false,Mathematics,Computer Science,2749512,M. Kloft,1754215,P. Laskov,,,,,,,,,,,,,,,,,,,,,,,
cec81c1acbc36503108337a74d845008d5e68f70,https://www.semanticscholar.org/paper/cec81c1acbc36503108337a74d845008d5e68f70,Machine Learning for Prediction in Electronic Health Data.,"Machine learning for prediction in electronic health data has been deployed for many clinical questions during the last decade. Machine learning methods may excel at finding new features or nonlinear relationships in the data, as well as handling settings with more predictor variables than observations. However, the usefulness of both these data and machine learning has varied. Electronic health data often have quality issues (eg, missingness, misclassification, measurement error), and machine learning may perform similarly to standard techniques for some research questions. Ensembles (running multiple algorithms and either selecting the single best algorithm or creating a weighted average) can help mitigate the latter concern. Using several machine learning tools, Wong et al1 predicted delirium risk for newly hospitalized patients with high-dimensional electronic health record data at a large academic health institution. They compared these approaches with a questionnaire-based scoring system and found improved performance for machine learning with respect to several metrics calculated in a single holdout sample. Their article is a step toward updating delirium risk prediction. It also provides an opportunity to discuss 2 key issues in the current state of machine learning for prediction in electronic health data: evaluation and generalizability. The machine learning researchers who develop novel algorithms for prediction and the clinical teams interested in implementing them are frequently and unfortunately 2 nonintersecting groups. Thus, these algorithms may originally be built and evaluated in the machine learning literature based on metrics that are less clinically useful than other choices. Computer scientists and statisticians may optimize to achieve the best area under the receiver operating characteristic curve (AUC), but what a clinical team might need is high sensitivity or positive predictive value. Worse yet, algorithms can have misleading performance when evaluated only along 1 or 2 dimensions. For example, high AUC, accuracy, and positive predictive values can be accompanied by near-zero levels of sensitivity and specificity. It can also be essential to calculate metrics like the percentage of true cases in the top risk percentile.2 This is especially important when a goal of the tool is to target high-risk patients for interventions. Wong and colleagues1 helpfully compute AUC, positive predictive values, sensitivity, and specificity. However, one accepted standard for evaluation that should be adopted in future clinical machine learning applications is K-fold cross-validation (eg, with K = 10) rather than the single holdout validation sample in their article. K-fold cross-validation involves K successive mutually exclusive validation sets where the algorithm fitting is iteratively performed on the nonvalidation data (ie, training set). At the end, each observation in the full data has a predicted value that was obtained from when it was part of a validation set. Typically, metrics calculated based on these K-fold cross-validated predicted values will more effectively assess overfitting and have lower variance.3 Of course, assessing the generalizability of a prediction algorithm goes well beyond using crossvalidated metrics to evaluate overfitting. Wong et al1 carefully discussed a number of limitations in their work, including the lack of external validation in other health systems. As in similar studies, the step from good performance in the study to a generalizable algorithm is vast and sometimes may not be feasible. Patients receiving treatment in varied care settings or geographic regions simply may require tailored tools. Recognizing the need for unique tools in different populations is not inherently negative, but one of many considerations not magically solved by using machine learning. Even those algorithms that prove to be generalizable may quickly become outdated as treatment patterns or physician incentives to code health conditions change.4 Increased social tolerance for certain + Related article",2018,11,54,1,true,Computer Science,Medicine,48345067,Sherri Rose,,,,,,,,,,,,,,,,,,,,,,,,,
cedea36fa3692281b3ac767335fe49a16d00957d,https://www.semanticscholar.org/paper/cedea36fa3692281b3ac767335fe49a16d00957d,Structural Topic Models for Open‐Ended Survey Responses,"Collection and especially analysis of open-ended survey responses are relatively rare in the discipline and when conducted are almost exclusively done through human coding. We present an alternative, semiautomated approach, the structural topic model (STM) (Roberts, Stewart, and Airoldi 2013; Roberts et al. 2013), that draws on recent developments in machine learning based analysis of textual data. A crucial contribution of the method is that it incorporates information about the document, such as the author's gender, political affiliation, and treatment assignment (if an experimental study). This article focuses on how the STM is helpful for survey researchers and experimentalists. The STM makes analyzing open-ended responses easier, more revealing, and capable of being used to estimate treatment effects. We illustrate these innovations with analysis of text from surveys and experiments.",2014,71,920,111,true,Computer Science,,2464550,Margaret E. Roberts,28924497,Brandon M Stewart,3252940,D. Tingley,2061550766,Christopher Lucas,1403360325,Jetson Leder-Luis,13901928,S. Gadarian,,50483051,B. Albertson,2157480,David G. Rand,,,,,,,,,,
0d482366a508c33346bf8af10736d10a31233dfc,https://www.semanticscholar.org/paper/0d482366a508c33346bf8af10736d10a31233dfc,Fault Detection in Wireless Sensor Networks Through SVM Classifier,"Wireless sensor networks (WSNs) are prone to many failures such as hardware failures, software failures, and communication failures. The fault detection in WSNs is a challenging problem due to sensor resources limitation and the variety of deployment field. Furthermore, the detection has to be precise to avoid negative alerts, and rapid to limit loss. The use of machine learning seems to be one of the most convenient solutions for detecting failure in WSNs. In this paper, support vector machines (SVMs) classification method is used for this purpose. Based on statistical learning theory, SVM is used in our context to define a decision function. As a light process in term of required resources, this decision function can be easily executed at cluster heads to detect anomalous sensor. The effectiveness of SVM for fault detection in WSNs is shown through an experimental study, comparing it to latest for the same application.",2018,26,153,16,false,Computer Science,,2522993,S. Zidi,2099267,T. Moulahi,2894526,B. Alaya,,,,,,,,,,,,,,,,,,,,,
eb3caabde41ce45f895b60e59ef88d66eeaf9711,https://www.semanticscholar.org/paper/eb3caabde41ce45f895b60e59ef88d66eeaf9711,A Contextual Bandit Bake-off,"Contextual bandit algorithms are essential for solving many real-world interactive machine learning problems. Despite multiple recent successes on statistically and computationally efficient methods, the practical behavior of these algorithms is still poorly understood. We leverage the availability of large numbers of supervised learning datasets to compare and empirically optimize contextual bandit algorithms, focusing on practical methods that learn by relying on optimization oracles from supervised learning. We find that a recent method (Foster et al., 2018) using optimism under uncertainty works the best overall. A surprisingly close second is a simple greedy baseline that only explores implicitly through the diversity of contexts, followed by a variant of Online Cover (Agarwal et al., 2014) which tends to be more conservative but robust to problem specification by design. Along the way, we also evaluate and improve several internal components of contextual bandit algorithm design. Overall, this is a thorough study and review of contextual bandit methodology.",2018,39,65,14,false,Computer Science,Mathematics,2269602,A. Bietti,40333747,Alekh Agarwal,144162125,J. Langford,,,,,,,,,,,,,,,,,,,,,
121f46b8c1a4f837fc439a8cd74d8afc96d1d0c5,https://www.semanticscholar.org/paper/121f46b8c1a4f837fc439a8cd74d8afc96d1d0c5,A CNN–LSTM model for gold price time-series forecasting,,2020,44,190,14,false,Computer Science,,9266879,I. Livieris,66066672,Emmanuel G. Pintelas,1725504,P. Pintelas,,,,,,,,,,,,,,,,,,,,,
a5b4b34eab08f1995eecbd5f61dee7d65593529b,https://www.semanticscholar.org/paper/a5b4b34eab08f1995eecbd5f61dee7d65593529b,Reasoning Under Uncertainty: Towards Collaborative Interactive Machine Learning,,2016,88,24,0,true,Computer Science,,2066498285,Sebastian Robert,144172902,S. Büttner,1735388,C. Röcker,1749801,Andreas Holzinger,,,,,,,,,,,,,,,,,,,
6c44f8e62d824bcda4f291c679a5518bbd4225f6,https://www.semanticscholar.org/paper/6c44f8e62d824bcda4f291c679a5518bbd4225f6,Adversarial Attacks on Neural Networks for Graph Data,"Deep learning models for graphs have achieved strong performance for the task of node classification. Despite their proliferation, currently there is no study of their robustness to adversarial attacks. Yet, in domains where they are likely to be used, e.g. the web, adversaries are common. Can deep learning models for graphs be easily fooled? In this work, we introduce the first study of adversarial attacks on attributed graphs, specifically focusing on models exploiting ideas of graph convolutions. In addition to attacks at test time, we tackle the more challenging class of poisoning/causative attacks, which focus on the training phase of a machine learning model.We generate adversarial perturbations targeting the node's features and the graph structure, thus, taking the dependencies between instances in account. Moreover, we ensure that the perturbations remain unnoticeable by preserving important data characteristics. To cope with the underlying discrete domain we propose an efficient algorithm Nettack exploiting incremental computations. Our experimental study shows that accuracy of node classification significantly drops even when performing only few perturbations. Even more, our attacks are transferable: the learned attacks generalize to other state-of-the-art node classification models and unsupervised approaches, and likewise are successful even when only limited knowledge about the graph is given.",2018,65,574,131,true,Computer Science,Mathematics,3156540,Daniel Zügner,46256784,Amir Akbarnejad,3075189,Stephan Günnemann,,,,,,,,,,,,,,,,,,,,,
187110ea2bb38456b73fc50399bd7ce5f622702a,https://www.semanticscholar.org/paper/187110ea2bb38456b73fc50399bd7ce5f622702a,Discriminative Least Squares Regression for Multiclass Classification and Feature Selection,"This paper presents a framework of discriminative least squares regression (LSR) for multiclass classification and feature selection. The core idea is to enlarge the distance between different classes under the conceptual framework of LSR. First, a technique called ε-dragging is introduced to force the regression targets of different classes moving along opposite directions such that the distances between classes can be enlarged. Then, the ε-draggings are integrated into the LSR model for multiclass classification. Our learning framework, referred to as discriminative LSR, has a compact model form, where there is no need to train two-class machines that are independent of each other. With its compact form, this model can be naturally extended for feature selection. This goal is achieved in terms of L2,1 norm of matrix, generating a sparse learning model for feature selection. The model for multiclass classification and its extension for feature selection are finally solved elegantly and efficiently. Experimental evaluation over a range of benchmark datasets indicates the validity of our method.",2012,66,310,47,false,Mathematics,Medicine,1683738,Shiming Xiang,144962210,F. Nie,3182192,Gaofeng Meng,144809241,Chunhong Pan,14966740,Changshui Zhang,,,Computer Science,,,,,,,,,,,,,,
261e81cba749f70271fa4b7e230328fc1a4a6c96,https://www.semanticscholar.org/paper/261e81cba749f70271fa4b7e230328fc1a4a6c96,MAD-GAN: Multivariate Anomaly Detection for Time Series Data with Generative Adversarial Networks,,2019,44,315,51,true,Mathematics,Computer Science,2150383170,Dan Li,2113596319,Dacheng Chen,2117205408,Lei Shi,3284322,Baihong Jin,121813988,Jonathan Goh,1794527,See-Kiong Ng,,,,,,,,,,,,,,,
c6916fc5b6798c91c1c7f486d95cc94bc0a61afa,https://www.semanticscholar.org/paper/c6916fc5b6798c91c1c7f486d95cc94bc0a61afa,Persistence diagrams with linear machine learning models,,2017,45,55,4,true,Computer Science,Mathematics,2588838,I. Obayashi,3070407,Y. Hiraoka,,,,,,,,,,,,,,,,,,,,,,,
deb5b5b7cbc6e542b4334854be9efcd9d360b784,https://www.semanticscholar.org/paper/deb5b5b7cbc6e542b4334854be9efcd9d360b784,The Berlin Brain-Computer Interface: Accurate performance from first-session in BCI-naive subjects,"The Berlin brain-computer interface (BBCI) project develops a noninvasive BCI system whose key features are: 1) the use of well-established motor competences as control paradigms; 2) high-dimensional features from multichannel EEG; and 3) advanced machine-learning techniques. Spatio-spectral changes of sensorimotor rhythms are used to discriminate imagined movements (left hand, right hand, and foot). A previous feedback study [M. Krauledat, K.-R. Muller, and G. Curio. (2007) The non-invasive Berlin brain-computer Interface: Fast acquisition of effective performance in untrained subjects. NeuroImage. [Online]. 37(2), pp. 539--550. Available: http://dx.doi.org/10.1016/j.neuroimage.2007.01.051] with ten subjects provided preliminary evidence that the BBCI system can be operated at high accuracy for subjects with less than five prior BCI exposures. Here, we demonstrate in a group of 14 fully BCI-naive subjects that 8 out of 14 BCI novices can perform at >84% accuracy in their very first BCI session, and a further four subjects at >70%. Thus, 12 out of 14 BCI-novices had significant above-chance level performances without any subject training even in the first session, as based on an optimized EEG analysis by advanced machine-learning algorithms.",2008,72,313,10,false,Computer Science,Medicine,3156886,B. Blankertz,46733761,F. Losch,1831901,M. Krauledat,2115772,G. Dornhege,3073253,G. Curio,145034054,K. Müller,,,,,,,,,,,,,,,
79a8674b05b045b459cf6eeba3b4687da1878fcd,https://www.semanticscholar.org/paper/79a8674b05b045b459cf6eeba3b4687da1878fcd,Risk-Aware Machine Learning Classifier for Skin Lesion Diagnosis,"Knowing when a machine learning system is not confident about its prediction is crucial in medical domains where safety is critical. Ideally, a machine learning algorithm should make a prediction only when it is highly certain about its competency, and refer the case to physicians otherwise. In this paper, we investigate how Bayesian deep learning can improve the performance of the machine–physician team in the skin lesion classification task. We used the publicly available HAM10000 dataset, which includes samples from seven common skin lesion categories: Melanoma (MEL), Melanocytic Nevi (NV), Basal Cell Carcinoma (BCC), Actinic Keratoses and Intraepithelial Carcinoma (AKIEC), Benign Keratosis (BKL), Dermatofibroma (DF), and Vascular (VASC) lesions. Our experimental results show that Bayesian deep networks can boost the diagnostic performance of the standard DenseNet-169 model from 81.35% to 83.59% without incurring additional parameters or heavy computation. More importantly, a hybrid physician–machine workflow reaches a classification accuracy of 90% while only referring 35% of the cases to physicians. The findings are expected to generalize to other medical diagnosis applications. We believe that the availability of risk-aware machine learning methods will enable a wider adoption of machine learning technology in clinical settings.",2019,77,49,5,true,Medicine,,27588412,Aryan Mobiny,2109435489,Aditi Singh,151497174,Hien Van Nguyen,,,,,,,,,,,,,,,,,,,,,
b1e25e6dcf66029952b4f925c81848c04c97f2b6,https://www.semanticscholar.org/paper/b1e25e6dcf66029952b4f925c81848c04c97f2b6,Sentiment analysis using deep learning architectures: a review,,2019,245,231,4,false,Computer Science,,35144077,Ashima Yadav,47731526,D. Vishwakarma,,,,,,,,,,,,,,,,,,,,,,,
e9256e49151f5ff23e2ac25fcd11f2dfe25729c2,https://www.semanticscholar.org/paper/e9256e49151f5ff23e2ac25fcd11f2dfe25729c2,Machine Learning in Proof General: Interfacing Interfaces,"We present ML4PG - a machine learning extension for Proof General. It allows users to gather proof statistics related to shapes of goals, sequences of applied tactics, and proof tree structures from the libraries of interactive higher-order proofs written in Coq and SSReflect. The gathered data is clustered using the state-of-the-art machine learning algorithms available in MATLAB and Weka. ML4PG provides automated interfacing between Proof General and MATLAB/Weka. The results of clustering are used by ML4PG to provide proof hints in the process of interactive proof development.",2012,61,54,2,true,Computer Science,,2875686,E. Komendantskaya,1751150,J. Heras,1687679,G. Grov,,,,,,,,,,,,,,,,,,,,,
b0c505f6b8f785af48b21e28c25dbc6db61e5a83,https://www.semanticscholar.org/paper/b0c505f6b8f785af48b21e28c25dbc6db61e5a83,Support vector machine learning-based fMRI data group analysis,,2007,52,130,9,true,Computer Science,Medicine,2108724297,Ze Wang,1871426,A. Childress,3065062,Danny J. J. Wang,1890176,J. Detre,,,,,,,,,,,,,,,,,,,
b0742e0cd29d318761bc7918a4f05399b7d67e19,https://www.semanticscholar.org/paper/b0742e0cd29d318761bc7918a4f05399b7d67e19,Machine-learning-based hotspot detection using topological classification and critical feature extraction,"Because of the widening sub-wavelength lithography gap in advanced fabrication technology, lithography hotspot detection has become an essential task in design for manufacturability. Current state-of-the-art works unite pattern matching and machine learning engines. Unlike them, we fully exploit the strengths of machine learning using novel techniques. By combing topological classification and critical feature extraction, our hotspot detection framework achieves very high accuracy. Furthermore, to speed up the evaluation, we verify only possible layout clips instead of full-layout scanning. After detection, we filter hotspots to reduce the false alarm. Experimental results show that the proposed framework is very accurate and demonstrates a rapid training convergence. Moreover, our framework outperforms the 2012 CAD Contest at ICCAD winner on accuracy and false alarm.",2013,27,110,11,false,Computer Science,Engineering,2116068526,Yen-Ting Yu,2809872,Geng-He Lin,1717610,I. Jiang,144434073,C. Chiang,,,,,,,,,,,,,,,,,,,
