paperId,url,title,abstract,year,referenceCount,citationCount,influentialCitationCount,isOpenAccess,fieldsOfStudy/0,fieldsOfStudy/1,authors/0/authorId,authors/0/name,authors/1/authorId,authors/1/name,authors/2/authorId,authors/2/name,authors/3/authorId,authors/3/name,authors/4/authorId,authors/4/name,authors/5/authorId,authors/5/name,authors/6/authorId,authors/6/name,authors/7/authorId,authors/7/name,authors/8/authorId,authors/8/name,authors/9/authorId,authors/9/name,authors/10/authorId,authors/10/name,authors/11/authorId,authors/11/name,authors/12/authorId,authors/12/name,authors/13/authorId,authors/13/name,authors/14/authorId,authors/14/name,authors/15/authorId,authors/15/name,fieldsOfStudy/2
9111e0a578ae34664dddcd76794bbe20e168a1ff,https://www.semanticscholar.org/paper/9111e0a578ae34664dddcd76794bbe20e168a1ff,Usilng Machine Learning Technliques to Identify Botnet Traffic,"To date, techniques to counter cyber-attacks have predominantly been reactive; they focus on monitoring network traffic, detecting anomalies and cyber-attack traffic patterns, and, a posteriori, combating the cyber-attacks and mitigating their effects. Contrary to such approaches, we advocate proactively detecting and identifying botnets prior to their being used as part of a cyber-attack (Strayer et al., 2006). In this paper, we present our work on using machine learning-based classification techniques to identify the command and control (C2) traffic of IRC-based botnets - compromised hosts that are collectively commanded using Internet relay chat (IRC). We split this task into two stages: (I) distinguishing between IRC and non-IRC traffic, and (II) distinguishing between botnet and real IRC traffic. For stage I, we compare the performance of J48, naive Bayes, and Bayesian network classifiers, identify the features that achieve good overall classification accuracy, and determine the classification sensitivity to the training set size. While sensitive to the training data and the attributes used to characterize communication flows, machine learning-based classifiers show promise in identifying IRC traffic. Using classification in stage II is trickier, since accurately labeling IRC traffic as botnet and non-botnet is challenging. We are currently exploring labeling flows as suspicious and non-suspicious based on telltales of hosts being compromised",2006,19,348,16,false,Computer Science,,32744942,C. Livadas,145963952,R. Walsh,17286974,D. Lapsley,1732393,W. Strayer,,,,,,,,,,,,,,,,,,,,,,,,,
c39a7d4c36efd7d08678f6ab6d97e31df91235b5,https://www.semanticscholar.org/paper/c39a7d4c36efd7d08678f6ab6d97e31df91235b5,The application of machine learning to structural health monitoring,"In broad terms, there are two approaches to damage identification. Model-driven methods establish a high-fidelity physical model of the structure, usually by finite element analysis, and then establish a comparison metric between the model and the measured data from the real structure. If the model is for a system or structure in normal (i.e. undamaged) condition, any departures indicate that the structure has deviated from normal condition and damage is inferred. Data-driven approaches also establish a model, but this is usually a statistical representation of the system, e.g. a probability density function of the normal condition. Departures from normality are then signalled by measured data appearing in regions of very low density. The algorithms that have been developed over the years for data-driven approaches are mainly drawn from the discipline of pattern recognition, or more broadly, machine learning. The object of this paper is to illustrate the utility of the data-driven approach to damage identification by means of a number of case studies.",2007,37,322,9,false,Mathematics,Medicine,144789804,K. Worden,145004158,G. Manson,,,,,,,,,,,,,,,,,,,,,,,,,,,,,
75e56ef7924972fde2ffc32d7071cd182d0f0f21,https://www.semanticscholar.org/paper/75e56ef7924972fde2ffc32d7071cd182d0f0f21,Selection of Relevant Features in Machine Learning,"In this paper, we review the problem of selecting rele- vant features for use in machine learning. We describe this problem in terms of heuristic search through a space of feature sets, and we identify four dimensions along which approaches to the problem can vary. We consider recent work on feature selection in terms of this framework, then close with some challenges for future work in the area. 1. The Problem of Irrelevant Features accuracy) to grow slowly with the number of irrele- vant attributes. Theoretical results for algorithms that search restricted hypothesis spaces are encouraging. For instance, the worst-case number of errors made by Littlestone's (1987) WINNOW method grows only logarithmically with the number of irrelevant features. Pazzani and Sarrett's (1992) average-case analysis for WHOLIST, a simple conjunctive algorithm, and Lang- ley and Iba's (1993) treatment of the naive Bayesian classifier, suggest that their sample complexities grow at most linearly with the number of irrelevant features. However, the theoretical results are less optimistic for induction methods that search a larger space of concept descriptions. For example, Langley and Iba's (1993) average-case analysis of simple nearest neighbor indicates that its sample complexity grows exponen- tially with the number of irrelevant attributes, even for conjunctive target concepts. Experimental stud- ies of nearest neighbor are consistent with this conclu- sion, and other experiments suggest that similar results hold even for induction algorithms that explicitly se- lect features. For example, the sample complexity for decision-tree methods appears to grow linearly with the number of irrelevants for conjunctive concepts, but exponentially for parity concepts, since the evaluation metric cannot distinguish relevant from irrelevant fea- tures in the latter situation (Langley & Sage, in press). Results of this sort have encouraged machine learn- ing researchers to explore more sophisticated methods for selecting relevant features. In the sections that fol- low, we present a general framework for this task, and then consider some recent examples of work on this important problem.",1994,21,778,24,true,Mathematics,,1713919,P. Langley,,,,,,,,,,,,,,,,,,,,,,,,,,,,,,,
e6276780b23ce2cff6e19397b5e726842f8a24d4,https://www.semanticscholar.org/paper/e6276780b23ce2cff6e19397b5e726842f8a24d4,Ensemble Based Extreme Learning Machine,"Extreme learning machine (ELM) was proposed as a new class of learning algorithm for single-hidden layer feedforward neural network (SLFN). To achieve good generalization performance, ELM minimizes training error on the entire training data set, therefore it might suffer from overfitting as the learning model will approximate all training samples well. In this letter, an ensemble based ELM (EN-ELM) algorithm is proposed where ensemble learning and cross-validation are embedded into the training phase so as to alleviate the overtraining problem and enhance the predictive stability. Experimental results on several benchmark databases demonstrate that EN-ELM is robust and efficient for classification.",2010,17,217,11,false,Computer Science,,2143065963,Nan Liu,2113289095,Han Wang,,,,,,,,,,,,,,,,,,,,,,,,,,,,,
160a4786dd643d9f758b9cc0758bdd2581524941,https://www.semanticscholar.org/paper/160a4786dd643d9f758b9cc0758bdd2581524941,Machine learning for detection and diagnosis of disease.,"Machine learning offers a principled approach for developing sophisticated, automatic, and objective algorithms for analysis of high-dimensional and multimodal biomedical data. This review focuses on several advances in the state of the art that have shown promise in improving detection, diagnosis, and therapeutic monitoring of disease. Key in the advancement has been the development of a more in-depth understanding and theoretical analysis of critical issues related to algorithmic construction and learning theory. These include trade-offs for maximizing generalization performance, use of physically realistic constraints, and incorporation of prior knowledge and uncertainty. The review describes recent developments in machine learning, focusing on supervised and unsupervised linear methods and Bayesian inference, which have made significant impacts in the detection and diagnosis of disease in biomedicine. We describe the different methodologies and, for each, provide examples of their application to specific domains in biomedical diagnostics.",2006,152,293,7,false,Computer Science,Medicine,1812793,P. Sajda,,,,,,,,,,,,,,,,,,,,,,,,,,,,,,,
7975195638f3574ac02975df6f4048558ec1bc96,https://www.semanticscholar.org/paper/7975195638f3574ac02975df6f4048558ec1bc96,Extreme learning machines: a survey,,2011,127,1692,108,false,Computer Science,,145678691,G. Huang,70129091,Dianhui Wang,1770395,Yuan Lan,,,,,,,,,,,,,,,,,,,,,,,,,,,
fc82788021963ff8e318ffe955829bc68e48943a,https://www.semanticscholar.org/paper/fc82788021963ff8e318ffe955829bc68e48943a,Machine Learning of Temporal Relations,"This paper investigates a machine learning approach for temporally ordering and anchoring events in natural language texts. To address data sparseness, we used temporal reasoning as an over-sampling method to dramatically expand the amount of training data, resulting in predictive accuracy on link labeling as high as 93% using a Maximum Entropy classifier on human annotated data. This method compared favorably against a series of increasingly sophisticated baselines involving expansion of rules derived from human intuitions.",2006,28,274,27,true,Computer Science,,1729172,I. Mani,145539145,M. Verhagen,2107124,Ben Wellner,2495244,Chong Min Lee,1707726,J. Pustejovsky,,,,,,,,,,,,,,,,,,,,,,,
dc418bccc06fdf3873b0241c97af4219dfca794a,https://www.semanticscholar.org/paper/dc418bccc06fdf3873b0241c97af4219dfca794a,Machine Learning in a Quantum World,,2006,25,132,3,false,Computer Science,,1765537,Esma Aïmeur,1771605,G. Brassard,1777382,S. Gambs,,,,,,,,,,,,,,,,,,,,,,,,,,,
06757c457ec442eb35af6ea45d8d0e2339415178,https://www.semanticscholar.org/paper/06757c457ec442eb35af6ea45d8d0e2339415178,The Interplay of Optimization and Machine Learning Research,"The fields of machine learning and mathematical programming are increasingly intertwined. Optimization problems lie at the heart of most machine learning approaches. The Special Topic on Machine Learning and Large Scale Optimization examines this interplay. Machine learning researchers have embraced the advances in mathematical programming allowing new types of models to be pursued. The special topic includes models using quadratic, linear, second-order cone, semi-definite, and semi-infinite programs. We observe that the qualities of good optimization algorithms from the machine learning and optimization perspectives can be quite different. Mathematical programming puts a premium on accuracy, speed, and robustness. Since generalization is the bottom line in machine learning and training is normally done off-line, accuracy and small speed improvements are of little concern in machine learning. Machine learning prefers simpler algorithms that work in reasonable computational time for specific classes of problems. Reducing machine learning problems to well-explored mathematical programming classes with robust general purpose optimization codes allows machine learning researchers to rapidly develop new techniques. In turn, machine learning presents new challenges to mathematical programming. The special issue include papers from two primary themes: novel machine learning models and novel optimization approaches for existing models. Many papers blend both themes, making small changes in the underlying core mathematical program that enable the develop of effective new algorithms.",2006,50,142,5,false,Computer Science,,2065549778,Kristin P. Bennett,1399027884,E. Parrado-Hernández,,,,,,,,,,,,,,,,,,,,,,,,,,,,,
cfc04be0eaf30ad81dcaaada8d6e6171aa058432,https://www.semanticscholar.org/paper/cfc04be0eaf30ad81dcaaada8d6e6171aa058432,Flow Clustering Using Machine Learning Techniques,,2004,11,569,23,true,Computer Science,,144078738,A. McGregor,118860642,M. Hall,2623414,Perry Lorier,50187557,James Brunskill,,,,,,,,,,,,,,,,,,,,,,,,,
6383011826c14af5d63700b4a3dd6e33391c55d0,https://www.semanticscholar.org/paper/6383011826c14af5d63700b4a3dd6e33391c55d0,Bioinformatics: the machine learning approach,"In this book Pierre Baldi and Soren Brunak present the key machine learning approaches and apply them to the computational problems encountered in the analysis of biological data. The book is aimed both at biologists and biochemists who need to understand new data-driven algorithms and at those with a primary background in physics, mathematics, statistics, or computer science who need to know more about applications in molecular biology.",2002,0,615,21,false,Computer Science,,144902513,P. Baldi,8169197,S. Brunak,,,,,,,,,,,,,,,,,,,,,,,,,,,,,
69ae9989ecc0f72a79b339bde11d68a53b9c7c46,https://www.semanticscholar.org/paper/69ae9989ecc0f72a79b339bde11d68a53b9c7c46,Pattern Recognition and Machine Learning,,2012,0,316,0,false,Computer Science,,97306284,K. Fu,,,,,,,,,,,,,,,,,,,,,,,,,,,,,,,
ccfaba27ca7bce5b95dde407e9df568e5902b218,https://www.semanticscholar.org/paper/ccfaba27ca7bce5b95dde407e9df568e5902b218,Learning with Submodular Functions: A Convex Optimization Perspective,"Submodular functions are relevant to machine learning for at least two reasons: (1) some problems may be expressed directly as the optimization of submodular functions and (2) the Lovsz extension of submodular functions provides a useful set of regularization functions for supervised and unsupervised learning. In Learning with Submodular Functions: A Convex Optimization Perspective, the theory of submodular functions is presented in a self-contained way from a convex analysis perspective, presenting tight links between certain polyhedra, combinatorial optimization and convex optimization problems. In particular, it describes how submodular function minimization is equivalent to solving a wide variety of convex optimization problems. This allows the derivation of new efficient algorithms for approximate and exact submodular function minimization with theoretical guarantees and good practical performance. By listing many examples of submodular functions, it reviews various applications to machine learning, such as clustering, experimental design, sensor placement, graphical model structure learning or subset selection, as well as a family of structured sparsity-inducing norms that can be derived and used from submodular functions. Learning with Submodular Functions: A Convex Optimization Perspective is an ideal reference for researchers, scientists, or engineers with an interest in applying submodular functions to machine learning problems.",2011,221,410,62,true,Computer Science,Mathematics,144570279,F. Bach,,,,,,,,,,,,,,,,,,,,,,,,,,,,,,,
403a730841c1e8e9e8062df22ff8f43537afd6ee,https://www.semanticscholar.org/paper/403a730841c1e8e9e8062df22ff8f43537afd6ee,Feature Selection for Machine Learning: Comparing a Correlation-Based Filter Approach to the Wrapper,"Feature selection is often an essential data processing step prior to applying a learning algorithm. The removal of irrelevant and redundant information often improves the performance of machine learning algorithms. There are two common approaches: a wrapper uses the intended learning algorithm itself to evaluate the usefulness of features, while a fllter evaluates features according to heuristics based on general characteristics of the data. The wrapper approach is generally considered to produce better feature subsets but runs much more slowly than a fllter. This paper describes a new fllter approach to feature selection that uses a correlation based heuristic to evaluate the worth of feature subsets When applied as a data preprocessing step for two common machine learning algorithms, the new method compares favourably with the wrapper but requires much less computation.",1999,17,588,56,false,Computer Science,,118860642,M. Hall,2226870,L. A. Smith,,,,,,,,,,,,,,,,,,,,,,,,,,,,,
78a907839eadb15730ed51b574009067a5ac394a,https://www.semanticscholar.org/paper/78a907839eadb15730ed51b574009067a5ac394a,Orange: From Experimental Machine Learning to Interactive Data Mining,,2004,0,482,39,true,Computer Science,,2701105,J. Demšar,1775384,B. Zupan,1770649,Gregor Leban,1772593,Tomaž Curk,,,,,,,,,,,,,,,,,,,,,,,,,
fb829c5e6b406bb325fa5a02e05073df12b1772b,https://www.semanticscholar.org/paper/fb829c5e6b406bb325fa5a02e05073df12b1772b,Classes of Kernels for Machine Learning: A Statistics Perspective,"In this paper, we present classes of kernels for machine learning from a statistics perspective. Indeed, kernels are positive definite functions and thus also covariances. After discussing key properties of kernels, as well as a new formula to construct kernels, we present several important classes of kernels: anisotropic stationary kernels, isotropic stationary kernels, compactly supported kernels, locally stationary kernels, nonstationary kernels, and separable nonstationary kernels. Compactly supported kernels and separable nonstationary kernels are of prime interest because they provide a computational reduction for kernel-based methods. We describe the spectral representation of the various classes of kernels and conclude with a discussion on the characterization of nonlinear maps that reduce nonstationary kernels to either stationarity or local stationarity.",2002,41,629,32,false,Mathematics,Computer Science,1877479,M. Genton,,,,,,,,,,,,,,,,,,,,,,,,,,,,,,,
29cedf9f9edd5179aa2e78654a7b81c9da45f0d0,https://www.semanticscholar.org/paper/29cedf9f9edd5179aa2e78654a7b81c9da45f0d0,Learning and optimization using the clonal selection principle,"The clonal selection principle is used to explain the basic features of an adaptive immune response to an antigenic stimulus. It establishes the idea that only those cells that recognize the antigens (Ag's) are selected to proliferate. The selected cells are subject to an affinity maturation process, which improves their affinity to the selective Ag's. This paper proposes a computational implementation of the clonal selection principle that explicitly takes into account the affinity maturation of the immune response. The general algorithm, named CLONALG, is derived primarily to perform machine learning and pattern recognition tasks, and then it is adapted to solve optimization problems, emphasizing multimodal and combinatorial optimization. Two versions of the algorithm are derived, their computational cost per iteration is presented, and a sensitivity analysis in relation to the user-defined parameters is given. CLONALG is also contrasted with evolutionary algorithms. Several benchmark problems are considered to evaluate the performance of CLONALG and it is also compared to a niching method for multimodal function optimization.",2002,61,2279,208,false,Computer Science,,145390561,L. Castro,7359553,F. V. Zuben,,,,,,,,,,,,,,,,,,,,,,,,,,,,,
d91ea30f4f9de817b29bb4ece00f43cb971822b4,https://www.semanticscholar.org/paper/d91ea30f4f9de817b29bb4ece00f43cb971822b4,Machine Learning Benchmarks and Random Forest Regression,"Breiman (2001a,b) has recently developed an ensemble classification and regression approach that displayed outstanding performance with regard prediction error on a suite of benchmark datasets. As the base constituents of the ensemble are tree-structured predictors, and since each of these is constructed using an injection of randomness, the method is called ‘random forests’. That the exceptional performance is attained with seemingly only a single tuning parameter, to which sensitivity is minimal, makes the methodology all the more remarkable. The individual trees comprising the forest are all grown to maximal depth. While this helps with regard bias, there is the familiar tradeoff with variance. However, these variability concerns were potentially obscured because of an interesting feature of those benchmarking datasets extracted from the UCI machine learning repository for testing: all these datasets are hard to overfit using tree-structured methods. This raises issues about the scope of the repository. With this as motivation, and coupled with experience from boosting methods, we revisit the formulation of random forests and investigate prediction performance on real-world and simulated datasets for which maximally sized trees do overfit. These explorations reveal that gains can be realized by additional tuning to regulate tree size via limiting the number of splits and/or the size of nodes for which splitting is allowed. Nonetheless, even in these settings, good performance for random forests can be attained by using larger (than default) primary tuning parameter values.",2004,14,452,19,false,Computer Science,,3013332,M. Segal,,,,,,,,,,,,,,,,,,,,,,,,,,,,,,,
49ca42e19bd1c647d099f9accd44e31e2e8e0b5a,https://www.semanticscholar.org/paper/49ca42e19bd1c647d099f9accd44e31e2e8e0b5a,Machine-Learning Research,"Machine-learning research has been making great progress in many directions. This article summarizes four of these directions and discusses some current open problems. The four directions are (1) the improvement of classification accuracy by learning ensembles of classifiers, (2) methods for scaling up supervised learning algorithms, (3) reinforcement learning, and (4) the learning of complex stochastic models.",1997,89,733,13,false,Computer Science,,144299726,Thomas G. Dietterich,,,,,,,,,,,,,,,,,,,,,,,,,,,,,,,
8d1b6888aa08b0a590c9e5d1c563d5e646f0505e,https://www.semanticscholar.org/paper/8d1b6888aa08b0a590c9e5d1c563d5e646f0505e,Multi-Objective Machine Learning,,2006,0,200,8,true,Computer Science,,2157835870,Yaochu Jin,,,,,,,,,,,,,,,,,,,,,,,,,,,,,,,
f5e04e45416dbfb66c3e132570f897d67f13d474,https://www.semanticscholar.org/paper/f5e04e45416dbfb66c3e132570f897d67f13d474,Using GPUs for machine learning algorithms,"Using dedicated hardware to do machine learning typically ends up in disaster because of cost, obsolescence, and poor software. The popularization of graphic processing units (GPUs), which are now available on every PC, provides an attractive alternative. We propose a generic 2-layer fully connected neural network GPU implementation which yields over 3/spl times/ speedup for both training and testing with respect to a 3 GHz P4 CPU.",2005,12,218,12,false,Computer Science,,3265929,Dave Steinkrau,2812486,P. Simard,144437216,I. Buck,,,,,,,,,,,,,,,,,,,,,,,,,,,
8b8570a9892c487ac05dc196e2bfe23faa34d99e,https://www.semanticscholar.org/paper/8b8570a9892c487ac05dc196e2bfe23faa34d99e,Interactive machine learning,"Perceptual user interfaces (PUIs) are an important part of ubiquitous computing. Creating such interfaces is difficult because of the image and signal processing knowledge required for creating classifiers. We propose an interactive machine-learning (IML) model that allows users to train, classify/view and correct the classifications. The concept and implementation details of IML are discussed and contrasted with classical machine learning models. Evaluations of two algorithms are also presented. We also briefly describe Image Processing with Crayons (Crayons), which is a tool for creating new camera-based interfaces using a simple painting metaphor. The Crayons tool embodies our notions of interactive machine learning",2003,33,542,34,false,Computer Science,,3141061,Jerry Alan Fails,1733794,D. Olsen,,,,,,,,,,,,,,,,,,,,,,,,,,,,,
463565c30b7a9c12c2ef0558a51cfc7b05055737,https://www.semanticscholar.org/paper/463565c30b7a9c12c2ef0558a51cfc7b05055737,Semi-Supervised Learning (Adaptive Computation and Machine Learning),,2006,34,238,19,false,Computer Science,,1730609,O. Chapelle,1707625,B. Schölkopf,2281542,A. Zien,,,,,,,,,,,,,,,,,,,,,,,,,,,
8df9c71f09eb0dabf5adf17bee0f6b36190b52b2,https://www.semanticscholar.org/paper/8df9c71f09eb0dabf5adf17bee0f6b36190b52b2,Representational Learning with Extreme Learning Machine for Big Data Liyanaarachchi,"Restricted Boltzmann Machines (RBM) and auto encoders, learns to represent features in a dataset meaningfully and used as the basic building blocks to create deep networks. This paper introduces Extreme Learning Machine based Auto Encoder (ELM-AE), which learns feature representations using singular values and is used as the basic building block for Multi Layer Extreme Learning Machine (ML-ELM). ML-ELM performance is better than auto encoders based deep networks and Deep Belief Networks (DBN), while in par with Deep Boltzmann Machines (DBM) for MNIST dataset. However MLELM is significantly faster than any state−of−the−art deep networks.",,10,254,32,false,,,3276764,L. C. Kasun,2986982,Hongming Zhou,145678691,G. Huang,1807914,C. Vong,,,,,,,,,,,,,,,,,,,,,,,,,
