paperId,url,title,abstract,year,referenceCount,citationCount,influentialCitationCount,isOpenAccess,fieldsOfStudy/0,authors/0/authorId,authors/0/name,authors/1/authorId,authors/1/name,authors/2/authorId,authors/2/name,authors/3/authorId,authors/3/name,authors/4/authorId,authors/4/name,authors/5/authorId,authors/5/name,fieldsOfStudy/1,fieldsOfStudy/2,authors/6/authorId,authors/6/name,authors/7/authorId,authors/7/name,authors/8/authorId,authors/8/name,authors/9/authorId,authors/9/name,authors/10/authorId,authors/10/name,authors/11/authorId,authors/11/name,authors/12/authorId,authors/12/name,authors/13/authorId,authors/13/name,authors/14/authorId,authors/14/name,authors/15/authorId,authors/15/name
ccf6a69a7f33bcf052aa7def176d3b9de495beb7,https://www.semanticscholar.org/paper/ccf6a69a7f33bcf052aa7def176d3b9de495beb7,Man is to Computer Programmer as Woman is to Homemaker? Debiasing Word Embeddings,"The blind application of machine learning runs the risk of amplifying biases present in data. Such a danger is facing us with word embedding, a popular framework to represent text data as vectors which has been used in many machine learning and natural language processing tasks. We show that even word embeddings trained on Google News articles exhibit female/male gender stereotypes to a disturbing extent. This raises concerns because their widespread use, as we describe, often tends to amplify these biases. Geometrically, gender bias is first shown to be captured by a direction in the word embedding. Second, gender neutral words are shown to be linearly separable from gender definition words in the word embedding. Using these properties, we provide a methodology for modifying an embedding to remove gender stereotypes, such as the association between the words receptionist and female, while maintaining desired associations such as between the words queen and female. Using crowd-worker evaluation as well as standard benchmarks, we empirically demonstrate that our algorithms significantly reduce gender bias in embeddings while preserving the its useful properties such as the ability to cluster related concepts and to solve analogy tasks. The resulting embeddings can be used in applications without amplifying gender bias.",2016,47,1842,279,False,Computer Science,2843215,Tolga Bolukbasi,2782886.0,Kai-Wei Chang,145085305.0,James Y. Zou,1699322.0,Venkatesh Saligrama,2186481.0,A. Kalai,,,Mathematics,,,,,,,,,,,,,,,,,,,,,
427b168f490b56716f22b129ac93aba5425ea08f,https://www.semanticscholar.org/paper/427b168f490b56716f22b129ac93aba5425ea08f,Training linear SVMs in linear time,"Linear Support Vector Machines (SVMs) have become one of the most prominent machine learning techniques for high-dimensional sparse data commonly encountered in applications like text classification, word-sense disambiguation, and drug design. These applications involve a large number of examples n as well as a large number of features N, while each example has only s << N non-zero features. This paper presents a Cutting Plane Algorithm for training linear SVMs that provably has training time 0(s,n) for classification problems and o(sn log (n))for ordinal regression problems. The algorithm is based on an alternative, but equivalent formulation of the SVM optimization problem. Empirically, the Cutting-Plane Algorithm is several orders of magnitude faster than decomposition methods like svm light for large datasets.",2006,25,2147,338,False,Mathematics,1680188,T. Joachims,,,,,,,,,,,Computer Science,,,,,,,,,,,,,,,,,,,,,
d079a2f877f554e00f71a6975435d8325987bdf5,https://www.semanticscholar.org/paper/d079a2f877f554e00f71a6975435d8325987bdf5,Return of Frustratingly Easy Domain Adaptation,"
 
 Unlike human learning, machine learning often fails to handle changes between training (source) and test (target) input distributions. Such domain shifts, common in practical scenarios, severely damage the performance of conventional machine learning methods. Supervised domain adaptation methods have been proposed for the case when the target data have labels, including some that perform very well despite being ``frustratingly easy'' to implement. However, in practice, the target domain is often unlabeled, requiring unsupervised adaptation. We propose a simple, effective, and efficient method for unsupervised domain adaptation called CORrelation ALignment (CORAL). CORAL minimizes domain shift by aligning the second-order statistics of source and target distributions, without requiring any target labels. Even though it is extraordinarily simple--it can be implemented in four lines of Matlab code--CORAL performs remarkably well in extensive evaluations on standard benchmark datasets.
 
",2015,40,1170,226,True,Computer Science,2636783,Baochen Sun,33221685.0,Jiashi Feng,2903226.0,Kate Saenko,,,,,,,,,,,,,,,,,,,,,,,,,,,,
a96e508a94c37ef847b172e7d31b5bbe25629cbb,https://www.semanticscholar.org/paper/a96e508a94c37ef847b172e7d31b5bbe25629cbb,"Data Mining: Concepts and Techniques, 3rd edition","The book Knowledge Discovery in Databases, edited by Piatetsky-Shapiro and Frawley [PSF91], is an early collection of research papers on knowledge discovery from data. The book Advances in Knowledge Discovery and Data Mining, edited by Fayyad, Piatetsky-Shapiro, Smyth, and Uthurusamy [FPSSe96], is a collection of later research results on knowledge discovery and data mining. There have been many data mining books published in recent years, including Predictive Data Mining by Weiss and Indurkhya [WI98], Data Mining Solutions: Methods and Tools for Solving Real-World Problems by Westphal and Blaxton [WB98], Mastering Data Mining: The Art and Science of Customer Relationship Management by Berry and Linofi [BL99], Building Data Mining Applications for CRM by Berson, Smith, and Thearling [BST99], Data Mining: Practical Machine Learning Tools and Techniques by Witten and Frank [WF05], Principles of Data Mining (Adaptive Computation and Machine Learning) by Hand, Mannila, and Smyth [HMS01], The Elements of Statistical Learning by Hastie, Tibshirani, and Friedman [HTF01], Data Mining: Introductory and Advanced Topics by Dunham, and Data Mining: Multimedia, Soft Computing, and Bioinformatics by Mitra and Acharya [MA03]. There are also books containing collections of papers on particular aspects of knowledge discovery, such as Machine Learning and Data Mining: Methods and Applications edited by Michalski, Brakto, and Kubat [MBK98], and Relational Data Mining edited by Dzeroski and Lavrac [De01], as well as many tutorial notes on data mining in major database, data mining and machine learning conferences.",2006,736,2831,253,False,Computer Science,145325584,Jiawei Han,46833537.0,M. Kamber,145525190.0,J. Pei,,,,,,,,,,,,,,,,,,,,,,,,,,,,
b57c54350769ffa59ff57f79ee5aad918844d298,https://www.semanticscholar.org/paper/b57c54350769ffa59ff57f79ee5aad918844d298,Differentially Private Empirical Risk Minimization,"Privacy-preserving machine learning algorithms are crucial for the increasingly common setting in which personal data, such as medical or financial records, are analyzed. We provide general techniques to produce privacy-preserving approximations of classifiers learned via (regularized) empirical risk minimization (ERM). These algorithms are private under the ε-differential privacy definition due to Dwork et al. (2006). First we apply the output perturbation ideas of Dwork et al. (2006), to ERM classification. Then we propose a new method, objective perturbation, for privacy-preserving machine learning algorithm design. This method entails perturbing the objective function before optimizing over classifiers. If the loss and regularizer satisfy certain convexity and differentiability criteria, we prove theoretical results showing that our algorithms preserve privacy, and provide generalization bounds for linear and nonlinear kernels. We further present a privacy-preserving technique for tuning the parameters in general machine learning algorithms, thereby providing end-to-end privacy guarantees for the training process. We apply these results to produce privacy-preserving analogues of regularized logistic regression and support vector machines. We obtain encouraging results from evaluating their performance on real demographic and benchmark data sets. Our results show that both theoretically and empirically, objective perturbation is superior to the previous state-of-the-art, output perturbation, in managing the inherent tradeoff between privacy and learning performance.",2009,59,1159,166,False,Medicine,38120884,Kamalika Chaudhuri,1806678.0,C. Monteleoni,9208982.0,A. Sarwate,,,,,,,Computer Science,,,,,,,,,,,,,,,,,,,,,
b8d7788f25dfaf0f9fe2e6c441d75ca7cd3bc09a,https://www.semanticscholar.org/paper/b8d7788f25dfaf0f9fe2e6c441d75ca7cd3bc09a,Feature Selection for High-Dimensional Data: A Fast Correlation-Based Filter Solution,"Feature selection, as a preprocessing step to machine learning, is effective in reducing dimensionality, removing irrelevant data, increasing learning accuracy, and improving result comprehensibility. However, the recent increase of dimensionality of data poses a severe challenge to many existing feature selection methods with respect to efficiency and effectiveness. In this work, we introduce a novel concept, predominant correlation, and propose a fast filter method which can identify relevant features as well as redundancy among relevant features without pairwise correlation analysis. The efficiency and effectiveness of our method is demonstrated through extensive comparisons with other methods using real-world data of high dimensionality",2003,32,2380,215,False,Computer Science,143676604,Lei Yu,2146397025.0,Huan Liu,,,,,,,,,,,,,,,,,,,,,,,,,,,,,,
03bf05bcb5fc5ea98c737c3aeaa330e047901b34,https://www.semanticscholar.org/paper/03bf05bcb5fc5ea98c737c3aeaa330e047901b34,Experimental design,"Maximizing data information requires careful selection, termed design, of the points at which data are observed. Experimental design is reviewed here for broad classes of data collection and analysis problems, including: fractioning techniques based on orthogonal arrays, Latin hypercube designs and their variants for computer experimentation, efficient design for data mining and machine learning applications, and sequential design for active learning. © 2012 Wiley Periodicals, Inc.",2012,159,1211,65,False,Computer Science,143887093,J. Morgan,35946980.0,Xinwei Deng,,,,,,,,,,,,,,,,,,,,,,,,,,,,,,
9257779eed46107bcdce9f4dc86298572ff466ce,https://www.semanticscholar.org/paper/9257779eed46107bcdce9f4dc86298572ff466ce,Automated learning of decision rules for text categorization,"We describe the results of extensive experiments using optimized rule-based induction methods on large document collections. The goal of these methods is to discover automatically classification patterns that can be used for general document categorization or personalized filtering of free text. Previous reports indicate that human-engineered rule-based systems, requiring many man-years of developmental efforts, have been successfully built to “read” documents and assign topics to them. We show that machine-generated decision rules appear comparable to human performance, while using the identical rule-based representation. In comparison with other machine-learning techniques, results on a key benchmark from the Reuters collection show a large gain in performance, from a previously reported 67% recall/precision breakeven point to 80.5%. In the context of a very high-dimensional feature space, several methodological alternatives are examined, including universal versus local dictionaries, and binary versus frequency-related features.",1994,45,970,46,False,Computer Science,145272844,C. Apté,68982679.0,Fred J. Damerau,145700185.0,S. Weiss,,,,,,,,,,,,,,,,,,,,,,,,,,,,
885af28a751553be48a25b411a5d492767d4cf65,https://www.semanticscholar.org/paper/885af28a751553be48a25b411a5d492767d4cf65,Ensemble Classifiers for Steganalysis of Digital Media,"Today, the most accurate steganalysis methods for digital media are built as supervised classifiers on feature vectors extracted from the media. The tool of choice for the machine learning seems to be the support vector machine (SVM). In this paper, we propose an alternative and well-known machine learning tool-ensemble classifiers implemented as random forests-and argue that they are ideally suited for steganalysis. Ensemble classifiers scale much more favorably w.r.t. the number of training examples and the feature dimensionality with performance comparable to the much more complex SVMs. The significantly lower training complexity opens up the possibility for the steganalyst to work with rich (high-dimensional) cover models and train on larger training sets-two key elements that appear necessary to reliably detect modern steganographic algorithms. Ensemble classification is portrayed here as a powerful developer tool that allows fast construction of steganography detectors with markedly improved detection accuracy across a wide range of embedding methods. The power of the proposed framework is demonstrated on three steganographic methods that hide messages in JPEG images.",2012,57,898,72,True,Computer Science,1808384,Jan Kodovský,1751812.0,J. Fridrich,37127008.0,V. Holub,,,,,,,,,,,,,,,,,,,,,,,,,,,,
9d4bb6ec511c5dd4c6c97224b59cf4cdf4dc0746,https://www.semanticscholar.org/paper/9d4bb6ec511c5dd4c6c97224b59cf4cdf4dc0746,The class imbalance problem: A systematic study,"In machine learning problems, differences in prior class probabilities -- or class imbalances -- have been reported to hinder the performance of some standard classifiers, such as decision trees. This paper presents a systematic study aimed at answering three different questions. First, we attempt to understand the nature of the class imbalance problem by establishing a relationship between concept complexity, size of the training set and class imbalance level. Second, we discuss several basic re-sampling or cost-modifying methods previously proposed to deal with the class imbalance problem and compare their effectiveness. The results obtained by such methods on artificial domains are linked to results in real-world domains. Finally, we investigate the assumption that the class imbalance problem does not only affect decision tree systems but also affects other classification systems such as Neural Networks and Support Vector Machines.",2002,18,2546,116,False,Mathematics,1743642,N. Japkowicz,144980086.0,Shaju Stephen,,,,,,,,,Computer Science,,,,,,,,,,,,,,,,,,,,,
bae3eda9605700b14237f4d04652ab6759c68eef,https://www.semanticscholar.org/paper/bae3eda9605700b14237f4d04652ab6759c68eef,"Artificial intelligence - a modern approach, 2nd Edition","Artificial IntelligenceArtificial Intelligence: A Modern Approach 2Nd Ed.Introduction to Machine LearningArtificial IntelligenceArtificial Intelligence: A Modern Approach, eBook, Global EditionIntroduction to Artificial IntelligenceModern Approaches in Machine Learning and Cognitive Science: A WalkthroughArtificial Intelligence: Pearson New International EditionArtificial IntelligenceArtificial IntelligenceArtificial IntelligenceArtificial Intelligence a Modern ApproachFundamentals of the New Artificial IntelligenceMultiagent SystemsArtificial IntelligenceArtificial IntelligenceThe Hundred-page Machine Learning BookArtificial IntelligenceArtificial IntelligenceArtificial IntelligenceDistributed Artificial IntelligenceArtificial Intelligence For BeginnersParadigms of Artificial Intelligence ProgrammingHuman CompatibleHuman CompatibleARTIFICIAL INTELLIGENCEArtificial IntelligenceArtificial IntelligenceArtificial Intelligence a Modern ApproachDo the Right ThingArtificial IntelligenceArtificial Intelligence : a Modern ApproachArtificial IntelligenceIntelligent Help Systems for UNIXArtificial IntelligenceArtificial IntelligenceArtificial Intelligence a Modern ApproachArtificial IntelligenceArtificial IntelligenceArtificial Intelligence for Human Computer Interaction: A Modern Approach",2003,0,1975,198,False,Computer Science,145107462,Stuart J. Russell,2784519.0,Peter Norvig,,,,,,,,,,,,,,,,,,,,,,,,,,,,,,
7f57e9939560562727344c1c987416285ef76cda,https://www.semanticscholar.org/paper/7f57e9939560562727344c1c987416285ef76cda,Accessorize to a Crime: Real and Stealthy Attacks on State-of-the-Art Face Recognition,"Machine learning is enabling a myriad innovations, including new algorithms for cancer diagnosis and self-driving cars. The broad use of machine learning makes it important to understand the extent to which machine-learning algorithms are subject to attack, particularly when used in applications where physical security or safety is at risk. In this paper, we focus on facial biometric systems, which are widely used in surveillance and access control. We define and investigate a novel class of attacks: attacks that are physically realizable and inconspicuous, and allow an attacker to evade recognition or impersonate another individual. We develop a systematic method to automatically generate such attacks, which are realized through printing a pair of eyeglass frames. When worn by the attacker whose image is supplied to a state-of-the-art face-recognition algorithm, the eyeglasses allow her to evade being recognized or to impersonate another individual. Our investigation focuses on white-box face-recognition systems, but we also demonstrate how similar techniques can be used in black-box scenarios, as well as to avoid face detection.",2016,45,1128,83,True,Computer Science,36301492,Mahmood Sharif,38181360.0,Sruti Bhagavatula,41224057.0,Lujo Bauer,1746214.0,M. Reiter,,,,,,,,,,,,,,,,,,,,,,,,,,
317794c81f54371dda5950a5ee7a41ed10298ab2,https://www.semanticscholar.org/paper/317794c81f54371dda5950a5ee7a41ed10298ab2,"How to Grow a Mind: Statistics, Structure, and Abstraction","In coming to understand the world—in learning concepts, acquiring language, and grasping causal relations—our minds make inferences that appear to go far beyond the data available. How do we do it? This review describes recent approaches to reverse-engineering human learning and cognitive development and, in parallel, engineering more humanlike machine learning systems. Computational models that perform probabilistic inference over hierarchies of flexibly structured representations can address some of the deepest questions about the nature and origins of human thought: How does abstract knowledge guide learning and reasoning from sparse data? What forms does our knowledge take, across different domains and tasks? And how is that abstract knowledge itself acquired?",2011,82,1376,57,False,Computer Science,1763295,J. Tenenbaum,145300792.0,Charles Kemp,1799860.0,T. Griffiths,144002017.0,Noah D. Goodman,,,,,Medicine,,,,,,,,,,,,,,,,,,,,,
e86f71ca2948d17b003a5f068db1ecb2b77827f7,https://www.semanticscholar.org/paper/e86f71ca2948d17b003a5f068db1ecb2b77827f7,Concrete Problems in AI Safety,"Rapid progress in machine learning and artificial intelligence (AI) has brought increasing attention to the potential impacts of AI technologies on society. In this paper we discuss one such potential impact: the problem of accidents in machine learning systems, defined as unintended and harmful behavior that may emerge from poor design of real-world AI systems. We present a list of five practical research problems related to accident risk, categorized according to whether the problem originates from having the wrong objective function (""avoiding side effects"" and ""avoiding reward hacking""), an objective function that is too expensive to evaluate frequently (""scalable supervision""), or undesirable behavior during the learning process (""safe exploration"" and ""distributional shift""). We review previous work in these areas as well as suggesting research directions with a focus on relevance to cutting-edge AI systems. Finally, we consider the high-level question of how to think most productively about the safety of forward-looking applications of AI.",2016,173,1387,76,False,Computer Science,2698777,Dario Amodei,37232298.0,C. Olah,5164568.0,J. Steinhardt,145791315.0,P. Christiano,47971768.0,J. Schulman,30415265.0,Dandelion Mané,,,,,,,,,,,,,,,,,,,,,,
0a289dd59b8043c0fbe3a4d1ae59055476ddb3ff,https://www.semanticscholar.org/paper/0a289dd59b8043c0fbe3a4d1ae59055476ddb3ff,Ensemble Methods: Foundations and Algorithms,"An up-to-date, self-contained introduction to a state-of-the-art machine learning approach, Ensemble Methods: Foundations and Algorithms shows how these accurate methods are used in real-world tasks. It gives you the necessary groundwork to carry out further research in this evolving field. After presenting background and terminology, the book covers the main algorithms and theories, including Boosting, Bagging, Random Forest, averaging and voting schemes, the Stacking method, mixture of experts, and diversity measures. It also discusses multiclass extension, noise tolerance, error-ambiguity and bias-variance decompositions, and recent progress in information theoretic diversity. Moving on to more advanced topics, the author explains how to achieve better performance through ensemble pruning and how to generate better clustering results by combining multiple clusterings. In addition, he describes developments of ensemble methods in semi-supervised learning, active learning, cost-sensitive learning, class-imbalance learning, and comprehensibility enhancement.",2012,0,1183,44,False,Computer Science,145624000,Zhi-Hua Zhou,,,,,,,,,,,,,,,,,,,,,,,,,,,,,,,,
455d9a4ff96561d543acbcb2aa81d6cd8fcd20df,https://www.semanticscholar.org/paper/455d9a4ff96561d543acbcb2aa81d6cd8fcd20df,Trends & Controversies: Support Vector Machines,"My first exposure to Support Vector Machines came this spring when heard Sue Dumais present impressive results on text categorization using this analysis technique. This issue's collection of essays should help familiarize our readers with this interesting new racehorse in the Machine Learning stable. Bernhard Scholkopf, in an introductory overview, points out that a particular advantage of SVMs over other learning algorithms is that it can be analyzed theoretically using concepts from computational learning theory, and at the same time can achieve good performance when applied to real problems. Examples of these real-world applications are provided by Sue Dumais, who describes the aforementioned text-categorization problem, yielding the best results to date on the Reuters collection, and Edgar Osuna, who presents strong results on application to face detection. Our fourth author, John Platt, gives us a practical guide and a new technique for implementing the algorithm efficiently.",1998,86,2627,111,False,Computer Science,1716902,Marti A. Hearst,,,,,,,,,,,,,,,,,,,,,,,,,,,,,,,,
ad3c82ada3ff848bb36bade1d90820c2e465b2d7,https://www.semanticscholar.org/paper/ad3c82ada3ff848bb36bade1d90820c2e465b2d7,Feature Selection,"Feature selection, as a data preprocessing strategy, has been proven to be effective and efficient in preparing data (especially high-dimensional data) for various data-mining and machine-learning problems. The objectives of feature selection include building simpler and more comprehensible models, improving data-mining performance, and preparing clean, understandable data. The recent proliferation of big data has presented some substantial challenges and opportunities to feature selection. In this survey, we provide a comprehensive and structured overview of recent advances in feature selection research. Motivated by current challenges and opportunities in the era of big data, we revisit feature selection research from a data perspective and review representative feature selection algorithms for conventional data, structured data, heterogeneous data and streaming data. Methodologically, to emphasize the differences and similarities of most existing feature selection algorithms for conventional data, we categorize them into four main groups: similarity-based, information-theoretical-based, sparse-learning-based, and statistical-based methods. To facilitate and promote the research in this community, we also present an open source feature selection repository that consists of most of the popular feature selection algorithms (http://featureselection.asu.edu/). Also, we use it as an example to show how to evaluate feature selection algorithms. At the end of the survey, we present a discussion about some open problems and challenges that require more attention in future research.",2016,191,1239,46,True,Computer Science,2040455,Jundong Li,3161399.0,Kewei Cheng,2893721.0,Suhang Wang,2775559.0,Fred Morstatter,39690948.0,Robert P. Trevino,1736632.0,Jiliang Tang,,,145896397.0,Huan Liu,,,,,,,,,,,,,,,,,,
