paperId,url,title,abstract,year,referenceCount,citationCount,influentialCitationCount,isOpenAccess,fieldsOfStudy/0,authors/0/authorId,authors/0/name,authors/1/authorId,authors/1/name,authors/2/authorId,authors/2/name,authors/3/authorId,authors/3/name,authors/4/authorId,authors/4/name,authors/5/authorId,authors/5/name,fieldsOfStudy/1,fieldsOfStudy/2,authors/6/authorId,authors/6/name,authors/7/authorId,authors/7/name,authors/8/authorId,authors/8/name,authors/9/authorId,authors/9/name,authors/10/authorId,authors/10/name,authors/11/authorId,authors/11/name,authors/12/authorId,authors/12/name,authors/13/authorId,authors/13/name,authors/14/authorId,authors/14/name,authors/15/authorId,authors/15/name
167e1359943b96b9e92ee73db1df69a1f65d731d,https://www.semanticscholar.org/paper/167e1359943b96b9e92ee73db1df69a1f65d731d,A Sentimental Education: Sentiment Analysis Using Subjectivity Summarization Based on Minimum Cuts,"Sentiment analysis seeks to identify the viewpoint(s) underlying a text span; an example application is classifying a movie review as ""thumbs up"" or ""thumbs down"". To determine this sentiment polarity, we propose a novel machine-learning method that applies text-categorization techniques to just the subjective portions of the document. Extracting these portions can be implemented using efficient techniques for finding minimum cuts in graphs; this greatly facilitates incorporation of cross-sentence contextual constraints.",2004,26,3692,378,True,Computer Science,144865353,B. Pang,145810617.0,Lillian Lee,,,,,,,,,,,,,,,,,,,,,,,,,,,,,,
a3461eaf51016f9d6e85ea47173b27e019e801c4,https://www.semanticscholar.org/paper/a3461eaf51016f9d6e85ea47173b27e019e801c4,State of the Art,"We are concerned with the inference (induction) of theories (hypotheses) from observations (data). This problem is common to philosophy (Aristotle 1988), statistical inference (Casella & Berger 2001) and machine learning (Mitchell 1997, Agluin & Smith 1983). We constrain ourselves only to the latter two frameworks. Within machine-learning, we further concentrate on its subfield called inductive logic programming (Nienhuys-Cheng & de Wolf 1997). Whereas in statistics we namely concentrate on evaluating hypotheses, in machine learning we study ways of constructing the theories. From the theoretical viewpoint, however, the construction is also viewed as a selection of a hypothesis from an a priori given set. Unlike in statistics, however, the range of considered hypotheses is usually large so that hypotheses cannot by inspected individually by a human. Such a set of hypotheses may be conveniently viewed as (equivalent to) a language L H generated by a certain formal grammar. Every hypothesis H ∈ L H induces a mapping h : X → O where X is a predefined (usually countable) set of instances (which we also call the domain of L H) and O is a set usually assumed to be finite and its elements called classes. Very often, O has just two elements. The assigned mapping gives the hypothesis its meaning (semantics). The usual formalization of the concept learning task is then as follows. Let there be a hypothesis C ∈ L H called the target concept and let n examples (x 1 , c(x 1)),(x 2 , c(x 2)),... ,(x n , c(x n))= S drawn from a predefined distribution D X on X be provided to the algorithm L called the learner (S is called a sample). We ask L to output an hypothesis H ∈ L H such that a specified error function Err(H, C) is minimized with respect to D X. The error function may be defined as e.g. Err(H, C) = 0 if H ≡ C (i.e. h(x) = c(x) ∀x ∈ X) and Err(H, C) = 1 otherwise, that is, irrespectively of the distribution D X. We would thus require the learner to exactly identify the target concept. This would be close to the theoretical framework of identification in the limit (Gold 1967), which, roughly said, demands that the learner converges to the correct hypothesis in the limit as n → ∞. Such a requirement is however very rigid and does not comply to the …",1997,67,5105,213,True,,2087814893,Markus Voelter,,,,,,,,,,,,,,,,,,,,,,,,,,,,,,,,
a34e35dbbc6911fa7b94894dffdc0076a261b6f0,https://www.semanticscholar.org/paper/a34e35dbbc6911fa7b94894dffdc0076a261b6f0,Neural Networks and the Bias/Variance Dilemma,"Feedforward neural networks trained by error backpropagation are examples of nonparametric regression estimators. We present a tutorial on nonparametric inference and its relation to neural networks, and we use the statistical viewpoint to highlight strengths and weaknesses of neural models. We illustrate the main points with some recognition experiments involving artificial data as well as handwritten numerals. In way of conclusion, we suggest that current-generation feedforward neural networks are largely inadequate for difficult problems in machine perception and machine learning, regardless of parallel-versus-serial hardware or other implementation issues. Furthermore, we suggest that the fundamental challenges in neural modeling are about representation rather than learning per se. This last point is supported by additional experiments with handwritten numerals.",1992,111,3607,137,False,Computer Science,3194361,S. Geman,2246319.0,E. Bienenstock,2330895.0,R. Doursat,,,,,,,,,,,,,,,,,,,,,,,,,,,,
43d2ed5c3c55c1100450cd74dc1031afa24d37b2,https://www.semanticscholar.org/paper/43d2ed5c3c55c1100450cd74dc1031afa24d37b2,Collective Classification in Network Data,"Many real-world applications produce networked data such as the world-wide web (hypertext documents connected via hyperlinks), social networks (for example, people connected by friendship links), communication networks (computers connected via communication links) and biological networks (for example, protein interaction networks). A recent focus in machine learning research has been to extend traditional machine learning classification techniques to classify nodes in such networks. In this article, we provide a brief introduction to this area of research and how it has progressed during the past decade. We introduce four of the most widely used inference algorithms for classifying networked data and empirically compare them on both synthetic and real-world data.",2008,88,2471,556,True,Computer Science,40655309,P. Sen,1686834.0,Galileo Namata,2696727.0,M. Bilgic,1746034.0,L. Getoor,153701431.0,B. Gallagher,1397398770.0,Tina Eliassi-Rad,,,,,,,,,,,,,,,,,,,,,,
7ef26fb13e7b8d7555b6f58af141609535f7e28e,https://www.semanticscholar.org/paper/7ef26fb13e7b8d7555b6f58af141609535f7e28e,A review of classification algorithms for EEG-based brain–computer interfaces: a 10 year update,"Objective. Most current electroencephalography (EEG)-based brain–computer interfaces (BCIs) are based on machine learning algorithms. There is a large diversity of classifier types that are used in this field, as described in our 2007 review paper. Now, approximately ten years after this review publication, many new algorithms have been developed and tested to classify EEG signals in BCIs. The time is therefore ripe for an updated review of EEG classification algorithms for BCIs. Approach. We surveyed the BCI and machine learning literature from 2007 to 2017 to identify the new classification approaches that have been investigated to design BCIs. We synthesize these studies in order to present such algorithms, to report how they were used for BCIs, what were the outcomes, and to identify their pros and cons. Main results. We found that the recently designed classification algorithms for EEG-based BCIs can be divided into four main categories: adaptive classifiers, matrix and tensor classifiers, transfer learning and deep learning, plus a few other miscellaneous classifiers. Among these, adaptive classifiers were demonstrated to be generally superior to static ones, even with unsupervised adaptation. Transfer learning can also prove useful although the benefits of transfer learning remain unpredictable. Riemannian geometry-based methods have reached state-of-the-art performances on multiple BCI problems and deserve to be explored more thoroughly, along with tensor-based methods. Shrinkage linear discriminant analysis and random forests also appear particularly useful for small training samples settings. On the other hand, deep learning methods have not yet shown convincing improvement over state-of-the-art BCI methods. Significance. This paper provides a comprehensive overview of the modern classification algorithms used in EEG-based BCIs, presents the principles of these methods and guidelines on when and how to use them. It also identifies a number of challenges to further advance EEG classification in BCI.",2018,346,985,71,True,Physics,2890785,F. Lotte,1765001.0,L. Bougrain,145683892.0,A. Cichocki,48021716.0,Maureen Clerc,3276441.0,M. Congedo,1792962.0,A. Rakotomamonjy,Medicine,Computer Science,1783082.0,F. Yger,,,,,,,,,,,,,,,,,,
fc7a5018c590332b02e077ca056bdf8597d4cc9a,https://www.semanticscholar.org/paper/fc7a5018c590332b02e077ca056bdf8597d4cc9a,DATA CLASSIFICATION USING SUPPORT VECTOR MACHINE,"Classification is one of the most important tasks for different application such as text categorization, tone recognition, image classification, micro-array gene expression, proteins structure predictions, data Classification etc. Most of the existing supervised classification methods are based on traditional statistics, which can provide ideal results when sample size is tending to infinity. However, only finite samples can be acquired in practice. In this paper, a novel learning method, Support Vector Machine (SVM), is applied on different data (Diabetes data, Heart Data, Satellite Data and Shuttle data) which have two or multi class. SVM, a powerful machine method developed from statistical learning and has made significant achievement in some field. Introduced in the early 90’s, they led to an explosion of interest in machine learning. The foundations of SVM have been developed by Vapnik and are gaining popularity in field of machine learning due to many attractive features and promising empirical performance. SVM method does not suffer the limitations of data dimensionality and limited samples [1] & [2]. In our experiment, the support vectors, which are critical for classification, are obtained by learning from the training samples. In this paper we have shown the comparative results using different kernel functions for all data samples.",2009,6,386,21,False,Computer Science,153610425,D. Srivastava,70455528.0,L. Bhambhu,,,,,,,,,,,,,,,,,,,,,,,,,,,,,,
7b4f3d0e4e2486a8d5d3f8e00549cf9a117bf88f,https://www.semanticscholar.org/paper/7b4f3d0e4e2486a8d5d3f8e00549cf9a117bf88f,Sequence Transduction with Recurrent Neural Networks,"Many machine learning tasks can be expressed as the transformation---or \emph{transduction}---of input sequences into output sequences: speech recognition, machine translation, protein secondary structure prediction and text-to-speech to name but a few. One of the key challenges in sequence transduction is learning to represent both the input and output sequences in a way that is invariant to sequential distortions such as shrinking, stretching and translating. Recurrent neural networks (RNNs) are a powerful sequence learning architecture that has proven capable of learning such representations. However RNNs traditionally require a pre-defined alignment between the input and output sequences to perform transduction. This is a severe limitation since \emph{finding} the alignment is the most difficult aspect of many sequence transduction problems. Indeed, even determining the length of the output sequence is often challenging. This paper introduces an end-to-end, probabilistic sequence transduction system, based entirely on RNNs, that is in principle able to transform any input sequence into any finite, discrete output sequence. Experimental results for phoneme recognition are provided on the TIMIT speech corpus.",2012,21,1144,201,False,Computer Science,1753223,A. Graves,,,,,,,,,,,Mathematics,,,,,,,,,,,,,,,,,,,,,
3a84214cb69ea0b34352285029f368b75718c32b,https://www.semanticscholar.org/paper/3a84214cb69ea0b34352285029f368b75718c32b,Understanding of a convolutional neural network,"The term Deep Learning or Deep Neural Network refers to Artificial Neural Networks (ANN) with multi layers. Over the last few decades, it has been considered to be one of the most powerful tools, and has become very popular in the literature as it is able to handle a huge amount of data. The interest in having deeper hidden layers has recently begun to surpass classical methods performance in different fields; especially in pattern recognition. One of the most popular deep neural networks is the Convolutional Neural Network (CNN). It take this name from mathematical linear operation between matrixes called convolution. CNN have multiple layers; including convolutional layer, non-linearity layer, pooling layer and fully-connected layer. The convolutional and fully-connected layers have parameters but pooling and non-linearity layers don't have parameters. The CNN has an excellent performance in machine learning problems. Specially the applications that deal with image data, such as largest image classification data set (Image Net), computer vision, and in natural language processing (NLP) and the results achieved were very amazing. In this paper we will explain and define all the elements and important issues related to CNN, and how these elements work. In addition, we will also state the parameters that effect CNN efficiency. This paper assumes that the readers have adequate knowledge about both machine learning and artificial neural network.",2017,14,1314,100,False,Computer Science,147999774,Saad Albawi,37517325.0,T. Mohammed,1410550919.0,Saad Al-Zawi,,,,,,,,,,,,,,,,,,,,,,,,,,,,
d1b9a3b11e6c9571a1553556f82b605b2b4baec3,https://www.semanticscholar.org/paper/d1b9a3b11e6c9571a1553556f82b605b2b4baec3,Model Inversion Attacks that Exploit Confidence Information and Basic Countermeasures,"Machine-learning (ML) algorithms are increasingly utilized in privacy-sensitive applications such as predicting lifestyle choices, making medical diagnoses, and facial recognition. In a model inversion attack, recently introduced in a case study of linear classifiers in personalized medicine by Fredrikson et al., adversarial access to an ML model is abused to learn sensitive genomic information about individuals. Whether model inversion attacks apply to settings outside theirs, however, is unknown. We develop a new class of model inversion attack that exploits confidence values revealed along with predictions. Our new attacks are applicable in a variety of settings, and we explore two in depth: decision trees for lifestyle surveys as used on machine-learning-as-a-service systems and neural networks for facial recognition. In both cases confidence values are revealed to those with the ability to make prediction queries to models. We experimentally show attacks that are able to estimate whether a respondent in a lifestyle survey admitted to cheating on their significant other and, in the other context, show how to recover recognizable images of people's faces given only their name and access to the ML model. We also initiate experimental exploration of natural countermeasures, investigating a privacy-aware decision tree training algorithm that is a simple variant of CART learning, as well as revealing only rounded confidence values. The lesson that emerges is that one can avoid these kinds of MI attacks with negligible degradation to utility.",2015,36,1549,137,False,Computer Science,2623167,Matt Fredrikson,1680133.0,S. Jha,1707461.0,T. Ristenpart,,,,,,,,,,,,,,,,,,,,,,,,,,,,
043f084e379a44608c470059c2aa174a323e9774,https://www.semanticscholar.org/paper/043f084e379a44608c470059c2aa174a323e9774,Counterfactual Fairness,"Machine learning can impact people with legal or ethical consequences when it is used to automate decisions in areas such as insurance, lending, hiring, and predictive policing. In many of these scenarios, previous decisions have been made that are unfairly biased against certain subpopulations, for example those of a particular race, gender, or sexual orientation. Since this past data may be biased, machine learning predictors must account for this to avoid perpetuating or creating discriminatory practices. In this paper, we develop a framework for modeling fairness using tools from causal inference. Our definition of counterfactual fairness captures the intuition that a decision is fair towards an individual if it the same in (a) the actual world and (b) a counterfactual world where the individual belonged to a different demographic group. We demonstrate our framework on a real-world problem of fair prediction of success in law school.",2017,42,888,107,False,Mathematics,1940272,Matt J. Kusner,48678411.0,Joshua R. Loftus,2052380526.0,Chris Russell,2187716.0,Ricardo Silva,,,,,Computer Science,Psychology,,,,,,,,,,,,,,,,,,,,
e4a85af3f5dc41e13dc2cae9ee851953709b764e,https://www.semanticscholar.org/paper/e4a85af3f5dc41e13dc2cae9ee851953709b764e,Solving the quantum many-body problem with artificial neural networks,"Machine learning and quantum physics Elucidating the behavior of quantum interacting systems of many particles remains one of the biggest challenges in physics. Traditional numerical methods often work well, but some of the most interesting problems leave them stumped. Carleo and Troyer harnessed the power of machine learning to develop a variational approach to the quantum many-body problem (see the Perspective by Hush). The method performed at least as well as state-of-the-art approaches, setting a benchmark for a prototypical two-dimensional problem. With further development, it may well prove a valuable piece in the quantum toolbox. Science, this issue p. 602; see also p. 580 A machine-learning approach sets a computational benchmark for a prototypical two-dimensional problem. The challenge posed by the many-body problem in quantum physics originates from the difficulty of describing the nontrivial correlations encoded in the exponential complexity of the many-body wave function. Here we demonstrate that systematic machine learning of the wave function can reduce this complexity to a tractable computational form for some notable cases of physical interest. We introduce a variational representation of quantum states based on artificial neural networks with a variable number of hidden neurons. A reinforcement-learning scheme we demonstrate is capable of both finding the ground state and describing the unitary time evolution of complex interacting quantum systems. Our approach achieves high accuracy in describing prototypical interacting spins models in one and two dimensions.",2016,48,1183,75,True,Physics,50666189,G. Carleo,1752096.0,M. Troyer,,,,,,,,,Computer Science,Medicine,,,,,,,,,,,,,,,,,,,,
a42ca00fc188beb5586ad4c7108b70aeb5317da0,https://www.semanticscholar.org/paper/a42ca00fc188beb5586ad4c7108b70aeb5317da0,Auto-WEKA: combined selection and hyperparameter optimization of classification algorithms,"Many different machine learning algorithms exist; taking into account each algorithm's hyperparameters, there is a staggeringly large number of possible alternatives overall. We consider the problem of simultaneously selecting a learning algorithm and setting its hyperparameters, going beyond previous work that attacks these issues separately. We show that this problem can be addressed by a fully automated approach, leveraging recent innovations in Bayesian optimization. Specifically, we consider a wide range of feature selection techniques (combining 3 search and 8 evaluator methods) and all classification approaches implemented in WEKA's standard distribution, spanning 2 ensemble methods, 10 meta-methods, 27 base classifiers, and hyperparameter settings for each classifier. On each of 21 popular datasets from the UCI repository, the KDD Cup 09, variants of the MNIST dataset and CIFAR-10, we show classification performance often much better than using standard selection and hyperparameter optimization methods. We hope that our approach will help non-expert users to more effectively identify machine learning algorithms and hyperparameter settings appropriate to their applications, and hence to achieve improved performance.",2012,43,1223,134,False,Computer Science,143928655,C. Thornton,144661829.0,F. Hutter,2470869.0,H. Hoos,1388404060.0,Kevin Leyton-Brown,,,,,,,,,,,,,,,,,,,,,,,,,,
a85e512d8845bd007b0866b4a97e8341463f8190,https://www.semanticscholar.org/paper/a85e512d8845bd007b0866b4a97e8341463f8190,Scalable Nearest Neighbor Algorithms for High Dimensional Data,"For many computer vision and machine learning problems, large training sets are key for good performance. However, the most computationally expensive part of many computer vision and machine learning algorithms consists of finding nearest neighbor matches to high dimensional vectors that represent the training data. We propose new algorithms for approximate nearest neighbor matching and evaluate and compare them with previous algorithms. For matching high dimensional features, we find two algorithms to be the most efficient: the randomized k-d forest and a new algorithm proposed in this paper, the priority search k-means tree. We also propose a new algorithm for matching binary features by searching multiple hierarchical clustering trees and show it outperforms methods typically used in the literature. We show that the optimal nearest neighbor algorithm and its parameters depend on the data set characteristics and describe an automated configuration procedure for finding the best algorithm to search a particular data set. In order to scale to very large data sets that would otherwise not fit in the memory of a single machine, we propose a distributed nearest neighbor matching framework that can be used with any of the algorithms described in the paper. All this research has been released as an open source library called fast library for approximate nearest neighbors (FLANN), which has been incorporated into OpenCV and is now one of the most popular libraries for nearest neighbor matching.",2014,65,1209,118,True,Computer Science,2658890,Marius Muja,35238678.0,D. Lowe,,,,,,,,,Medicine,,,,,,,,,,,,,,,,,,,,,
31af4b8793e93fd35e89569ccd663ae8777f0072,https://www.semanticscholar.org/paper/31af4b8793e93fd35e89569ccd663ae8777f0072,The Netflix Prize,"Netflix released a dataset containing 100 million anonymous movie ratings and challenged the data mining, machine learning and computer science communities to develop systems that could beat the accuracy of its recommendation system, Cinematch. We briefly describe the challenge itself, review related work and efforts, and summarize visible progress to date. Other potential uses of the data are outlined, including its application to the KDD Cup 2007.",2007,6,2065,192,False,Engineering,2113543585,J. Bennett,47511653.0,S. Lanning,,,,,,,,,,,,,,,,,,,,,,,,,,,,,,
44bb1605c4ab8a8ce2764fa20424f6a148101ca4,https://www.semanticscholar.org/paper/44bb1605c4ab8a8ce2764fa20424f6a148101ca4,ROC Graphs: Notes and Practical Considerations for Researchers,"Receiver Operating Characteristics (ROC) graphs are a useful technique for organizing classifiers and visualizing their performance. ROC graphs are commonly used in medical decision making, and in recent years have been increasingly adopted in the machine learning and data mining research communities. Although ROC graphs are apparently simple, there are some common misconceptions and pitfalls when using them in practice. This article serves both as a tutorial introduction to ROC graphs and as a practical guide for using them in research.",2007,35,2070,216,False,Computer Science,145421658,Tom Fawcett,,,,,,,,,,,,,,,,,,,,,,,,,,,,,,,,
f46714d200d69eb9cb5cce176297b89a3f5e3a2c,https://www.semanticscholar.org/paper/f46714d200d69eb9cb5cce176297b89a3f5e3a2c,An Introduction to Convolutional Neural Networks,"The field of machine learning has taken a dramatic twist in recent times, with the rise of the Artificial Neural Network (ANN). These biologically inspired computational models are able to far exceed the performance of previous forms of artificial intelligence in common machine learning tasks. One of the most impressive forms of ANN architecture is that of the Convolutional Neural Network (CNN). CNNs are primarily used to solve difficult image-driven pattern recognition tasks and with their precise yet simple architecture, offers a simplified method of getting started with ANNs. 
This document provides a brief introduction to CNNs, discussing recently published papers and newly formed techniques in developing these brilliantly fantastic image recognition models. This introduction assumes you are familiar with the fundamentals of ANNs and machine learning.",2015,21,1079,104,False,Computer Science,1399833554,K. O’Shea,2053923268.0,Ryan Nash,,,,,,,,,,,,,,,,,,,,,,,,,,,,,,
