paperId,url,title,abstract,year,referenceCount,citationCount,influentialCitationCount,isOpenAccess,fieldsOfStudy/0,authors/0/authorId,authors/0/name,authors/1/authorId,authors/1/name,authors/2/authorId,authors/2/name,authors/3/authorId,authors/3/name,fieldsOfStudy/1,fieldsOfStudy/2,authors/4/authorId,authors/4/name,authors/5/authorId,authors/5/name,authors/6/authorId,authors/6/name,authors/7/authorId,authors/7/name,authors/8/authorId,authors/8/name,fieldsOfStudy/3,authors/9/authorId,authors/9/name,authors/10/authorId,authors/10/name,authors/11/authorId,authors/11/name,authors/12/authorId,authors/12/name,authors/13/authorId,authors/13/name,authors/14/authorId,authors/14/name,authors/15/authorId,authors/15/name,authors/16/authorId,authors/16/name,authors/17/authorId,authors/17/name
a17bad00f1e031e22cdf5b83369c5defeaea9d1e,https://www.semanticscholar.org/paper/a17bad00f1e031e22cdf5b83369c5defeaea9d1e,Deep Challenges Associated with Deep Learning,"Deep learning is a recent emerging field of research in data science. Deep learning is essentially a combination of artificial intelligence and machine learning. Inspired by brain neurons, this has proven greater flexibility and builds more accurate models compared to machine learning. But making theoretical designs and to perform desired experiments are quite challenging due to many aspects. In the present paper, these challenges have been discussed to provide researchers a clear vision for the futuristic research in the field of deep learning.",2019,9,23,0,False,Computer Science,51233230,Ochin Sharma,,,,,,,,,,,,,,,,,,,,,,,,,,,,,,,,,,,,,
82bab33fc8793565697e893c19117220b496dc67,https://www.semanticscholar.org/paper/82bab33fc8793565697e893c19117220b496dc67,Machine learning for online query relaxation,"In this paper we provide a fast, data-driven solution to the failing query problem: given a query that returns an empty answer, how can one relax the query's constraints so that it returns a non-empty set of tuples? We introduce a novel algorithm, loqr, which is designed to relax queries that are in the disjunctive normal form and contain a mixture of discrete and continuous attributes. loqr discovers the implicit relationships that exist among the various domain attributes and then uses this knowledge to relax the constraints from the failing query.In a first step, loqr uses a small, randomly-chosen subset of the target database to learn a set of decision rules that predict whether an attribute's value satisfies the constraints in the failing query; this query-driven operation is performed online for each failing query. In the second step, loqr uses nearest-neighbor techniques to find the learned rule that is the most similar to the failing query; then it uses the attributes' values from this rule to relax the failing query's constraints. Our experiments on six application domains show that loqr is both robust and fast: it successfully relaxes more than 95% of the failing queries, and it takes under a second for processing queries that consist of up to 20 attributes (larger queries of up to 93 attributes are processed in several seconds).",2004,29,68,2,False,Mathematics,3276863,Ion Muslea,,,,,,,Computer Science,,,,,,,,,,,,,,,,,,,,,,,,,,,,,,
b1bd8464fad64d70cef2273fefdf95877998b75b,https://www.semanticscholar.org/paper/b1bd8464fad64d70cef2273fefdf95877998b75b,Machine-Learning Quantum States in the NISQ Era,"We review the development of generative modeling techniques in machine learning for the purpose of reconstructing real, noisy, many-qubit quantum states. Motivated by its interpretability and utility, we discuss in detail the theory of the restricted Boltzmann machine. We demonstrate its practical use for state reconstruction, starting from a classical thermal distribution of Ising spins, then moving systematically through increasingly complex pure and mixed quantum states. We review recent techniques in reconstruction of a cold atom wavefunction, intended for use on experimental noisy intermediate-scale quantum (NISQ) devices. Finally, we discuss the outlook for future experimental state reconstruction using machine learning in the NISQ era and beyond.",2019,26,56,1,True,Physics,3422999,G. Torlai,3422513.0,R. Melko,,,,,Computer Science,,,,,,,,,,,,,,,,,,,,,,,,,,,,,,
e4bcb45990a928ac06df4dc24dc07e16fcac9141,https://www.semanticscholar.org/paper/e4bcb45990a928ac06df4dc24dc07e16fcac9141,Synthesizing benchmarks for predictive modeling,"Predictive modeling using machine learning is an effective method for building compiler heuristics, but there is a shortage of benchmarks. Typical machine learning experiments outside of the compilation field train over thousands or millions of examples. In machine learning for compilers, however, there are typically only a few dozen common benchmarks available. This limits the quality of learned models, as they have very sparse training data for what are often high-dimensional feature spaces. What is needed is a way to generate an unbounded number of training programs that finely cover the feature space. At the same time the generated programs must be similar to the types of programs that human developers actually write, otherwise the learning will target the wrong parts of the feature space. We mine open source repositories for program fragments and apply deep learning techniques to automatically construct models for how humans write programs. We sample these models to generate an unbounded number of runnable training programs. The quality of the programs is such that even human developers struggle to distinguish our generated programs from hand-written code. We use our generator for OpenCL programs, CLgen, to automatically synthesize thousands of programs and show that learning over these improves the performance of a state of the art predictive model by 1.27x. In addition, the fine covering of the feature space automatically exposes weaknesses in the feature design which are invisible with the sparse training examples from existing benchmark suites. Correcting these weaknesses further increases performance by 4.30x.",2017,57,84,8,True,Computer Science,2059804383,Chris Cummins,1955185.0,Pavlos Petoumenos,,Zheng Wang,2476647.0,H. Leather,,,,,,,,,,,,,,,,,,,,,,,,,,,,,,,
bb4de6ce625837aae1c7b09576cd9173d3ac0729,https://www.semanticscholar.org/paper/bb4de6ce625837aae1c7b09576cd9173d3ac0729,Large‐scale data mining using genetics‐based machine learning,"In the last decade, genetics‐based machine learning methods have shown their competence in large‐scale data mining tasks because of the scalability capacity that these techniques have demonstrated. This capacity goes beyond the innate massive parallelism of evolutionary computation methods by the proposal of a variety of mechanisms specifically tailored for machine learning tasks, including knowledge representations that exploit regularities in the datasets, hardware accelerations or data‐intensive computing methods, among others. This paper reviews different classes of methods that alone or (in many cases) combined accelerate genetics‐based machine learning methods. © 2013 Wiley Periodicals, Inc.",2013,143,47,0,False,Computer Science,1697337,J. Bacardit,1822628.0,Xavier Llorà,,,,,,,,,,,,,,,,,,,,,,,,,,,,,,,,,,,
45b5765cd1847f6a370da01483a53e9ed9676557,https://www.semanticscholar.org/paper/45b5765cd1847f6a370da01483a53e9ed9676557,On exponential convergence of SGD in non-convex over-parametrized learning,"Large over-parametrized models learned via stochastic gradient descent (SGD) methods have become a key element in modern machine learning. Although SGD methods are very effective in practice, most theoretical analyses of SGD suggest slower convergence than what is empirically observed. In our recent work [8] we analyzed how interpolation, common in modern over-parametrized learning, results in exponential convergence of SGD with constant step size for convex loss functions. In this note, we extend those results to a much broader non-convex function class satisfying the Polyak-Lojasiewicz (PL) condition. A number of important non-convex problems in machine learning, including some classes of neural networks, have been recently shown to satisfy the PL condition. We argue that the PL condition provides a relevant and attractive setting for many machine learning problems, particularly in the over-parametrized regime.",2018,15,66,12,False,Computer Science,1679638,Raef Bassily,145520115.0,Mikhail Belkin,143791100.0,Siyuan Ma,,,Mathematics,,,,,,,,,,,,,,,,,,,,,,,,,,,,,,
5d819d0949692635e73368f8879a3b2ab0462974,https://www.semanticscholar.org/paper/5d819d0949692635e73368f8879a3b2ab0462974,"Comprehensive survey of deep learning in remote sensing: theories, tools, and challenges for the community","Abstract. In recent years, deep learning (DL), a rebranding of neural networks (NNs), has risen to the top in numerous areas, namely computer vision (CV), speech recognition, and natural language processing. Whereas remote sensing (RS) possesses a number of unique challenges, primarily related to sensors and applications, inevitably RS draws from many of the same theories as CV, e.g., statistics, fusion, and machine learning, to name a few. This means that the RS community should not only be aware of advancements such as DL, but also be leading researchers in this area. Herein, we provide the most comprehensive survey of state-of-the-art RS DL research. We also review recent new developments in the DL field that can be used in DL for RS. Namely, we focus on theories, tools, and challenges for the RS community. Specifically, we focus on unsolved challenges and opportunities as they relate to (i) inadequate data sets, (ii) human-understandable solutions for modeling physical phenomena, (iii) big data, (iv) nontraditional heterogeneous data sources, (v) DL architectures and learning algorithms for spectral, spatial, and temporal data, (vi) transfer learning, (vii) an improved theoretical understanding of DL systems, (viii) high barriers to entry, and (ix) training and optimizing the DL.",2017,417,390,14,True,Computer Science,145672842,J. Ball,152900419.0,Derek T. Anderson,2863960.0,Chee Seng Chan,,,Engineering,,,,,,,,,,,,,,,,,,,,,,,,,,,,,,
0c8067178c90f12df1eed68926d658c21b4e04f1,https://www.semanticscholar.org/paper/0c8067178c90f12df1eed68926d658c21b4e04f1,Convex Learning of Multiple Tasks and their Structure,"Reducing the amount of human supervision is a key problem in machine learning and a natural approach is that of exploiting the relations (structure) among different tasks. This is the idea at the core of multi-task learning. In this context a fundamental question is how to incorporate the tasks structure in the learning problem. We tackle this question by studying a general computational framework that allows to encode apriori knowledge of the tasks structure in the form of a convex penalty; in this setting a variety of previously proposed methods can be recovered as special cases, including linear and non-linear approaches. Within this framework, we show that tasks and their structure can be efficiently learned considering a convex optimization problem that can be approached by means of block coordinate methods such as alternating minimization and for which we prove convergence to the global minimum.",2015,42,63,12,False,Computer Science,7666146,C. Ciliberto,2211263.0,Youssef Mroueh,1685292.0,T. Poggio,1690976.0,L. Rosasco,Mathematics,,,,,,,,,,,,,,,,,,,,,,,,,,,,,,
bf6d4aeeb10cb389d019e7f25fdc6dfba48036dc,https://www.semanticscholar.org/paper/bf6d4aeeb10cb389d019e7f25fdc6dfba48036dc,Quantum-Assisted Learning of Hardware-Embedded Probabilistic Graphical Models,"Mainstream machine-learning techniques such as deep learning and probabilistic programming rely heavily on sampling from generally intractable probability distributions. There is increasing interest in the potential advantages of using quantum computing technologies as sampling engines to speed up these tasks or to make them more effective. However, some pressing challenges in state-of-the-art quantum annealers have to be overcome before we can assess their actual performance. The sparse connectivity, resulting from the local interaction between quantum bits in physical hardware implementations, is considered the most severe limitation to the quality of constructing powerful generative unsupervised machine-learning models. Here we use embedding techniques to add redundancy to data sets, allowing us to increase the modeling capacity of quantum annealers. We illustrate our findings by training hardware-embedded graphical models on a binarized data set of handwritten digits and two synthetic data sets in experiments with up to 940 quantum bits. Our model can be trained in quantum hardware without full knowledge of the effective parameters specifying the corresponding quantum Gibbs-like distribution; therefore, this approach avoids the need to infer the effective temperature at each iteration, speeding up learning; it also mitigates the effect of noise in the control parameters, making it robust to deviations from the reference Gibbs distribution. Our approach demonstrates the feasibility of using quantum annealers for implementing generative models, and it provides a suitable framework for benchmarking these quantum technologies on machine-learning-related tasks.",2016,78,90,2,True,Physics,3468759,M. Benedetti,1402789590.0,John Realpe-G'omez,144637418.0,R. Biswas,1402938096.0,A. Perdomo-Ortiz,Computer Science,Mathematics,,,,,,,,,,,,,,,,,,,,,,,,,,,,,
0bdcf145ecc3cabd44933c530fa3e59dda8561ea,https://www.semanticscholar.org/paper/0bdcf145ecc3cabd44933c530fa3e59dda8561ea,Tag-Aware Ordinal Sparse Factor Analysis for Learning and Content Analytics,"Machine learning offers novel ways and means to design personalized learning systems wherein each student's educational experience is customized in real time depending on their background, learning goals, and performance to date. SPARse Factor Analysis (SPARFA) is a novel framework for machine learning-based learning analytics, which estimates a learner's knowledge of the concepts underlying a domain, and content analytics, which estimates the relationships among a collection of questions and those concepts. SPARFA jointly learns the associations among the questions and the concepts, learner concept knowledge profiles, and the underlying question difficulties, solely based on the correct/incorrect graded responses of a population of learners to a collection of questions. In this paper, we extend the SPARFA framework significantly to enable: (i) the analysis of graded responses on an ordinal scale (partial credit) rather than a binary scale (correct/incorrect); (ii) the exploitation of tags/labels for questions that partially describe the question{concept associations. The resulting Ordinal SPARFA-Tag framework greatly enhances the interpretability of the estimated concepts. We demonstrate using real educational data that Ordinal SPARFA-Tag outperforms both SPARFA and existing collaborative filtering techniques in predicting missing learner responses.",2013,97,133,9,False,Computer Science,1730535,Andrew S. Lan,2123358.0,Andrew E. Waters,1746575.0,Christoph Studer,144908066.0,Richard Baraniuk,Mathematics,,,,,,,,,,,,,,,,,,,,,,,,,,,,,,
cea2a9ea8f83e3736f5efdd004a0617b5817c35c,https://www.semanticscholar.org/paper/cea2a9ea8f83e3736f5efdd004a0617b5817c35c,Statistically reinforced machine learning for nonlinear patterns and variable interactions,". Most statistical models assume linearity and few variable interactions, even though real-world ecological patterns often result from nonlinear and highly interactive processes. We here introduce a set of novel empirical modeling techniques which can address this mismatch: statistically reinforced machine learning. We demonstrate the behaviors of three techniques (conditional inference tree, model-based tree, and permutation-based random forest) by analyzing an arti ﬁ cially generated example dataset that contains patterns based on nonlinearity and variable interactions. The results show the potential of statistically reinforced machine learning algorithms to detect nonlinear relationships and higher-order interactions. Estimation reliability for any technique, however, depended on sample size. The applications of statistically reinforced machine learning approaches would be particularly bene ﬁ cial for investigating (1) novel patterns for which shapes cannot be assumed a priori, (2) higher-order interactions which are often overlooked in parametric statistics, (3) context dependency where patterns change depending on other conditions, (4) signi ﬁ cance and effect sizes of variables while taking nonlinearity and variable interactions into account, and (5) a hypothesis using parametric statistics after identifying patterns using statistically reinforced machine learning techniques.",2017,86,64,1,True,Computer Science,38057242,M. Ryo,5718291.0,M. Rillig,,,,,,,,,,,,,,,,,,,,,,,,,,,,,,,,,,,
233fe6feeee53f0eda5f6a8b26a3a174fce5542d,https://www.semanticscholar.org/paper/233fe6feeee53f0eda5f6a8b26a3a174fce5542d,"Discrepancy, Coresets, and Sketches in Machine Learning","This paper defines the notion of class discrepancy for families of functions. It shows that low discrepancy classes admit small offline and streaming coresets. We provide general techniques for bounding the class discrepancy of machine learning problems. As corollaries of the general technique we bound the discrepancy (and therefore coreset complexity) of logistic regression, sigmoid activation loss, matrix covariance, kernel density and any analytic function of the dot product or the squared distance. Our results prove the existence of epsilon-approximation O(sqrt{d}/epsilon) sized coresets for the above problems. This resolves the long-standing open problem regarding the coreset complexity of Gaussian kernel density estimation. We provide two more related but independent results. First, an exponential improvement of the widely used merge-and-reduce trick which gives improved streaming sketches for any low discrepancy problem. Second, an extremely simple deterministic algorithm for finding low discrepancy sequences (and therefore coresets) for any positive semi-definite kernel. This paper establishes some explicit connections between class discrepancy, coreset complexity, learnability, and streaming algorithms.",2019,32,26,3,False,Computer Science,3386660,Zohar S. Karnin,2941680.0,Edo Liberty,,,,,Mathematics,,,,,,,,,,,,,,,,,,,,,,,,,,,,,,
b7a6b7adafd01e939c9266083dfba9edea88846c,https://www.semanticscholar.org/paper/b7a6b7adafd01e939c9266083dfba9edea88846c,On the Universality of Invariant Networks,"Constraining linear layers in neural networks to respect symmetry transformations from a group $G$ is a common design principle for invariant networks that has found many applications in machine learning. In this paper, we consider a fundamental question that has received little attention to date: Can these networks approximate any (continuous) invariant function? We tackle the rather general case where $G\leq S_n$ (an arbitrary subgroup of the symmetric group) that acts on $\mathbb{R}^n$ by permuting coordinates. This setting includes several recent popular invariant networks. We present two main results: First, $G$-invariant networks are universal if high-order tensors are allowed. Second, there are groups $G$ for which higher-order tensors are unavoidable for obtaining universality. $G$-invariant networks consisting of only first-order tensors are of special interest due to their practical value. We conclude the paper by proving a necessary condition for the universality of $G$-invariant networks that incorporate only first-order tensors.",2019,24,160,30,False,Computer Science,3416939,Haggai Maron,2645055.0,Ethan Fetaya,66870455.0,Nimrod Segol,3232072.0,Y. Lipman,Mathematics,,,,,,,,,,,,,,,,,,,,,,,,,,,,,,
9cbf9de13b8115ba2b6019b5cd7449b2820fdc28,https://www.semanticscholar.org/paper/9cbf9de13b8115ba2b6019b5cd7449b2820fdc28,Unsupervised Machine Learning and Band Topology.,"The study of topological band structures is an active area of research in condensed matter physics and beyond. Here, we combine recent progress in this field with developments in machine learning, another rising topic of interest. Specifically, we introduce an unsupervised machine learning approach that searches for and retrieves paths of adiabatic deformations between Hamiltonians, thereby clustering them according to their topological properties. The algorithm is general, as it does not rely on a specific parametrization of the Hamiltonian and is readily applicable to any symmetry class. We demonstrate the approach using several different models in both one and two spatial dimensions and for different symmetry classes with and without crystalline symmetries. Accordingly, it is also shown how trivial and topological phases can be diagnosed upon comparing with a generally designated set of trivial atomic insulators.",2020,104,54,2,True,Physics,4238038,M. Scheurer,47926510.0,Robert-Jan Slager,,,,,Computer Science,Medicine,,,,,,,,,,,,,,,,,,,,,,,,,,,,,
d481a674ccbca3110fb7d66054b4ed28de1c3120,https://www.semanticscholar.org/paper/d481a674ccbca3110fb7d66054b4ed28de1c3120,Machine-learning Algorithm to Predict Hypotension Based on High-fidelity Arterial Pressure Waveform Analysis,"What We Already Know about This Topic The ability to predict intraoperative hypotension may advance the ability to prevent hypotension-associated complications effectively The extent to which advanced waveform analysis of invasive arterial lines may provide meaningful forewarning remains unknown What This Article Tells Us That Is New A machine-learning algorithm based on thousands of arterial waveform features can identify an intraoperative hypotensive event 15 min before its occurrence with a sensitivity of 88% and specificity of 87% Further studies must evaluate the real-time value of such algorithms in a broader set of clinical conditions and patients Background: With appropriate algorithms, computers can learn to detect patterns and associations in large data sets. The authors’ goal was to apply machine learning to arterial pressure waveforms and create an algorithm to predict hypotension. The algorithm detects early alteration in waveforms that can herald the weakening of cardiovascular compensatory mechanisms affecting preload, afterload, and contractility. Methods: The algorithm was developed with two different data sources: (1) a retrospective cohort, used for training, consisting of 1,334 patients’ records with 545,959 min of arterial waveform recording and 25,461 episodes of hypotension; and (2) a prospective, local hospital cohort used for external validation, consisting of 204 patients’ records with 33,236 min of arterial waveform recording and 1,923 episodes of hypotension. The algorithm relates a large set of features calculated from the high-fidelity arterial pressure waveform to the prediction of an upcoming hypotensive event (mean arterial pressure < 65 mmHg). Receiver-operating characteristic curve analysis evaluated the algorithm’s success in predicting hypotension, defined as mean arterial pressure less than 65 mmHg. Results: Using 3,022 individual features per cardiac cycle, the algorithm predicted arterial hypotension with a sensitivity and specificity of 88% (85 to 90%) and 87% (85 to 90%) 15 min before a hypotensive event (area under the curve, 0.95 [0.94 to 0.95]); 89% (87 to 91%) and 90% (87 to 92%) 10 min before (area under the curve, 0.95 [0.95 to 0.96]); 92% (90 to 94%) and 92% (90 to 94%) 5 min before (area under the curve, 0.97 [0.97 to 0.98]). Conclusions: The results demonstrate that a machine-learning algorithm can be trained, with large data sets of high-fidelity arterial waveforms, to predict hypotension in surgical patients’ records.",2018,40,219,13,False,Medicine,10330055,F. Hatib,49711459.0,Zhongping Jian,2093538.0,S. Buddi,7497039.0,Christine Lee,,,143614098.0,J. Settels,47731010.0,K. Sibert,49521118.0,J. Rinehart,2067401564.0,M. Cannesson,,,,,,,,,,,,,,,,,,,,,
