paperId,url,title,abstract,year,referenceCount,citationCount,influentialCitationCount,isOpenAccess,fieldsOfStudy/0,authors/0/authorId,authors/0/name,authors/1/authorId,authors/1/name,authors/2/authorId,authors/2/name,authors/3/authorId,authors/3/name,authors/4/authorId,authors/4/name,authors/5/authorId,authors/5/name,authors/6/authorId,authors/6/name,authors/7/authorId,authors/7/name,authors/8/authorId,authors/8/name,authors/9/authorId,authors/9/name,authors/10/authorId,authors/10/name,authors/11/authorId,authors/11/name,authors/12/authorId,authors/12/name,authors/13/authorId,authors/13/name,fieldsOfStudy/1,fieldsOfStudy/2,authors/14/authorId,authors/14/name,authors/15/authorId,authors/15/name,authors/16/authorId,authors/16/name,authors/17/authorId,authors/17/name,authors/18/authorId,authors/18/name,authors/19/authorId,authors/19/name,authors/20/authorId,authors/20/name,authors/21/authorId,authors/21/name,authors/22/authorId,authors/22/name,authors/23/authorId,authors/23/name
24e250cb8a94742eed51dc2035fb41bddea2ceb9,https://www.semanticscholar.org/paper/24e250cb8a94742eed51dc2035fb41bddea2ceb9,Applying reinforcement learning towards automating resource allocation and application scalability in the cloud,"Public Infrastructure as a Service (IaaS) clouds such as Amazon, GoGrid and Rackspace deliver computational resources by means of virtualisation technologies. These technologies allow multiple independent virtual machines to reside in apparent isolation on the same physical host. Dynamically scaling applications running on IaaS clouds can lead to varied and unpredictable results because of the performance interference effects associated with co‐located virtual machines. Determining appropriate scaling policies in a dynamic non‐stationary environment is non‐trivial. One principle advantage exhibited by IaaS clouds over their traditional hosting counterparts is the ability to scale resources on‐demand. However, a problem arises concerning resource allocation as to which resources should be added and removed when the underlying performance of the resource is in a constant state of flux. Decision theoretic frameworks such as Markov Decision Processes are particularly suited to decision making under uncertainty. By applying a temporal difference, reinforcement learning algorithm known as Q‐learning, optimal scaling policies can be determined. Additionally, reinforcement learning techniques typically suffer from curse of dimensionality problems, where the state space grows exponentially with each additional state variable. To address this challenge, we also present a novel parallel Q‐learning approach aimed at reducing the time taken to determine optimal policies whilst learning online. Copyright © 2012 John Wiley & Sons, Ltd.",2013,38,202,18,True,Computer Science,47862122,E. Barrett,48313838.0,E. Howley,2462471.0,J. Duggan,,,,,,,,,,,,,,,,,,,,,,,,,,,,,,,,,,,,,,,,,,,,
cfa2646776405d50533055ceb1b7f050e9014dcb,https://www.semanticscholar.org/paper/cfa2646776405d50533055ceb1b7f050e9014dcb,Semi-Supervised Recursive Autoencoders for Predicting Sentiment Distributions,"We introduce a novel machine learning framework based on recursive autoencoders for sentence-level prediction of sentiment label distributions. Our method learns vector space representations for multi-word phrases. In sentiment prediction tasks these representations outperform other state-of-the-art approaches on commonly used datasets, such as movie reviews, without using any pre-defined sentiment lexica or polarity shifting rules. We also evaluate the model's ability to predict sentiment distributions on a new dataset based on confessions from the experience project. The dataset consists of personal user stories annotated with multiple labels which, when aggregated, form a multinomial distribution that captures emotional reactions. Our algorithm can more accurately predict distributions over such labels compared to several competitive baselines.",2011,38,1288,135,False,Computer Science,2166511,R. Socher,143845796.0,Jeffrey Pennington,40150953.0,E. Huang,34699434.0,A. Ng,144783904.0,Christopher D. Manning,,,,,,,,,,,,,,,,,,,,,,,,,,,,,,,,,,,,,,,,
3dbb621f1c35c659f3ce6efadad7aa16308fae13,https://www.semanticscholar.org/paper/3dbb621f1c35c659f3ce6efadad7aa16308fae13,Breast cancer histopathological image classification using Convolutional Neural Networks,"The performance of most conventional classification systems relies on appropriate data representation and much of the efforts are dedicated to feature engineering, a difficult and time-consuming process that uses prior expert domain knowledge of the data to create useful features. On the other hand, deep learning can extract and organize the discriminative information from the data, not requiring the design of feature extractors by a domain expert. Convolutional Neural Networks (CNNs) are a particular type of deep, feedforward network that have gained attention from research community and industry, achieving empirical successes in tasks such as speech recognition, signal processing, object recognition, natural language processing and transfer learning. In this paper, we conduct some preliminary experiments using the deep learning approach to classify breast cancer histopathological images from BreaKHis, a publicly dataset available at http://web.inf.ufpr.br/vri/breast-cancer-database. We propose a method based on the extraction of image patches for training the CNN and the combination of these patches for final classification. This method aims to allow using the high-resolution histopathological images from BreaKHis as input to existing CNN, avoiding adaptations of the model that can lead to a more complex and computationally costly architecture. The CNN performance is better when compared to previously reported results obtained by other machine learning models trained with hand-crafted textural descriptors. Finally, we also investigate the combination of different CNNs using simple fusion rules, achieving some improvement in recognition rates.",2016,33,559,41,False,Computer Science,32786132,F. Spanhol,144925520.0,Luiz Oliveira,144518944.0,C. Petitjean,1804638.0,L. Heutte,,,,,,,,,,,,,,,,,,,,,,,,,,,,,,,,,,,,,,,,,,
18939eadc9c4460c8385e0591cde214a1ead067b,https://www.semanticscholar.org/paper/18939eadc9c4460c8385e0591cde214a1ead067b,Reliable evaluation of adversarial robustness with an ensemble of diverse parameter-free attacks,"The field of defense strategies against adversarial attacks has significantly grown over the last years, but progress is hampered as the evaluation of adversarial defenses is often insufficient and thus gives a wrong impression of robustness. Many promising defenses could be broken later on, making it difficult to identify the state-of-the-art. Frequent pitfalls in the evaluation are improper tuning of hyperparameters of the attacks, gradient obfuscation or masking. In this paper we first propose two extensions of the PGD-attack overcoming failures due to suboptimal step size and problems of the objective function. We then combine our novel attacks with two complementary existing ones to form a parameter-free, computationally affordable and user-independent ensemble of attacks to test adversarial robustness. We apply our ensemble to over 50 models from papers published at recent top machine learning and computer vision venues. In all except one of the cases we achieve lower robust test accuracy than reported in these papers, often by more than $10\%$, identifying several broken defenses.",2020,58,653,225,False,Computer Science,39171784,Francesco Croce,143610806.0,Matthias Hein,,,,,,,,,,,,,,,,,,,,,,,,,Mathematics,,,,,,,,,,,,,,,,,,,,,
16f05470e01a0c6fd7e925f77d48302bbf872189,https://www.semanticscholar.org/paper/16f05470e01a0c6fd7e925f77d48302bbf872189,Online Algorithms for Rent-Or-Buy with Expert Advice,"We study the use of predictions by multiple experts (such as machine learning algorithms) to improve the performance of online algorithms. In particular, we consider the classical rent-or-buy problem (also called ski rental), and obtain algorithms that provably improve their performance over the adversarial scenario by using these predictions. We also prove matching lower bounds to show that our algorithms are the best possible, and perform experiments to empirically validate their performance in practice.",2019,20,86,6,False,Computer Science,144979147,Sreenivas Gollapudi,1715972.0,Debmalya Panigrahi,,,,,,,,,,,,,,,,,,,,,,,,,,,,,,,,,,,,,,,,,,,,,,
1d4b4f1ca1e7492820411fd668f09984fefe8c3e,https://www.semanticscholar.org/paper/1d4b4f1ca1e7492820411fd668f09984fefe8c3e,Visual Analytics for Explainable Deep Learning,"Recently, deep learning has been advancing the state of the art in artificial intelligence to a new level, and humans rely on artificial intelligence techniques more than ever. However, even with such unprecedented advancements, the lack of explanation regarding the decisions made by deep learning models and absence of control over their internal processes act as major drawbacks in critical decision-making processes, such as precision medicine and law enforcement. In response, efforts are being made to make deep learning interpretable and controllable by humans. This article reviews visual analytics, information visualization, and machine learning perspectives relevant to this aim, and discusses potential challenges and future research directions.",2018,18,158,10,True,Computer Science,1795455,J. Choo,48641970.0,Shixia Liu,,,,,,,,,,,,,,,,,,,,,,,,,Mathematics,Medicine,,,,,,,,,,,,,,,,,,,,
34c062e2b8a3f6421b9f4ff22f115a36d4aba823,https://www.semanticscholar.org/paper/34c062e2b8a3f6421b9f4ff22f115a36d4aba823,A Dataset and a Technique for Generalized Nuclear Segmentation for Computational Pathology,"Nuclear segmentation in digital microscopic tissue images can enable extraction of high-quality features for nuclear morphometrics and other analysis in computational pathology. Conventional image processing techniques, such as Otsu thresholding and watershed segmentation, do not work effectively on challenging cases, such as chromatin-sparse and crowded nuclei. In contrast, machine learning-based segmentation can generalize across various nuclear appearances. However, training machine learning algorithms requires data sets of images, in which a vast number of nuclei have been annotated. Publicly accessible and annotated data sets, along with widely agreed upon metrics to compare techniques, have catalyzed tremendous innovation and progress on other image classification problems, particularly in object recognition. Inspired by their success, we introduce a large publicly accessible data set of hematoxylin and eosin (H&E)-stained tissue images with more than 21000 painstakingly annotated nuclear boundaries, whose quality was validated by a medical doctor. Because our data set is taken from multiple hospitals and includes a diversity of nuclear appearances from several patients, disease states, and organs, techniques trained on it are likely to generalize well and work right out-of-the-box on other H&E-stained images. We also propose a new metric to evaluate nuclear segmentation results that penalizes object- and pixel-level errors in a unified manner, unlike previous metrics that penalize only one type of error. We also propose a segmentation technique based on deep learning that lays a special emphasis on identifying the nuclear boundaries, including those between the touching or overlapping nuclei, and works well on a diverse set of test images.",2017,51,469,107,False,Computer Science,2119734444,Neeraj Kumar,3200813.0,R. Verma,2109948052.0,Sanuj Sharma,2061041305.0,S. Bhargava,1927113.0,Abhishek Vahadane,2049437.0,A. Sethi,,,,,,,,,,,,,,,,,Medicine,,,,,,,,,,,,,,,,,,,,,
b5702b5726b3dc58d97100061b4f54020631d9e6,https://www.semanticscholar.org/paper/b5702b5726b3dc58d97100061b4f54020631d9e6,Human Detection via Classification on Riemannian Manifolds,"We present a new algorithm to detect humans in still images utilizing covariance matrices as object descriptors. Since these descriptors do not lie on a vector space, well known machine learning techniques are not adequate to learn the classifiers. The space of d-dimensional nonsingular covariance matrices can be represented as a connected Riemannian manifold. We present a novel approach for classifying points lying on a Riemannian manifold by incorporating the a priori information about the geometry of the space. The algorithm is tested on INRIA human database where superior detection rates are observed over the previous approaches.",2007,26,543,45,True,Computer Science,2577513,Oncel Tuzel,29905643.0,F. Porikli,145776090.0,P. Meer,,,,,,,,,,,,,,,,,,,,,,,Mathematics,,,,,,,,,,,,,,,,,,,,,
26f29d8ace472ece16e0881625c1e8882687ffb0,https://www.semanticscholar.org/paper/26f29d8ace472ece16e0881625c1e8882687ffb0,Side-channel analysis and machine learning: A practical perspective,"The field of side-channel analysis has made significant progress over time. Side-channel analysis is now used in practice in design companies as well as in test laboratories, and the security of products against side-channel attacks has significantly improved. However, there are still some remaining issues to be solved for side-channel analysis to become more effective. Side-channel analysis consists of two steps, commonly referred to as identification and exploitation. The identification consists of understanding the leakage and building suitable models. The exploitation consists of using the identified leakage models to extract the secret key. In scenarios where the model is poorly known, it can be approximated in a profiling phase. There, machine learning techniques are gaining value. In this paper, we conduct extensive analysis of several machine learning techniques, showing the importance of proper parameter tuning and training. In contrast to what is perceived as common knowledge in unrestricted scenarios, we show that some machine learning techniques can significantly outperform template attacks when properly used. We therefore stress that the traditional worst case security assessment of cryptographic implementations, that mainly includes template attacks, might not be accurate enough. Besides that, we present a new measure called the Data Confusion Factor that can be used to assess how well machine learning techniques will perform on a certain dataset.",2017,26,83,3,False,Computer Science,1686538,S. Picek,2563182.0,Annelie Heuser,3303583.0,A. Jović,145409036.0,Simone A. Ludwig,1688300.0,S. Guilley,3010687.0,D. Jakobovic,1708582.0,N. Mentens,,,,,,,,,,,,,,,,,,,,,,,,,,,,,,,,,,,,
053f4d6715a4dba6f8103456fc1bb5fd6a5266c4,https://www.semanticscholar.org/paper/053f4d6715a4dba6f8103456fc1bb5fd6a5266c4,Ensemble Distillation for Robust Model Fusion in Federated Learning,"Federated Learning (FL) is a machine learning setting where many devices collaboratively train a machine learning model while keeping the training data decentralized. In most of the current training schemes the central model is refined by averaging the parameters of the server model and the updated parameters from the client side. However, directly averaging model parameters is only possible if all models have the same structure and size, which could be a restrictive constraint in many scenarios. In this work we investigate more powerful and more flexible aggregation schemes for FL. Specifically, we propose ensemble distillation for model fusion, i.e. training the central classifier through unlabeled data on the outputs of the models from the clients. This knowledge distillation technique mitigates privacy risk and cost to the same extent as the baseline FL algorithms, but allows flexible aggregation over heterogeneous client models that can differ e.g. in size, numerical precision or structure. We show in extensive empirical experiments on various CV/NLP datasets (CIFAR-10/100, ImageNet, AG News, SST2) and settings (heterogeneous models/data) that the server model can be trained much faster, requiring fewer communication rounds than any existing FL technique so far.",2020,86,250,52,False,Computer Science,145724662,Tao Lin,2069275317.0,Lingjing Kong,2127057.0,Sebastian U. Stich,2456863.0,Martin Jaggi,,,,,,,,,,,,,,,,,,,,,Mathematics,,,,,,,,,,,,,,,,,,,,,
12808499adea5df5bf683818edc7ad7a6873ed12,https://www.semanticscholar.org/paper/12808499adea5df5bf683818edc7ad7a6873ed12,"A digital architecture for support vector machines: theory, algorithm, and FPGA implementation","In this paper, we propose a digital architecture for support vector machine (SVM) learning and discuss its implementation on a field programmable gate array (FPGA). We analyze briefly the quantization effects on the performance of the SVM in classification problems to show its robustness, in the feedforward phase, respect to fixed-point math implementations; then, we address the problem of SVM learning. The architecture described here makes use of a new algorithm for SVM learning which is less sensitive to quantization errors respect to the solution appeared so far in the literature. The algorithm is composed of two parts: the first one exploits a recurrent network for finding the parameters of the SVM; the second one uses a bisection process for computing the threshold. The architecture implementing the algorithm is described in detail and mapped on a real current-generation FPGA (Xilinx Virtex II). Its effectiveness is then tested on a channel equalization problem, where real-time performances are of paramount importance.",2003,33,205,12,False,Computer Science,1686031,D. Anguita,46952894.0,A. Boni,1751728.0,S. Ridella,,,,,,,,,,,,,,,,,,,,,,,Medicine,,,,,,,,,,,,,,,,,,,,,
5913cbd4d209311df06c7fdab7ba34b082098853,https://www.semanticscholar.org/paper/5913cbd4d209311df06c7fdab7ba34b082098853,A Comparative Study on Machine Learning Algorithms for Smart Manufacturing: Tool Wear Prediction Using Random Forests,"Manufacturers have faced an increasing need for the development of predictive models that predict mechanical failures and the remaining useful life (RUL) of manufacturing systems or components. Classical model-based or physics-based prognostics often require an in-depth physical understanding of the system of interest to develop closedform mathematical models. However, prior knowledge of system behavior is not always available, especially for complex manufacturing systems and processes. To complement model-based prognostics, data-driven methods have been increasingly applied to machinery prognostics and maintenance management, transforming legacy manufacturing systems into smart manufacturing systems with artificial intelligence. While previous research has demonstrated the effectiveness of data-driven methods, most of these prognostic methods are based on classical machine learning techniques, such as artificial neural networks (ANNs) and support vector regression (SVR). With the rapid advancement in artificial intelligence, various machine learning algorithms have been developed and widely applied in many engineering fields. The objective of this research is to introduce a random forests (RFs)-based prognostic method for tool wear prediction as well as compare the performance of RFs with feed-forward back propagation (FFBP) ANNs and SVR. Specifically, the performance of FFBP ANNs, SVR, and RFs are compared using an experimental data collected from 315 milling tests. Experimental results have shown that RFs can generate more accurate predictions than FFBP ANNs with a single hidden layer and SVR. [DOI: 10.1115/1.4036350]",2017,50,294,5,True,Engineering,48198404,Dazhong Wu,26999030.0,Connor Jennings,2939300.0,J. Terpenny,1700762.0,R. Gao,1749112.0,S. Kumara,,,,,,,,,,,,,,,,,,,,,,,,,,,,,,,,,,,,,,,,
8d904d49cb178def9a15fbea955d427d85cad2f5,https://www.semanticscholar.org/paper/8d904d49cb178def9a15fbea955d427d85cad2f5,Manifold: A Model-Agnostic Framework for Interpretation and Diagnosis of Machine Learning Models,"Interpretation and diagnosis of machine learning models have gained renewed interest in recent years with breakthroughs in new approaches. We present Manifold, a framework that utilizes visual analysis techniques to support interpretation, debugging, and comparison of machine learning models in a more transparent and interactive manner. Conventional techniques usually focus on visualizing the internal logic of a specific model type (i.e., deep neural networks), lacking the ability to extend to a more complex scenario where different model types are integrated. To this end, Manifold is designed as a generic framework that does not rely on or access the internal logic of the model and solely observes the input (i.e., instances or features) and the output (i.e., the predicted result and probability distribution). We describe the workflow of Manifold as an iterative process consisting of three major phases that are commonly involved in the model development and diagnosis process: inspection (hypothesis), explanation (reasoning), and refinement (verification). The visual components supporting these tasks include a scatterplot-based visual summary that overviews the models' outcome and a customizable tabular view that reveals feature discrimination. We demonstrate current applications of the framework on the classification and regression tasks and discuss other potential machine learning use scenarios where Manifold can be applied.",2018,44,131,7,True,Computer Science,47540407,Jiawei Zhang,2153676199.0,Yang Wang,34890911.0,Piero Molino,2151534400.0,Lezhi Li,33449182.0,D. Ebert,,,,,,,,,,,,,,,,,,,Medicine,Mathematics,,,,,,,,,,,,,,,,,,,,
784b018c87c7dcbbe772374e45d5191bae9938ee,https://www.semanticscholar.org/paper/784b018c87c7dcbbe772374e45d5191bae9938ee,Hyperbolic Graph Neural Networks,"Learning from graph-structured data is an important task in machine learning and artificial intelligence, for which Graph Neural Networks (GNNs) have shown great promise. Motivated by recent advances in geometric representation learning, we propose a novel GNN architecture for learning representations on Riemannian manifolds with differentiable exponential and logarithmic maps. We develop a scalable algorithm for modeling the structural properties of graphs, comparing Euclidean and hyperbolic geometry. In our experiments, we show that hyperbolic GNNs can lead to substantial improvements on various benchmark datasets.",2019,52,156,20,False,Computer Science,2144831836,Qi Liu,1729762.0,Maximilian Nickel,1743722.0,Douwe Kiela,,,,,,,,,,,,,,,,,,,,,,,Mathematics,,,,,,,,,,,,,,,,,,,,,
9136509aa692002a573fa18e3845568bd652e5b3,https://www.semanticscholar.org/paper/9136509aa692002a573fa18e3845568bd652e5b3,On learning how to learn learning strategies,"This paper introduces the ""incremental self-improvement paradigm"". Unlike previous methods, incremental self-improvement encourages a reinforcement learning system to improve the way it learns, and to improve the way it improves the way it learns ... , without significant theoretical limitations the system is able to ""shift its inductive bias"" in a universal way. Its major features are: (1} There is no explicit difference between ""learning"", ""meta-learning"", and other kinds of information processing. Using a Turing machine equivalent programming language, the system itself occasionally executes self-delimiting, initially highly random ""self-modification programs"" which modify the context-dependent probabilities of future action sequences (including future self-modification programs}. (2} The system keeps only those probability modifications computed by ""useful"" selfmodification programs: those which bring about more payoff (reward, reinforcement} per time than all previous self-modification programs. (3) The computation of payoff per time takes into account all the computation time required for learning the entire system life is considered: boundaries between learning trials are ignored (if there are any). A particular implementation based on the novel paradigm is presented. It is designed to exploit what conventional digital machines are good at: fast storage addressing, arithmetic operations etc. Experiments illustrate the system's mode of",1994,25,105,6,False,Computer Science,2055652031,J. Schmidhuber,,,,,,,,,,,,,,,,,,,,,,,,,,,,,,,,,,,,,,,,,,,,,,,,
