b516eeb62d112f5dffd60336f28cfaf5200a29bf,https://www.semanticscholar.org/paper/b516eeb62d112f5dffd60336f28cfaf5200a29bf,Machine learning in autistic spectrum disorder behavioral research: A review and ways forward,"ABSTRACT Autistic Spectrum Disorder (ASD) is a mental disorder that retards acquisition of linguistic, communication, cognitive, and social skills and abilities. Despite being diagnosed with ASD, some individuals exhibit outstanding scholastic, non-academic, and artistic capabilities, in such cases posing a challenging task for scientists to provide answers. In the last few years, ASD has been investigated by social and computational intelligence scientists utilizing advanced technologies such as machine learning to improve diagnostic timing, precision, and quality. Machine learning is a multidisciplinary research topic that employs intelligent techniques to discover useful concealed patterns, which are utilized in prediction to improve decision making. Machine learning techniques such as support vector machines, decision trees, logistic regressions, and others, have been applied to datasets related to autism in order to construct predictive models. These models claim to enhance the ability of clinicians to provide robust diagnoses and prognoses of ASD. However, studies concerning the use of machine learning in ASD diagnosis and treatment suffer from conceptual, implementation, and data issues such as the way diagnostic codes are used, the type of feature selection employed, the evaluation measures chosen, and class imbalances in data among others. A more serious claim in recent studies is the development of a new method for ASD diagnoses based on machine learning. This article critically analyses these recent investigative studies on autism, not only articulating the aforementioned issues in these studies but also recommending paths forward that enhance machine learning use in ASD with respect to conceptualization, implementation, and data. Future studies concerning machine learning in autism research are greatly benefitted by such proposals.",2019,62,153,6,False,Psychology,Medicine,1692763,F. Thabtah,,,,,,,,,,,,,,,,,,,,,,,,,,,,,,,,,,,,,,,,,,,,,,,,,,,,,,,,,,,,,,,,,,,,,,,,
52d97890dbc290108136739ec2afe0f2b6c4f570,https://www.semanticscholar.org/paper/52d97890dbc290108136739ec2afe0f2b6c4f570,Freeze-Thaw Bayesian Optimization,"In this paper we develop a dynamic form of Bayesian optimization for machine learning models with the goal of rapidly finding good hyperparameter settings. Our method uses the partial information gained during the training of a machine learning model in order to decide whether to pause training and start a new model, or resume the training of a previously-considered model. We specifically tailor our method to machine learning problems by developing a novel positive-definite covariance kernel to capture a variety of training curves. Furthermore, we develop a Gaussian process prior that scales gracefully with additional temporal observations. Finally, we provide an information-theoretic framework to automate the decision process. Experiments on several common machine learning models show that our approach is extremely effective in practice.",2014,28,211,26,False,Computer Science,Mathematics,1754860,Kevin Swersky,144108062.0,Jasper Snoek,1722180.0,Ryan P. Adams,,,,,,,,,,,,,,,,,,,,,,,,,,,,,,,,,,,,,,,,,,,,,,,,,,,,,,,,,,,,,,,,,,,,
d480f90ec1d48309850c1b92b2053990a60522a8,https://www.semanticscholar.org/paper/d480f90ec1d48309850c1b92b2053990a60522a8,MLI: An API for Distributed Machine Learning,"MLI is an Application Programming Interface designed to address the challenges of building Machine Learning algorithms in a distributed setting based on data-centric computing. Its primary goal is to simplify the development of high-performance, scalable, distributed algorithms. Our initial results show that, relative to existing systems, this interface can be used to build distributed implementations of a wide variety of common Machine Learning algorithms with minimal complexity and highly competitive performance and scalability.",2013,30,194,23,True,Computer Science,Mathematics,144752747,Evan R. Sparks,145532827.0,Ameet S. Talwalkar,145260024.0,Virginia Smith,2983690.0,Jey Kottalam,40201504.0,Xinghao Pan,,,49988044.0,Joseph E. Gonzalez,143666627.0,M. Franklin,1694621.0,Michael I. Jordan,1746961.0,Tim Kraska,,,,,,,,,,,,,,,,,,,,,,,,,,,,,,,,,,,,,,,,,,,,,,,,,,,,,,
df2a7756382540e92895f10703cec32d50c4f316,https://www.semanticscholar.org/paper/df2a7756382540e92895f10703cec32d50c4f316,Fast and accurate modeling of molecular atomization energies with machine learning.,"We introduce a machine learning model to predict atomization energies of a diverse set of organic molecules, based on nuclear charges and atomic positions only. The problem of solving the molecular Schrödinger equation is mapped onto a nonlinear statistical regression problem of reduced complexity. Regression models are trained on and compared to atomization energies computed with hybrid density-functional theory. Cross validation over more than seven thousand organic molecules yields a mean absolute error of ∼10  kcal/mol. Applicability is demonstrated for the prediction of molecular atomization potential energy curves.",2011,23,1191,26,True,Physics,Mathematics,48041657,M. Rupp,2462983.0,A. Tkatchenko,145034054.0,K. Müller,7847508.0,O. A. von Lilienfeld,,,Medicine,,,,,,,,,,,,,,,,,,,,,,,,,,,,,,,,,,,,,,,,,,,,,,,,,,,,,,,,,,,,,,,
5091316bb1c6db6c6a813f4391911a5c311fdfe0,https://www.semanticscholar.org/paper/5091316bb1c6db6c6a813f4391911a5c311fdfe0,“Why Should I Trust You?”: Explaining the Predictions of Any Classifier,"Despite widespread adoption, machine learning models remain mostly black boxes. Understanding the reasons behind predictions is, however, quite important in assessing trust, which is fundamental if one plans to take action based on a prediction, or when choosing whether to deploy a new model. Such understanding also provides insights into the model, which can be used to transform an untrustworthy model or prediction into a trustworthy one. In this work, we propose LIME, a novel explanation technique that explains the predictions of any classifier in an interpretable and faithful manner, by learning an interpretable model locally varound the prediction. We also propose a method to explain models by presenting representative individual predictions and their explanations in a non-redundant way, framing the task as a submodular optimization problem. We demonstrate the flexibility of these methods by explaining different models for text (e.g. random forests) and image classification (e.g. neural networks). We show the utility of explanations via novel experiments, both simulated and with human subjects, on various scenarios that require trust: deciding if one should trust a prediction, choosing between models, improving an untrustworthy classifier, and identifying why a classifier should not be trusted.",2016,41,8857,1299,True,Computer Science,Mathematics,78846919,Marco Tulio Ribeiro,34650964.0,Sameer Singh,1730156.0,Carlos Guestrin,,,,,,,,,,,,,,,,,,,,,,,,,,,,,,,,,,,,,,,,,,,,,,,,,,,,,,,,,,,,,,,,,,,,
2a04511d1f95e8663429bcadb46083e10d3458eb,https://www.semanticscholar.org/paper/2a04511d1f95e8663429bcadb46083e10d3458eb,Integrating machine learning and workflow management to support acquisition and adaptation of workflow models,"Current workflow management systems (WFMS) offer little aid for the acquisition of workflow models and their adaptation to changing requirements. To support these activities we propose to integrate machine learning and workflow management. This enables an inductive approach to workflow acquisition and adaptation by processing traces of manually enacted workflows. We present a machine learning component that combines two different machine learning algorithms. In this paper we focus mainly on the first one, which induces the structure of the workflow, based on the induction of hidden markov models. The second algorithm, a standard decision rule induction algorithm, induces transition conditions. The main concepts have been implemented in a prototype, which we have validated using artificial process traces. The induced workflow models can be imported by the business process management system ADONIS.",1998,34,239,14,False,Computer Science,,2325415,J. Herbst,145328956.0,D. Karagiannis,,,,,,,,,,,,,,,,,,,,,,,,,,,,,,,,,,,,,,,,,,,,,,,,,,,,,,,,,,,,,,,,,,,,,,
792d90c2ed5ebbe050bd80b9c865dc416b574c09,https://www.semanticscholar.org/paper/792d90c2ed5ebbe050bd80b9c865dc416b574c09,Machine Learning–Based Model for Prediction of Outcomes in Acute Stroke,"Background and Purpose— The prediction of long-term outcomes in ischemic stroke patients may be useful in treatment decisions. Machine learning techniques are being increasingly adapted for use in the medical field because of their high accuracy. This study investigated the applicability of machine learning techniques to predict long-term outcomes in ischemic stroke patients. Methods— This was a retrospective study using a prospective cohort that enrolled patients with acute ischemic stroke. Favorable outcome was defined as modified Rankin Scale score 0, 1, or 2 at 3 months. We developed 3 machine learning models (deep neural network, random forest, and logistic regression) and compared their predictability. To evaluate the accuracy of the machine learning models, we also compared them to the Acute Stroke Registry and Analysis of Lausanne (ASTRAL) score. Results— A total of 2604 patients were included in this study, and 2043 (78%) of them had favorable outcomes. The area under the curve for the deep neural network model was significantly higher than that of the ASTRAL score (0.888 versus 0.839; P<0.001), while the areas under the curves of the random forest (0.857; P=0.136) and logistic regression (0.849; P=0.413) models were not significantly higher than that of the ASTRAL score. Using only the 6 variables that are used for the ASTRAL score, the performance of the machine learning models did not significantly differ from that of the ASTRAL score. Conclusions— Machine learning algorithms, particularly the deep neural network, can improve the prediction of long-term outcomes in ischemic stroke patients.",2019,9,154,3,True,Medicine,,5980849,Joonnyung Heo,32745548.0,Jihoon G Yoon,4994655.0,Hyungjong Park,34471989.0,Young Dae Kim,2185414.0,H. S. Nam,,,34508977.0,J. Heo,,,,,,,,,,,,,,,,,,,,,,,,,,,,,,,,,,,,,,,,,,,,,,,,,,,,,,,,,,,,
3eaf21ba64b0775b68ebadbafe064bb619b75ca6,https://www.semanticscholar.org/paper/3eaf21ba64b0775b68ebadbafe064bb619b75ca6,Adaptive Sparseness for Supervised Learning,"The goal of supervised learning is to infer a functional mapping based on a set of training examples. To achieve good generalization, it is necessary to control the ""complexity"" of the learned function. In Bayesian approaches, this is done by adopting a prior for the parameters of the function being learned. We propose a Bayesian approach to supervised learning, which leads to sparse solutions; that is, in which irrelevant parameters are automatically set exactly to zero. Other ways to obtain sparse classifiers (such as Laplacian priors, support vector machines) involve (hyper)parameters which control the degree of sparseness of the resulting classifiers; these parameters have to be somehow adjusted/estimated from the training data. In contrast, our approach does not involve any (hyper)parameters to be adjusted or estimated. This is achieved by a hierarchical-Bayes interpretation of the Laplacian prior, which is then modified by the adoption of a Jeffreys' noninformative hyperprior. Implementation is carried out by an expectation-maximization (EM) algorithm. Experiments with several benchmark data sets show that the proposed approach yields state-of-the-art performance. In particular, our method outperforms SVMs and performs competitively with the best alternative techniques, although it involves no tuning or adjustment of sparseness-controlling hyperparameters.",2003,40,565,54,True,Computer Science,,34659351,Mário A. T. Figueiredo,,,,,,,,,,,,,,,,,,,,,,,,,,,,,,,,,,,,,,,,,,,,,,,,,,,,,,,,,,,,,,,,,,,,,,,,
6d0fb3a5ad66c83e9f2ef066d83f0ae23180da41,https://www.semanticscholar.org/paper/6d0fb3a5ad66c83e9f2ef066d83f0ae23180da41,Distributed GraphLab : A Framework for Machine Learning and Data Mining in the Cloud,"While high-level data parallel frameworks, like MapReduce, simplify the design and implementation of large-scale data processing systems, they do not naturally or efficiently support many important data mining and machine learning algorithms and can lead to inefficient learning systems. To help fill this critical void, we introduced the GraphLab abstraction which naturally expresses asynchronous, dynamic, graph-parallel computation while ensuring data consistency and achieving a high degree of parallel performance in the shared-memory setting. In this paper, we extend the GraphLab framework to the substantially more challenging distributed setting while preserving strong data consistency guarantees. We develop graph based extensions to pipelined locking and data versioning to reduce network congestion and mitigate the effect of network latency. We also introduce fault tolerance to the GraphLab abstraction using the classic Chandy-Lamport snapshot algorithm and demonstrate how it can be easily implemented by exploiting the GraphLab abstraction itself. Finally, we evaluate our distributed implementation of the GraphLab abstraction on a large Amazon EC2 deployment and show 1-2 orders of magnitude performance gains over Hadoop-based implementations.",2012,40,1292,208,False,,,1680638,Y. Low,2119113835.0,Joseph Gonzalez,1717990.0,Aapo Kyrola,1741745.0,D. Bickson,1730156.0,Carlos Guestrin,,,1695576.0,J. Hellerstein,,,,,,,,,,,,,,,,,,,,,,,,,,,,,,,,,,,,,,,,,,,,,,,,,,,,,,,,,,,,
84534c6fa2dab4768617205b302bfbce9b3bb376,https://www.semanticscholar.org/paper/84534c6fa2dab4768617205b302bfbce9b3bb376,A Review of Ensemble Methods in Bioinformatics,"Ensemble learning is an intensively studies technique in machine learning and pattern recognition. Recent work in computational biology has seen an increasing use of ensemble learning methods due to their unique advantages in dealing with small sample size, high-dimensionality, and complexity data structures. The aim of this article is two-fold. First, it is to provide a review of the most widely used ensemble learning methods and their application in various bioinformatics problems, including the main topics of gene expression, mass spectrometry-based proteomics, gene-gene interaction identification from genome-wide association studies, and prediction of regulatory elements from DNA and protein sequences. Second, we try to identify and summarize future trends of ensemble methods in bioinformatics. Promising directions such as ensemble of support vector machine, meta-ensemble, and ensemble based feature selection are discussed.",2010,110,404,12,False,Computer Science,,1745108,Pengyi Yang,119607780.0,Y. H. Yang,1776472.0,B. Zhou,9392149.0,Albert Y. Zomaya,,,,,,,,,,,,,,,,,,,,,,,,,,,,,,,,,,,,,,,,,,,,,,,,,,,,,,,,,,,,,,,,,,
ccf6a69a7f33bcf052aa7def176d3b9de495beb7,https://www.semanticscholar.org/paper/ccf6a69a7f33bcf052aa7def176d3b9de495beb7,Man is to Computer Programmer as Woman is to Homemaker? Debiasing Word Embeddings,"The blind application of machine learning runs the risk of amplifying biases present in data. Such a danger is facing us with word embedding, a popular framework to represent text data as vectors which has been used in many machine learning and natural language processing tasks. We show that even word embeddings trained on Google News articles exhibit female/male gender stereotypes to a disturbing extent. This raises concerns because their widespread use, as we describe, often tends to amplify these biases. Geometrically, gender bias is first shown to be captured by a direction in the word embedding. Second, gender neutral words are shown to be linearly separable from gender definition words in the word embedding. Using these properties, we provide a methodology for modifying an embedding to remove gender stereotypes, such as the association between the words receptionist and female, while maintaining desired associations such as between the words queen and female. Using crowd-worker evaluation as well as standard benchmarks, we empirically demonstrate that our algorithms significantly reduce gender bias in embeddings while preserving the its useful properties such as the ability to cluster related concepts and to solve analogy tasks. The resulting embeddings can be used in applications without amplifying gender bias.",2016,47,1842,279,False,Computer Science,Mathematics,2843215,Tolga Bolukbasi,2782886.0,Kai-Wei Chang,145085305.0,James Y. Zou,1699322.0,Venkatesh Saligrama,2186481.0,A. Kalai,,,,,,,,,,,,,,,,,,,,,,,,,,,,,,,,,,,,,,,,,,,,,,,,,,,,,,,,,,,,,,,,
f2ac2a3fd7b341f2b1be752b4dd46ed9abcf0751,https://www.semanticscholar.org/paper/f2ac2a3fd7b341f2b1be752b4dd46ed9abcf0751,Deep Reinforcement Learning,"We discuss deep reinforcement learning in an overview style. We draw a big picture, filled with details. We discuss six core elements, six important mechanisms, and twelve applications, focusing on contemporary work, and in historical contexts. We start with background of artificial intelligence, machine learning, deep learning, and reinforcement learning (RL), with resources. Next we discuss RL core elements, including value function, policy, reward, model, exploration vs. exploitation, and representation. Then we discuss important mechanisms for RL, including attention and memory, unsupervised learning, hierarchical RL, multi-agent RL, relational RL, and learning to learn. After that, we discuss RL applications, including games, robotics, natural language processing (NLP), computer vision, finance, business management, healthcare, education, energy, transportation, computer systems, and, science, engineering, and art. Finally we summarize briefly, discuss challenges and opportunities, and close with an epilogue.",2018,890,261,17,True,Computer Science,Mathematics,2276894,Yuxi Li,,,,,,,,,,,,,,,,,,,,,,,,,,,,,,,,,,,,,,,,,,,,,,,,,,,,,,,,,,,,,,,,,,,,,,,,
3b9f6a6901db3bc39be9e147f6efe66e40f6a8f7,https://www.semanticscholar.org/paper/3b9f6a6901db3bc39be9e147f6efe66e40f6a8f7,The practice on using machine learning for network anomaly intrusion detection,"Machine learning is regarded as an effective tool utilized by intrusion detection system (IDS) to detect abnormal activities from network traffic. In particular, neural networks, support vector machines (SVM) and decision trees are three significant and popular schemes borrowed from the machine learning community into intrusion detection in recent academic research. However, these machine learning schemes are rarely employed in large-scale practical settings. In this paper, we implement and compare machine learning schemes of neural networks, SVM and decision trees in a uniform environment with the purpose of exploring the practice and issues of using these approaches in detecting abnormal behaviors. With the analysis of experimental results, we claim that the real performance of machine learning algorithms depends heavily on practical context. Therefore, the machine learning approaches are supposed to be applied in an appropriate way in terms of the actual settings.",2011,22,51,0,False,Computer Science,,3592010,Yuxin Meng,,,,,,,,,,,,,,,,,,,,,,,,,,,,,,,,,,,,,,,,,,,,,,,,,,,,,,,,,,,,,,,,,,,,,,,,
6989e13df80edfc6e638e8d8502cb0739d494ca6,https://www.semanticscholar.org/paper/6989e13df80edfc6e638e8d8502cb0739d494ca6,Machine Learning in Compiler Optimization,"In the last decade, machine-learning-based compilation has moved from an obscure research niche to a mainstream activity. In this paper, we describe the relationship between machine learning and compiler optimization and introduce the main concepts of features, models, training, and deployment. We then provide a comprehensive survey and provide a road map for the wide variety of different research areas. We conclude with a discussion on open issues in the area and potential research directions. This paper provides both an accessible introduction to the fast moving area of machine-learning-based compilation and a detailed bibliography of its main achievements.",2018,200,128,8,True,Computer Science,,12230182,Zheng Wang,1401533251.0,M. O’Boyle,,,,,,,,,,,,,,,,,,,,,,,,,,,,,,,,,,,,,,,,,,,,,,,,,,,,,,,,,,,,,,,,,,,,,,
c48e85a7a4ed7895096ae074a6c544415e6c4b85,https://www.semanticscholar.org/paper/c48e85a7a4ed7895096ae074a6c544415e6c4b85,RAPID: Rating Pictorial Aesthetics using Deep Learning,"Effective visual features are essential for computational aesthetic quality rating systems. Existing methods used machine learning and statistical modeling techniques on handcrafted features or generic image descriptors. A recently-published large-scale dataset, the AVA dataset, has further empowered machine learning based approaches. We present the RAPID (RAting PIctorial aesthetics using Deep learning) system, which adopts a novel deep neural network approach to enable automatic feature learning. The central idea is to incorporate heterogeneous inputs generated from the image, which include a global view and a local view, and to unify the feature learning and classifier training using a double-column deep convolutional neural network. In addition, we utilize the style attributes of images to help improve the aesthetic quality categorization accuracy. Experimental results show that our approach significantly outperforms the state of the art on the AVA dataset.",2014,34,325,50,False,Computer Science,,145574672,Xin Lu,145527707.0,Zhe L. Lin,41151701.0,Hailin Jin,1706007.0,Jianchao Yang,2116439116.0,J. Z. Wang,,,,,,,,,,,,,,,,,,,,,,,,,,,,,,,,,,,,,,,,,,,,,,,,,,,,,,,,,,,,,,,,
400081ba358663ca24365044e5e818638c439e1d,https://www.semanticscholar.org/paper/400081ba358663ca24365044e5e818638c439e1d,Machine Learning DDoS Detection for Consumer Internet of Things Devices,"An increasing number of Internet of Things (IoT) devices are connecting to the Internet, yet many of these devices are fundamentally insecure, exposing the Internet to a variety of attacks. Botnets such as Mirai have used insecure consumer IoT devices to conduct distributed denial of service (DDoS) attacks on critical Internet infrastructure. This motivates the development of new techniques to automatically detect consumer IoT attack traffic. In this paper, we demonstrate that using IoT-specific network behaviors (e.g., limited number of endpoints and regular time intervals between packets) to inform feature selection can result in high accuracy DDoS detection in IoT network traffic with a variety of machine learning algorithms, including neural networks. These results indicate that home gateway routers or other network middleboxes could automatically detect local IoT device sources of DDoS attacks using low-cost machine learning algorithms and traffic data that is flow-based and protocol-agnostic.",2018,23,368,32,True,Computer Science,,145488660,Rohan Doshi,11669550.0,Noah J. Apthorpe,1800154.0,N. Feamster,,,,,,,,,,,,,,,,,,,,,,,,,,,,,,,,,,,,,,,,,,,,,,,,,,,,,,,,,,,,,,,,,,,,
bb35ef89addbbc28d960bc0cab70d8a29fdf6eee,https://www.semanticscholar.org/paper/bb35ef89addbbc28d960bc0cab70d8a29fdf6eee,A Survey on Multi-Task Learning,"Multi-Task Learning (MTL) is a learning paradigm in machine learning and its aim is to leverage useful information contained in multiple related tasks to help improve the generalization performance of all the tasks. In this paper, we give a survey for MTL from the perspective of algorithmic modeling, applications and theoretical analyses. For algorithmic modeling, we give a definition of MTL and then classify different MTL algorithms into five categories, including feature learning approach, low-rank approach, task clustering approach, task relation learning approach and decomposition approach as well as discussing the characteristics of each approach. In order to improve the performance of learning tasks further, MTL can be combined with other learning paradigms including semi-supervised learning, active learning, unsupervised learning, reinforcement learning, multi-view learning and graphical models. When the number of tasks is large or the data dimensionality is high, we review online, parallel and distributed MTL models as well as dimensionality reduction and feature hashing to reveal their computational and storage advantages. Many real-world applications use MTL to boost their performance and we review representative works in this paper. Finally, we present theoretical analyses and discuss several future directions for MTL.",2017,277,993,62,True,Computer Science,Mathematics,46867608,Yu Zhang,152290618.0,Qiang Yang,,,,,,,,,,,,,,,,,,,,,,,,,,,,,,,,,,,,,,,,,,,,,,,,,,,,,,,,,,,,,,,,,,,,,,
