dc0c84b7c5e6521216da789f8171544709120cf0,https://www.semanticscholar.org/paper/dc0c84b7c5e6521216da789f8171544709120cf0,Opportunities and obstacles for deep learning in biology and medicine,"Deep learning, which describes a class of machine learning algorithms, has recently showed impressive results across a variety of domains. Biology and medicine are data rich, but the data are complex and often ill-understood. Problems of this nature may be particularly well-suited to deep learning techniques. We examine applications of deep learning to a variety of biomedical problems -- patient classification, fundamental biological processes, and treatment of patients -- to predict whether deep learning will transform these tasks or if the biomedical sphere poses unique challenges. We find that deep learning has yet to revolutionize or definitively resolve any of these problems, but promising advances have been made on the prior state of the art. Even when improvement over a previous baseline has been modest, we have seen signs that deep learning methods may speed or aid human investigation. More work is needed to address concerns related to interpretability and how to best model each problem. Furthermore, the limited amount of labeled data for training presents problems in some domains, as can legal and privacy constraints on work with sensitive health records. Nonetheless, we foresee deep learning powering changes at the bench and bedside with the potential to transform several areas of biology and medicine.",2017,628,1219,18,True,Biology,Computer Science,5926615,T. Ching,1868440.0,Daniel S. Himmelstein,1402651503.0,Brett K. Beaulieu-Jones,32985843.0,Alexandr A Kalinin,48154546.0,Brian T Do,Medicine,,3738725.0,Gregory P. Way,137381074.0,E. Ferrero,2236448.0,P. Agapow,40862218.0,M. Zietz,35290352.0,M. M. Hoffman,1993128574.0,W. Xie,6997856.0,G. Rosen,6580840.0,Benjamin J. Lengerich,39246361.0,Johnny Israeli,3369052.0,Jack Lanchantin,8230326.0,S. Woloszynek,1721012.0,Anne E Carpenter,3407268.0,Avanti Shrikumar,1807918.0,Jinbo Xu,30469485.0,Evan M. Cofer,39291675.0,C. A. Lavender,3178417.0,Srinivas C. Turaga,35786407.0,Amr M. Alexandari,144202084.0,Zhiyong Lu,145192391.0,David J Harris,1973239.0,D. DeCaprio,121817403.0,Yanjun Qi,2844479.0,A. Kundaje,2699239.0,Yifan Peng,3116087.0,L. K. Wiley,3451383.0,Marwin H. S. Segler,2831521.0,S. Boca,7946353.0,S. Joshua Joshua Swamidass,119855034.0,Austin Huang,2041407.0,A. Gitter,2104940.0,C. Greene
6db308779954a4006d87ce68148ff2aaa176dfb2,https://www.semanticscholar.org/paper/6db308779954a4006d87ce68148ff2aaa176dfb2,A Study of K-Nearest Neighbour as an Imputation Method,"Data quality is a major concern in Machine Learning and other correlated areas such as Knowledge Discovery from Databases (KDD). As most Machine Learning algorithms induce knowledge strictly from data, the quality of the knowledge extracted is largely determined by the quality of the underlying data. One relevant problem in data quality is the presence of missing data. Despite the frequent occurrence of missing data, many Machine Learning algorithms handle missing data in a rather naive way. Missing data treatment should be carefully thought, otherwise bias might be introduced into the knowledge induced. In this work, we analyse the use of the k-nearest neighbour as an imputation method. Imputation is a term that denotes a procedure that replaces the missing values in a data set by some plausible values. Our analysis indicates that missing data imputation based on the k-nearest neighbour algorithm can outperform the internal methods used by C4.5 and CN2 to treat missing data.",2002,16,307,19,False,Computer Science,,145666101,Gustavo E. A. P. A. Batista,1737677.0,M. C. Monard,,,,,,,,,,,,,,,,,,,,,,,,,,,,,,,,,,,,,,,,,,,,,,,,,,,,,,,,,,,,,,,,,,,,,,
7195cc1469cded3f506f16fcdd497576996e8cde,https://www.semanticscholar.org/paper/7195cc1469cded3f506f16fcdd497576996e8cde,Introduction to machine learning,1 Why Machine Learning and AI: The Contributions of AI to Learning Techniques 2 Theoretical Foundations for Machine Learning 3 Representation of Complex Knowledge by Clauses 4 Representation of Knowledge about Actions and the Addition of New Rules to a Knowledge Base 5 Learning by Doing 6 A Formal Presentation of Version Spaces 7 Explanation-Based Learning 8 Learning by Similarity Detection: The Empirical Approach 9 Learning by Similarity Detection: The 'Rational' Approach 10 Automatic Construction of Taxonomies: Techniques for Clustering 11 Debugging and Understanding in Depth: The Learning of Micro-Worlds 12 Learning by Analogy Appendix 1 Equivalence Between Theorems and Clauses Appendix 2 Synthesis of Predicates Appendix 3 Machine Learning in Context,1988,0,88,3,True,Computer Science,,1713946,Y. Kodratoff,,,,,,,,,,,,,,,,,,,,,,,,,,,,,,,,,,,,,,,,,,,,,,,,,,,,,,,,,,,,,,,,,,,,,,,,
02505d330224375113f2a905efdd867591c0d435,https://www.semanticscholar.org/paper/02505d330224375113f2a905efdd867591c0d435,Music Plus One and Machine Learning,"A system for musical accompaniment is presented in which a computer-driven orchestra follows and learns from a soloist in a concerto-like setting. The system is decomposed into three modules: the first computes a real-time score match using a hidden Markov model; the second generates the output audio by phase-vocoding a preexisting audio recording; the third provides a link between these two, by predicting future timing evolution using a Kalman filter-like model. Several examples are presented showing the system in action in diverse musical settings. Connections with machine learning are highlighted, showing current weaknesses and new possible directions.",2010,12,74,8,False,Computer Science,,145087434,C. Raphael,,,,,,,,,,,,,,,,,,,,,,,,,,,,,,,,,,,,,,,,,,,,,,,,,,,,,,,,,,,,,,,,,,,,,,,,
f10e071292d593fef939e6ef4a59baf0bb3a6c2b,https://www.semanticscholar.org/paper/f10e071292d593fef939e6ef4a59baf0bb3a6c2b,Reinforcement Learning Neural Turing Machines,"The expressive power of a machine learning model is closely related to the number of sequential computational steps it can learn. For example, Deep Neural Networks have been more successful than shallow networks because they can perform a greater number of sequential computational steps (each highly parallel). The Neural Turing Machine (NTM) [8] is a model that can compactly express an even greater number of sequential computational steps, so it is even more powerful than a DNN. Its memory addressing operations are designed to be differentiable; thus the NTM can be trained with backpropagation. While differentiable memory is relatively easy to implement and train, it necessitates accessing the entire memory content at each computational step. This makes it difficult to implement a fast NTM. In this work, we use the Re inforce algorithm to learn where to access the memory, while using backpropagation to learn what to write to the memory. We call this model the RL-NTM. Reinforce allows our model to access a constant number of memory cells at each computational step, so its implementation can be faster. The RL-NTM is the first mo del that can, in principle, learn programs of unbounded running time. We successfully trained the RL-NTM to solve a number of algorithmic tasks that are simpler than the ones solvable by the fully differentiable NTM. As the RL-NTM is a fairly intricate model, we needed a method for verifying the correctness of our implementation. To do so, we developed a simple technique for numerically checking arbitrary implementations of models that use Reinforce, which may be of independent interest.",2015,28,170,9,False,Computer Science,,2563432,Wojciech Zaremba,1701686.0,Ilya Sutskever,,,,,,,,,,,,,,,,,,,,,,,,,,,,,,,,,,,,,,,,,,,,,,,,,,,,,,,,,,,,,,,,,,,,,,
2de37e9d1046f18ab739202a1dfb7541fccadd7a,https://www.semanticscholar.org/paper/2de37e9d1046f18ab739202a1dfb7541fccadd7a,Beyond PageRank: machine learning for static ranking,"Since the publication of Brin and Page's paper on PageRank, many in the Web community have depended on PageRank for the static (query-independent) ordering of Web pages. We show that we can significantly outperform PageRank using features that are independent of the link structure of the Web. We gain a further boost in accuracy by using data on the frequency at which users visit Web pages. We use RankNet, a ranking machine learning algorithm, to combine these and other static features based on anchor text and domain characteristics. The resulting model achieves a static ranking pairwise accuracy of 67.3% (vs. 56.7% for PageRank or 50% for random).",2006,37,207,9,False,Computer Science,,144422314,Matthew Richardson,2054035504.0,Amit Prakash,145022783.0,E. Brill,,,,,,,,,,,,,,,,,,,,,,,,,,,,,,,,,,,,,,,,,,,,,,,,,,,,,,,,,,,,,,,,,,,,
ad32f5295c2e0f7d077fee722aff2998e2af72e7,https://www.semanticscholar.org/paper/ad32f5295c2e0f7d077fee722aff2998e2af72e7,An Extensive Empirical Study of Feature Selection Metrics for Text Classification,"Machine learning for text classification is the cornerstone of document categorization, news filtering, document routing, and personalization. In text domains, effective feature selection is essential to make the learning task efficient and more accurate. This paper presents an empirical comparison of twelve feature selection methods (e.g. Information Gain) evaluated on a benchmark of 229 text classification problem instances that were gathered from Reuters, TREC, OHSUMED, etc. The results are analyzed from multiple goal perspectives-accuracy, F-measure, precision, and recall-since each is appropriate in different situations. The results reveal that a new feature selection metric we call 'Bi-Normal Separation' (BNS), outperformed the others by a substantial margin in most situations. This margin widened in tasks with high class skew, which is rampant in text classification problems and is particularly challenging for induction algorithms. A new evaluation methodology is offered that focuses on the needs of the data mining practitioner faced with a single dataset who seeks to choose one (or a pair of) metrics that are most likely to yield the best performance. From this perspective, BNS was the top single choice for all goals except precision, for which Information Gain yielded the best result most often. This analysis also revealed, for example, that Information Gain and Chi-Squared have correlated failures, and so they work poorly together. When choosing optimal pairs of metrics for each of the four performance goals, BNS is consistently a member of the pair---e.g., for greatest recall, the pair BNS + F1-measure yielded the best performance on the greatest number of tasks by a considerable margin.",2003,20,2795,213,False,Computer Science,,3332330,George Forman,,,,,,,,,,,,,,,,,,,,,,,,,,,,,,,,,,,,,,,,,,,,,,,,,,,,,,,,,,,,,,,,,,,,,,,,
5d5593a7b368fa4b3f3a8abf111ff17c261313c1,https://www.semanticscholar.org/paper/5d5593a7b368fa4b3f3a8abf111ff17c261313c1,Toward harnessing user feedback for machine learning,"There has been little research into how end users might be able to communicate advice to machine learning systems. If this resource--the users themselves--could somehow work hand-in-hand with machine learning systems, the accuracy of learning systems could be improved and the users' understanding and trust of the system could improve as well. We conducted a think-aloud study to see how willing users were to provide feedback and to understand what kinds of feedback users could give. Users were shown explanations of machine learning predictions and asked to provide feedback to improve the predictions. We found that users had no difficulty providing generous amounts of feedback. The kinds of feedback ranged from suggestions for reweighting of features to proposals for new features, feature combinations, relational features, and wholesale changes to the learning algorithm. The results show that user feedback has the potential to significantly improve machine learning systems, but that learning algorithms need to be extended in several ways to be able to assimilate this feedback.",2007,30,153,3,True,Computer Science,,2121662,S. Stumpf,40051508.0,Vidya Rajaram,2107914294.0,Lida Li,1737204.0,M. Burnett,144299726.0,Thomas G. Dietterich,,,2054441880.0,Erin Sullivan,2070070437.0,Russell Drummond,2658798.0,Jonathan L. Herlocker,,,,,,,,,,,,,,,,,,,,,,,,,,,,,,,,,,,,,,,,,,,,,,,,,,,,,,,,
96abcdded2985bd44b9514e28f5b8da4fa1e4371,https://www.semanticscholar.org/paper/96abcdded2985bd44b9514e28f5b8da4fa1e4371,The mythos of model interpretability,"In machine learning, the concept of interpretability is both important and slippery.",2018,41,308,33,True,Computer Science,,32219137,Zachary Chase Lipton,,,,,,,,,,,,,,,,,,,,,,,,,,,,,,,,,,,,,,,,,,,,,,,,,,,,,,,,,,,,,,,,,,,,,,,,
4a7eea3ec3080ecb277bfe466afce4822a1071d7,https://www.semanticscholar.org/paper/4a7eea3ec3080ecb277bfe466afce4822a1071d7,Quantum embeddings for machine learning,"Quantum classifiers are trainable quantum circuits used as machine learning models. The first part of the circuit implements a quantum feature map that encodes classical inputs into quantum states, embedding the data in a high-dimensional Hilbert space; the second part of the circuit executes a quantum measurement interpreted as the output of the model. Usually, the measurement is trained to distinguish quantum-embedded data. We propose to instead train the first part of the circuit---the embedding---with the objective of maximally separating data classes in Hilbert space, a strategy we call quantum metric learning. As a result, the measurement minimizing a linear classification loss is already known and depends on the metric used: for embeddings separating data using the l1 or trace distance, this is the Helstrom measurement, while for the l2 or Hilbert-Schmidt distance, it is a simple overlap measurement. This approach provides a powerful analytic framework for quantum machine learning and eliminates a major component in current models, freeing up more precious resources to best leverage the capabilities of near-term quantum information processors.",2020,21,136,16,False,Computer Science,Physics,145762777,S. Lloyd,3048564.0,M. Schuld,35323164.0,Aroosa Ijaz,2070140.0,J. Izaac,3399181.0,N. Killoran,,,,,,,,,,,,,,,,,,,,,,,,,,,,,,,,,,,,,,,,,,,,,,,,,,,,,,,,,,,,,,,,
0cc6dbfd929bc816d507527993f55f9b4e88615d,https://www.semanticscholar.org/paper/0cc6dbfd929bc816d507527993f55f9b4e88615d,Machine learning & artificial intelligence in the quantum domain: a review of recent progress,"Quantum information technologies, on the one hand, and intelligent learning systems, on the other, are both emergent technologies that are likely to have a transformative impact on our society in the future. The respective underlying fields of basic research—quantum information versus machine learning (ML) and artificial intelligence (AI)—have their own specific questions and challenges, which have hitherto been investigated largely independently. However, in a growing body of recent work, researchers have been probing the question of the extent to which these fields can indeed learn and benefit from each other. Quantum ML explores the interaction between quantum computing and ML, investigating how results and techniques from one field can be used to solve the problems of the other. Recently we have witnessed significant breakthroughs in both directions of influence. For instance, quantum computing is finding a vital application in providing speed-ups for ML problems, critical in our ‘big data’ world. Conversely, ML already permeates many cutting-edge technologies and may become instrumental in advanced quantum technologies. Aside from quantum speed-up in data analysis, or classical ML optimization used in quantum experiments, quantum enhancements have also been (theoretically) demonstrated for interactive learning tasks, highlighting the potential of quantum-enhanced learning agents. Finally, works exploring the use of AI for the very design of quantum experiments and for performing parts of genuine research autonomously, have reported their first successes. Beyond the topics of mutual enhancement—exploring what ML/AI can do for quantum physics and vice versa—researchers have also broached the fundamental issue of quantum generalizations of learning and AI concepts. This deals with questions of the very meaning of learning and intelligence in a world that is fully described by quantum mechanics. In this review, we describe the main ideas, recent developments and progress in a broad spectrum of research investigating ML and AI in the quantum domain.",2017,375,511,7,True,Physics,Computer Science,2878563,V. Dunjko,32534184.0,H. Briegel,,,,,,,Medicine,,,,,,,,,,,,,,,,,,,,,,,,,,,,,,,,,,,,,,,,,,,,,,,,,,,,,,,,,,,,,,,
b1059d25d092e0e872a1d2db01b24c73eb869ad9,https://www.semanticscholar.org/paper/b1059d25d092e0e872a1d2db01b24c73eb869ad9,Machine Learning for Neural Decoding,"Abstract Despite rapid advances in machine learning tools, the majority of neural decoding approaches still use traditional methods. Modern machine learning tools, which are versatile and easy to use, have the potential to significantly improve decoding performance. This tutorial describes how to effectively apply these algorithms for typical decoding problems. We provide descriptions, best practices, and code for applying common machine learning methods, including neural networks and gradient boosting. We also provide detailed comparisons of the performance of various methods at the task of decoding spiking activity in motor cortex, somatosensory cortex, and hippocampus. Modern methods, particularly neural networks and ensembles, significantly outperform traditional approaches, such as Wiener and Kalman filters. Improving the performance of neural decoding algorithms allows neuroscientists to better understand the information contained in a neural population and can help to advance engineering applications such as brain–machine interfaces. Our code package is available at github.com/kordinglab/neural_decoding.",2017,104,128,11,True,Biology,Computer Science,2937772,Joshua I. Glaser,38308858.0,Raeed H. Chowdhury,5228640.0,M. Perich,32776555.0,L. Miller,3282030.0,Konrad Paul Kording,Mathematics,Medicine,,,,,,,,,,,,,,,,,,,,,,,,,,,,,,,,,,,,,,,,,,,,,,,,,,,,,,,,,,,,,,
f2642db17084b14068d56f332de2f2d5a1622c5a,https://www.semanticscholar.org/paper/f2642db17084b14068d56f332de2f2d5a1622c5a,Error Minimized Extreme Learning Machine With Growth of Hidden Nodes and Incremental Learning,"One of the open problems in neural network research is how to automatically determine network architectures for given applications. In this brief, we propose a simple and efficient approach to automatically determine the number of hidden nodes in generalized single-hidden-layer feedforward networks (SLFNs) which need not be neural alike. This approach referred to as error minimized extreme learning machine (EM-ELM) can add random hidden nodes to SLFNs one by one or group by group (with varying group size). During the growth of the networks, the output weights are updated incrementally. The convergence of this approach is proved in this brief as well. Simulation results demonstrate and verify that our new approach is much faster than other sequential/incremental/growing algorithms with good generalization performance.",2009,26,578,31,False,Computer Science,Medicine,2069968720,Guorui Feng,145678691.0,G. Huang,3026738.0,Qingping Lin,1723858.0,R. Gay,,,,,,,,,,,,,,,,,,,,,,,,,,,,,,,,,,,,,,,,,,,,,,,,,,,,,,,,,,,,,,,,,,
23bd1da0ad4d2ec956346655f0bb0206e13556b8,https://www.semanticscholar.org/paper/23bd1da0ad4d2ec956346655f0bb0206e13556b8,Learning to Control a Brain–Machine Interface for Reaching and Grasping by Primates,"Reaching and grasping in primates depend on the coordination of neural activity in large frontoparietal ensembles. Here we demonstrate that primates can learn to reach and grasp virtual objects by controlling a robot arm through a closed-loop brain–machine interface (BMIc) that uses multiple mathematical models to extract several motor parameters (i.e., hand position, velocity, gripping force, and the EMGs of multiple arm muscles) from the electrical activity of frontoparietal neuronal ensembles. As single neurons typically contribute to the encoding of several motor parameters, we observed that high BMIc accuracy required recording from large neuronal ensembles. Continuous BMIc operation by monkeys led to significant improvements in both model predictions and behavioral performance. Using visual feedback, monkeys succeeded in producing robot reach-and-grasp movements even when their arms did not move. Learning to operate the BMIc was paralleled by functional reorganization in multiple cortical areas, suggesting that the dynamic properties of the BMIc were incorporated into motor and sensory cortical representations.",2003,45,1739,122,True,Biology,Medicine,2016191,J. Carmena,2057713.0,M. Lebedev,1826610.0,R. Crist,1397219405.0,J. E. O’Doherty,39819116.0,David M. Santucci,,,38928339.0,D. Dimitrov,8004223.0,P. Patil,1845021.0,C. Henriquez,144052463.0,M. Nicolelis,,,,,,,,,,,,,,,,,,,,,,,,,,,,,,,,,,,,,,,,,,,,,,,,,,,,,,
f0cdd1488734abe45854b96d76f797188005656b,https://www.semanticscholar.org/paper/f0cdd1488734abe45854b96d76f797188005656b,"A Survey on Federated Learning Systems: Vision, Hype and Reality for Data Privacy and Protection","Federated learning has been a hot research topic in enabling the collaborative training of machine learning models among different organizations under the privacy restrictions. As researchers try to support more machine learning models with different privacy-preserving approaches, there is a requirement in developing systems and infrastructures to ease the development of various federated learning algorithms. Similar to deep learning systems such as PyTorch and TensorFlow that boost the development of deep learning, federated learning systems (FLSs) are equivalently important, and face challenges from various aspects such as effectiveness, efficiency, and privacy. In this survey, we conduct a comprehensive review on federated learning systems. To achieve smooth flow and guide future research, we introduce the definition of federated learning systems and analyze the system components. Moreover, we provide a thorough categorization for federated learning systems according to six different aspects, including data distribution, machine learning model, privacy mechanism, communication architecture, scale of federation and motivation of federation. The categorization can help the design of federated learning systems as shown in our case studies. By systematically summarizing the existing federated learning systems, we present the design factors, case studies, and future research opportunities.",2019,313,239,19,True,Computer Science,Mathematics,92621060,Q. Li,39003902.0,Zeyi Wen,143824511.0,Bingsheng He,,,,,,,,,,,,,,,,,,,,,,,,,,,,,,,,,,,,,,,,,,,,,,,,,,,,,,,,,,,,,,,,,,,,
2eee70568be6f780eb98178568df5dd204b0064e,https://www.semanticscholar.org/paper/2eee70568be6f780eb98178568df5dd204b0064e,A Machine Learning Strategy to Assist Turbulence Model Development,"Turbulence modeling in a Reynolds Averaged Navier–Stokes (RANS) setting has traditionally evolved through a combination of theory, mathematics, and empiricism. The problem of closure, resulting from the averaging process, requires an infusion of information into the various models that is often managed in an ad-hoc way or that is focused on particular classes of problems, thus diminishing the predictive capabilities of a model in other flow contexts. In this work, a proof-of-concept of a new data-driven approach of turbulence model development is presented. The key idea in the proposed framework is to use supervised learning algorithms to build a representation of turbulence modeling closure terms. The learned terms are then inserted into a Computational Fluid Dynamics (CFD) numerical simulation with the aim of offering a better representation of turbulence physics. But while the basic idea is attractive, modeling unknown terms by increasingly large amounts of data from higher-fidelity simulations (LES, DNS, etc) or even experiment, the details of how to make the approach viable are not at all obvious. In this work, we investigate the feasibility of such an approach by attempting to reproduce, through a machine learning methodology, the results obtained with the well-established SpalartAllmaras model. In other words, the key question that we seek to answer is the following: Given a number of observations of CFD solutions using the Spalart-Allmaras model (our truth model), can we reproduce those solutions using machine-learning techniques without knowledge of the structure, functional form, and coefficients of the actual model? We discuss the challenges of applying machine learning techniques in a fluid dynamic setting and possible successful approaches. We also explore the potential for machine learning as an enhancement to or replacement for traditional turbulence models. Our results highlight the potential and viability of machine learning approaches to aid turbulence model development.",2015,31,219,4,True,,,143613254,Brendan D. Tracey,1974037.0,K. Duraisamy,145409784.0,J. Alonso,,,,,,,,,,,,,,,,,,,,,,,,,,,,,,,,,,,,,,,,,,,,,,,,,,,,,,,,,,,,,,,,,,,,
