paperId,url,title,abstract,year,referenceCount,citationCount,influentialCitationCount,isOpenAccess,fieldsOfStudy/0,fieldsOfStudy/1,authors/0/authorId,authors/0/name,authors/1/authorId,authors/1/name,authors/2/authorId,authors/2/name,authors/3/authorId,authors/3/name,authors/4/authorId,authors/4/name,fieldsOfStudy/2,fieldsOfStudy/3,authors/5/authorId,authors/5/name,authors/6/authorId,authors/6/name,authors/7/authorId,authors/7/name,authors/8/authorId,authors/8/name,authors/9/authorId,authors/9/name,authors/10/authorId,authors/10/name,authors/11/authorId,authors/11/name,authors/12/authorId,authors/12/name,authors/13/authorId,authors/13/name,authors/14/authorId,authors/14/name,authors/15/authorId,authors/15/name,authors/16/authorId,authors/16/name,authors/17/authorId,authors/17/name,authors/18/authorId,authors/18/name,authors/19/authorId,authors/19/name,authors/20/authorId,authors/20/name,authors/21/authorId,authors/21/name,authors/22/authorId,authors/22/name,authors/23/authorId,authors/23/name,authors/24/authorId,authors/24/name,authors/25/authorId,authors/25/name,authors/26/authorId,authors/26/name,authors/27/authorId,authors/27/name,authors/28/authorId,authors/28/name,authors/29/authorId,authors/29/name,authors/30/authorId,authors/30/name,authors/31/authorId,authors/31/name,authors/32/authorId,authors/32/name,authors/33/authorId,authors/33/name,authors/34/authorId,authors/34/name,authors/35/authorId,authors/35/name
ab1258b286c729e2c0cd2546ec0f79ad21bd3883,https://www.semanticscholar.org/paper/ab1258b286c729e2c0cd2546ec0f79ad21bd3883,Quantum Boltzmann Machine,"Inspired by the success of Boltzmann Machines based on classical Boltzmann distribution, we propose a new machine learning approach based on quantum Boltzmann distribution of a transverse-field Ising Hamiltonian. Due to the non-commutative nature of quantum mechanics, the training process of the Quantum Boltzmann Machine (QBM) can become nontrivial. We circumvent the problem by introducing bounds on the quantum probabilities. This allows us to train the QBM efficiently by sampling. We show examples of QBM training with and without the bound, using exact diagonalization, and compare the results with classical Boltzmann training. We also discuss the possibility of using quantum annealing processors like D-Wave for QBM training and application.",2016,41,331,17,True,Physics,Computer Science,143707843,M. Amin,8381113.0,E. Andriyash,34965728.0,J. Rolfe,103330749.0,B. Kulchytskyy,3422513.0,R. Melko,,,,,,,,,,,,,,,,,,,,,,,,,,,,,,,,,,,,,,,,,,,,,,,,,,,,,,,,,,,,,,,,
127c1cb96b73399f429de553d315561504cc7cd4,https://www.semanticscholar.org/paper/127c1cb96b73399f429de553d315561504cc7cd4,On Human Predictions with Explanations and Predictions of Machine Learning Models: A Case Study on Deception Detection,"Humans are the final decision makers in critical tasks that involve ethical and legal concerns, ranging from recidivism prediction, to medical diagnosis, to fighting against fake news. Although machine learning models can sometimes achieve impressive performance in these tasks, these tasks are not amenable to full automation. To realize the potential of machine learning for improving human decisions, it is important to understand how assistance from machine learning models affects human performance and human agency. In this paper, we use deception detection as a testbed and investigate how we can harness explanations and predictions of machine learning models to improve human performance while retaining human agency. We propose a spectrum between full human agency and full automation, and develop varying levels of machine assistance along the spectrum that gradually increase the influence of machine predictions. We find that without showing predicted labels, explanations alone slightly improve human performance in the end task. In comparison, human performance is greatly improved by showing predicted labels (>20% relative improvement) and can be further improved by explicitly suggesting strong machine performance. Interestingly, when predicted labels are shown, explanations of machine predictions induce a similar level of accuracy as an explicit statement of strong machine performance. Our results demonstrate a tradeoff between human performance and human agency and show that explanations of machine predictions can moderate this tradeoff.",2018,82,159,18,True,Computer Science,Physics,120801533,Vivian Lai,40348583.0,Chenhao Tan,,,,,,,Mathematics,,,,,,,,,,,,,,,,,,,,,,,,,,,,,,,,,,,,,,,,,,,,,,,,,,,,,,,,,,,,,,,
a16e484824b2580e092c985aa659e8680aeda5ee,https://www.semanticscholar.org/paper/a16e484824b2580e092c985aa659e8680aeda5ee,Shallow Semantic Parsing using Support Vector Machines,"In this paper, we propose a machine learning algorithm for shallow semantic parsing, extending the work of Gildea and Jurafsky (2002), Surdeanu et al. (2003) and others. Our algorithm is based on Support Vector Machines which we show give an improvement in performance over earlier classifiers. We show performance improvements through a number of new features and measure their ability to generalize to a new test set drawn from the AQUAINT corpus.",2004,22,447,52,False,Computer Science,,1735131,Sameer Pradhan,1866226.0,Wayne H. Ward,2483422.0,K. Hacioglu,10796472.0,James H. Martin,1746807.0,Dan Jurafsky,,,,,,,,,,,,,,,,,,,,,,,,,,,,,,,,,,,,,,,,,,,,,,,,,,,,,,,,,,,,,,,,
7c7ab73469c25437332f5c1c1c5cb67c7b2f0855,https://www.semanticscholar.org/paper/7c7ab73469c25437332f5c1c1c5cb67c7b2f0855,Low-Shot Visual Recognition by Shrinking and Hallucinating Features,"Low-shot visual learning–the ability to recognize novel object categories from very few examples–is a hallmark of human visual intelligence. Existing machine learning approaches fail to generalize in the same way. To make progress on this foundational problem, we present a low-shot learning benchmark on complex images that mimics challenges faced by recognition systems in the wild. We then propose (1) representation regularization techniques, and (2) techniques to hallucinate additional training examples for data-starved classes. Together, our methods improve the effectiveness of convolutional networks in low-shot learning, improving the one-shot accuracy on novel classes by 2.3× on the challenging ImageNet dataset.",2016,51,569,60,True,Computer Science,,1790580,Bharath Hariharan,2983898.0,Ross B. Girshick,,,,,,,,,,,,,,,,,,,,,,,,,,,,,,,,,,,,,,,,,,,,,,,,,,,,,,,,,,,,,,,,,,,,,,
d76c07211479e233f7c6a6f32d5346c983c5598f,https://www.semanticscholar.org/paper/d76c07211479e233f7c6a6f32d5346c983c5598f,Multi-task Sequence to Sequence Learning,"Sequence to sequence learning has recently emerged as a new paradigm in supervised learning. To date, most of its applications focused on only one task and not much work explored this framework for multiple tasks. This paper examines three multi-task learning (MTL) settings for sequence to sequence models: (a) the oneto-many setting - where the encoder is shared between several tasks such as machine translation and syntactic parsing, (b) the many-to-one setting - useful when only the decoder can be shared, as in the case of translation and image caption generation, and (c) the many-to-many setting - where multiple encoders and decoders are shared, which is the case with unsupervised objectives and translation. Our results show that training on a small amount of parsing and image caption data can improve the translation quality between English and German by up to 1.5 BLEU points over strong single-task baselines on the WMT benchmarks. Furthermore, we have established a new state-of-the-art result in constituent parsing with 93.0 F1. Lastly, we reveal interesting properties of the two unsupervised learning objectives, autoencoder and skip-thought, in the MTL context: autoencoder helps less in terms of perplexities but more on BLEU scores compared to skip-thought.",2015,34,714,71,False,Computer Science,Mathematics,1707242,Minh-Thang Luong,2827616.0,Quoc V. Le,1701686.0,Ilya Sutskever,1689108.0,Oriol Vinyals,40527594.0,Lukasz Kaiser,,,,,,,,,,,,,,,,,,,,,,,,,,,,,,,,,,,,,,,,,,,,,,,,,,,,,,,,,,,,,,,,
1f7ed2ebc6b641e3804cf177fd42a1b8de95003b,https://www.semanticscholar.org/paper/1f7ed2ebc6b641e3804cf177fd42a1b8de95003b,Machine-learning techniques and their applications in manufacturing,"Abstract Machine learning is concerned with enabling computer programs automatically to improve their performance at some tasks through experience. Manufacturing is an area where the application of machine learning can be very fruitful. However, little has been published about the use of machine-learning techniques in the manufacturing domain. This paper evaluates several machine-learning techniques and examines applications in which they have been successfully deployed. Special attention is given to inductive learning, which is among the most mature of the machine-learning approaches currently available. Current trends and recent developments in machine-learning research are also discussed. The paper concludes with a summary of some of the key research issues in machine learning.",2005,157,97,3,False,Engineering,,2082214471,D. T. Pham,2002947.0,A. Afify,,,,,,,,,,,,,,,,,,,,,,,,,,,,,,,,,,,,,,,,,,,,,,,,,,,,,,,,,,,,,,,,,,,,,,
4f71ab367eb37cfd145d41327f7bb14077e5e7c5,https://www.semanticscholar.org/paper/4f71ab367eb37cfd145d41327f7bb14077e5e7c5,Deep Learning for Hyperspectral Image Classification: An Overview,"Hyperspectral image (HSI) classification has become a hot topic in the field of remote sensing. In general, the complex characteristics of hyperspectral data make the accurate classification of such data challenging for traditional machine learning methods. In addition, hyperspectral imaging often deals with an inherently nonlinear relation between the captured spectral information and the corresponding materials. In recent years, deep learning has been recognized as a powerful feature-extraction tool to effectively address nonlinear problems and widely used in a number of image processing tasks. Motivated by those successful applications, deep learning has also been introduced to classify HSIs and demonstrated good performance. This survey paper presents a systematic review of deep learning-based HSI classification literatures and compares several strategies for this topic. Specifically, we first summarize the main challenges of HSI classification which cannot be effectively overcome by traditional machine learning methods, and also introduce the advantages of deep learning to handle these problems. Then, we build a framework that divides the corresponding works into spectral-feature networks, spatial-feature networks, and spectral–spatial-feature networks to systematically review the recent achievements in deep learning-based HSI classification. In addition, considering the fact that available training samples in the remote sensing field are usually very limited and training deep networks require a large number of samples, we include some strategies to improve classification performance, which can provide some guidelines for future studies on this topic. Finally, several representative deep learning-based classification methods are conducted on real HSIs in our experiments.",2019,118,484,17,True,Engineering,Computer Science,2116066317,Shutao Li,145273596.0,Weiwei Song,38140728.0,Leyuan Fang,2597809.0,Yushi Chen,2370080.0,Pedram Ghamisi,,,1682001.0,J. Benediktsson,,,,,,,,,,,,,,,,,,,,,,,,,,,,,,,,,,,,,,,,,,,,,,,,,,,,,,,,,,,,
33fd991b4e05becfdec93585d25b6369a0519133,https://www.semanticscholar.org/paper/33fd991b4e05becfdec93585d25b6369a0519133,Trading convexity for scalability,"Convex learning algorithms, such as Support Vector Machines (SVMs), are often seen as highly desirable because they offer strong practical properties and are amenable to theoretical analysis. However, in this work we show how non-convexity can provide scalability advantages over convexity. We show how concave-convex programming can be applied to produce (i) faster SVMs where training errors are no longer support vectors, and (ii) much faster Transductive SVMs.",2006,54,380,47,True,Computer Science,Mathematics,2939803,Ronan Collobert,50095217.0,Fabian H Sinz,145183709.0,J. Weston,52184096.0,L. Bottou,,,,,,,,,,,,,,,,,,,,,,,,,,,,,,,,,,,,,,,,,,,,,,,,,,,,,,,,,,,,,,,,,,
f6154535699c65633243c482d2b97d4b66036633,https://www.semanticscholar.org/paper/f6154535699c65633243c482d2b97d4b66036633,Learning Features of Music from Scratch,"This paper introduces a new large-scale music dataset, MusicNet, to serve as a source of supervision and evaluation of machine learning methods for music research. MusicNet consists of hundreds of freely-licensed classical music recordings by 10 composers, written for 11 instruments, together with instrument/note annotations resulting in over 1 million temporal labels on 34 hours of chamber music performances under various studio and microphone conditions. 
The paper defines a multi-label classification task to predict notes in musical recordings, along with an evaluation protocol, and benchmarks several machine learning architectures for this task: i) learning from spectrogram features; ii) end-to-end learning with a neural net; iii) end-to-end learning with a convolutional neural net. These experiments show that end-to-end models trained for note prediction learn frequency selective filters as a low-level representation of audio.",2016,39,138,27,False,Computer Science,Mathematics,50343904,John Thickstun,1753355.0,Z. Harchaoui,144695232.0,S. Kakade,,,,,,,,,,,,,,,,,,,,,,,,,,,,,,,,,,,,,,,,,,,,,,,,,,,,,,,,,,,,,,,,,,,,
3fc9cff6ad55986de180204b98613af42f8ac37d,https://www.semanticscholar.org/paper/3fc9cff6ad55986de180204b98613af42f8ac37d,Towards CRISP-ML(Q): A Machine Learning Process Model with Quality Assurance Methodology,"Machine learning is an established and frequently used technique in industry and academia, but a standard process model to improve success and efficiency of machine learning applications is still missing. Project organizations and machine learning practitioners face manifold challenges and risks when developing machine learning applications and have a need for guidance to meet business expectations. This paper therefore proposes a process model for the development of machine learning applications, covering six phases from defining the scope to maintaining the deployed machine learning application. Business and data understanding are executed simultaneously in the first phase, as both have considerable impact on the feasibility of the project. The next phases are comprised of data preparation, modeling, evaluation, and deployment. Special focus is applied to the last phase, as a model running in changing real-time environments requires close monitoring and maintenance to reduce the risk of performance degradation over time. With each task of the process, this work proposes quality assurance methodology that is suitable to address challenges in machine learning development that are identified in the form of risks. The methodology is drawn from practical experience and scientific literature, and has proven to be general and stable. The process model expands on CRISP-DM, a data mining process model that enjoys strong industry support, but fails to address machine learning specific tasks. The presented work proposes an industry- and application-neutral process model tailored for machine learning applications with a focus on technical tasks for quality assurance.",2020,181,47,5,True,Computer Science,Mathematics,2066100848,Stefan Studer,4667865.0,T. Bui,40117299.0,C. Drescher,3332452.0,A. Hanuschkin,2065341843.0,Ludwig Winkler,,,2050675924.0,S. Peters,2113612432.0,Klaus-Robert Müller,,,,,,,,,,,,,,,,,,,,,,,,,,,,,,,,,,,,,,,,,,,,,,,,,,,,,,,,,,
3893783a815a5d46a26f154683115d4195b1b004,https://www.semanticscholar.org/paper/3893783a815a5d46a26f154683115d4195b1b004,Preparing Medical Imaging Data for Machine Learning.,"Artificial intelligence (AI) continues to garner substantial interest in medical imaging. The potential applications are vast and include the entirety of the medical imaging life cycle from image creation to diagnosis to outcome prediction. The chief obstacles to development and clinical implementation of AI algorithms include availability of sufficiently large, curated, and representative training data that includes expert labeling (eg, annotations). Current supervised AI methods require a curation process for data to optimally train, validate, and test algorithms. Currently, most research groups and industry have limited data access based on small sample sizes from small geographic areas. In addition, the preparation of data is a costly and time-intensive process, the results of which are algorithms with limited utility and poor generalization. In this article, the authors describe fundamental steps for preparing medical imaging data in AI algorithm development, explain current limitations to data curation, and explore new approaches to address the problem of data availability.",2020,132,280,7,True,Medicine,,4127337,M. Willemink,70244729.0,Wojciech A Koszek,1498054949.0,Cailin Hardell,2118432480.0,Jie Wu,1733946.0,D. Fleischmann,,,144953202.0,H. Harvey,2684053.0,L. Folio,144838131.0,R. Summers,143648587.0,D. Rubin,4204731.0,M. Lungren,,,,,,,,,,,,,,,,,,,,,,,,,,,,,,,,,,,,,,,,,,,,,,,,,,,,
160a4786dd643d9f758b9cc0758bdd2581524941,https://www.semanticscholar.org/paper/160a4786dd643d9f758b9cc0758bdd2581524941,Machine learning for detection and diagnosis of disease.,"Machine learning offers a principled approach for developing sophisticated, automatic, and objective algorithms for analysis of high-dimensional and multimodal biomedical data. This review focuses on several advances in the state of the art that have shown promise in improving detection, diagnosis, and therapeutic monitoring of disease. Key in the advancement has been the development of a more in-depth understanding and theoretical analysis of critical issues related to algorithmic construction and learning theory. These include trade-offs for maximizing generalization performance, use of physically realistic constraints, and incorporation of prior knowledge and uncertainty. The review describes recent developments in machine learning, focusing on supervised and unsupervised linear methods and Bayesian inference, which have made significant impacts in the detection and diagnosis of disease in biomedicine. We describe the different methodologies and, for each, provide examples of their application to specific domains in biomedical diagnostics.",2006,152,293,7,False,Computer Science,Medicine,1812793,P. Sajda,,,,,,,,,,,,,,,,,,,,,,,,,,,,,,,,,,,,,,,,,,,,,,,,,,,,,,,,,,,,,,,,,,,,,,,,
18cb13754640a0bbdef07cf8efcfc762a27afa6a,https://www.semanticscholar.org/paper/18cb13754640a0bbdef07cf8efcfc762a27afa6a,Intelligent Hybrid Vehicle Power Control—Part I: Machine Learning of Optimal Vehicle Power,"In this series of two papers, we present our research on intelligent energy management for hybrid electric vehicles (HEVs). These two papers cover the modeling of power flow in HEVs, the mathematical background of optimization in energy management in HEVs, a machine learning framework that combines dynamic programming (DP) with machine learning to learn about roadway-type- and traffic-congestion-level-specific energy optimization, machine learning algorithms, and real-time quasi-optimal control of energy flow in an HEV. This first paper presents our research on machine learning for optimal energy management in HEVs. We will present a machine learning framework ML_EMO_HEV developed for the optimization of energy management in an HEV, machine learning algorithms for predicting driving environments, and the generation of an optimal power split for a given driving environment. Experiments are conducted based on a simulated Ford Escape Hybrid vehicle model provided by Argonne National Laboratory's Powertrain Systems Analysis Toolkit (PSAT). Based on the experimental results on the test data, we can conclude that the neural networks trained under the ML_EMO_HEV framework are effective in predicting roadway type and traffic congestion levels, predicting driving trends, and learning optimal engine speed and optimal battery power from DP.",2012,26,152,3,False,Engineering,Computer Science,9491649,Y. Murphey,2087950.0,Jungme Park,2109331148.0,ZhiHang Chen,2157249.0,M. Kuang,144347027.0,M. Masrur,,,31639858.0,A. Phillips,,,,,,,,,,,,,,,,,,,,,,,,,,,,,,,,,,,,,,,,,,,,,,,,,,,,,,,,,,,,
2550d4f922f9652c4755695c822e492161524bce,https://www.semanticscholar.org/paper/2550d4f922f9652c4755695c822e492161524bce,DeepDefense: Identifying DDoS Attack via Deep Learning,"Distributed Denial of Service (DDoS) attacks grow rapidly and become one of the fatal threats to the Internet. Automatically detecting DDoS attack packets is one of the main defense mechanisms. Conventional solutions monitor network traffic and identify attack activities from legitimate network traffic based on statistical divergence. Machine learning is another method to improve identifying performance based on statistical features. However, conventional machine learning techniques are limited by the shallow representation models. In this paper, we propose a deep learning based DDoS attack detection approach (DeepDefense). Deep learning approach can automatically extract high-level features from low-level ones and gain powerful representation and inference. We design a recurrent deep neural network to learn patterns from sequences of network traffic and trace network attack activities. The experimental results demonstrate a better performance of our model compared with conventional machine learning models. We reduce the error rate from 7.517% to 2.103% compared with conventional machine learning method in the larger data set.",2017,37,178,19,False,Computer Science,,2115844647,Xiaoyong Yuan,1838103.0,Chuanhuang Li,2108672978.0,Xiaolin Li,,,,,,,,,,,,,,,,,,,,,,,,,,,,,,,,,,,,,,,,,,,,,,,,,,,,,,,,,,,,,,,,,,,,
d4599b177559dd5ede4dda9d6d96aa149fc71942,https://www.semanticscholar.org/paper/d4599b177559dd5ede4dda9d6d96aa149fc71942,An Efficient Learning Procedure for Deep Boltzmann Machines,"We present a new learning algorithm for Boltzmann machines that contain many layers of hidden variables. Data-dependent statistics are estimated using a variational approximation that tends to focus on a single mode, and data-independent statistics are estimated using persistent Markov chains. The use of two quite different techniques for estimating the two types of statistic that enter into the gradient of the log likelihood makes it practical to learn Boltzmann machines with multiple hidden layers and millions of parameters. The learning can be made more efficient by using a layer-by-layer pretraining phase that initializes the weights sensibly. The pretraining also allows the variational inference to be initialized sensibly with a single bottom-up pass. We present results on the MNIST and NORB data sets showing that deep Boltzmann machines learn very good generative models of handwritten digits and 3D objects. We also show that the features discovered by deep Boltzmann machines are a very effective way to initialize the hidden layers of feedforward neural nets, which are then discriminatively fine-tuned.",2012,72,416,46,True,Medicine,Computer Science,145124475,R. Salakhutdinov,1695689.0,Geoffrey E. Hinton,,,,,,,,,,,,,,,,,,,,,,,,,,,,,,,,,,,,,,,,,,,,,,,,,,,,,,,,,,,,,,,,,,,,,,
13b3a1e7e0bd80bf38b444ce1568213ebe98d0df,https://www.semanticscholar.org/paper/13b3a1e7e0bd80bf38b444ce1568213ebe98d0df,Large Scale Online Learning of Image Similarity Through Ranking,"Learning a measure of similarity between pairs of objects is an important generic problem in machine learning. It is particularly useful in large scale applications like searching for an image that is similar to a given image or finding videos that are relevant to a given video. In these tasks, users look for objects that are not only visually similar but also semantically related to a given object. Unfortunately, the approaches that exist today for learning such semantic similarity do not scale to large data sets. This is both because typically their CPU and storage requirements grow quadratically with the sample size, and because many methods impose complex positivity constraints on the space of learned similarity functions. 
 
The current paper presents OASIS, an Online Algorithm for Scalable Image Similarity learning that learns a bilinear similarity measure over sparse representations. OASIS is an online dual approach using the passive-aggressive family of learning algorithms with a large margin criterion and an efficient hinge loss cost. Our experiments show that OASIS is both fast and accurate at a wide range of scales: for a data set with thousands of images, it achieves better results than existing state-of-the-art methods, while being an order of magnitude faster. For large, web scale, data sets, OASIS can be trained on more than two million images from 150K text queries within 3 days on a single CPU. On this large scale data set, human evaluations showed that 35% of the ten nearest neighbors of a given test image, as found by OASIS, were semantically relevant to that image. This suggests that query independent similarity could be accurately learned even for large scale data sets that could not be handled before.",2009,41,710,80,True,Computer Science,,1732280,Gal Chechik,2112448321.0,Varun Sharma,2304764.0,Uri Shalit,1751569.0,Samy Bengio,,,,,,,,,,,,,,,,,,,,,,,,,,,,,,,,,,,,,,,,,,,,,,,,,,,,,,,,,,,,,,,,,,
