paperId,url,title,abstract,year,referenceCount,citationCount,influentialCitationCount,isOpenAccess,fieldsOfStudy/0,fieldsOfStudy/1,authors/0/authorId,authors/0/name,authors/1/authorId,authors/1/name,authors/2/authorId,authors/2/name,authors/3/authorId,authors/3/name,authors/4/authorId,authors/4/name,fieldsOfStudy/2,fieldsOfStudy/3,authors/5/authorId,authors/5/name,authors/6/authorId,authors/6/name,authors/7/authorId,authors/7/name,authors/8/authorId,authors/8/name,authors/9/authorId,authors/9/name,authors/10/authorId,authors/10/name,authors/11/authorId,authors/11/name,authors/12/authorId,authors/12/name,authors/13/authorId,authors/13/name,authors/14/authorId,authors/14/name,authors/15/authorId,authors/15/name,authors/16/authorId,authors/16/name,authors/17/authorId,authors/17/name,authors/18/authorId,authors/18/name,authors/19/authorId,authors/19/name,authors/20/authorId,authors/20/name,authors/21/authorId,authors/21/name
8729441d734782c3ed532a7d2d9611b438c0a09a,https://www.semanticscholar.org/paper/8729441d734782c3ed532a7d2d9611b438c0a09a,ADADELTA: An Adaptive Learning Rate Method,"We present a novel per-dimension learning rate method for gradient descent called ADADELTA. The method dynamically adapts over time using only first order information and has minimal computational overhead beyond vanilla stochastic gradient descent. The method requires no manual tuning of a learning rate and appears robust to noisy gradient information, different model architecture choices, various data modalities and selection of hyperparameters. We show promising results compared to other methods on the MNIST digit classification task using a single machine and on a large scale voice dataset in a distributed cluster environment.",2012,8,5762,870,False,Computer Science,,48799969,Matthew D. Zeiler,,,,,,,,,,,,,,,,,,,,,,,,,,,,,,,,,,,,,,,,,,,,
d37fc9e9c4fedc32865b08661e7fb950df1f8fbe,https://www.semanticscholar.org/paper/d37fc9e9c4fedc32865b08661e7fb950df1f8fbe,Kernel methods in machine learning,"We review machine learning methods employing positive definite kernels. These methods formulate learning and estimation problems in a reproducing kernel Hilbert space (RKHS) of functions defined on the data domain, expanded in terms of a kernel. Working in linear spaces of function has the benefit of facilitating the construction and analysis of learning algorithms while at the same time allowing large classes of functions. The latter include nonlinear functions as well as functions defined on nonvectorial data. We cover a wide range of methods, ranging from binary classifiers to sophisticated methods for estimation with structured data.",2007,164,1292,56,False,Mathematics,,143936663,Thomas Hofmann,1707625.0,B. Schölkopf,46234526.0,Alex Smola,,,,,,,,,,,,,,,,,,,,,,,,,,,,,,,,,,,,,,,,
7fe7e80bf59a112386211b38ef2ea0b71ae76345,https://www.semanticscholar.org/paper/7fe7e80bf59a112386211b38ef2ea0b71ae76345,Machine Learning that Matters,"Much of current machine learning (ML) research has lost its connection to problems of import to the larger world of science and society. From this perspective, there exist glaring limitations in the data sets we investigate, the metrics we employ for evaluation, and the degree to which results are communicated back to their originating domains. What changes are needed to how we conduct research to increase the impact that ML has? We present six Impact Challenges to explicitly focus the field's energy and attention, and we discuss existing obstacles that must be addressed. We aim to inspire ongoing discussion and focus on ML that matters.",2012,20,243,22,False,Computer Science,Mathematics,6541629,K. Wagstaff,,,,,,,,,,,,,,,,,,,,,,,,,,,,,,,,,,,,,,,,,,,,
ce0b8b6fca7dc089548cc2e9aaac3bae82bb19da,https://www.semanticscholar.org/paper/ce0b8b6fca7dc089548cc2e9aaac3bae82bb19da,Making machine learning models interpretable,"Data of different levels of complexity and of ever growing diversity of characteristics are the raw materials that machine learning practitioners try to model using their wide palette of methods and tools. The obtained models are meant to be a synthetic representation of the available, observed data that captures some of their intrinsic regularities or patterns. Therefore, the use of machine learning techniques for data analysis can be understood as a problem of pattern recognition or, more informally, of knowledge discovery and data mining. There exists a gap, though, between data modeling and knowledge extraction. Models, de- pending on the machine learning techniques employed, can be described in diverse ways but, in order to consider that some knowledge has been achieved from their description, we must take into account the human cog- nitive factor that any knowledge extraction process entails. These models as such can be rendered powerless unless they can be interpreted ,a nd the process of human interpretation follows rules that go well beyond techni- cal prowess. For this reason, interpretability is a paramount quality that machine learning methods should aim to achieve if they are to be applied in practice. This paper is a brief introduction to the special session on interpretable models in machine learning, organized as part of the 20 th European Symposium on Artificial Neural Networks, Computational In- telligence and Machine Learning. It includes a discussion on the several works accepted for the session, with an overview of the context of wider research on interpretability of machine learning models.",2012,46,284,6,False,Computer Science,,1723612,A. Vellido,84306443.0,J. Martín-Guerrero,145408620.0,P. Lisboa,,,,,,,,,,,,,,,,,,,,,,,,,,,,,,,,,,,,,,,,
3c8bf504ddc7db1829466b6e9da5251025dd48f1,https://www.semanticscholar.org/paper/3c8bf504ddc7db1829466b6e9da5251025dd48f1,Automatic analysis of malware behavior using machine learning,"Malicious software - so called malware - poses a major threat to the security of computer systems. The amount and diversity of its variants render classic security defenses ineffective, such that millions of hosts in the Internet are infected with malware in the form of computer viruses, Internet worms and Trojan horses. While obfuscation and polymorphism employed by malware largely impede detection at file level, the dynamic analysis of malware binaries during run-time provides an instrument for characterizing and defending against the threat of malicious software. 
 
In this article, we propose a framework for the automatic analysis of malware behavior using machine learning. The framework allows for automatically identifying novel classes of malware with similar behavior (clustering) and assigning unknown malware to these discovered classes (classification). Based on both, clustering and classification, we propose an incremental approach for behavior-based analysis, capable of processing the behavior of thousands of malware binaries on a daily basis. The incremental analysis significantly reduces the run-time overhead of current analysis methods, while providing accurate discovery and discrimination of novel malware variants.",2011,68,663,60,True,Computer Science,,144825749,K. Rieck,2032673.0,Philipp Trinius,2043274.0,Carsten Willems,144227650.0,Thorsten Holz,,,,,,,,,,,,,,,,,,,,,,,,,,,,,,,,,,,,,,
02227c94dd41fe0b439e050d377b0beb5d427cda,https://www.semanticscholar.org/paper/02227c94dd41fe0b439e050d377b0beb5d427cda,Reading Digits in Natural Images with Unsupervised Feature Learning,"Detecting and reading text from natural images is a hard computer vision task that is central to a variety of emerging applications. Related problems like document character recognition have been widely studied by computer vision and machine learning researchers and are virtually solved for practical applications like reading handwritten digits. Reliably recognizing characters in more complex scenes like photographs, however, is far more difficult: the best existing methods lag well behind human performance on the same tasks. In this paper we attack the problem of recognizing digits in a real application using unsupervised feature learning methods: reading house numbers from street level photos. To this end, we introduce a new benchmark dataset for research use containing over 600,000 labeled digits cropped from Street View images. We then demonstrate the difficulty of recognizing these digits when the problem is approached with hand-designed features. Finally, we employ variants of two recently proposed unsupervised feature learning methods and find that they are convincingly superior on our benchmarks.",2011,28,4413,1673,False,Computer Science,,34180232,Yuval Netzer,2156632012.0,Tao Wang,144638694.0,Adam Coates,1726358.0,A. Bissacco,144397975.0,Bo Wu,,,34699434.0,A. Ng,,,,,,,,,,,,,,,,,,,,,,,,,,,,,,,,
58209c6db7b321ea7c75395b23ddb5100cd9bf81,https://www.semanticscholar.org/paper/58209c6db7b321ea7c75395b23ddb5100cd9bf81,Machine Learning for the New York City Power Grid,"Power companies can benefit from the use of knowledge discovery methods and statistical machine learning for preventive maintenance. We introduce a general process for transforming historical electrical grid data into models that aim to predict the risk of failures for components and systems. These models can be used directly by power companies to assist with prioritization of maintenance and repair work. Specialized versions of this process are used to produce (1) feeder failure rankings, (2) cable, joint, terminator, and transformer rankings, (3) feeder Mean Time Between Failure (MTBF) estimates, and (4) manhole events vulnerability rankings. The process in its most general form can handle diverse, noisy, sources that are historical (static), semi-real-time, or real-time, incorporates state-of-the-art machine learning algorithms for prioritization (supervised ranking or MTBF), and includes an evaluation of results via cross-validation and blind test. Above and beyond the ranked lists and MTBF estimates are business management interfaces that allow the prediction capability to be integrated directly into corporate planning and decision support; such interfaces rely on several important properties of our general modeling approach: that machine learning features are meaningful to domain experts, that the processing of data is transparent, and that prediction results are accurate enough to support sound decision making. We discuss the challenges in working with historical electrical grid data that were not designed for predictive purposes. The “rawness” of these data contrasts with the accuracy of the statistical models that can be obtained from the process; these models are sufficiently accurate to assist in maintaining New York City's electrical grid.",2012,58,220,7,True,Computer Science,Medicine,48395540,C. Rudin,1788375.0,D. Waltz,50035867.0,Roger N. Anderson,21545954.0,A. Boulanger,1403192347.0,Ansaf Salleb-Aouissi,,,32350828.0,M. Chow,1720958.0,Haimonti Dutta,152889617.0,Philip Gross,40486307.0,Bert Huang,1779637.0,Steve Ierome,,,,,,,,,,,,,,,,,,,,,,,,
f04df4e20a18358ea2f689b4c129781628ef7fc1,https://www.semanticscholar.org/paper/f04df4e20a18358ea2f689b4c129781628ef7fc1,A large annotated corpus for learning natural language inference,"Understanding entailment and contradiction is fundamental to understanding natural language, and inference about entailment and contradiction is a valuable testing ground for the development of semantic representations. However, machine learning research in this area has been dramatically limited by the lack of large-scale resources. To address this, we introduce the Stanford Natural Language Inference corpus, a new, freely available collection of labeled sentence pairs, written by humans doing a novel grounded task based on image captioning. At 570K pairs, it is two orders of magnitude larger than all other resources of its type. This increase in scale allows lexicalized classifiers to outperform some sophisticated existing entailment models, and it allows a neural network-based model to perform competitively on natural language inference benchmarks for the first time.",2015,37,2847,764,True,Computer Science,,3644767,Samuel R. Bowman,32301760.0,Gabor Angeli,144922861.0,Christopher Potts,144783904.0,Christopher D. Manning,,,,,,,,,,,,,,,,,,,,,,,,,,,,,,,,,,,,,,
e9a986c8ff6c2f381d026fe014f6aaa865f34da7,https://www.semanticscholar.org/paper/e9a986c8ff6c2f381d026fe014f6aaa865f34da7,Deep Learning with Differential Privacy,"Machine learning techniques based on neural networks are achieving remarkable results in a wide variety of domains. Often, the training of models requires large, representative datasets, which may be crowdsourced and contain sensitive information. The models should not expose private information in these datasets. Addressing this goal, we develop new algorithmic techniques for learning and a refined analysis of privacy costs within the framework of differential privacy. Our implementation and experiments demonstrate that we can train deep neural networks with non-convex objectives, under a modest privacy budget, and at a manageable cost in software complexity, training efficiency, and model quality.",2016,60,3070,717,True,Computer Science,Mathematics,2057642721,Martín Abadi,1396184193.0,Andy Chu,153440022.0,Ian J. Goodfellow,145057514.0,H. B. McMahan,145591745.0,Ilya Mironov,,,35210462.0,Kunal Talwar,2152832173.0,Li Zhang,,,,,,,,,,,,,,,,,,,,,,,,,,,,,,
9ead7583542e55c84bb9b90260ffde7a70c88e8d,https://www.semanticscholar.org/paper/9ead7583542e55c84bb9b90260ffde7a70c88e8d,Large-scale machine learning at twitter,"The success of data-driven solutions to difficult problems, along with the dropping costs of storing and processing massive amounts of data, has led to growing interest in large-scale machine learning. This paper presents a case study of Twitter's integration of machine learning tools into its existing Hadoop-based, Pig-centric analytics platform. We begin with an overview of this platform, which handles ""traditional"" data warehousing and business intelligence tasks for the organization. The core of this work lies in recent Pig extensions to provide predictive analytics capabilities that incorporate machine learning, focused specifically on supervised classification. In particular, we have identified stochastic gradient descent techniques for online learning and ensemble methods as being highly amenable to scaling out to large amounts of data. In our deployed solution, common machine learning tasks such as data sampling, feature generation, training, and testing can be accomplished directly in Pig, via carefully crafted loaders, storage functions, and user-defined functions. This means that machine learning is just another Pig script, which allows seamless integration with existing infrastructure for data management, scheduling, and monitoring in a production environment, as well as access to rich libraries of user-defined functions and the materialized output of other scripts.",2012,56,200,5,True,Computer Science,,145580839,Jimmy J. Lin,2062921.0,A. Kolcz,,,,,,,,,,,,,,,,,,,,,,,,,,,,,,,,,,,,,,,,,,
9e35e0fa69a96dea383890401d44366117eb6631,https://www.semanticscholar.org/paper/9e35e0fa69a96dea383890401d44366117eb6631,Machine Learning,The guest editor discusses some recent advances in machine learning and their applications to exciting new problem areas.,2013,4,2,0,False,Computer Science,,21060755,F. Alexander,,,,,,,,,,,,,,,,,,,,,,,,,,,,,,,,,,,,,,,,,,,,
ea58af907495e97c93997119db4a59fab5cd3683,https://www.semanticscholar.org/paper/ea58af907495e97c93997119db4a59fab5cd3683,Deep Machine Learning - A New Frontier in Artificial Intelligence Research [Research Frontier],"This article provides an overview of the mainstream deep learning approaches and research directions proposed over the past decade. It is important to emphasize that each approach has strengths and ""weaknesses, depending on the application and context in ""which it is being used. Thus, this article presents a summary on the current state of the deep machine learning field and some perspective into how it may evolve. Convolutional Neural Networks (CNNs) and Deep Belief Networks (DBNs) (and their respective variations) are focused on primarily because they are well established in the deep learning field and show great promise for future work.",2010,57,1041,22,False,Computer Science,,1804314,I. Arel,2483864.0,Derek C. Rose,1970334.0,T. Karnowski,,,,,,,,,,,,,,,,,,,,,,,,,,,,,,,,,,,,,,,,
0148bbc80ea2f2526ab019a317639b4fb357f399,https://www.semanticscholar.org/paper/0148bbc80ea2f2526ab019a317639b4fb357f399,A Machine Learning Approach to Twitter User Classification,"
 
 This paper addresses the task of user classification in social media, with an application to Twitter. We automatically infer the values of user attributes such as political orientation or ethnicity by leveraging observable information such as the user behavior, network structure and the linguistic content of the user’s Twitter feed. We employ a machine learning approach which relies on a comprehensive set of features derived from such user information. We report encouraging experimental results on 3 tasks with different characteristics: political affiliation detection, ethnicity identification and detecting affinity for a particular business. Finally, our analysis shows that rich linguistic features prove consistently valuable across the 3 tasks and show great promise for additional user classification needs.
 
",2011,23,597,44,True,Computer Science,,145375801,M. Pennacchiotti,36445704.0,Ana-Maria Popescu,,,,,,,,,,,,,,,,,,,,,,,,,,,,,,,,,,,,,,,,,,
0e779fd59353a7f1f5b559b9d65fa4bfe367890c,https://www.semanticscholar.org/paper/0e779fd59353a7f1f5b559b9d65fa4bfe367890c,Geometric Deep Learning: Going beyond Euclidean data,"Many scientific fields study data with an underlying structure that is non-Euclidean. Some examples include social networks in computational social sciences, sensor networks in communications, functional networks in brain imaging, regulatory networks in genetics, and meshed surfaces in computer graphics. In many applications, such geometric data are large and complex (in the case of social networks, on the scale of billions) and are natural targets for machine-learning techniques. In particular, we would like to use deep neural networks, which have recently proven to be powerful tools for a broad range of problems from computer vision, natural-language processing, and audio analysis. However, these tools have been most successful on data with an underlying Euclidean or grid-like structure and in cases where the invariances of these structures are built into networks used to model them.",2016,126,2238,135,True,Computer Science,,1732570,M. Bronstein,143627859.0,Joan Bruna,1688882.0,Yann LeCun,3149531.0,Arthur D. Szlam,1697397.0,P. Vandergheynst,,,,,,,,,,,,,,,,,,,,,,,,,,,,,,,,,,,,
79cf9462a583e1889781868cbf8c31e43b36dd2f,https://www.semanticscholar.org/paper/79cf9462a583e1889781868cbf8c31e43b36dd2f,Towards Federated Learning at Scale: System Design,"Federated Learning is a distributed machine learning approach which enables model training on a large corpus of decentralized data. We have built a scalable production system for Federated Learning in the domain of mobile devices, based on TensorFlow. In this paper, we describe the resulting high-level design, sketch some of the challenges and their solutions, and touch upon the open problems and future directions.",2019,26,1305,121,False,Computer Science,Mathematics,2039588,Keith Bonawitz,153086296.0,Hubert Eichner,1718871.0,W. Grieskamp,68973739.0,Dzmitry Huba,67147139.0,A. Ingerman,,,2072422622.0,Vladimir Ivanov,3104292.0,Chloé Kiddon,32139366.0,Jakub Konecný,2066466157.0,Stefano Mazzocchi,145057514.0,H. B. McMahan,2592207.0,Timon Van Overveldt,2131407.0,David Petrou,1878835.0,D. Ramage,68972407.0,Jason Roselander,,,,,,,,,,,,,,,,
4187caa4d0d329f47e18377a6cd31ef3f580cfcc,https://www.semanticscholar.org/paper/4187caa4d0d329f47e18377a6cd31ef3f580cfcc,GraphLab: A New Framework For Parallel Machine Learning,"Designing and implementing efficient, provably correct parallel machine learning (ML) algorithms is challenging. Existing high-level parallel abstractions like MapReduce are insufficiently expressive while low-level tools like MPI and Pthreads leave ML experts repeatedly solving the same design challenges. By targeting common patterns in ML, we developed GraphLab, which improves upon abstractions like MapReduce by compactly expressing asynchronous iterative algorithms with sparse computational dependencies while ensuring data consistency and achieving a high degree of parallel performance. We demonstrate the expressiveness of the GraphLab framework by designing and implementing parallel versions of belief propagation, Gibbs sampling, Co-EM, Lasso and Compressed Sensing. We show that using GraphLab we can achieve excellent parallel performance on large scale real-world problems.",2010,23,848,103,False,Computer Science,,1680638,Y. Low,49988044.0,Joseph E. Gonzalez,1717990.0,Aapo Kyrola,1741745.0,D. Bickson,1730156.0,Carlos Guestrin,,,1695576.0,J. Hellerstein,,,,,,,,,,,,,,,,,,,,,,,,,,,,,,,,
e3d772986d176057aca2f5e3eb783da53b559134,https://www.semanticscholar.org/paper/e3d772986d176057aca2f5e3eb783da53b559134,Unsupervised Machine Translation Using Monolingual Corpora Only,"Machine translation has recently achieved impressive performance thanks to recent advances in deep learning and the availability of large-scale parallel corpora. There have been numerous attempts to extend these successes to low-resource language pairs, yet requiring tens of thousands of parallel sentences. In this work, we take this research direction to the extreme and investigate whether it is possible to learn to translate even without any parallel data. We propose a model that takes sentences from monolingual corpora in two different languages and maps them into the same latent space. By learning to reconstruct in both languages from this shared feature space, the model effectively learns to translate without using any labeled data. We demonstrate our model on two widely used datasets and two language pairs, reporting BLEU scores of 32.8 and 15.1 on the Multi30k and WMT English-French datasets, without using even a single parallel sentence at training time.",2017,42,859,157,False,Computer Science,,1830914,Guillaume Lample,8905591.0,Ludovic Denoyer,1706809.0,Marc'Aurelio Ranzato,,,,,,,,,,,,,,,,,,,,,,,,,,,,,,,,,,,,,,,,
819167ace2f0caae7745d2f25a803979be5fbfae,https://www.semanticscholar.org/paper/819167ace2f0caae7745d2f25a803979be5fbfae,The Limitations of Deep Learning in Adversarial Settings,"Deep learning takes advantage of large datasets and computationally efficient training algorithms to outperform other approaches at various machine learning tasks. However, imperfections in the training phase of deep neural networks make them vulnerable to adversarial samples: inputs crafted by adversaries with the intent of causing deep neural networks to misclassify. In this work, we formalize the space of adversaries against deep neural networks (DNNs) and introduce a novel class of algorithms to craft adversarial samples based on a precise understanding of the mapping between inputs and outputs of DNNs. In an application to computer vision, we show that our algorithms can reliably produce samples correctly classified by human subjects but misclassified in specific targets by a DNN with a 97% adversarial success rate while only modifying on average 4.02% of the input features per sample. We then evaluate the vulnerability of different sample classes to adversarial perturbations by defining a hardness measure. Finally, we describe preliminary work outlining defenses against adversarial samples by defining a predictive measure of distance between a benign input and a target classification.",2015,40,2872,397,True,Computer Science,Mathematics,1967156,Nicolas Papernot,144061974.0,P. Mcdaniel,1680133.0,S. Jha,2623167.0,Matt Fredrikson,144643812.0,Z. B. Celik,,,144231976.0,A. Swami,,,,,,,,,,,,,,,,,,,,,,,,,,,,,,,,
7fcb90f68529cbfab49f471b54719ded7528d0ef,https://www.semanticscholar.org/paper/7fcb90f68529cbfab49f471b54719ded7528d0ef,Federated Learning: Strategies for Improving Communication Efficiency,"Federated Learning is a machine learning setting where the goal is to train a high-quality centralized model while training data remains distributed over a large number of clients each with unreliable and relatively slow network connections. We consider learning algorithms for this setting where on each round, each client independently computes an update to the current model based on its local data, and communicates this update to a central server, where the client-side updates are aggregated to compute a new global model. The typical clients in this setting are mobile phones, and communication efficiency is of the utmost importance. In this paper, we propose two ways to reduce the uplink communication costs: structured updates, where we directly learn an update from a restricted space parametrized using a smaller number of variables, e.g. either low-rank or a random mask; and sketched updates, where we learn a full model update and then compress it using a combination of quantization, random rotations, and subsampling before sending it to the server. Experiments on both convolutional and recurrent networks show that the proposed methods can reduce the communication cost by two orders of magnitude.",2016,26,2494,222,False,Computer Science,,32139366,Jakub Konecný,145057514.0,H. B. McMahan,1815972.0,Felix X. Yu,2662221.0,Peter Richtárik,9486035.0,A. Suresh,,,36577444.0,D. Bacon,,,,,,,,,,,,,,,,,,,,,,,,,,,,,,,,
