paperId,url,title,abstract,year,referenceCount,citationCount,influentialCitationCount,isOpenAccess,fieldsOfStudy/0,fieldsOfStudy/1,authors/0/authorId,authors/0/name,authors/1/authorId,authors/1/name,authors/2/authorId,authors/2/name,authors/3/authorId,authors/3/name,authors/4/authorId,authors/4/name,fieldsOfStudy/2,fieldsOfStudy/3,authors/5/authorId,authors/5/name,authors/6/authorId,authors/6/name,authors/7/authorId,authors/7/name,authors/8/authorId,authors/8/name,authors/9/authorId,authors/9/name,authors/10/authorId,authors/10/name,authors/11/authorId,authors/11/name,authors/12/authorId,authors/12/name,authors/13/authorId,authors/13/name,authors/14/authorId,authors/14/name,authors/15/authorId,authors/15/name,authors/16/authorId,authors/16/name,authors/17/authorId,authors/17/name,authors/18/authorId,authors/18/name,authors/19/authorId,authors/19/name,authors/20/authorId,authors/20/name,authors/21/authorId,authors/21/name
1d122a074c936fcfd95faf44608e377a9d1799c8,https://www.semanticscholar.org/paper/1d122a074c936fcfd95faf44608e377a9d1799c8,DeepFM: A Factorization-Machine based Neural Network for CTR Prediction,"Learning sophisticated feature interactions behind user behaviors is critical in maximizing CTR for recommender systems. Despite great progress, existing methods seem to have a strong bias towards low- or high-order interactions, or require expertise feature engineering. In this paper, we show that it is possible to derive an end-to-end learning model that emphasizes both low- and high-order feature interactions. The proposed model, DeepFM, combines the power of factorization machines for recommendation and deep learning for feature learning in a new neural network architecture. Compared to the latest Wide & Deep model from Google, DeepFM has a shared input to its ""wide"" and ""deep"" parts, with no need of feature engineering besides raw features. Comprehensive experiments are conducted to demonstrate the effectiveness and efficiency of DeepFM over the existing models for CTR prediction, on both benchmark data and commercial data.",2017,32,1457,273,True,Computer Science,,3339005,Huifeng Guo,2824766.0,Ruiming Tang,144782498.0,Yunming Ye,7718952.0,Zhenguo Li,1996703.0,Xiuqiang He,,,,,,,,,,,,,,,,,,,,,,,,,,,,,,,,,,,,
8ccdee6826cbc97256bd4d082ebfa8cdfd2c727f,https://www.semanticscholar.org/paper/8ccdee6826cbc97256bd4d082ebfa8cdfd2c727f,Hidden fluid mechanics: Learning velocity and pressure fields from flow visualizations,"Machine-learning fluid flow Quantifying fluid flow is relevant to disciplines ranging from geophysics to medicine. Flow can be experimentally visualized using, for example, smoke or contrast agents, but extracting velocity and pressure fields from this information is tricky. Raissi et al. developed a machine-learning approach to tackle this problem. Their method exploits the knowledge of Navier-Stokes equations, which govern the dynamics of fluid flow in many scientifically relevant situations. The authors illustrate their approach using examples such as blood flow in an aneurysm. Science, this issue p. 1026 A machine learning approach exploiting the knowledge of Navier-Stokes equations can extract detailed fluid flow information. For centuries, flow visualization has been the art of making fluid motion visible in physical and biological systems. Although such flow patterns can be, in principle, described by the Navier-Stokes equations, extracting the velocity and pressure fields directly from the images is challenging. We addressed this problem by developing hidden fluid mechanics (HFM), a physics-informed deep-learning framework capable of encoding the Navier-Stokes equations into the neural networks while being agnostic to the geometry or the initial and boundary conditions. We demonstrate HFM for several physical and biomedical problems by extracting quantitative information for which direct measurements may not be possible. HFM is robust to low resolution and substantial noise in the observation data, which is important for potential applications.",2020,30,561,19,True,Medicine,Computer Science,145401977,M. Raissi,37412357.0,A. Yazdani,1720124.0,G. Karniadakis,,,,,,,,,,,,,,,,,,,,,,,,,,,,,,,,,,,,,,,,
bb35ef89addbbc28d960bc0cab70d8a29fdf6eee,https://www.semanticscholar.org/paper/bb35ef89addbbc28d960bc0cab70d8a29fdf6eee,A Survey on Multi-Task Learning,"Multi-Task Learning (MTL) is a learning paradigm in machine learning and its aim is to leverage useful information contained in multiple related tasks to help improve the generalization performance of all the tasks. In this paper, we give a survey for MTL from the perspective of algorithmic modeling, applications and theoretical analyses. For algorithmic modeling, we give a definition of MTL and then classify different MTL algorithms into five categories, including feature learning approach, low-rank approach, task clustering approach, task relation learning approach and decomposition approach as well as discussing the characteristics of each approach. In order to improve the performance of learning tasks further, MTL can be combined with other learning paradigms including semi-supervised learning, active learning, unsupervised learning, reinforcement learning, multi-view learning and graphical models. When the number of tasks is large or the data dimensionality is high, we review online, parallel and distributed MTL models as well as dimensionality reduction and feature hashing to reveal their computational and storage advantages. Many real-world applications use MTL to boost their performance and we review representative works in this paper. Finally, we present theoretical analyses and discuss several future directions for MTL.",2017,277,990,62,True,Computer Science,Mathematics,46867608,Yu Zhang,152290618.0,Qiang Yang,,,,,,,,,,,,,,,,,,,,,,,,,,,,,,,,,,,,,,,,,,
b5be3165d56580b60e29ad1a4a08b124d6cb8264,https://www.semanticscholar.org/paper/b5be3165d56580b60e29ad1a4a08b124d6cb8264,Scaling up machine learning: parallel and distributed approaches,"This tutorial gives a broad view of modern approaches for scaling up machine learning and data mining methods on parallel/distributed platforms. Demand for scaling up machine learning is task-specific: for some tasks it is driven by the enormous dataset sizes, for others by model complexity or by the requirement for real-time prediction. Selecting a task-appropriate parallelization platform and algorithm requires understanding their benefits, trade-offs and constraints. This tutorial focuses on providing an integrated overview of state-of-the-art platforms and algorithm choices. These span a range of hardware options (from FPGAs and GPUs to multi-core systems and commodity clusters), programming frameworks (including CUDA, MPI, MapReduce, and DryadLINQ), and learning settings (e.g., semi-supervised and online learning). The tutorial is example-driven, covering a number of popular algorithms (e.g., boosted trees, spectral clustering, belief propagation) and diverse applications (e.g., recommender systems and object recognition in vision).
 The tutorial is based on (but not limited to) the material from our upcoming Cambridge U. Press edited book which is currently in production.
 Visit the tutorial website at http://hunch.net/~large_scale_survey/",2011,6,386,16,False,Computer Science,,1988453,R. Bekkerman,47695762.0,M. Bilenko,144162125.0,J. Langford,,,,,,,,,,,,,,,,,,,,,,,,,,,,,,,,,,,,,,,,
a25fbcbbae1e8f79c4360d26aa11a3abf1a11972,https://www.semanticscholar.org/paper/a25fbcbbae1e8f79c4360d26aa11a3abf1a11972,A Survey on Transfer Learning,"A major assumption in many machine learning and data mining algorithms is that the training and future data must be in the same feature space and have the same distribution. However, in many real-world applications, this assumption may not hold. For example, we sometimes have a classification task in one domain of interest, but we only have sufficient training data in another domain of interest, where the latter data may be in a different feature space or follow a different data distribution. In such cases, knowledge transfer, if done successfully, would greatly improve the performance of learning by avoiding much expensive data-labeling efforts. In recent years, transfer learning has emerged as a new learning framework to address this problem. This survey focuses on categorizing and reviewing the current progress on transfer learning for classification, regression, and clustering problems. In this survey, we discuss the relationship between transfer learning and other related machine learning techniques such as domain adaptation, multitask learning and sample selection bias, as well as covariate shift. We also explore some potential future issues in transfer learning research.",2010,90,15007,853,False,Computer Science,,1746914,Sinno Jialin Pan,152290618.0,Qiang Yang,,,,,,,,,,,,,,,,,,,,,,,,,,,,,,,,,,,,,,,,,,
e3948c28d605e0d90e88e160556cfc14fbba57c8,https://www.semanticscholar.org/paper/e3948c28d605e0d90e88e160556cfc14fbba57c8,Incremental and Decremental Support Vector Machine Learning,"An on-line recursive algorithm for training support vector machines, one vector at a time, is presented. Adiabatic increments retain the Kuhn-Tucker conditions on all previously seen training data, in a number of steps each computed analytically. The incremental procedure is reversible, and decremental ""unlearning"" offers an efficient method to exactly evaluate leave-one-out generalization performance. Interpretation of decremental unlearning in feature space sheds light on the relationship between generalization and geometry of the data.",2000,16,1316,140,False,Computer Science,Mathematics,2702388,G. Cauwenberghs,1685292.0,T. Poggio,,,,,,,,,,,,,,,,,,,,,,,,,,,,,,,,,,,,,,,,,,
e7e25fd534e9e024da329aea546484938df305a5,https://www.semanticscholar.org/paper/e7e25fd534e9e024da329aea546484938df305a5,Gaussian Processes for Machine Learning (GPML) Toolbox,"The GPML toolbox provides a wide range of functionality for Gaussian process (GP) inference and prediction. GPs are specified by mean and covariance functions; we offer a library of simple mean and covariance functions and mechanisms to compose more complex ones. Several likelihood functions are supported including Gaussian and heavy-tailed for regression as well as others suitable for classification. Finally, a range of inference methods is provided, including exact and variational inference, Expectation Propagation, and Laplace's method dealing with non-Gaussian likelihoods and FITC for dealing with large regression tasks.",2010,7,845,50,False,Computer Science,,3472959,C. Rasmussen,1748758.0,H. Nickisch,,,,,,,,,,,,,,,,,,,,,,,,,,,,,,,,,,,,,,,,,,
c526ad0ea8b4cff9a671eb8a90ea98eb64ae17a7,https://www.semanticscholar.org/paper/c526ad0ea8b4cff9a671eb8a90ea98eb64ae17a7,Sparse Bayesian Extreme Learning Machine for Multi-classification,"Extreme learning machine (ELM) has become a popular topic in machine learning in recent years. ELM is a new kind of single-hidden layer feedforward neural network with an extremely low computational cost. ELM, however, has two evident drawbacks: 1) the output weights solved by Moore-Penrose generalized inverse is a least squares minimization issue, which easily suffers from overfitting and 2) the accuracy of ELM is drastically sensitive to the number of hidden neurons so that a large model is usually generated. This brief presents a sparse Bayesian approach for learning the output weights of ELM in classification. The new model, called Sparse Bayesian ELM (SBELM), can resolve these two drawbacks by estimating the marginal likelihood of network outputs and automatically pruning most of the redundant hidden neurons during learning phase, which results in an accurate and compact model. The proposed SBELM is evaluated on wide types of benchmark classification problems, which verifies that the accuracy of SBELM model is relatively insensitive to the number of hidden neurons; and hence a much more compact model is always produced as compared with other state-of-the-art neural network classifiers.",2014,26,169,15,False,Computer Science,Medicine,2353988,Jiahua Luo,1807914.0,C. Vong,48692831.0,P. Wong,,,,,,,,,,,,,,,,,,,,,,,,,,,,,,,,,,,,,,,,
a7fce24eb350e592338ffa9f3b7f8b2a8887b0dd,https://www.semanticscholar.org/paper/a7fce24eb350e592338ffa9f3b7f8b2a8887b0dd,Human Decisions and Machine Predictions,"Can machine learning improve human decision making? Bail decisions provide a good test case. Millions of times each year, judges make jail-or-release decisions that hinge on a prediction of what a defendant would do if released. The concreteness of the prediction task combined with the volume of data available makes this a promising machine-learning application. Yet comparing the algorithm to judges proves complicated. First, the available data are generated by prior judge decisions. We only observe crime outcomes for released defendants, not for those judges detained. This makes it hard to evaluate counterfactual decision rules based on algorithmic predictions. Second, judges may have a broader set of preferences than the variable the algorithm predicts; for instance, judges may care specifically about violent crimes or about racial inequities. We deal with these problems using different econometric strategies, such as quasi-random assignment of cases to judges. Even accounting for these concerns, our results suggest potentially large welfare gains: one policy simulation shows crime reductions up to 24.7% with no change in jailing rates, or jailing rate reductions up to 41.9% with no increase in crime rates. Moreover, all categories of crime, including violent crimes, show reductions; and these gains can be achieved while simultaneously reducing racial disparities. These results suggest that while machine learning can be valuable, realizing this value requires integrating these tools into an economic framework: being clear about the link between predictions and decisions; specifying the scope of payoff functions; and constructing unbiased decision counterfactuals. JEL Codes: C10 (Econometric and statistical methods and methodology), C55 (Large datasets: Modeling and analysis), K40 (Legal procedure, the legal system, and illegal behavior).",2017,68,639,48,True,Economics,Medicine,3371403,J. Kleinberg,1892673.0,Himabindu Lakkaraju,1702139.0,J. Leskovec,50197963.0,J. Ludwig,2062143.0,S. Mullainathan,Computer Science,,,,,,,,,,,,,,,,,,,,,,,,,,,,,,,,,,,
10bc3b9bf71c4448ea0f4bec441403c0e50a0691,https://www.semanticscholar.org/paper/10bc3b9bf71c4448ea0f4bec441403c0e50a0691,Machine Learning - An Algorithmic Perspective,"Written in an easily accessible style, this book provides the ideal blend of theory and practical, applicable knowledge. It covers neural networks, graphical models, reinforcement learning, evolutionary algorithms, dimensionality reduction methods, and the important area of optimization. It treads the fine line between adequate academic rigor and overwhelming students with equations and mathematical concepts. The author includes examples based on widely available datasets and practical and theoretical problems to test understanding and application of the material. The book describes algorithms with code examples backed up by a website that provides working implementations in Python.",2009,4,982,119,False,Computer Science,,2112255,S. Marsland,,,,,,,,,,,,,,,,,,,,,,,,,,,,,,,,,,,,,,,,,,,,
d5b8b4bffc457150310dd3713241310a7f5c6165,https://www.semanticscholar.org/paper/d5b8b4bffc457150310dd3713241310a7f5c6165,SystemML: Declarative machine learning on MapReduce,"MapReduce is emerging as a generic parallel programming paradigm for large clusters of machines. This trend combined with the growing need to run machine learning (ML) algorithms on massive datasets has led to an increased interest in implementing ML algorithms on MapReduce. However, the cost of implementing a large class of ML algorithms as low-level MapReduce jobs on varying data and machine cluster sizes can be prohibitive. In this paper, we propose SystemML in which ML algorithms are expressed in a higher-level language and are compiled and executed in a MapReduce environment. This higher-level language exposes several constructs including linear algebra primitives that constitute key building blocks for a broad class of supervised and unsupervised ML algorithms. The algorithms expressed in SystemML are compiled and optimized into a set of MapReduce jobs that can run on a cluster of machines. We describe and empirically evaluate a number of optimization strategies for efficiently executing these algorithms on Hadoop, an open-source MapReduce implementation. We report an extensive performance evaluation on three ML algorithms on varying data and cluster sizes.",2011,23,315,41,False,Computer Science,,2317316,A. Ghoting,3252167.0,R. Krishnamurthy,3208372.0,E. Pednault,1698945.0,B. Reinwald,1808676.0,V. Sindhwani,,,1947100.0,S. Tatikonda,1968180.0,Yuanyuan Tian,2066721.0,Shivakumar Vaithyanathan,,,,,,,,,,,,,,,,,,,,,,,,,,,,
90972e7394b5fc884470cf78a657aae3932a8d8a,https://www.semanticscholar.org/paper/90972e7394b5fc884470cf78a657aae3932a8d8a,Using Machine Learning to Detect Cyberbullying,"Cyber bullying is the use of technology as a medium to bully someone. Although it has been an issue for many years, the recognition of its impact on young people has recently increased. Social networking sites provide a fertile medium for bullies, and teens and young adults who use these sites are vulnerable to attacks. Through machine learning, we can detect language patterns used by bullies and their victims, and develop rules to automatically detect cyber bullying content. The data we used for our project was collected from the website Formspring.me, a question-and-answer formatted website that contains a high percentage of bullying content. The data was labeled using a web service, Amazon's Mechanical Turk. We used the labeled data, in conjunction with machine learning techniques provided by the Weka tool kit, to train a computer to recognize bullying content. Both a C4.5 decision tree learner and an instance-based learner were able to identify the true positives with 78.5% accuracy.",2011,22,334,29,False,Computer Science,,145951266,Kelly Reynolds,1713751.0,April Kontostathis,38000101.0,Lynne Edwards,,,,,,,,,,,,,,,,,,,,,,,,,,,,,,,,,,,,,,,,
2a4ba0c1699965381fb2ba802157a89edd217943,https://www.semanticscholar.org/paper/2a4ba0c1699965381fb2ba802157a89edd217943,Data Mining and Machine Learning in Cybersecurity,"With the rapid advancement of information discovery techniques, machine learning and data mining continue to play a significant role in cybersecurity. Although several conferences, workshops, and journals focus on the fragmented research topics in this area, there has been no single interdisciplinary resource on past and current works and possible paths for future research in this area. This book fills this need. From basic concepts in machine learning and data mining to advanced problems in the machine learning domain, Data Mining and Machine Learning in Cybersecurity provides a unified reference for specific machine learning solutions to cybersecurity problems. It supplies a foundation in cybersecurity fundamentals and surveys contemporary challengesdetailing cutting-edge machine learning and data mining techniques. It also: Unveils cutting-edge techniques for detectingnew attacks Contains in-depth discussions of machine learning solutions to detection problems Categorizes methods for detecting, scanning, and profiling intrusions and anomalies Surveys contemporary cybersecurity problems and unveils state-of-the-art machine learning and data mining solutions Details privacy-preserving data mining methods This interdisciplinary resource includes technique review tables that allow for speedy access to common cybersecurity problems and associated data mining methods. Numerous illustrative figures help readers visualize the workflow of complex techniques and more than forty case studies provide a clear understanding of the design and application of data mining and machine learning techniques in cybersecurity.",2011,0,324,22,False,Computer Science,,145201255,S. Dua,48505005.0,Xian Du,,,,,,,,,,,,,,,,,,,,,,,,,,,,,,,,,,,,,,,,,,
0ecf8c56300c20622f317e1e6cefdeeb85c513e2,https://www.semanticscholar.org/paper/0ecf8c56300c20622f317e1e6cefdeeb85c513e2,Improving propensity score weighting using machine learning,"Machine learning techniques such as classification and regression trees (CART) have been suggested as promising alternatives to logistic regression for the estimation of propensity scores. The authors examined the performance of various CART‐based propensity score models using simulated data. Hypothetical studies of varying sample sizes (n=500, 1000, 2000) with a binary exposure, continuous outcome, and 10 covariates were simulated under seven scenarios differing by degree of non‐linear and non‐additive associations between covariates and the exposure. Propensity score weights were estimated using logistic regression (all main effects), CART, pruned CART, and the ensemble methods of bagged CART, random forests, and boosted CART. Performance metrics included covariate balance, standard error, per cent absolute bias, and 95 per cent confidence interval (CI) coverage. All methods displayed generally acceptable performance under conditions of either non‐linearity or non‐additivity alone. However, under conditions of both moderate non‐additivity and moderate non‐linearity, logistic regression had subpar performance, whereas ensemble methods provided substantially better bias reduction and more consistent 95 per cent CI coverage. The results suggest that ensemble methods, especially boosted CART, may be useful for propensity score weighting. Copyright © 2009 John Wiley & Sons, Ltd.",2010,51,668,44,True,Computer Science,Medicine,16170202,Brian K. Lee,3020850.0,J. Lessler,145130892.0,E. Stuart,,,,,,,,,,,,,,,,,,,,,,,,,,,,,,,,,,,,,,,,
f308f4305a7295d89ca6d287c351ce117952a710,https://www.semanticscholar.org/paper/f308f4305a7295d89ca6d287c351ce117952a710,Machine Learning: The ingredients of machine learning,"MACHINE LEARNING IS ALL ABOUT using the right features to build the right models that achieve the right tasks – this is the slogan, visualised in Figure 3 on p.11, with which we ended the Prologue. In essence, features define a ‘language’ in which we describe the relevant objects in our domain, be they e-mails or complex organic molecules. We should not normally have to go back to the domain objects themselves once we have a suitable feature representation, which is why features play such an important role in machine learning. We will take a closer look at them in Section 1.3. A task is an abstract representation of a problem we want to solve regarding those domain objects: the most common form of these is classifying them into two or more classes, but we shall encounter other tasks throughout the book. Many of these tasks can be represented as a mapping from data points to outputs. This mapping or model is itself produced as the output of a machine learning algorithm applied to training data; there is a wide variety of models to choose from, as we shall see in Section 1.2. We start this chapter by discussing tasks, the problems that can be solved with machine learning. No matter what variety of machine learning models you may encounter, you will find that they are designed to solve one of only a small number of tasks and use only a few different types of features.",2012,0,1,0,False,Mathematics,,144474086,P. Flach,,,,,,,,,,,,,,,,,,,,,,,,,,,,,,,,,,,,,,,,,,,,
23bd1da0ad4d2ec956346655f0bb0206e13556b8,https://www.semanticscholar.org/paper/23bd1da0ad4d2ec956346655f0bb0206e13556b8,Learning to Control a Brain–Machine Interface for Reaching and Grasping by Primates,"Reaching and grasping in primates depend on the coordination of neural activity in large frontoparietal ensembles. Here we demonstrate that primates can learn to reach and grasp virtual objects by controlling a robot arm through a closed-loop brain–machine interface (BMIc) that uses multiple mathematical models to extract several motor parameters (i.e., hand position, velocity, gripping force, and the EMGs of multiple arm muscles) from the electrical activity of frontoparietal neuronal ensembles. As single neurons typically contribute to the encoding of several motor parameters, we observed that high BMIc accuracy required recording from large neuronal ensembles. Continuous BMIc operation by monkeys led to significant improvements in both model predictions and behavioral performance. Using visual feedback, monkeys succeeded in producing robot reach-and-grasp movements even when their arms did not move. Learning to operate the BMIc was paralleled by functional reorganization in multiple cortical areas, suggesting that the dynamic properties of the BMIc were incorporated into motor and sensory cortical representations.",2003,45,1737,122,True,Biology,Medicine,2016191,J. Carmena,2057713.0,M. Lebedev,1826610.0,R. Crist,1397219405.0,J. E. O’Doherty,39819116.0,David M. Santucci,,,38928339.0,D. Dimitrov,8004223.0,P. Patil,1845021.0,C. Henriquez,144052463.0,M. Nicolelis,,,,,,,,,,,,,,,,,,,,,,,,,,
