paperId,url,title,abstract,year,referenceCount,citationCount,influentialCitationCount,isOpenAccess,fieldsOfStudy/0,fieldsOfStudy/1,authors/0/authorId,authors/0/name,authors/1/authorId,authors/1/name,authors/2/authorId,authors/2/name,authors/3/authorId,authors/3/name,authors/4/authorId,authors/4/name,fieldsOfStudy/2,fieldsOfStudy/3,authors/5/authorId,authors/5/name,authors/6/authorId,authors/6/name,authors/7/authorId,authors/7/name,authors/8/authorId,authors/8/name,authors/9/authorId,authors/9/name,authors/10/authorId,authors/10/name,authors/11/authorId,authors/11/name,authors/12/authorId,authors/12/name,authors/13/authorId,authors/13/name,authors/14/authorId,authors/14/name,authors/15/authorId,authors/15/name,authors/16/authorId,authors/16/name,authors/17/authorId,authors/17/name,authors/18/authorId,authors/18/name,authors/19/authorId,authors/19/name,authors/20/authorId,authors/20/name,authors/21/authorId,authors/21/name
7da323e7103245eeaed32367c46abe3f4913df86,https://www.semanticscholar.org/paper/7da323e7103245eeaed32367c46abe3f4913df86,A survey of techniques for internet traffic classification using machine learning,"The research community has begun looking for IP traffic classification techniques that do not rely on `well known¿ TCP or UDP port numbers, or interpreting the contents of packet payloads. New work is emerging on the use of statistical traffic characteristics to assist in the identification and classification process. This survey paper looks at emerging research into the application of Machine Learning (ML) techniques to IP traffic classification - an inter-disciplinary blend of IP networking and data mining techniques. We provide context and motivation for the application of ML techniques to IP traffic classification, and review 18 significant works that cover the dominant period from 2004 to early 2007. These works are categorized and reviewed according to their choice of ML strategies and primary contributions to the literature. We also discuss a number of key requirements for the employment of ML-based traffic classifiers in operational IP networks, and qualitatively critique the extent to which the reviewed works meet these requirements. Open issues and challenges in the field are also discussed.",2008,63,1476,83,False,Computer Science,,1716282,Thuy T. T. Nguyen,145027304.0,G. Armitage,,,,,,,,,,,,,,,,,,,,,,,,,,,,,,,,,,,,,,,,,,
f9ae5196908d21336ab02f5c20258dc760d125d6,https://www.semanticscholar.org/paper/f9ae5196908d21336ab02f5c20258dc760d125d6,Adversarial machine learning,"In this paper (expanded from an invited talk at AISEC 2010), we discuss an emerging field of study: adversarial machine learning---the study of effective machine learning techniques against an adversarial opponent. In this paper, we: give a taxonomy for classifying attacks against online machine learning algorithms; discuss application-specific factors that limit an adversary's capabilities; introduce two models for modeling an adversary's capabilities; explore the limits of an adversary's knowledge about the algorithm, feature space, training, and input data; explore vulnerabilities in machine learning algorithms; discuss countermeasures against attacks; introduce the evasion challenge; and discuss privacy-preserving learning techniques.",2011,204,1121,75,True,Computer Science,,1787610,J. Tygar,,,,,,,,,,,,,,,,,,,,,,,,,,,,,,,,,,,,,,,,,,,,
be9811f7e6019d5cd59ff97829a44bb5577bab00,https://www.semanticscholar.org/paper/be9811f7e6019d5cd59ff97829a44bb5577bab00,Machine Learning in Action,"SummaryMachine Learning in Action is unique book that blends the foundational theories of machine learning with the practical realities of building tools for everyday data analysis. You'll use the flexible Python programming language to build programs that implement algorithms for data classification, forecasting, recommendations, and higher-level features like summarization and simplification. About the BookA machine is said to learn when its performance improves with experience. Learning requires algorithms and programs that capture data and ferret out the interesting or useful patterns. Once the specialized domain of analysts and mathematicians, machine learning is becoming a skill needed by many.Machine Learning in Action is a clearly written tutorial for developers. It avoids academic language and takes you straight to the techniques you'll use in your day-to-day work. Many (Python) examples present the core algorithms of statistical data processing, data analysis, and data visualization in code you can reuse. You'll understand the concepts and how they fit in with tactical tasks like classification, forecasting, recommendations, and higher-level features like summarization and simplification.Readers need no prior experience with machine learning or statistical processing. Familiarity with Python is helpful.Purchase includes free PDF, ePub, and Kindle eBooks downloadable at manning.com. What's InsideA no-nonsense introduction Examples showing common ML tasks Everyday data analysis Implementing classic algorithms like Apriori and Adaboos=================================== Table of ContentsPART 1 CLASSIFICATION Machine learning basics Classifying with k-Nearest Neighbors Splitting datasets one feature at a time: decision trees Classifying with probability theory: nave Bayes Logistic regression Support vector machines Improving classification with the AdaBoost meta algorithm PART 2 FORECASTING NUMERIC VALUES WITH REGRESSION Predicting numeric values: regression Tree-based regression PART 3 UNSUPERVISED LEARNING Grouping unlabeled items using k-means clustering Association analysis with the Apriori algorithm Efficiently finding frequent itemsets with FP-growth PART 4 ADDITIONAL TOOLS Using principal component analysis to simplify data Simplifying data with the singular value decomposition Big data and MapReduce",2012,0,466,53,False,Computer Science,,145785408,P. Harrington,,,,,,,,,,,,,,,,,,,,,,,,,,,,,,,,,,,,,,,,,,,,
0fa45cfa88ee9ac93cb01ec159ad8713d0e32d93,https://www.semanticscholar.org/paper/0fa45cfa88ee9ac93cb01ec159ad8713d0e32d93,"Data Mining: Practical Machine Learning Tools and Techniques, 3/E","Data Mining: Practical Machine Learning Tools and Techniques offers a thorough grounding in machine learning concepts as well as practical advice on applying machine learning tools and techniques in real-world data mining situations. This highly anticipated third edition of the most acclaimed work on data mining and machine learning will teach you everything you need to know about preparing inputs, interpreting outputs, evaluating results, and the algorithmic methods at the heart of successful data mining. 
 
 Thorough updates reflect the technical changes and modernizations that have taken place in the field since the last edition, including new material on Data Transformations, Ensemble Learning, Massive Data Sets, Multi-instance Learning, plus a new version of the popular Weka machine learning software developed by the authors. Witten, Frank, and Hall include both tried-and-true techniques of today as well as methods at the leading edge of contemporary research. 
 
 *Provides a thorough grounding in machine learning concepts as well as practical advice on applying the tools and techniques to your data mining projects *Offers concrete tips and techniques for performance improvement that work by transforming the input or output in machine learning methods *Includes downloadable Weka software toolkit, a collection of machine learning algorithms for data mining tasks—in an updated, interactive interface. Algorithms in toolkit cover: data pre-processing, classification, regression, clustering, association rules, visualization",2014,0,779,132,False,Computer Science,,9419406,I. Witten,143713826.0,Eibe Frank,118860642.0,M. Hall,,,,,,,,,,,,,,,,,,,,,,,,,,,,,,,,,,,,,,,,
90848562905d26873b57bbf3f2f98319e38e5bde,https://www.semanticscholar.org/paper/90848562905d26873b57bbf3f2f98319e38e5bde,Density Ratio Estimation in Machine Learning,"Machine learning is an interdisciplinary field of science and engineering that studies mathematical theories and practical applications of systems that learn. This book introduces theories, methods, and applications of density ratio estimation, which is a newly emerging paradigm in the machine learning community. Various machine learning problems such as non-stationarity adaptation, outlier detection, dimensionality reduction, independent component analysis, clustering, classification, and conditional density estimation can be systematically solved via the estimation of probability density ratios. The authors offer a comprehensive introduction of various density ratio estimators including methods via density estimation, moment matching, probabilistic classification, density fitting, and density ratio fitting as well as describing how these can be applied to machine learning. The book also provides mathematical theories for density ratio estimation including parametric and non-parametric convergence analysis and numerical stability analysis to complete the first and definitive treatment of the entire framework of density ratio estimation in machine learning.",2012,67,419,52,False,Computer Science,,67154907,Masashi Sugiyama,2026193813.0,Taiji Suzuki,1897617.0,T. Kanamori,,,,,,,,,,,,,,,,,,,,,,,,,,,,,,,,,,,,,,,,
498ca0a1f8c980586408addf7ab2919ecdb7dd3d,https://www.semanticscholar.org/paper/498ca0a1f8c980586408addf7ab2919ecdb7dd3d,Factorizing YAGO: scalable machine learning for linked data,"Vast amounts of structured information have been published in the Semantic Web's Linked Open Data (LOD) cloud and their size is still growing rapidly. Yet, access to this information via reasoning and querying is sometimes difficult, due to LOD's size, partial data inconsistencies and inherent noisiness. Machine Learning offers an alternative approach to exploiting LOD's data with the advantages that Machine Learning algorithms are typically robust to both noise and data inconsistencies and are able to efficiently utilize non-deterministic dependencies in the data. From a Machine Learning point of view, LOD is challenging due to its relational nature and its scale. Here, we present an efficient approach to relational learning on LOD data, based on the factorization of a sparse tensor that scales to data consisting of millions of entities, hundreds of relations and billions of known facts. Furthermore, we show how ontological knowledge can be incorporated in the factorization to improve learning results and how computation can be distributed across multiple nodes. We demonstrate that our approach is able to factorize the YAGO~2 core ontology and globally predict statements for this large knowledge base using a single dual-core desktop computer. Furthermore, we show experimentally that our approach achieves good results in several relational learning tasks that are relevant to Linked Data. Once a factorization has been computed, our model is able to predict efficiently, and without any additional training, the likelihood of any of the 4.3 ⋅ 1014 possible triples in the YAGO~2 core ontology.",2012,38,399,45,False,Computer Science,,1729762,Maximilian Nickel,1700754.0,Volker Tresp,1688561.0,H. Kriegel,,,,,,,,,,,,,,,,,,,,,,,,,,,,,,,,,,,,,,,,
c62043a7d2537bbf40a84b9913957452a47fdb83,https://www.semanticscholar.org/paper/c62043a7d2537bbf40a84b9913957452a47fdb83,Dataset Shift in Machine Learning,"Dataset shift is a common problem in predictive modeling that occurs when the joint distribution of inputs and outputs differs between training and test stages. Covariate shift, a particular case of dataset shift, occurs when only the input distribution changes. Dataset shift is present in most practical applications, for reasons ranging from the bias introduced by experimental design to the irreproducibility of the testing conditions at training time. (An example is -email spam filtering, which may fail to recognize spam that differs in form from the spam the automatic filter has been built on.) Despite this, and despite the attention given to the apparently similar problems of semi-supervised learning and active learning, dataset shift has received relatively little attention in the machine learning community until recently. This volume offers an overview of current efforts to deal with dataset and covariate shift. The chapters offer a mathematical and philosophical introduction to the problem, place dataset shift in relationship to transfer learning, transduction, local learning, active learning, and semi-supervised learning, provide theoretical views of dataset and covariate shift (including decision theoretic and Bayesian perspectives), and present algorithms for covariate shift. Contributors: Shai Ben-David, Steffen Bickel, Karsten Borgwardt, Michael Brckner, David Corfield, Amir Globerson, Arthur Gretton, Lars Kai Hansen, Matthias Hein, Jiayuan Huang, Takafumi Kanamori, Klaus-Robert Mller, Sam Roweis, Neil Rubens, Tobias Scheffer, Marcel Schmittfull, Bernhard Schlkopf, Hidetoshi Shimodaira, Alex Smola, Amos Storkey, Masashi Sugiyama, Choon Hui Teo Neural Information Processing series",2009,162,1338,48,True,Computer Science,,1409068337,Joaquin Quionero-Candela,67154907.0,Masashi Sugiyama,2071649.0,Anton Schwaighofer,145306271.0,Neil D. Lawrence,,,,,,,,,,,,,,,,,,,,,,,,,,,,,,,,,,,,,,
bb99668d4df98a3f6ff0b9fa3402e09008f22e2c,https://www.semanticscholar.org/paper/bb99668d4df98a3f6ff0b9fa3402e09008f22e2c,Making large-scale support vector machine learning practical,"Training a support vector machine (SVM) leads to a quadratic optimization problem with bound constraints and one linear equality constraint. Despite the fact that this type of problem is well understood, there are many issues to be considered in designing an SVM learner. In particular, for large learning tasks with many training examples, oo-the-shelf optimization techniques for general quadratic programs quickly become intractable in their memory and time requirements. SV M light1 is an implementation of an SVM learner which addresses the problem of large tasks. This chapter presents algorithmic and computational results developed for SV M light V2.0, which make large-scale SVM training more practical. The results give guidelines for the application of SVMs to large domains.",1999,12,1863,186,False,Computer Science,,1680188,T. Joachims,,,,,,,,,,,,,,,,,,,,,,,,,,,,,,,,,,,,,,,,,,,,
d2972fa779c91162f447d1e15540fba0df4cb547,https://www.semanticscholar.org/paper/d2972fa779c91162f447d1e15540fba0df4cb547,Deploying an interactive machine learning system in an evidence-based practice center: abstrackr,"Medical researchers looking for evidence pertinent to a specific clinical question must navigate an increasingly voluminous corpus of published literature. This data deluge has motivated the development of machine learning and data mining technologies to facilitate efficient biomedical research. Despite the obvious labor-saving potential of these technologies and the concomitant academic interest therein, however, adoption of machine learning techniques by medical researchers has been relatively sluggish. One explanation for this is that while many machine learning methods have been proposed and retrospectively evaluated, they are rarely (if ever) actually made accessible to the practitioners whom they would benefit. In this work, we describe the ongoing development of an end-to-end interactive machine learning system at the Tufts Evidence-based Practice Center. More specifically, we have developed abstrackr, an online tool for the task of citation screening for systematic reviews. This tool provides an interface to our machine learning methods. The main aim of this work is to provide a case study in deploying cutting-edge machine learning methods that will actually be used by experts in a clinical research setting.",2012,15,381,18,False,Computer Science,,1912476,Byron C. Wallace,50044599.0,Kevin Small,1729374.0,C. Brodley,143917291.0,J. Lau,2947796.0,T. Trikalinos,,,,,,,,,,,,,,,,,,,,,,,,,,,,,,,,,,,,
a35d565e8f70cb6ddc09a65904a72622e16b9485,https://www.semanticscholar.org/paper/a35d565e8f70cb6ddc09a65904a72622e16b9485,Distributed Optimization and Statistical Learning via the Alternating Direction Method of Multipliers,"Many problems of recent interest in statistics and machine learning can be posed in the framework of convex optimization. Due to the explosion in size and complexity of modern datasets, it is increasingly important to be able to solve problems with a very large number of features or training examples. As a result, both the decentralized collection or storage of these datasets as well as accompanying distributed solution methods are either necessary or at least highly desirable. In this review, we argue that the alternating direction method of multipliers is well suited to distributed convex optimization, and in particular to large-scale problems arising in statistics, machine learning, and related areas. The method was developed in the 1970s, with roots in the 1950s, and is equivalent or closely related to many other algorithms, such as dual decomposition, the method of multipliers, Douglas–Rachford splitting, Spingarn's method of partial inverses, Dykstra's alternating projections, Bregman iterative algorithms for l1 problems, proximal methods, and others. After briefly surveying the theory and history of the algorithm, we discuss applications to a wide variety of statistical and machine learning problems of recent interest, including the lasso, sparse logistic regression, basis pursuit, covariance selection, support vector machines, and many others. We also discuss general distributed optimization, extensions to the nonconvex setting, and efficient implementation, including some details on distributed MPI and Hadoop MapReduce implementations.",2011,185,15556,3442,True,Computer Science,,1843103,Stephen P. Boyd,46822591.0,Neal Parikh,1737474.0,E. Chu,2698633.0,B. Peleato,3809476.0,Jonathan Eckstein,,,,,,,,,,,,,,,,,,,,,,,,,,,,,,,,,,,,
d837267b364b4dc97bb35facda235a19be5ed374,https://www.semanticscholar.org/paper/d837267b364b4dc97bb35facda235a19be5ed374,Machine Learning in Non-Stationary Environments - Introduction to Covariate Shift Adaptation,"As the power of computing has grown over the past few decades, the field of machine learning has advanced rapidly in both theory and practice. Machine learning methods are usually based on the assumption that the data generation mechanism does not change over time. Yet real-world applications of machine learning, including image recognition, natural language processing, speech recognition, robot control, and bioinformatics, often violate this common assumption. Dealing with non-stationarity is one of modern machine learning's greatest challenges. This book focuses on a specific non-stationary environment known as covariate shift, in which the distributions of inputs (queries) change but the conditional distribution of outputs (answers) is unchanged, and presents machine learning theory, algorithms, and applications to overcome this variety of non-stationarity. After reviewing the state-of-the-art research in the field, the authors discuss topics that include learning under covariate shift, model selection, importance estimation, and active learning. They describe such real world applications of covariate shift adaption as brain-computer interface, speaker identification, and age prediction from facial images. With this book, they aim to encourage future research in machine learning, statistics, and engineering that strives to create truly autonomous learning machines able to learn under non-stationarity.",2012,0,325,22,False,Computer Science,,67154907,Masashi Sugiyama,1716788.0,M. Kawanabe,,,,,,,,,,,,,,,,,,,,,,,,,,,,,,,,,,,,,,,,,,
7ea08581dff3d8ac301b80e693ebe0e6d247f2f5,https://www.semanticscholar.org/paper/7ea08581dff3d8ac301b80e693ebe0e6d247f2f5,The master algorithm: how the quest for the ultimate learning machine will remake our world,"Nowadays, “machine learning” is present in several aspects of the current world, internet advisors, advertisements and “smart” devices that seem to know what we need in a given moment. These are some examples of the problems solved by machine learning. This book presents the past, the present and the future of the different types of machine learning algorithms. At the beginning of the book, the author takes us to the first years of the computing science, where a programmer had to do absolutely everything by himself to make an algorithm do a certain task. As time passes, there appeared the first algorithms that were capable of programming themselves learning from the available data. The author presents what he himself calls the five “tribes” of machine learning, the essence that defends each one and the kind of problems that are able to solve without problems. With a great amount of simple examples, the author depicts which advantages and disadvantages of the “master” algorithms of each “tribes” are, saying that the problem that a tribe solves perfectly well, another one cannot do it, and the other way about. The author suggests to get the best out of each “tribe” and make a unique learning algorithm able to learn without caring about the problem: the master algorithm.",2015,8,324,34,False,Computer Science,,31294642,W. Hasperué,,,,,,,,,,,,,,,,,,,,,,,,,,,,,,,,,,,,,,,,,,,,
6c10262a5d4230c7c85fbe528b8bbd9444116bca,https://www.semanticscholar.org/paper/6c10262a5d4230c7c85fbe528b8bbd9444116bca,Finding Density Functionals with Machine Learning,"Machine learning is used to approximate density functionals. For the model problem of the kinetic energy of noninteracting fermions in 1D, mean absolute errors below 1 kcal/mol on test densities similar to the training set are reached with fewer than 100 training densities. A predictor identifies if a test density is within the interpolation region. Via principal component analysis, a projected functional derivative finds highly accurate self-consistent densities. The challenges for application of our method to real electronic structure problems are discussed.",2011,42,396,3,True,Physics,Computer Science,27796226,John C. Snyder,48041657.0,M. Rupp,39960184.0,K. Hansen,145034054.0,K. Müller,2544144.0,K. Burke,Mathematics,Medicine,,,,,,,,,,,,,,,,,,,,,,,,,,,,,,,,,,
28d82be56e54df4b28a17908de17480d699e1409,https://www.semanticscholar.org/paper/28d82be56e54df4b28a17908de17480d699e1409,A Machine Learning Approach to Android Malware Detection,"With the recent emergence of mobile platforms capable of executing increasingly complex software and the rising ubiquity of using mobile platforms in sensitive applications such as banking, there is a rising danger associated with malware targeted at mobile devices. The problem of detecting such malware presents unique challenges due to the limited resources avalible and limited privileges granted to the user, but also presents unique opportunity in the required metadata attached to each application. In this article, we present a machine learning-based system for the detection of malware on Android devices. Our system extracts a number of features and trains a One-Class Support Vector Machine in an offline (off-device) manner, in order to leverage the higher computing power of a server or cluster of servers.",2012,44,320,22,False,Computer Science,,2200163,Justin Sahs,145155297.0,L. Khan,,,,,,,,,,,,,,,,,,,,,,,,,,,,,,,,,,,,,,,,,,
9e7e1d962ab25ae00e6fb5713116967e9b64be50,https://www.semanticscholar.org/paper/9e7e1d962ab25ae00e6fb5713116967e9b64be50,IEEE Transactions on Pattern Analysis and Machine Intelligence,"Nonparametric kernel methods are widely used and proven to be successful in many statistical learning problems. Well-known examples include the kernel density estimate (KDE) for density estimation and the support vector machine (SVM) for classification. We propose a kernel classifier that optimizes the L2 or integrated squared error (ISE) of a “difference of densities”. We focus on the Gaussian kernel, although the method applies to other kernels suitable for density estimation. Like a support vector machine (SVM), the classifier is sparse and results from solving a quadratic program. We provide statistical performance guarantees for the proposed L2 kernel classifier in the form of a finite sample oracle inequality, and strong consistency in the sense of both ISE and probability of error. A special case of our analysis applies to a previously introduced ISE-based method for kernel density estimation. For dimensionality greater than 15, the basic L2 kernel classifier performs poorly in practice. Thus, we extend the method through the introduction of a natural regularization parameter, which allows it to remain competitive with the SVM in high dimensions. Simulation results for both synthetic and real-world data are presented.",2022,31,788,74,False,,,2061918,JooSeuk Kim,40531965.0,C. Scott,,,,,,,,,,,,,,,,,,,,,,,,,,,,,,,,,,,,,,,,,,
