9512facd37bba2ff1ece31900c08901bb011f1ce,https://www.semanticscholar.org/paper/9512facd37bba2ff1ece31900c08901bb011f1ce,Using Machine Teaching to Identify Optimal Training-Set Attacks on Machine Learners,"
 
 We investigate a problem at the intersection of machine learning and security: training-set attacks on machine learners. In such attacks an attacker contaminates the training data so that a specific learning algorithm would produce a model profitable to the attacker. Understanding training-set attacks is important as more intelligent agents (e.g. spam filters and robots) are equipped with learning capability and can potentially be hacked via data they receive from the environment. This paper identifies the optimal training-set attack on a broad family of machine learners. First we show that optimal training-set attack can be formulated as a bilevel optimization problem. Then we show that for machine learners with certain Karush-Kuhn-Tucker conditions we can solve the bilevel problem efficiently using gradient methods on an implicit function. As examples, we demonstrate optimal training-set attacks on Support VectorMachines, logistic regression, and linear regression with extensive experiments. Finally, we discuss potential defenses against such attacks.
 
",2015,32,311,37,True,Computer Science,2121022,Shike Mei,1832364.0,Xiaojin Zhu,,,,,,,,,,,,,,,,,,,,,,,,,,,,,,,,,,,,,,,,,,,,,,,,,,,,,,,,,,,,,,,,,,,,,,
9c4da62e9e89e65ac78ee271e424e8b498053e8c,https://www.semanticscholar.org/paper/9c4da62e9e89e65ac78ee271e424e8b498053e8c,Advances in kernel methods: support vector learning,"Introduction to support vector learning roadmap. Part 1 Theory: three remarks on the support vector method of function estimation, Vladimir Vapnik generalization performance of support vector machines and other pattern classifiers, Peter Bartlett and John Shawe-Taylor Bayesian voting schemes and large margin classifiers, Nello Cristianini and John Shawe-Taylor support vector machines, reproducing kernel Hilbert spaces, and randomized GACV, Grace Wahba geometry and invariance in kernel based methods, Christopher J.C. Burges on the annealed VC entropy for margin classifiers - a statistical mechanics study, Manfred Opper entropy numbers, operators and support vector kernels, Robert C. Williamson et al. Part 2 Implementations: solving the quadratic programming problem arising in support vector classification, Linda Kaufman making large-scale support vector machine learning practical, Thorsten Joachims fast training of support vector machines using sequential minimal optimization, John C. Platt. Part 3 Applications: support vector machines for dynamic reconstruction of a chaotic system, Davide Mattera and Simon Haykin using support vector machines for time series prediction, Klaus-Robert Muller et al pairwise classification and support vector machines, Ulrich Kressel. Part 4 Extensions of the algorithm: reducing the run-time complexity in support vector machines, Edgar E. Osuna and Federico Girosi support vector regression with ANOVA decomposition kernels, Mark O. Stitson et al support vector density estimation, Jason Weston et al combining support vector and mathematical programming methods for classification, Bernhard Scholkopf et al.",1999,235,5422,217,False,Mathematics,1707625,B. Schölkopf,2676309.0,C. Burges,46234526.0,Alex Smola,,,,,,,,,,,,,,,,,,,,,,,,,,,,,,,,,,,,,,,,,,,,,,,,,,,,,,,,,,,,,,,,,,,,
3c1dfe0b52c0638ff69a187ae183e8cdeebff303,https://www.semanticscholar.org/paper/3c1dfe0b52c0638ff69a187ae183e8cdeebff303,Machine-Learning Research Four Current Directions,"The last five years have seen an explosion in machine-learning research. This explosion has many causes: First, separate research communities in symbolic machine learning, computational learning theory, neural networks, statistics, and pattern recognition have discovered one another and begun to work together. Second, machine-learning techniques are being applied to new kinds of problem, including knowledge discovery in databases, language processing, robot control, and combinatorial optimization, as well as to more traditional problems such as speech recognition, face recognition, handwriting recognition, medical data analysis, and game playing. In this article, I selected four topics within machine learning where there has been a lot of recent activity. The purpose of the article is to describe the results in these areas to a broader AI audience and to sketch some of the open research problems. The topic areas are (1) ensembles of classifiers, (2) methods for scaling up supervised learning algorithms, (3) reinforcement learning, and (4) the learning of complex stochastic models. The reader should be cautioned that this article is not a comprehensive review of each of these topics. Rather, my goal is to provide a representative sample of the research in each of these four areas. In each of the areas, there are many other papers that describe relevant work. I apologize to those authors whose work I was unable to include in the article. Ensembles of Classifiers",1997,128,1003,56,False,Computer Science,144299726,Thomas G. Dietterich,,,,,,,,,,,,,,,,,,,,,,,,,,,,,,,,,,,,,,,,,,,,,,,,,,,,,,,,,,,,,,,,,,,,,,,,
d517b13f2b152c913b81ce534a149493517dbdad,https://www.semanticscholar.org/paper/d517b13f2b152c913b81ce534a149493517dbdad,Big Data Deep Learning: Challenges and Perspectives,"Deep learning is currently an extremely active research area in machine learning and pattern recognition society. It has gained huge successes in a broad area of applications such as speech recognition, computer vision, and natural language processing. With the sheer size of data available today, big data brings big opportunities and transformative potential for various sectors; on the other hand, it also presents unprecedented challenges to harnessing data and information. As the data keeps getting bigger, deep learning is coming to play a key role in providing big data predictive analytics solutions. In this paper, we provide a brief overview of deep learning, and highlight current research efforts and the challenges to big data, as well as the future trends.",2014,110,867,30,False,Computer Science,2145447101,Xue-wen Chen,39376164.0,Xiaotong Lin,,,,,,,,,,,,,,,,,,,,,,,,,,,,,,,,,,,,,,,,,,,,,,,,,,,,,,,,,,,,,,,,,,,,,,
c9d60858f1cbe6b7eb36473b7d37ff4b73c31af8,https://www.semanticscholar.org/paper/c9d60858f1cbe6b7eb36473b7d37ff4b73c31af8,Machine Learning from Imbalanced Data Sets 101,"For research to progress most effectively, we first should establish common ground regarding just what is the problem that imbalanced data sets present to machine learning systems. Why and when should imbalanced data sets be problematic? When is the problem simply an artifact of easily rectified design choices? I will try to pick the low-hanging fruit and share them with the rest of the workshop participants. Specifically, I would like to discuss what the problem is not. I hope this will lead to a profitable discussion of what the problem indeed is, and how it might be addressed most effectively.",2008,8,430,7,False,Computer Science,1752722,F. Provost,,,,,,,,,,,,,,,,,,,,,,,,,,,,,,,,,,,,,,,,,,,,,,,,,,,,,,,,,,,,,,,,,,,,,,,,
50feafd2cdafdfb1eead14388f6210f6b467eaa0,https://www.semanticscholar.org/paper/50feafd2cdafdfb1eead14388f6210f6b467eaa0,Pareto-Based Multiobjective Machine Learning: An Overview and Case Studies,"Machine learning is inherently a multiobjective task. Traditionally, however, either only one of the objectives is adopted as the cost function or multiple objectives are aggregated to a scalar cost function. This can be mainly attributed to the fact that most conventional learning algorithms can only deal with a scalar cost function. Over the last decade, efforts on solving machine learning problems using the Pareto-based multiobjective optimization methodology have gained increasing impetus, particularly due to the great success of multiobjective optimization using evolutionary algorithms and other population-based stochastic search methods. It has been shown that Pareto-based multiobjective learning approaches are more powerful compared to learning algorithms with a scalar cost function in addressing various topics of machine learning, such as clustering, feature selection, improvement of generalization ability, knowledge extraction, and ensemble generation. One common benefit of the different multiobjective learning approaches is that a deeper insight into the learning problem can be gained by analyzing the Pareto front composed of multiple Pareto-optimal solutions. This paper provides an overview of the existing research on multiobjective machine learning, focusing on supervised learning. In addition, a number of case studies are provided to illustrate the major benefits of the Pareto-based approach to machine learning, e.g., how to identify interpretable models and models that can generalize on unseen data from the obtained Pareto-optimal solutions. Three approaches to Pareto-based multiobjective ensemble generation are compared and discussed in detail. Finally, potentially interesting topics in multiobjective machine learning are suggested.",2008,109,354,19,True,Computer Science,2157835870,Yaochu Jin,1718432.0,B. Sendhoff,,,,,,,,,,,,,,,,,,,,,,,,,,,,,,,,,,,,,,,,,,,,,,,,,,,,,,,,,,,,,,,,,,,,,,
5726c7b40fcc454b77d989656c085520bf6c15fa,https://www.semanticscholar.org/paper/5726c7b40fcc454b77d989656c085520bf6c15fa,Multimodal learning with deep Boltzmann machines,"Data often consists of multiple diverse modalities. For example, images are tagged with textual information and videos are accompanied by audio. Each modality is characterized by having distinct statistical properties. We propose a Deep Boltzmann Machine for learning a generative model of such multimodal data. We show that the model can be used to create fused representations by combining features across modalities. These learned representations are useful for classification and information retrieval. By sampling from the conditional distributions over each data modality, it is possible to create these representations even when some data modalities are missing. We conduct experiments on bimodal image-text and audio-video data. The fused representation achieves good classification results on the MIR-Flickr data set matching or outperforming other deep models as well as SVM based models that use Multiple Kernel Learning. We further demonstrate that this multimodal model helps classification and retrieval even when only unimodal data is available at test time.",2012,46,1555,126,False,Computer Science,2897313,Nitish Srivastava,145124475.0,R. Salakhutdinov,,,,,,,,,,,,,,,,,,,,,,,,,,,,,,,,,,,,,,,,,,,,,,,,,,,,,,,,,,,,,,,,,,,,,,
7550a05bf00f7b24aed9c1ac3ef000575388d21c,https://www.semanticscholar.org/paper/7550a05bf00f7b24aed9c1ac3ef000575388d21c,Making large scale SVM learning practical,"Training a support vector machine SVM leads to a quadratic optimization problem with bound constraints and one linear equality constraint. Despite the fact that this type of problem is well understood, there are many issues to be considered in designing an SVM learner. In particular, for large learning tasks with many training examples on the shelf optimization techniques for general quadratic programs quickly become intractable in their memory and time requirements. SVM light is an implementation of an SVM learner which addresses the problem of large tasks. This chapter presents algorithmic and computational results developed for SVM light V 2.0, which make large-scale SVM training more practical. The results give guidelines for the application of SVMs to large domains.",1998,14,5531,507,False,Computer Science,1680188,T. Joachims,,,,,,,,,,,,,,,,,,,,,,,,,,,,,,,,,,,,,,,,,,,,,,,,,,,,,,,,,,,,,,,,,,,,,,,,
9011405b759b492b1132aea7b6165c9d1b0513e7,https://www.semanticscholar.org/paper/9011405b759b492b1132aea7b6165c9d1b0513e7,Reconciling schemas of disparate data sources: a machine-learning approach,"A data-integration system provides access to a multitude of data sources through a single mediated schema. A key bottleneck in building such systems has been the laborious manual construction of semantic mappings between the source schemas and the mediated schema. We describe LSD, a system that employs and extends current machine-learning techniques to semi-automatically find such mappings. LSD first asks the user to provide the semantic mappings for a small set of data sources, then uses these mappings together with the sources to train a set of learners. Each learner exploits a different type of information either in the source schemas or in their data. Once the learners have been trained, LSD finds semantic mappings for a new data source by applying the learners, then combining their predictions using a meta-learner. To further improve matching accuracy, we extend machine learning techniques so that LSD can incorporate domain constraints as an additional source of knowledge, and develop a novel learner that utilizes the structural information in XML documents. Our approach thus is distinguished in that it incorporates multiple types of knowledge. Importantly, its architecture is extensible to additional learners that may exploit new kinds of information. We describe a set of experiments on several real-world domains, and show that LSD proposes semantic mappings with a high degree of accuracy.",2001,28,901,68,False,Computer Science,3030274,A. Doan,1740213.0,Pedro M. Domingos,1770962.0,A. Halevy,,,,,,,,,,,,,,,,,,,,,,,,,,,,,,,,,,,,,,,,,,,,,,,,,,,,,,,,,,,,,,,,,,,,
a84f4fe31fcfb4ad92c995dba0fc09ed8fe6a4f4,https://www.semanticscholar.org/paper/a84f4fe31fcfb4ad92c995dba0fc09ed8fe6a4f4,Exploiting Machine Learning to Subvert Your Spam Filter,"Using statistical machine learning for making security decisions introduces new vulnerabilities in large scale systems. This paper shows how an adversary can exploit statistical machine learning, as used in the SpamBayes spam filter, to render it useless--even if the adversary's access is limited to only 1% of the training messages. We further demonstrate a new class of focused attacks that successfully prevent victims from receiving specific email messages. Finally, we introduce two new types of defenses against these attacks.",2008,21,297,17,False,Computer Science,39743720,Blaine Nelson,145140480.0,M. Barreno,1852911.0,F. J. Chi,1687701.0,A. Joseph,1868067.0,Benjamin I. P. Rubinstein,39708572.0,Udam Saini,,37210858.0,Charles Sutton,1787610.0,J. Tygar,2065015702.0,Kai Xia,,,,,,,,,,,,,,,,,,,,,,,,,,,,,,,,,,,,,,,,,,,,,,,,,,,,,,,
ae20c630759847cd88655631d0041b0be127fd0c,https://www.semanticscholar.org/paper/ae20c630759847cd88655631d0041b0be127fd0c,Transfer Learning for Visual Categorization: A Survey,"Regular machine learning and data mining techniques study the training data for future inferences under a major assumption that the future data are within the same feature space or have the same distribution as the training data. However, due to the limited availability of human labeled training data, training data that stay in the same feature space or have the same distribution as the future data cannot be guaranteed to be sufficient enough to avoid the over-fitting problem. In real-world applications, apart from data in the target domain, related data in a different domain can also be included to expand the availability of our prior knowledge about the target future data. Transfer learning addresses such cross-domain learning problems by extracting useful information from data in a related domain and transferring them for being used in target tasks. In recent years, with transfer learning being applied to visual categorization, some typical problems, e.g., view divergence in action recognition tasks and concept drifting in image classification tasks, can be efficiently solved. In this paper, we survey state-of-the-art transfer learning algorithms in visual categorization applications, such as object recognition, image classification, and human action recognition.",2015,99,583,16,False,Computer Science,144082425,L. Shao,152506137.0,F. Zhu,67180560.0,Xuelong Li,,,,,,,Medicine,,,,,,,,,,,,,,,,,,,,,,,,,,,,,,,,,,,,,,,,,,,,,,,,,,,,,,,,,,,,,
391b86cf16c2702dcc4beee55a6dd6d3bd7cf27b,https://www.semanticscholar.org/paper/391b86cf16c2702dcc4beee55a6dd6d3bd7cf27b,Deep Learning for Content-Based Image Retrieval: A Comprehensive Study,"Learning effective feature representations and similarity measures are crucial to the retrieval performance of a content-based image retrieval (CBIR) system. Despite extensive research efforts for decades, it remains one of the most challenging open problems that considerably hinders the successes of real-world CBIR systems. The key challenge has been attributed to the well-known ``semantic gap'' issue that exists between low-level image pixels captured by machines and high-level semantic concepts perceived by human. Among various techniques, machine learning has been actively investigated as a possible direction to bridge the semantic gap in the long term. Inspired by recent successes of deep learning techniques for computer vision and other applications, in this paper, we attempt to address an open problem: if deep learning is a hope for bridging the semantic gap in CBIR and how much improvements in CBIR tasks can be achieved by exploring the state-of-the-art deep learning techniques for learning feature representations and similarity measures. Specifically, we investigate a framework of deep learning with application to CBIR tasks with an extensive set of empirical studies by examining a state-of-the-art deep learning method (Convolutional Neural Networks) for CBIR tasks under varied settings. From our empirical studies, we find some encouraging results and summarize some important insights for future research.",2014,59,790,39,False,Computer Science,2041852738,Ji Wan,47858913.0,Dayong Wang,1741126.0,S. Hoi,2406415.0,Pengcheng Wu,1704030.0,Jianke Zhu,1699819.0,Yongdong Zhang,,30821609.0,Jintao Li,,,,,,,,,,,,,,,,,,,,,,,,,,,,,,,,,,,,,,,,,,,,,,,,,,,,,,,,,,,
4417f78b31546227784941bbd6f6532a177e60b8,https://www.semanticscholar.org/paper/4417f78b31546227784941bbd6f6532a177e60b8,Deep Learning using Linear Support Vector Machines,"Recently, fully-connected and convolutional neural networks have been trained to achieve state-of-the-art performance on a wide variety of tasks such as speech recognition, image classification, natural language processing, and bioinformatics. For classification tasks, most of these ""deep learning"" models employ the softmax activation function for prediction and minimize cross-entropy loss. In this paper, we demonstrate a small but consistent advantage of replacing the softmax layer with a linear support vector machine. Learning minimizes a margin-based loss instead of the cross-entropy loss. While there have been various combinations of neural nets and SVMs in prior art, our results using L2-SVMs show that by simply replacing softmax with linear SVMs gives significant gains on popular deep learning datasets MNIST, CIFAR-10, and the ICML 2013 Representation Learning Workshop's face expression recognition challenge.",2013,25,736,69,False,Computer Science,34312504,Yichuan Tang,,,,,,,,,,,Mathematics,,,,,,,,,,,,,,,,,,,,,,,,,,,,,,,,,,,,,,,,,,,,,,,,,,,,,,,,,,,,,
5f198e9f1a6cace1fcee5ec53f5d35d9d83af6b7,https://www.semanticscholar.org/paper/5f198e9f1a6cace1fcee5ec53f5d35d9d83af6b7,Can machine learning be secure?,"Machine learning systems offer unparalled flexibility in dealing with evolving input in a variety of applications, such as intrusion detection systems and spam e-mail filtering. However, machine learning algorithms themselves can be a target of attack by a malicious adversary. This paper provides a framework for answering the question, ""Can machine learning be secure?"" Novel contributions of this paper include a taxonomy of different types of attacks on machine learning techniques and systems, a variety of defenses against those attacks, a discussion of ideas that are important to security for machine learning, an analytical model giving a lower bound on attacker's work function, and a list of open problems.",2006,40,803,56,True,Computer Science,145140480,M. Barreno,39743720.0,Blaine Nelson,145879573.0,R. Sears,1687701.0,A. Joseph,1787610.0,J. Tygar,,,,,,,,,,,,,,,,,,,,,,,,,,,,,,,,,,,,,,,,,,,,,,,,,,,,,,,,,,,,,,,,
59882b92d0183163e897a671b8c9298f89df5df3,https://www.semanticscholar.org/paper/59882b92d0183163e897a671b8c9298f89df5df3,Task-Driven Dictionary Learning,"Modeling data with linear combinations of a few elements from a learned dictionary has been the focus of much recent research in machine learning, neuroscience, and signal processing. For signals such as natural images that admit such sparse representations, it is now well established that these models are well suited to restoration tasks. In this context, learning the dictionary amounts to solving a large-scale matrix factorization problem, which can be done efficiently with classical optimization tools. The same approach has also been used for learning features from data for other purposes, e.g., image classification, but tuning the dictionary in a supervised way for these tasks has proven to be more difficult. In this paper, we present a general formulation for supervised dictionary learning adapted to a wide variety of tasks, and present an efficient algorithm for solving the corresponding optimization problem. Experiments on handwritten digit classification, digital art identification, nonlinear inverse image problems, and compressed sensing demonstrate that our approach is effective in large-scale settings, and is well suited to supervised and semi-supervised classification, as well as regression tasks for data that admit sparse representations.",2010,61,877,98,True,Mathematics,2599292,J. Mairal,144570279.0,F. Bach,144189388.0,J. Ponce,,,,,,,Computer Science,,,,,,,,,Medicine,,,,,,,,,,,,,,,,,,,,,,,,,,,,,,,,,,,,,,,,,,,,,,,,,,,,
664b701a39371c5356754dc72cea1349233c8506,https://www.semanticscholar.org/paper/664b701a39371c5356754dc72cea1349233c8506,"Computer Systems That Learn: Classification and Prediction Methods from Statistics, Neural Nets, Machine Learning and Expert Systems","Preface 1 Overview of Learning Systems 1.1 What is a Learning System? 1.2 Motivation for Building Learning Systems 1.3 Types of Practical Empirical Learning Systems 1.3.1 Common Theme: The Classification Model 1.3.2 Let the Data Speak 1.4 What's New in Learning Methods 1.4.1 The Impact of New Technology 1.5 Outline of the Book 1.6 Bibliographical and Historical Remarks 2 How to Estimate the True Performance of a Learning System 2.1 The Importance of Unbiased Error Rate Estimation 2.2. What is an Error? 2.2.1 Costs and Risks 2.3 Apparent Error Rate Estimates 2.4 Too Good to Be True: Overspecialization 2.5 True Error Rate Estimation 2.5.1 The Idealized Model for Unlimited Samples 2.5.2 Train-and Test Error Rate Estimation 2.5.3 Resampling Techniques 2.5.4 Finding the Right Complexity Fit 2.6 Getting the Most Out of the Data 2.7 Classifier Complexity and Feature Dimensionality 2.7.1 Expected Patterns of Classifier Behavior 2.8 What Can Go Wrong? 2.8.1 Poor Features, Data Errors, and Mislabeled Classes 2.8.2 Unrepresentative Samples 2.9 How Close to the Truth? 2.10 Common Mistakes in Performance Analysis 2.11 Bibliographical and Historical Remarks 3 Statistical Pattern Recognition 3.1 Introduction and Overview 3.2 A Few Sample Applications 3.3 Bayesian Classifiers 3.3.1 Direct Application of the Bayes Rule 3.4 Linear Discriminants 3.4.1 The Normality Assumption and Discriminant Functions 3.4.2 Logistic Regression 3.5 Nearest Neighbor Methods 3.6 Feature Selection 3.7 Error Rate Analysis 3.8 Bibliographical and Historical Remarks 4 Neural Nets 4.1 Introduction and Overview 4.2 Perceptrons 4.2.1 Least Mean Square Learning Systems 4.2.2 How Good Is a Linear Separation Network? 4.3 Multilayer Neural Networks 4.3.1 Back-Propagation 4.3.2 The Practical Application of Back-Propagation 4.4 Error Rate and Complexity Fit Estimation 4.5 Improving on Standard Back-Propagation 4.6 Bibliographical and Historical Remarks 5 Machine Learning: Easily Understood Decision Rules 5.1 Introduction and Overview 5.2 Decision Trees 5.2.1 Finding the Perfect Tree 5.2.2 The Incredible Shrinking Tree 5.2.3 Limitations of Tree Induction Methods 5.3 Rule Induction 5.3.1 Predictive Value Maximization 5.4 Bibliographical and Historical Remarks 6 Which Technique is Best? 6.1 What's Important in Choosing a Classifier? 6.1.1 Prediction Accuracy 6.1.2 Speed of Learning and Classification 6.1.3 Explanation and Insight 6.2 So, How Do I Choose a Learning System? 6.3 Variations on the Standard Problem 6.3.1 Missing Data 6.3.2 Incremental Learning 6.4 Future Prospects for Improved Learning Methods 6.5 Bibliographical and Historical Remarks 7 Expert Systems 7.1 Introduction and Overview 7.1.1 Why Build Expert Systems? New vs. Old Knowledge 7.2 Estimating Error Rates for Expert Systems 7.3 Complexity of Knowledge Bases 7.3.1 How Many Rules Are Too Many? 7.4 Knowledge Base Example 7.5 Empirical Analysis of Knowledge Bases 7.6 Future: Combined Learning and Expert Systems 7.7 Bibliographical and Historical Remarks References Author Index Subject Index",1990,0,1065,41,False,Computer Science,145700185,S. Weiss,3285789.0,C. Kulikowski,,,,,,,,,,,,,,,,,,,,,,,,,,,,,,,,,,,,,,,,,,,,,,,,,,,,,,,,,,,,,,,,,,,,,,
