7e7b9f37ce280787075046727efbaf9b5a390729,https://www.semanticscholar.org/paper/7e7b9f37ce280787075046727efbaf9b5a390729,Applications of Machine Learning in Cancer Prediction and Prognosis,"Machine learning is a branch of artificial intelligence that employs a variety of statistical, probabilistic and optimization techniques that allows computers to “learn” from past examples and to detect hard-to-discern patterns from large, noisy or complex data sets. This capability is particularly well-suited to medical applications, especially those that depend on complex proteomic and genomic measurements. As a result, machine learning is frequently used in cancer diagnosis and detection. More recently machine learning has been applied to cancer prognosis and prediction. This latter approach is particularly interesting as it is part of a growing trend towards personalized, predictive medicine. In assembling this review we conducted a broad survey of the different types of machine learning methods being used, the types of data being integrated and the performance of these methods in cancer prediction and prognosis. A number of trends are noted, including a growing dependence on protein biomarkers and microarray data, a strong bias towards applications in prostate and breast cancer, and a heavy reliance on “older” technologies such artificial neural networks (ANNs) instead of more recently developed or more easily interpretable machine learning methods. A number of published studies also appear to lack an appropriate level of validation or testing. Among the better designed and validated studies it is clear that machine learning methods can be used to substantially (15–25%) improve the accuracy of predicting cancer susceptibility, recurrence and mortality. At a more fundamental level, it is also evident that machine learning is also helping to improve our basic understanding of cancer development and progression.",2006,210,902,28,True,Computer Science,34468738,Joseph A. Cruz,2066145.0,D. Wishart,,,,,,,,,Medicine,,,,,,,,,,,,,,,,,,,,,,,,,,,,,,,,,,,,,,,,,,,,,,,,,,,,,,,,,,,,,
dc0c84b7c5e6521216da789f8171544709120cf0,https://www.semanticscholar.org/paper/dc0c84b7c5e6521216da789f8171544709120cf0,Opportunities and obstacles for deep learning in biology and medicine,"Deep learning, which describes a class of machine learning algorithms, has recently showed impressive results across a variety of domains. Biology and medicine are data rich, but the data are complex and often ill-understood. Problems of this nature may be particularly well-suited to deep learning techniques. We examine applications of deep learning to a variety of biomedical problems -- patient classification, fundamental biological processes, and treatment of patients -- to predict whether deep learning will transform these tasks or if the biomedical sphere poses unique challenges. We find that deep learning has yet to revolutionize or definitively resolve any of these problems, but promising advances have been made on the prior state of the art. Even when improvement over a previous baseline has been modest, we have seen signs that deep learning methods may speed or aid human investigation. More work is needed to address concerns related to interpretability and how to best model each problem. Furthermore, the limited amount of labeled data for training presents problems in some domains, as can legal and privacy constraints on work with sensitive health records. Nonetheless, we foresee deep learning powering changes at the bench and bedside with the potential to transform several areas of biology and medicine.",2017,628,1219,18,True,Biology,5926615,T. Ching,1868440.0,Daniel S. Himmelstein,1402651503.0,Brett K. Beaulieu-Jones,32985843.0,Alexandr A Kalinin,48154546.0,Brian T Do,3738725.0,Gregory P. Way,Computer Science,137381074.0,E. Ferrero,2236448.0,P. Agapow,40862218.0,M. Zietz,35290352.0,M. M. Hoffman,Medicine,1993128574.0,W. Xie,6997856.0,G. Rosen,6580840.0,Benjamin J. Lengerich,39246361.0,Johnny Israeli,3369052.0,Jack Lanchantin,8230326.0,S. Woloszynek,1721012.0,Anne E Carpenter,3407268.0,Avanti Shrikumar,1807918.0,Jinbo Xu,30469485.0,Evan M. Cofer,39291675.0,C. A. Lavender,3178417.0,Srinivas C. Turaga,35786407.0,Amr M. Alexandari,144202084.0,Zhiyong Lu,145192391.0,David J Harris,1973239.0,D. DeCaprio,121817403.0,Yanjun Qi,2844479.0,A. Kundaje,2699239.0,Yifan Peng,3116087.0,L. K. Wiley,3451383.0,Marwin H. S. Segler,2831521.0,S. Boca,7946353.0,S. Joshua Joshua Swamidass,119855034.0,Austin Huang,2041407.0,A. Gitter,2104940.0,C. Greene
4d931ea98be69882f547ec6c1b42b78c3e13c36d,https://www.semanticscholar.org/paper/4d931ea98be69882f547ec6c1b42b78c3e13c36d,Quantum circuit learning,"We propose a classical-quantum hybrid algorithm for machine learning on near-term quantum processors, which we call quantum circuit learning. A quantum circuit driven by our framework learns a given task by tuning parameters implemented on it. The iterative optimization of the parameters allows us to circumvent the high-depth circuit. Theoretical investigation shows that a quantum circuit can approximate nonlinear functions, which is further confirmed by numerical simulations. Hybridizing a low-depth quantum circuit and a classical computer for machine learning, the proposed framework paves the way toward applications of near-term quantum devices for quantum machine learning.",2018,43,563,39,True,Computer Science,89418147,K. Mitarai,31729454.0,M. Negoro,2460970.0,M. Kitagawa,144950743.0,K. Fujii,,,,,Physics,,,,,,,,,,,,,,,,,,,,,,,,,,,,,,,,,,,,,,,,,,,,,,,,,,,,,,,,,,,,,
293987e14d64dc768a432115c93171ab8653e3bb,https://www.semanticscholar.org/paper/293987e14d64dc768a432115c93171ab8653e3bb,Machine Learning in Medical Imaging,"This article will discuss very different ways of using machine learning that may be less familiar, and we will demonstrate through examples the role of these concepts in medical imaging. Although the term machine learning is relatively recent, the ideas of machine learning have been applied to medical imaging for decades, perhaps most notably in the areas of computer-aided diagnosis (CAD) and functional brain mapping. We will not attempt in this brief article to survey the rich literature of this field. Instead our goals will be 1) to acquaint the reader with some modern techniques that are now staples of the machine-learning field and 2) to illustrate how these techniques can be employed in various ways in medical imaging.",2010,51,213,3,True,Computer Science,3067670,M. Wernick,46286398.0,Yongyi Yang,2489609.0,J. Brankov,3182604.0,G. Yourganov,2790050.0,S. Strother,,,Medicine,,,,,,,,,,,,,,,,,,,,,,,,,,,,,,,,,,,,,,,,,,,,,,,,,,,,,,,,,,,,,
60f43e763b370af0028317d7f6d94885cdfe390a,https://www.semanticscholar.org/paper/60f43e763b370af0028317d7f6d94885cdfe390a,Federated Learning,"How is it possible to allow multiple data owners to collaboratively train and use a shared prediction model while keeping all the local training data private? Traditional machine learning approaches need to combine all data at one location, typically a data center, which may very well violate the laws on user privacy and data confidentiality. Today, many parts of the world demand that technology companies treat user data carefully according to user-privacy laws. The European Union’s General Data Protection Regulation (GDPR) is a prime example. In this book, we describe how federated machine learning addresses this problem with novel solutions combining distributed machine learning, cryptography and security, and incentive mechanism design based on economic principles and game theory. We explain different types of privacypreserving machine learning solutions and their technological backgrounds, and highlight some representative practical use cases.We show how federated learning can become the foundation of next-generation machine learning that caters to technological and societal needs for responsible AI development and application.",2019,172,270,13,False,Computer Science,153096457,Qiang Yang,1614034792.0,Yang Liu,2157394918.0,Yong Cheng,1505828520.0,Yan Kang,11573257.0,Tianjian Chen,2110984588.0,Han Yu,,,,,,,,,,,,,,,,,,,,,,,,,,,,,,,,,,,,,,,,,,,,,,,,,,,,,,,,,,,,,,
da5c65b0ac8b525c3d3d4889bf44d8a48d254a07,https://www.semanticscholar.org/paper/da5c65b0ac8b525c3d3d4889bf44d8a48d254a07,Deep Bayesian Active Learning with Image Data,"Even though active learning forms an important pillar of machine learning, deep learning tools are not prevalent within it. Deep learning poses several difficulties when used in an active learning setting. First, active learning (AL) methods generally rely on being able to learn and update models from small amounts of data. Recent advances in deep learning, on the other hand, are notorious for their dependence on large amounts of data. Second, many AL acquisition functions rely on model uncertainty, yet deep learning methods rarely represent such model uncertainty. In this paper we combine recent advances in Bayesian deep learning into the active learning framework in a practical way. We develop an active learning framework for high dimensional data, a task which has been extremely challenging so far, with very sparse existing literature. Taking advantage of specialised models such as Bayesian convolutional neural networks, we demonstrate our active learning techniques with image data, obtaining a significant improvement on existing active learning approaches. We demonstrate this on both the MNIST dataset, as well as for skin cancer diagnosis from lesion images (ISIC2016 task).",2017,42,1014,166,False,Computer Science,2681954,Y. Gal,18014232.0,Riashat Islam,1744700.0,Zoubin Ghahramani,,,,,,,Mathematics,,,,,,,,,,,,,,,,,,,,,,,,,,,,,,,,,,,,,,,,,,,,,,,,,,,,,,,,,,,,,
cfea40bf4e4131aab2727e3aaedcf02c1dd594ac,https://www.semanticscholar.org/paper/cfea40bf4e4131aab2727e3aaedcf02c1dd594ac,Bidirectional Extreme Learning Machine for Regression Problem and Its Learning Effectiveness,"It is clear that the learning effectiveness and learning speed of neural networks are in general far slower than required, which has been a major bottleneck for many applications. Recently, a simple and efficient learning method, referred to as extreme learning machine (ELM), was proposed by Huang , which has shown that, compared to some conventional methods, the training time of neural networks can be reduced by a thousand times. However, one of the open problems in ELM research is whether the number of hidden nodes can be further reduced without affecting learning effectiveness. This brief proposes a new learning algorithm, called bidirectional extreme learning machine (B-ELM), in which some hidden nodes are not randomly selected. In theory, this algorithm tends to reduce network output error to 0 at an extremely early learning stage. Furthermore, we find a relationship between the network output error and the network output weights in the proposed B-ELM. Simulation results demonstrate that the proposed method can be tens to hundreds of times faster than other incremental ELM algorithms.",2012,14,162,6,False,Computer Science,2108776795,Yimin Yang,2119048509.0,Yaonan Wang,2474758.0,Xiaofang Yuan,,,,,,,Medicine,,,,,,,,,,,,,,,,,,,,,,,,,,,,,,,,,,,,,,,,,,,,,,,,,,,,,,,,,,,,,
c4ae802491724aee021f31f02327b9671cead3dc,https://www.semanticscholar.org/paper/c4ae802491724aee021f31f02327b9671cead3dc,Types of Machine Learning Algorithms,"• Supervised learning --where the algorithm generates a function that maps inputs to desired outputs. One standard formulation of the supervised learning task is the classification problem: the learner is required to learn (to approximate the behavior of) a function which maps a vector into one of several classes by looking at several input-output examples of the function. • Unsupervised learning --which models a set of inputs: labeled examples are not available. • Semi-supervised learning --which combines both labeled and unlabeled examples to generate an appropriate function or classifier. • Reinforcement learning --where the algorithm learns a policy of how to act given an observation of the world. Every action has some impact in the environment, and the environment provides feedback that guides the learning algorithm. • Transduction --similar to supervised learning, but does not explicitly construct a function: instead, tries to predict new outputs based on training inputs, training outputs, and new inputs. • Learning to learn --where the algorithm learns its own inductive bias based on previous experience.",2010,57,280,14,False,Computer Science,145298622,T. Ayodele,,,,,,,,,,,,,,,,,,,,,,,,,,,,,,,,,,,,,,,,,,,,,,,,,,,,,,,,,,,,,,,,,,,,,,,,
276194e96ebd620b5cff35a9168bdda39a0be57b,https://www.semanticscholar.org/paper/276194e96ebd620b5cff35a9168bdda39a0be57b,Federated Multi-Task Learning,"Federated learning poses new statistical and systems challenges in training machine learning models over distributed networks of devices. In this work, we show that multi-task learning is naturally suited to handle the statistical challenges of this setting, and propose a novel systems-aware optimization method, MOCHA, that is robust to practical systems issues. Our method and theory for the first time consider issues of high communication cost, stragglers, and fault tolerance for distributed multi-task learning. The resulting method achieves significant speedups compared to alternatives in the federated setting, as we demonstrate through simulations on real-world federated datasets.",2017,57,900,74,False,Computer Science,145260024,Virginia Smith,2054892.0,Chao-Kai Chiang,2095979.0,Maziar Sanjabi,145532827.0,Ameet S. Talwalkar,,,,,Mathematics,,,,,,,,,,,,,,,,,,,,,,,,,,,,,,,,,,,,,,,,,,,,,,,,,,,,,,,,,,,,,
a20bfec3c95aad003dcb45a21a220c19cca8bb66,https://www.semanticscholar.org/paper/a20bfec3c95aad003dcb45a21a220c19cca8bb66,A Machine Learning Approach to Coreference Resolution of Noun Phrases,"In this paper, we present a learning approach to coreference resolution of noun phrases in unrestricted text. The approach learns from a small, annotated corpus and the task includes resolving not just a certain type of noun phrase (e.g., pronouns) but rather general noun phrases. It also does not restrict the entity types of the noun phrases; that is, coreference is assigned whether they are of organization, person, or other types. We evaluate our approach on common data sets (namely, the MUC-6 and MUC-7 coreference corpora) and obtain encouraging results, indicating that on the general noun phrase coreference task, the learning approach holds promise and achieves accuracy comparable to that of nonlearning approaches. Our system is the first learning-based system that offers performance comparable to that of state-of-the-art nonlearning systems on these data sets.",2001,24,1091,150,True,Computer Science,2248565,W. M. Soon,34789794.0,H. Ng,3216372.0,Chung Yong Lim,,,,,,,,,,,,,,,,,,,,,,,,,,,,,,,,,,,,,,,,,,,,,,,,,,,,,,,,,,,,,,,,,,,,
066dd3d09eb5815e8be1da560abd1abe08f87cb9,https://www.semanticscholar.org/paper/066dd3d09eb5815e8be1da560abd1abe08f87cb9,OP-ELM: Optimally Pruned Extreme Learning Machine,"In this brief, the optimally pruned extreme learning machine (OP-ELM) methodology is presented. It is based on the original extreme learning machine (ELM) algorithm with additional steps to make it more robust and generic. The whole methodology is presented in detail and then applied to several regression and classification problems. Results for both computational time and accuracy (mean square error) are compared to the original ELM and to three other widely used methodologies: multilayer perceptron (MLP), support vector machine (SVM), and Gaussian process (GP). As the experiments for both regression and classification illustrate, the proposed OP-ELM methodology performs several orders of magnitude faster than the other algorithms used in this brief, except the original ELM. Despite the simplicity and fast performance, the OP-ELM is still able to maintain an accuracy that is comparable to the performance of the SVM. A toolbox for the OP-ELM is publicly available online.",2010,17,716,47,False,Computer Science,3194493,Y. Miché,2500799.0,A. Sorjamaa,144224330.0,P. Bas,1738231.0,O. Simula,1696508.0,C. Jutten,1731049.0,A. Lendasse,Medicine,,,,,,,,,,,,,,,,,,,,,,,,,,,,,,,,,,,,,,,,,,,,,,,,,,,,,,,,,,,,,
0ef9ae1ce8c91ce671a211bdda792bf3752d1522,https://www.semanticscholar.org/paper/0ef9ae1ce8c91ce671a211bdda792bf3752d1522,A Deep Learning Approach for Intrusion Detection Using Recurrent Neural Networks,"Intrusion detection plays an important role in ensuring information security, and the key technology is to accurately identify various attacks in the network. In this paper, we explore how to model an intrusion detection system based on deep learning, and we propose a deep learning approach for intrusion detection using recurrent neural networks (RNN-IDS). Moreover, we study the performance of the model in binary classification and multiclass classification, and the number of neurons and different learning rate impacts on the performance of the proposed model. We compare it with those of J48, artificial neural network, random forest, support vector machine, and other machine learning methods proposed by previous researchers on the benchmark data set. The experimental results show that RNN-IDS is very suitable for modeling a classification model with high accuracy and that its performance is superior to that of traditional machine learning classification methods in both binary and multiclass classification. The RNN-IDS model improves the accuracy of the intrusion detection and provides a new research method for intrusion detection.",2017,26,898,65,False,Computer Science,30796665,Chuanlong Yin,1733625.0,Yuefei Zhu,2191560.0,Jin-long Fei,50046030.0,Xin-Zheng He,,,,,,,,,,,,,,,,,,,,,,,,,,,,,,,,,,,,,,,,,,,,,,,,,,,,,,,,,,,,,,,,,,
8de174ab5419b9d3127695405efd079808e956e8,https://www.semanticscholar.org/paper/8de174ab5419b9d3127695405efd079808e956e8,Curriculum learning,"Humans and animals learn much better when the examples are not randomly presented but organized in a meaningful order which illustrates gradually more concepts, and gradually more complex ones. Here, we formalize such training strategies in the context of machine learning, and call them ""curriculum learning"". In the context of recent research studying the difficulty of training in the presence of non-convex training criteria (for deep deterministic and stochastic neural networks), we explore curriculum learning in various set-ups. The experiments show that significant improvements in generalization can be achieved. We hypothesize that curriculum learning has both an effect on the speed of convergence of the training process to a minimum and, in the case of non-convex criteria, on the quality of the local minima obtained: curriculum learning can be seen as a particular form of continuation method (a general strategy for global optimization of non-convex functions).",2009,33,3609,317,False,Computer Science,1751762,Yoshua Bengio,2373952.0,J. Louradour,2939803.0,Ronan Collobert,145183709.0,J. Weston,,,,,,,,,,,,,,,,,,,,,,,,,,,,,,,,,,,,,,,,,,,,,,,,,,,,,,,,,,,,,,,,,,
9d3e0fce253a4ae4a4456b2f24c03329a2b74621,https://www.semanticscholar.org/paper/9d3e0fce253a4ae4a4456b2f24c03329a2b74621,Deep Learning for Health Informatics,"With a massive influx of multimodality data, the role of data analytics in health informatics has grown rapidly in the last decade. This has also prompted increasing interests in the generation of analytical, data driven models based on machine learning in health informatics. Deep learning, a technique with its foundation in artificial neural networks, is emerging in recent years as a powerful tool for machine learning, promising to reshape the future of artificial intelligence. Rapid improvements in computational power, fast data storage, and parallelization have also contributed to the rapid uptake of the technology in addition to its predictive power and ability to generate automatically optimized high-level features and semantic interpretation from the input data. This article presents a comprehensive up-to-date review of research employing deep learning in health informatics, providing a critical analysis of the relative merit, and potential pitfalls of the technique as well as its future outlook. The paper mainly focuses on key applications of deep learning in the fields of translational bioinformatics, medical imaging, pervasive sensing, medical informatics, and public health.",2017,164,1106,34,False,Computer Science,1859140,D. Ravì,1905807.0,Charence Wong,2775904.0,F. Deligianni,3163767.0,M. Berthelot,1443783456.0,Javier Andreu-Perez,1745644.0,Benny P. L. Lo,Medicine,144574968.0,Guang-Zhong Yang,,,,,,,,,,,,,,,,,,,,,,,,,,,,,,,,,,,,,,,,,,,,,,,,,,,,,,,,,,,
9f1e9e56d80146766bc2316efbc54d8b770a23df,https://www.semanticscholar.org/paper/9f1e9e56d80146766bc2316efbc54d8b770a23df,Deep Reinforcement Learning: An Overview,"We give an overview of recent exciting achievements of deep reinforcement learning (RL). We discuss six core elements, six important mechanisms, and twelve applications. We start with background of machine learning, deep learning and reinforcement learning. Next we discuss core RL elements, including value function, in particular, Deep Q-Network (DQN), policy, reward, model, planning, and exploration. After that, we discuss important mechanisms for RL, including attention and memory, unsupervised learning, transfer learning, multi-agent RL, hierarchical RL, and learning to learn. Then we discuss various applications of RL, including games, in particular, AlphaGo, robotics, natural language processing, including dialogue systems, machine translation, and text generation, computer vision, neural architecture design, business management, finance, healthcare, Industry 4.0, smart grid, intelligent transportation systems, and computer systems. We mention topics not reviewed yet, and list a collection of RL resources. After presenting a brief summary, we close with discussions. 
Please see Deep Reinforcement Learning, arXiv:1810.06339, for a significant update.",2017,584,844,77,False,Computer Science,2276894,Yuxi Li,,,,,,,,,,,,,,,,,,,,,,,,,,,,,,,,,,,,,,,,,,,,,,,,,,,,,,,,,,,,,,,,,,,,,,,,
64be9999b68e12d260ba7423f6b55ffd41552ad3,https://www.semanticscholar.org/paper/64be9999b68e12d260ba7423f6b55ffd41552ad3,Deep Learning Applications in Medical Image Analysis,"The tremendous success of machine learning algorithms at image recognition tasks in recent years intersects with a time of dramatically increased use of electronic medical records and diagnostic imaging. This review introduces the machine learning algorithms as applied to medical image analysis, focusing on convolutional neural networks, and emphasizing clinical aspects of the field. The advantage of machine learning in an era of medical big data is that significant hierarchal relationships within the data can be discovered algorithmically without laborious hand-crafting of features. We cover key research areas and applications of medical image classification, localization, detection, segmentation, and registration. We conclude by discussing research obstacles, emerging trends, and possible future directions.",2018,140,697,10,False,Computer Science,34812292,Justin Ker,46659335.0,Lipo Wang,39917910.0,J. Rao,48508646.0,Tchoyoson C. C. Lim,,,,,,,,,,,,,,,,,,,,,,,,,,,,,,,,,,,,,,,,,,,,,,,,,,,,,,,,,,,,,,,,,,
7574bfa9fa539f1ccbaeabc7c82c295d6143b84c,https://www.semanticscholar.org/paper/7574bfa9fa539f1ccbaeabc7c82c295d6143b84c,Reinforcement Learning,"Reinforcement learning is an approach to artificial intelligence that emphasizes learning by the individual from its interaction with its environment. This contrasts with classical approaches to artificial intelligence and machine learning, which have downplayed learning from interaction, focusing instead on learning from a knowledgeable teacher, or on reasoning from a complete model of the environment. Modern reinforcement learning research is highly interdisciplinary; it includes researchers specializing in operations research, genetic algorithms, neural networks, psychology, and control engineering. Reinforcement learning is learning what to do—how to map situations to actions—so as to maximize a scalar reward signal. The learner is not told which action to take, as in most forms of machine learning, but instead must discover which actions yield the most reward by trying them. In the most interesting and challenging cases, actions may affect not only the immediate reward, but also the next situation, and through that all subsequent rewards. These two characteristics—trial-and-error search and delayed reward—are the two most important distinguishing features of reinforcement learning. One of the challenges that arises in reinforcement learning and not in other kinds of learning is the tradeoff between exploration and exploitation. To obtain a lot of reward, a reinforcement learning agent must prefer actions that it has tried in the past and found to be effective in producing reward. But to discover which actions these are it has to select actions that it has not tried before. The agent has to exploit what it already knows in order to obtain reward, but it also has to explore in order to make better action selections in the future. The dilemma is that neither exploitation nor exploration can be pursued exclusively without failing at the task. Modern reinforcement learning research uses the formal framework of",1992,33,511,12,False,Computer Science,1699645,R. Sutton,,,,,,,,,,,,,,,,,,,,,,,,,,,,,,,,,,,,,,,,,,,,,,,,,,,,,,,,,,,,,,,,,,,,,,,,
