paperId,url,title,abstract,year,referenceCount,citationCount,influentialCitationCount,isOpenAccess,fieldsOfStudy/0,authors/0/authorId,authors/0/name,authors/1/authorId,authors/1/name,authors/2/authorId,authors/2/name,authors/3/authorId,authors/3/name,authors/4/authorId,authors/4/name,authors/5/authorId,authors/5/name,fieldsOfStudy/1,authors/6/authorId,authors/6/name,authors/7/authorId,authors/7/name,authors/8/authorId,authors/8/name,authors/9/authorId,authors/9/name,fieldsOfStudy/2,authors/10/authorId,authors/10/name,authors/11/authorId,authors/11/name,authors/12/authorId,authors/12/name,authors/13/authorId,authors/13/name,authors/14/authorId,authors/14/name,authors/15/authorId,authors/15/name,authors/16/authorId,authors/16/name,authors/17/authorId,authors/17/name,authors/18/authorId,authors/18/name,authors/19/authorId,authors/19/name,authors/20/authorId,authors/20/name,authors/21/authorId,authors/21/name,authors/22/authorId,authors/22/name,authors/23/authorId,authors/23/name,authors/24/authorId,authors/24/name,authors/25/authorId,authors/25/name,authors/26/authorId,authors/26/name,authors/27/authorId,authors/27/name,authors/28/authorId,authors/28/name,authors/29/authorId,authors/29/name,authors/30/authorId,authors/30/name,authors/31/authorId,authors/31/name,authors/32/authorId,authors/32/name,authors/33/authorId,authors/33/name,authors/34/authorId,authors/34/name,authors/35/authorId,authors/35/name
5176a2f31dace77db9135dde7020d2c37f78cca0,https://www.semanticscholar.org/paper/5176a2f31dace77db9135dde7020d2c37f78cca0,"The Elements of Statistical Learning: Data Mining, Inference, and Prediction","In the words of the authors, the goal of this book was to “bring together many of the important new ideas in learning, and explain them in a statistical framework.” The authors have been quite successful in achieving this objective, and their work is a welcome addition to the statistics and learning literatures. Statistics has always been interdisciplinary, borrowing ideas from diverse  elds and repaying the debt with contributions, both theoretical and practical, to the other intellectual disciplines. For statistical learning, this cross-fertilization is especially noticeable. This book is a valuable resource, both for the statistician needing an introduction to machine learning and related  elds and for the computer scientist wishing to learn more about statistics. Statisticians will especially appreciate that it is written in their own language. The level of the book is roughly that of a second-year doctoral student in statistics, and it will be useful as a textbook for such students. In a stimulating article, Breiman (2001) argued that statistics has been focused too much on a “data modeling culture,” where the model is paramount. Breiman argued instead for an “algorithmic modeling culture,” with emphasis on black-box types of prediction. Breiman’s article is controversial, and in his discussion, Efron objects that “prediction is certainly an interesting subject, but Leo’s paper overstates both its role and our profession’s lack of interest in it.” Although I mostly agree with Efron, I worry that the courses offered by most statistics departments include little, if any, treatment of statistical learning and prediction. (Stanford, where Efron and the authors of this book teach, is an exception.) Graduate students in statistics certainly need to know more than they do now about prediction, machine learning, statistical learning, and data mining (not disjoint subjects). I hope that graduate courses covering the topics of this book will become more common in statistics curricula. Most of the book is focused on supervised learning, where one has inputs and outputs from some system and wishes to predict unknown outputs corresponding to known inputs. The methods discussed for supervised learning include linear and logistic regression; basis expansion, such as splines and wavelets; kernel techniques, such as local regression, local likelihood, and radial basis functions; neural networks; additive models; decision trees based on recursive partitioning, such as CART; and support vector machines. There is a  nal chapter on unsupervised learning, including association rules, cluster analysis, self-organizing maps, principal components and curves, and independent component analysis. Many statisticians will be unfamiliar with at least some of these algorithms. Association rules are popular for mining commercial data in what is called “market basket analysis.” The aim is to discover types of products often purchased together. Such knowledge can be used to develop marketing strategies, such as store or catalog layouts. Self-organizing maps (SOMs) involve essentially constrained k-means clustering, where prototypes are mapped to a two-dimensional curved coordinate system. Independent components analysis is similar to principal components analysis and factor analysis, but it uses higher-order moments to achieve independence, not merely zero correlation between components. A strength of the book is the attempt to organize a plethora of methods into a coherent whole. The relationships among the methods are emphasized. I know of no other book that covers so much ground. Of course, with such broad coverage, it is not possible to cover any single topic in great depth, so this book will encourage further reading. Fortunately, each chapter includes bibliographic notes surveying the recent literature. These notes and the extensive references provide a good introduction to the learning literature, including much outside of statistics. The book might be more suitable as a textbook if less material were covered in greater depth; however, such a change would compromise the book’s usefulness as a reference, and so I am happier with the book as it was written.",2004,2,15322,1843,False,Mathematics,144108246,D. Ruppert,,,,,,,,,,,,,,,,,,,,,,,,,,,,,,,,,,,,,,,,,,,,,,,,,,,,,,,,,,,,,,,,,,,,,,,,
01f702f8b1f9d1314587015f1f038af4d5735e77,https://www.semanticscholar.org/paper/01f702f8b1f9d1314587015f1f038af4d5735e77,Opposition-Based Learning: A New Scheme for Machine Intelligence,"Opposition-based learning as a new scheme for machine intelligence is introduced. Estimates and counter-estimates, weights and opposite weights, and actions versus counter-actions are the foundation of this new approach. Examples are provided. Possibilities for extensions of existing learning algorithms are discussed. Preliminary results are provided",2005,9,1272,142,False,Computer Science,9315255,H. Tizhoosh,,,,,,,,,,,,,,,,,,,,,,,,,,,,,,,,,,,,,,,,,,,,,,,,,,,,,,,,,,,,,,,,,,,,,,,,
d05d86db86a4ac0d95e6dcd951b42a9651939793,https://www.semanticscholar.org/paper/d05d86db86a4ac0d95e6dcd951b42a9651939793,Deep Learning Approach for Intelligent Intrusion Detection System,"Machine learning techniques are being widely used to develop an intrusion detection system (IDS) for detecting and classifying cyberattacks at the network-level and the host-level in a timely and automatic manner. However, many challenges arise since malicious attacks are continually changing and are occurring in very large volumes requiring a scalable solution. There are different malware datasets available publicly for further research by cyber security community. However, no existing study has shown the detailed analysis of the performance of various machine learning algorithms on various publicly available datasets. Due to the dynamic nature of malware with continuously changing attacking methods, the malware datasets available publicly are to be updated systematically and benchmarked. In this paper, a deep neural network (DNN), a type of deep learning model, is explored to develop a flexible and effective IDS to detect and classify unforeseen and unpredictable cyberattacks. The continuous change in network behavior and rapid evolution of attacks makes it necessary to evaluate various datasets which are generated over the years through static and dynamic approaches. This type of study facilitates to identify the best algorithm which can effectively work in detecting future cyberattacks. A comprehensive evaluation of experiments of DNNs and other classical machine learning classifiers are shown on various publicly available benchmark malware datasets. The optimal network parameters and network topologies for DNNs are chosen through the following hyperparameter selection methods with KDDCup 99 dataset. All the experiments of DNNs are run till 1,000 epochs with the learning rate varying in the range [0.01–0.5]. The DNN model which performed well on KDDCup 99 is applied on other datasets, such as NSL-KDD, UNSW-NB15, Kyoto, WSN-DS, and CICIDS 2017, to conduct the benchmark. Our DNN model learns the abstract and high-dimensional feature representation of the IDS data by passing them into many hidden layers. Through a rigorous experimental testing, it is confirmed that DNNs perform well in comparison with the classical machine learning classifiers. Finally, we propose a highly scalable and hybrid DNNs framework called scale-hybrid-IDS-AlertNet which can be used in real-time to effectively monitor the network traffic and host-level events to proactively alert possible cyberattacks.",2019,85,546,24,True,Computer Science,51162051,R. Vinayakumar,2474250.0,M. Alazab,144456263.0,K. Soman,2916235.0,P. Poornachandran,1399133087.0,Ameer Al-Nemrat,145710905.0,S. Venkatraman,,,,,,,,,,,,,,,,,,,,,,,,,,,,,,,,,,,,,,,,,,,,,,,,,,,,,,,,,,,,,,
cd49acefc8d51e324aa562e5337e1c2aff067053,https://www.semanticscholar.org/paper/cd49acefc8d51e324aa562e5337e1c2aff067053,An Overview of Multi-task Learning,"As a promising area in machine learning, multi-task learning (MTL) aims to improve the performance of multiple related learning tasks by leveraging useful information among them. In this paper, we give an overview of MTL by first giving a definition of MTL. Then several different settings of MTL are introduced, including multi-task supervised learning, multi-task unsupervised learning, multi-task semi-supervised learning, multi-task active learning, multi-task reinforcement learning, multi-task online learning and multi-task multi-view learning. For each setting, representative MTL models are presented. In order to speed up the learning process, parallel and distributed MTL models are introduced. Many areas, including computer vision, bioinformatics, health informatics, speech, natural language processing, web applications and ubiquitous computing, use MTL to improve the performance of the applications involved and some representative works are reviewed. Finally, recent theoretical analyses for MTL are presented.",2018,135,949,29,True,Computer Science,46867608,Yu Zhang,153096457.0,Qiang Yang,,,,,,,,,,,,,,,,,,,,,,,,,,,,,,,,,,,,,,,,,,,,,,,,,,,,,,,,,,,,,,,,,,,,,,
c99179ca3784e3465fd9ed049d7f34b50d39393e,https://www.semanticscholar.org/paper/c99179ca3784e3465fd9ed049d7f34b50d39393e,Ensemble learning: A survey,"Ensemble methods are considered the state‐of‐the art solution for many machine learning challenges. Such methods improve the predictive performance of a single model by training multiple models and combining their predictions. This paper introduce the concept of ensemble learning, reviews traditional, novel and state‐of‐the‐art ensemble methods and discusses current challenges and trends in the field.",2018,167,866,30,False,Computer Science,2066733832,Omer Sagi,1732091.0,L. Rokach,,,,,,,,,,,,,,,,,,,,,,,,,,,,,,,,,,,,,,,,,,,,,,,,,,,,,,,,,,,,,,,,,,,,,,
0bfc6add0390f1b4cfbd0e90ac71475cca88b2d5,https://www.semanticscholar.org/paper/0bfc6add0390f1b4cfbd0e90ac71475cca88b2d5,A Review on Multi-Label Learning Algorithms,"Multi-label learning studies the problem where each example is represented by a single instance while associated with a set of labels simultaneously. During the past decade, significant amount of progresses have been made toward this emerging machine learning paradigm. This paper aims to provide a timely review on this area with emphasis on state-of-the-art multi-label learning algorithms. Firstly, fundamentals on multi-label learning including formal definition and evaluation metrics are given. Secondly and primarily, eight representative multi-label learning algorithms are scrutinized under common notations with relevant analyses and discussions. Thirdly, several related learning settings are briefly summarized. As a conclusion, online resources and open research problems on multi-label learning are outlined for reference purposes.",2014,201,2102,182,False,Computer Science,3039887,Min-Ling Zhang,145624000.0,Zhi-Hua Zhou,,,,,,,,,,,,,,,,,,,,,,,,,,,,,,,,,,,,,,,,,,,,,,,,,,,,,,,,,,,,,,,,,,,,,,
e6cb9e80d1894bbb01882523137145d81dfb0a3c,https://www.semanticscholar.org/paper/e6cb9e80d1894bbb01882523137145d81dfb0a3c,The SHOGUN Machine Learning Toolbox,"We have developed a machine learning toolbox, called SHOGUN, which is designed for unified large-scale learning for a broad range of feature types and learning settings. It offers a considerable number of machine learning models such as support vector machines, hidden Markov models, multiple kernel learning, linear discriminant analysis, and more. Most of the specific algorithms are able to deal with several different data classes. We have used this toolbox in several applications from computational biology, some of them coming with no less than 50 million training examples and others with 7 billion test examples. With more than a thousand installations worldwide, SHOGUN is already widely adopted in the machine learning community and beyond. 
 
SHOGUN is implemented in C++ and interfaces to MATLABTM, R, Octave, Python, and has a stand-alone command line interface. The source code is freely available under the GNU General Public License, Version 3 at http://www.shogun-toolbox.org.",2010,11,292,17,False,Computer Science,3029782,S. Sonnenburg,2414086.0,G. Rätsch,2574834.0,S. Henschel,3263887.0,Christian Widmer,2094634.0,Jonas Behr,2281542.0,A. Zien,,1933978557.0,F. D. Bona,49345823.0,Alexander Binder,2140119.0,C. Gehl,1778663.0,Vojtech Franc,,,,,,,,,,,,,,,,,,,,,,,,,,,,,,,,,,,,,,,,,,,,,,,,,,,,,
395dd01c0d24777c660cf195c4cfadcdf51fb7e8,https://www.semanticscholar.org/paper/395dd01c0d24777c660cf195c4cfadcdf51fb7e8,Learning to learn by gradient descent by gradient descent,"The move from hand-designed features to learned features in machine learning has been wildly successful. In spite of this, optimization algorithms are still designed by hand. In this paper we show how the design of an optimization algorithm can be cast as a learning problem, allowing the algorithm to learn to exploit structure in the problems of interest in an automatic way. Our learned algorithms, implemented by LSTMs, outperform generic, hand-designed competitors on the tasks for which they are trained, and also generalize well to new tasks with similar structure. We demonstrate this on a number of tasks, including simple convex problems, training neural networks, and styling images with neural art.",2016,42,1484,166,False,Computer Science,2206490,Marcin Andrychowicz,1715051.0,Misha Denil,2016840.0,Sergio Gomez Colmenarejo,3243579.0,Matthew W. Hoffman,144846367.0,D. Pfau,1725157.0,T. Schaul,,1737568.0,N. D. Freitas,,,,,,,,,,,,,,,,,,,,,,,,,,,,,,,,,,,,,,,,,,,,,,,,,,,,,,,,,,,
7ab0f0da686cd4094fd96f5a30e0b6072525fd09,https://www.semanticscholar.org/paper/7ab0f0da686cd4094fd96f5a30e0b6072525fd09,Deep Learning in Medical Image Analysis.,"This review covers computer-assisted analysis of images in the field of medical imaging. Recent advances in machine learning, especially with regard to deep learning, are helping to identify, classify, and quantify patterns in medical images. At the core of these advances is the ability to exploit hierarchical feature representations learned solely from data, instead of features designed by hand according to domain-specific knowledge. Deep learning is rapidly becoming the state of the art, leading to enhanced performance in various medical applications. We introduce the fundamentals of deep learning methods and review their successes in image registration, detection of anatomical and cellular structures, tissue segmentation, computer-aided disease diagnosis and prognosis, and so on. We conclude by discussing research issues and suggesting future directions for further improvement.",2017,127,1470,16,True,Medicine,144986260,D. Shen,46531894.0,Guorong Wu,143802908.0,Heung-Il Suk,,,,,,,Computer Science,,,,,,,,,,,,,,,,,,,,,,,,,,,,,,,,,,,,,,,,,,,,,,,,,,,,,,,,,,,,,
4b61c25a86083c20730c9b12737ac6ac4178c364,https://www.semanticscholar.org/paper/4b61c25a86083c20730c9b12737ac6ac4178c364,An Introduction to Deep Reinforcement Learning,"Deep reinforcement learning is the combination of reinforcement learning (RL) and deep learning. This field of research has been able to solve a wide range of complex decision-making tasks that were previously out of reach for a machine. Thus, deep RL opens up many new applications in domains such as healthcare, robotics, smart grids, finance, and many more. This manuscript provides an introduction to deep reinforcement learning models, algorithms and techniques. Particular focus is on the aspects related to generalization and how deep RL can be used for practical applications. We assume the reader is familiar with basic machine learning concepts.",2018,355,606,41,True,Computer Science,1389921282,Vincent François-Lavet,40068904.0,Peter Henderson,18014232.0,Riashat Islam,1792298.0,Marc G. Bellemare,145134886.0,Joelle Pineau,,,Mathematics,,,,,,,,,,,,,,,,,,,,,,,,,,,,,,,,,,,,,,,,,,,,,,,,,,,,,,,,,,,,,
5c04f8002e24a8c09bfbfedca3c6c346fe1e5d53,https://www.semanticscholar.org/paper/5c04f8002e24a8c09bfbfedca3c6c346fe1e5d53,An Introduction to Support Vector Machines and Other Kernel-based Learning Methods,"From the publisher: This is the first comprehensive introduction to Support Vector Machines (SVMs), a new generation learning system based on recent advances in statistical learning theory. SVMs deliver state-of-the-art performance in real-world applications such as text categorisation, hand-written character recognition, image classification, biosequences analysis, etc., and are now established as one of the standard tools for machine learning and data mining. Students will find the book both stimulating and accessible, while practitioners will be guided smoothly through the material required for a good grasp of the theory and its applications. The concepts are introduced gradually in accessible and self-contained stages, while the presentation is rigorous and thorough. Pointers to relevant literature and web sites containing software ensure that it forms an ideal starting point for further study. Equally, the book and its associated web site will guide practitioners to updated literature, new applications, and on-line software.",2000,27,13846,1176,True,Mathematics,1685083,N. Cristianini,1404459229.0,J. Shawe-Taylor,,,,,,,,,Computer Science,,,,,,,,,,,,,,,,,,,,,,,,,,,,,,,,,,,,,,,,,,,,,,,,,,,,,,,,,,,,,
cb8a1b8d87a3fef15635eb4a32173f9c6f966055,https://www.semanticscholar.org/paper/cb8a1b8d87a3fef15635eb4a32173f9c6f966055,A Survey on Deep Learning,"The field of machine learning is witnessing its golden era as deep learning slowly becomes the leader in this domain. Deep learning uses multiple layers to represent the abstractions of data to build computational models. Some key enabler deep learning algorithms such as generative adversarial networks, convolutional neural networks, and model transfers have completely changed our perception of information processing. However, there exists an aperture of understanding behind this tremendously fast-paced domain, because it was never previously represented from a multiscope perspective. The lack of core understanding renders these powerful methods as black-box machines that inhibit development at a fundamental level. Moreover, deep learning has repeatedly been perceived as a silver bullet to all stumbling blocks in machine learning, which is far from the truth. This article presents a comprehensive review of historical and recent state-of-the-art approaches in visual, audio, and text processing; social network analysis; and natural language processing, followed by the in-depth analysis on pivoting and groundbreaking advances in deep learning applications. It was also undertaken to review the issues faced in deep learning such as unsupervised learning, black-box models, and online learning and to illustrate how these challenges can be transformed into prolific future research avenues.",2018,183,410,11,False,Computer Science,1997924,Samira Pouyanfar,8062083.0,Saad Sadiq,39588413.0,Yilin Yan,2229900.0,Haiman Tian,2868174.0,Yudong Tao,39611894.0,Maria E. Presa-Reyes,,144987531.0,M. Shyu,1705664.0,Shu‐Ching Chen,153093860.0,S. S. Iyengar,,,,,,,,,,,,,,,,,,,,,,,,,,,,,,,,,,,,,,,,,,,,,,,,,,,,,,,
b57e6468740d9320f3f14c6079168b8e21366416,https://www.semanticscholar.org/paper/b57e6468740d9320f3f14c6079168b8e21366416,The History Began from AlexNet: A Comprehensive Survey on Deep Learning Approaches,"Deep learning has demonstrated tremendous success in variety of application domains in the past few years. This new field of machine learning has been growing rapidly and applied in most of the application domains with some new modalities of applications, which helps to open new opportunity. There are different methods have been proposed on different category of learning approaches, which includes supervised, semi-supervised and un-supervised learning. The experimental results show state-of-the-art performance of deep learning over traditional machine learning approaches in the field of Image Processing, Computer Vision, Speech Recognition, Machine Translation, Art, Medical imaging, Medical information processing, Robotics and control, Bio-informatics, Natural Language Processing (NLP), Cyber security, and many more. This report presents a brief survey on development of DL approaches, including Deep Neural Network (DNN), Convolutional Neural Network (CNN), Recurrent Neural Network (RNN) including Long Short Term Memory (LSTM) and Gated Recurrent Units (GRU), Auto-Encoder (AE), Deep Belief Network (DBN), Generative Adversarial Network (GAN), and Deep Reinforcement Learning (DRL). In addition, we have included recent development of proposed advanced variant DL techniques based on the mentioned DL approaches. Furthermore, DL approaches have explored and evaluated in different application domains are also included in this survey. We have also comprised recently developed frameworks, SDKs, and benchmark datasets that are used for implementing and evaluating deep learning approaches. There are some surveys have published on Deep Learning in Neural Networks [1, 38] and a survey on RL [234]. However, those papers have not discussed the individual advanced techniques for training large scale deep learning models and the recently developed method of generative models [1].",2018,287,498,56,False,Computer Science,1932404,Md. Zahangir Alom,1799779.0,T. Taha,2498059.0,C. Yakopcic,40893684.0,Stefan Westberg,2325550.0,P. Sidike,100898809.0,M. S. Nasrin,,32977294.0,B. V. Essen,144948131.0,A. Awwal,2401900.0,V. Asari,,,,,,,,,,,,,,,,,,,,,,,,,,,,,,,,,,,,,,,,,,,,,,,,,,,,,,,
38aff6df1accc456f6cda7d16d4b9ecf418ef21e,https://www.semanticscholar.org/paper/38aff6df1accc456f6cda7d16d4b9ecf418ef21e,Map-Reduce for Machine Learning on Multicore,"We are at the beginning of the multicore era. Computers will have increasingly many cores (processors), but there is still no good programming framework for these architectures, and thus no simple and unified way for machine learning to take advantage of the potential speed up. In this paper, we develop a broadly applicable parallel programming method, one that is easily applied to many different learning algorithms. Our work is in distinct contrast to the tradition in machine learning of designing (often ingenious) ways to speed up a single algorithm at a time. Specifically, we show that algorithms that fit the Statistical Query model [15] can be written in a certain ""summation form,"" which allows them to be easily parallelized on multicore computers. We adapt Google's map-reduce [7] paradigm to demonstrate this parallel speed up technique on a variety of learning algorithms including locally weighted linear regression (LWLR), k-means, logistic regression (LR), naive Bayes (NB), SVM, ICA, PCA, gaussian discriminant analysis (GDA), EM, and backpropagation (NN). Our experimental results show basically linear speedup with an increasing number of processors.",2006,31,1143,55,False,Computer Science,2551676,Cheng-Tao Chu,2109828167.0,Sang Kyun Kim,47904256.0,Yi-An Lin,2117163611.0,YuanYuan Yu,1720184.0,G. Bradski,34699434.0,A. Ng,,1746638.0,K. Olukotun,,,,,,,,,,,,,,,,,,,,,,,,,,,,,,,,,,,,,,,,,,,,,,,,,,,,,,,,,,,
