db64f424710d57025c5fb42a564551f093a4d111,https://www.semanticscholar.org/paper/db64f424710d57025c5fb42a564551f093a4d111,The Extreme Value Machine,"It is often desirable to be able to recognize when inputs to a recognition function learned in a supervised manner correspond to classes unseen at training time. With this ability, new class labels could be assigned to these inputs by a human operator, allowing them to be incorporated into the recognition function—ideally under an efficient incremental update mechanism. While good algorithms that assume inputs from a fixed set of classes exist, e.g. , artificial neural networks and kernel machines, it is not immediately obvious how to extend them to perform incremental learning in the presence of unknown query classes. Existing algorithms take little to no distributional information into account when learning recognition functions and lack a strong theoretical foundation. We address this gap by formulating a novel, theoretically sound classifier—the Extreme Value Machine (EVM). The EVM has a well-grounded interpretation derived from statistical Extreme Value Theory (EVT), and is the first classifier to be able to perform nonlinear kernel-free variable bandwidth incremental learning. Compared to other classifiers in the same deep network derived feature space, the EVM is accurate and efficient on an established benchmark partition of the ImageNet dataset.",2015,67,164,25,False,Computer Science,39886114,Ethan M. Rudd,34939951.0,Lalit P. Jain,2613438.0,W. Scheirer,32163276.0,T. Boult,,,,,Medicine,,,,,,,,,,,,,,,,,,,,,,,,,,,,,,,,,,,,,,,,,,,,,,,,,,,,,,,,,,,,,
cc7827a17a7759a04aa389290d1a874db56e85e5,https://www.semanticscholar.org/paper/cc7827a17a7759a04aa389290d1a874db56e85e5,Meta-Learning: A Survey,"Meta-learning, or learning to learn, is the science of systematically observing how different machine learning approaches perform on a wide range of learning tasks, and then learning from this experience, or meta-data, to learn new tasks much faster than otherwise possible. Not only does this dramatically speed up and improve the design of machine learning pipelines or neural architectures, it also allows us to replace hand-engineered algorithms with novel approaches learned in a data-driven way. In this chapter, we provide an overview of the state of the art in this fascinating and continuously evolving field.",2018,207,369,22,False,Computer Science,1717534,J. Vanschoren,,,,,,,,,,,Mathematics,,,,,,,,,,,,,,,,,,,,,,,,,,,,,,,,,,,,,,,,,,,,,,,,,,,,,,,,,,,,,
12d1d070a53d4084d88a77b8b143bad51c40c38f,https://www.semanticscholar.org/paper/12d1d070a53d4084d88a77b8b143bad51c40c38f,Reinforcement Learning: A Survey,"This paper surveys the field of reinforcement learning from a computer-science perspective. It is written to be accessible to researchers familiar with machine learning. Both the historical basis of the field and a broad selection of current work are summarized. Reinforcement learning is the problem faced by an agent that learns behavior through trial-and-error interactions with a dynamic environment. The work described here has a resemblance to work in psychology, but differs considerably in the details and in the use of the word ""reinforcement."" The paper discusses central issues of reinforcement learning, including trading off exploration and exploitation, establishing the foundations of the field via Markov decision theory, learning from delayed reinforcement, constructing empirical models to accelerate learning, making use of generalization and hierarchy, and coping with hidden state. It concludes with a survey of some implemented systems and an assessment of the practical utility of current methods for reinforcement learning.",1996,128,7677,435,True,Computer Science,1709512,L. Kaelbling,144885169.0,M. Littman,1760402.0,A. Moore,,,,,,,,,,,,,,,,,,,,,,,,,,,,,,,,,,,,,,,,,,,,,,,,,,,,,,,,,,,,,,,,,,,,
4ea55038daf0907d27296de047008fb58def41c5,https://www.semanticscholar.org/paper/4ea55038daf0907d27296de047008fb58def41c5,Applications of Deep Learning and Reinforcement Learning to Biological Data,"Rapid advances in hardware-based technologies during the past decades have opened up new possibilities for life scientists to gather multimodal data in various application domains, such as omics, bioimaging, medical imaging, and (brain/body)–machine interfaces. These have generated novel opportunities for development of dedicated data-intensive machine learning techniques. In particular, recent research in deep learning (DL), reinforcement learning (RL), and their combination (deep RL) promise to revolutionize the future of artificial intelligence. The growth in computational power accompanied by faster and increased data storage, and declining computing costs have already allowed scientists in various fields to apply these techniques on data sets that were previously intractable owing to their size and complexity. This paper provides a comprehensive survey on the application of DL, RL, and deep RL techniques in mining biological data. In addition, we compare the performances of DL techniques when applied to different data sets across various application domains. Finally, we outline open issues in this challenging research area and discuss future development perspectives.",2017,222,466,3,True,Computer Science,144774721,M. Mahmud,4216715.0,M. S. Kaiser,144664815.0,A. Hussain,47323504.0,S. Vassanelli,,,,,Mathematics,,,,,,,,,Medicine,,,,,,,,,,,,,,,,,,,,,,,,,,,,,,,,,,,,,,,,,,,,,,,,,,,,
7e910b031e703caf683d44d7417d702a5aba2e95,https://www.semanticscholar.org/paper/7e910b031e703caf683d44d7417d702a5aba2e95,"Handbook Of Research On Machine Learning Applications and Trends: Algorithms, Methods and Techniques (2 Volumes)","The machine learning approach provides a useful tool when the amount of data is very large and a model is not available to explain the generation and relation of the data set. The Handbook of Research on Machine Learning Applications and Trends: Algorithms, Methods, and Techniques provides a set of practical applications for solving problems and applying various techniques in automatic data extraction and setting. A defining collection of field advancements, this Handbook of Research fills the gap between theory and practice, providing a strong reference for academicians, researchers, and practitioners.",2009,83,368,6,True,Computer Science,2060576305,E. S. Olivas,103992067.0,J. D. M. Guerrero,71631370.0,M. M. Sober,35119570.0,J. Benedito,152692443.0,A. López,,,,,,,,,,,,,,,,,,,,,,,,,,,,,,,,,,,,,,,,,,,,,,,,,,,,,,,,,,,,,,,,
a191715b2e3e51cc08114e759b7bf7fdf9f2c206,https://www.semanticscholar.org/paper/a191715b2e3e51cc08114e759b7bf7fdf9f2c206,Deep Learning with Python,"Summary Deep Learning with Python introduces the field of deep learning using the Python language and the powerful Keras library. Written by Keras creator and Google AI researcher Franois Chollet, this book builds your understanding through intuitive explanations and practical examples. Purchase of the print book includes a free eBook in PDF, Kindle, and ePub formats from Manning Publications. About the Technology Machine learning has made remarkable progress in recent years. We went from near-unusable speech and image recognition, to near-human accuracy. We went from machines that couldn't beat a serious Go player, to defeating a world champion. Behind this progress is deep learninga combination of engineering advances, best practices, and theory that enables a wealth of previously impossible smart applications. About the Book Deep Learning with Python introduces the field of deep learning using the Python language and the powerful Keras library. Written by Keras creator and Google AI researcher Franois Chollet, this book builds your understanding through intuitive explanations and practical examples. You'll explore challenging concepts and practice with applications in computer vision, natural-language processing, and generative models. By the time you finish, you'll have the knowledge and hands-on skills to apply deep learning in your own projects. What's Inside Deep learning from first principles Setting up your own deep-learning environment Image-classification models Deep learning for text and sequences Neural style transfer, text generation, and image generation About the Reader Readers need intermediate Python skills. No previous experience with Keras, TensorFlow, or machine learning is required. About the Author Franois Chollet works on deep learning at Google in Mountain View, CA. He is the creator of the Keras deep-learning library, as well as a contributor to the TensorFlow machine-learning framework. He also does deep-learning research, with a focus on computer vision and the application of machine learning to formal reasoning. His papers have been published at major conferences in the field, including the Conference on Computer Vision and Pattern Recognition (CVPR), the Conference and Workshop on Neural Information Processing Systems (NIPS), the International Conference on Learning Representations (ICLR), and others.",2017,0,442,41,False,Computer Science,1565641737,François Chollet,,,,,,,,,,,,,,,,,,,,,,,,,,,,,,,,,,,,,,,,,,,,,,,,,,,,,,,,,,,,,,,,,,,,,,,,
efd68f3724942c9de5dc804d3c7cb3f70f42234b,https://www.semanticscholar.org/paper/efd68f3724942c9de5dc804d3c7cb3f70f42234b,Deep learning for computational biology,"Technological advances in genomics and imaging have led to an explosion of molecular and cellular profiling data from large numbers of samples. This rapid increase in biological data dimension and acquisition rate is challenging conventional analysis strategies. Modern machine learning methods, such as deep learning, promise to leverage very large data sets for finding hidden structure within them, and for making accurate predictions. In this review, we discuss applications of this new breed of analysis approaches in regulatory genomics and cellular imaging. We provide background of what deep learning is, and the settings in which it can be successfully applied to derive biological insights. In addition to presenting specific applications and providing tips for practical use, we also highlight possible pitfalls and limitations to guide computational biologists when and how to make the most use of this new technology.",2016,136,937,29,False,Medicine,2414348,Christof Angermueller,3451978.0,Tanel Pärnamaa,2827805.0,L. Parts,152423211.0,O. Stegle,,,,,Biology,,,,,,,,,,,,,,,,,,,,,,,,,,,,,,,,,,,,,,,,,,,,,,,,,,,,,,,,,,,,,
767dcaf77f73f958cfee0f54cfcde0882e8ec50e,https://www.semanticscholar.org/paper/767dcaf77f73f958cfee0f54cfcde0882e8ec50e,Deep Learning: A Practitioner's Approach,"Although interest in machine learning has reached a high point, lofty expectations often scuttle projects before they get very far. How can machine learningespecially deep neural networksmake a real difference in your organization? This hands-on guide not only provides the most practical information available on the subject, but also helps you get started building efficient deep learning networks. Authors Adam Gibson and Josh Patterson provide theory on deep learning before introducing their open-source Deeplearning4j (DL4J) library for developing production-class workflows. Through real-world examples, youll learn methods and strategies for training deep network architectures and running deep learning workflows on Spark and Hadoop with DL4J. Dive into machine learning concepts in general, as well as deep learning in particular Understand how deep networks evolved from neural network fundamentals Explore the major deep network architectures, including Convolutional and Recurrent Learn how to map specific deep networks to the right problem Walk through the fundamentals of tuning general neural networks and specific deep network architectures Use vectorization techniques for different data types with DataVec, DL4Js workflow toolLearn how to use DL4J natively on Spark and Hadoop",2017,0,362,50,False,Computer Science,2055466552,Joshua Patterson,2052126530.0,Adam Gibson,,,,,,,,,,,,,,,,,,,,,,,,,,,,,,,,,,,,,,,,,,,,,,,,,,,,,,,,,,,,,,,,,,,,,,
298af26244e3ad836c1aa5cf5855d05f5197063d,https://www.semanticscholar.org/paper/298af26244e3ad836c1aa5cf5855d05f5197063d,Machine Learning Methods Without Tears: A Primer for Ecologists,"Machine learning methods, a family of statistical techniques with origins in the field of artificial intelligence, are recognized as holding great promise for the advancement of understanding and prediction about ecological phenomena. These modeling techniques are flexible enough to handle complex problems with multiple interacting elements and typically outcompete traditional approaches (e.g., generalized linear models), making them ideal for modeling ecological systems. Despite their inherent advantages, a review of the literature reveals only a modest use of these approaches in ecology as compared to other disciplines. One potential explanation for this lack of interest is that machine learning techniques do not fall neatly into the class of statistical modeling approaches with which most ecologists are familiar. In this paper, we provide an introduction to three machine learning approaches that can be broadly used by ecologists: classification and regression trees, artificial neural networks, and evolutionary computation. For each approach, we provide a brief background to the methodology, give examples of its application in ecology, describe model development and implementation, discuss strengths and weaknesses, explore the availability of statistical software, and provide an illustrative example. Although the ecological application of machine learning approaches has increased, there remains considerable skepticism with respect to the role of these techniques in ecology. Our review encourages a greater understanding of machine learning approaches and promotes their future application and utilization, while also providing a basis from which ecologists can make informed decisions about whether to select or avoid these approaches in their future modeling endeavors.",2008,110,563,35,True,Computer Science,2008387,J. Olden,34870951.0,J. Lawler,1991309.0,N. Poff,,,,,,,Medicine,,,,,,,,,,,,,,,,,,,,,,,,,,,,,,,,,,,,,,,,,,,,,,,,,,,,,,,,,,,,,
6241276a3074f73c1ce9b9ce4ac69f748732aecd,https://www.semanticscholar.org/paper/6241276a3074f73c1ce9b9ce4ac69f748732aecd,Data Mining and Machine Learning in Astronomy,"We review the current state of data mining and machine learning in astronomy. 'Data Mining' can have a somewhat mixed connotation from the point of view of a researcher in this field. If used correctly, it can be a powerful approach, holding the potential to fully exploit the exponentially increasing amount of available data, promising great scientific advance. However, if misused, it can be little more than the black-box application of complex computing algorithms that may give little physical insight, and provide questionable results. Here, we give an overview of the entire data mining process, from data collection through to the interpretation of results. We cover common machine learning algorithms, such as artificial neural networks and support vector machines, applications from a broad range of astronomy, emphasizing those where data mining techniques directly resulted in improved science, and important current and future directions, including probability density functions, parallel algorithms, petascale computing, and the time domain. We conclude that, so long as one carefully selects an appropriate algorithm, and is guided by the astronomical problem at hand, data mining can be very much the powerful tool, and not the questionable black box.",2009,314,271,16,True,Physics,2332144,N. Ball,102648043.0,Robert J. Brunner Herzberg Institute of Astrophysics,2073777983.0,Victoria,80559887.0,Bc,69477256.0,Canada.,102339916.0,D. O. Astronomy,,103072545.0,U. I. Urbana-Champaign,,,,,,,,,,,,,,,,,,,,,,,,,,,,,,,,,,,,,,,,,,,,,,,,,,,,,,,,,,,
cf8f2ca0c2d618104bc8724a6effc509088f16c4,https://www.semanticscholar.org/paper/cf8f2ca0c2d618104bc8724a6effc509088f16c4,Never-Ending Learning,"Whereas people learn many different types of knowledge from diverse experiences over many years, most current machine learning systems acquire just a single function or data model from just a single data set. We propose a neverending learning paradigm for machine learning, to better reflect the more ambitious and encompassing type of learning performed by humans. As a case study, we describe the Never-Ending Language Learner (NELL), which achieves some of the desired properties of a never-ending learner, and we discuss lessons learned. NELL has been learning to read the web 24 hours/day since January 2010, and so far has acquired a knowledge base with over 80 million confidenceweighted beliefs (e.g., servedWith(tea, biscuits)). NELL has also learned millions of features and parameters that enable it to read these beliefs from the web. Additionally, it has learned to reason over these beliefs to infer new beliefs, and is able to extend its ontology by synthesizing new relational predicates. NELL can be tracked online at http://rtw.ml.cmu.edu, and followed on Twitter at @CMUNELL.",2012,58,823,60,True,Computer Science,40975594,Tom Michael Mitchell,50056360.0,William W. Cohen,1842532.0,Estevam Hruschka,2406435.0,Partha P. Talukdar,2119660368.0,Bo Yang,31779043.0,J. Betteridge,Psychology,143818235.0,Andrew Carlson,40135250.0,Bhavana Dalvi,40642935.0,Matt Gardner,16411658.0,B. Kisiel,,2517825.0,J. Krishnamurthy,1914797.0,N. Lao,2406799.0,Kathryn Mazaitis,35645263.0,Thahir Mohamed,3115592.0,Ndapandula Nakashole,144888672.0,Emmanouil Antonios Platanios,1863425.0,Alan Ritter,32402038.0,M. Samadi,1717452.0,Burr Settles,2108772203.0,Richard C. Wang,2129412.0,D. Wijaya,1726095131.0,A. Gupta,39717886.0,Xinlei Chen,2407368.0,Abulhair Saparov,2062798496.0,Malcolm Greaves,122360608.0,Joel Welling,,,,,,,,,,,,,,,,,,,,
1242d79573397094c5670f55e58c8333cced0beb,https://www.semanticscholar.org/paper/1242d79573397094c5670f55e58c8333cced0beb,Deep Learning: A Primer for Radiologists.,"Deep learning is a class of machine learning methods that are gaining success and attracting interest in many domains, including computer vision, speech recognition, natural language processing, and playing games. Deep learning methods produce a mapping from raw inputs to desired outputs (eg, image classes). Unlike traditional machine learning methods, which require hand-engineered feature extraction from inputs, deep learning methods learn these features directly from data. With the advent of large datasets and increased computing power, these methods can produce models with exceptional performance. These models are multilayer artificial neural networks, loosely inspired by biologic neural systems. Weighted connections between nodes (neurons) in the network are iteratively adjusted based on example pairs of inputs and target outputs by back-propagating a corrective error signal through the network. For computer vision tasks, convolutional neural networks (CNNs) have proven to be effective. Recently, several clinical applications of CNNs have been proposed and studied in radiology for classification, detection, and segmentation tasks. This article reviews the key concepts of deep learning for clinical radiologists, discusses technical requirements, describes emerging applications in clinical radiology, and outlines limitations and future directions in this field. Radiologists should become familiar with the principles and potential applications of deep learning in medical imaging. ©RSNA, 2017.",2017,28,583,14,True,Medicine,38162399,G. Chartrand,34842677.0,P. Cheng,37627814.0,Eugene Vorontsov,3325894.0,M. Drozdzal,3622148.0,S. Turcotte,1972076.0,C. Pal,,1781469.0,S. Kadoury,2080173111.0,A. Tang,,,,,,,,,,,,,,,,,,,,,,,,,,,,,,,,,,,,,,,,,,,,,,,,,,,,,,,,,
bcce96a2a074448953fc61a29a84afbdfc8db55a,https://www.semanticscholar.org/paper/bcce96a2a074448953fc61a29a84afbdfc8db55a,Online Learning and Online Convex Optimization,"Online learning is a well established learning paradigm which has both theoretical and practical appeals. The goal of online learning is to make a sequence of accurate predictions given knowledge of the correct answer to previous prediction tasks and possibly additional available information. Online learning has been studied in several research fields including game theory, information theory, and machine learning. It also became of great interest to practitioners due the recent emergence of large scale applications such as online advertisement placement and online web ranking. In this survey we provide a modern overview of online learning. Our goal is to give the reader a sense of some of the interesting ideas and in particular to underscore the centrality of convexity in deriving efficient online learning algorithms. We do not mean to be comprehensive but rather to give a high-level, rigorous yet easy to follow, survey.",2012,48,1732,216,False,Computer Science,1389955537,S. Shalev-Shwartz,,,,,,,,,,,,,,,,,,,,,,,,,,,,,,,,,,,,,,,,,,,,,,,,,,,,,,,,,,,,,,,,,,,,,,,,
7c7f1bb3d483df4c4a20b78a91b833f32d6bdcc5,https://www.semanticscholar.org/paper/7c7f1bb3d483df4c4a20b78a91b833f32d6bdcc5,Machine learning in virtual screening.,"In this review, we highlight recent applications of machine learning to virtual screening, focusing on the use of supervised techniques to train statistical learning algorithms to prioritize databases of molecules as active against a particular protein target. Both ligand-based similarity searching and structure-based docking have benefited from machine learning algorithms, including naïve Bayesian classifiers, support vector machines, neural networks, and decision trees, as well as more traditional regression techniques. Effective application of these methodologies requires an appreciation of data preparation, validation, optimization, and search methodologies, and we also survey developments in these areas.",2009,161,167,4,False,Computer Science,20751784,James L. Melville,1741789.0,E. Burke,2499418.0,J. Hirst,,,,,,,Medicine,,,,,,,,,,,,,,,,,,,,,,,,,,,,,,,,,,,,,,,,,,,,,,,,,,,,,,,,,,,,,
ccd1282aea3cc7c3d40300d82472fc5f9f54cb8e,https://www.semanticscholar.org/paper/ccd1282aea3cc7c3d40300d82472fc5f9f54cb8e,Online Learning for Matrix Factorization and Sparse Coding,"Sparse coding--that is, modelling data vectors as sparse linear combinations of basis elements--is widely used in machine learning, neuroscience, signal processing, and statistics. This paper focuses on the large-scale matrix factorization problem that consists of learning the basis set in order to adapt it to specific data. Variations of this problem include dictionary learning in signal processing, non-negative matrix factorization and sparse principal component analysis. In this paper, we propose to address these tasks with a new online optimization algorithm, based on stochastic approximations, which scales up gracefully to large data sets with millions of training samples, and extends naturally to various matrix factorization formulations, making it suitable for a wide range of learning problems. A proof of convergence is presented, along with experiments with natural images and genomic data demonstrating that it leads to state-of-the-art performance in terms of speed and optimization for both small and large data sets.",2009,94,2506,299,False,Computer Science,2599292,J. Mairal,144570279.0,F. Bach,144189388.0,J. Ponce,1699339.0,G. Sapiro,,,,,Mathematics,,,,,,,,,,,,,,,,,,,,,,,,,,,,,,,,,,,,,,,,,,,,,,,,,,,,,,,,,,,,,
872352b0a53ab6cbb4420f81df64d215d86c7d9b,https://www.semanticscholar.org/paper/872352b0a53ab6cbb4420f81df64d215d86c7d9b,Emotions from Text: Machine Learning for Text-based Emotion Prediction,"In addition to information, text contains attitudinal, and more specifically, emotional content. This paper explores the text-based emotion prediction problem empirically, using supervised machine learning with the SNoW learning architecture. The goal is to classify the emotional affinity of sentences in the narrative domain of children's fairy tales, for subsequent usage in appropriate expressive rendering of text-to-speech synthesis. Initial experiments on a preliminary data set of 22 fairy tales show encouraging results over a naive baseline and BOW approach for classification of emotional versus non-emotional contents, with some dependency on parameter tuning. We also discuss results for a tripartite model which covers emotional valence, as well as feature set alternations. In addition, we present plans for a more cognitively sound sequential model, taking into consideration a larger set of basic emotions.",2005,35,865,59,True,Computer Science,144648940,Cecilia Ovesdotter Alm,144590225.0,D. Roth,145421878.0,R. Sproat,,,,,,,,,,,,,,,,,,,,,,,,,,,,,,,,,,,,,,,,,,,,,,,,,,,,,,,,,,,,,,,,,,,,
a206216c3f67605ac6e25b0178c3f156dc0f7ba0,https://www.semanticscholar.org/paper/a206216c3f67605ac6e25b0178c3f156dc0f7ba0,WEKA: a machine learning workbench,"WEKA is a workbench for machine learning that is intended to aid in the application of machine learning techniques to a variety of real-world problems, in particular, those arising from agricultural and horticultural domains. Unlike other machine learning projects, the emphasis is on providing a working environment for the domain specialist rather than the machine learning expert. Lessons learned include the necessity of providing a wealth of interactive tools for data manipulation, result visualization, database linkage, and cross-validation and comparison of rule sets, to complement the basic machine learning tools.<<ETX>>",1994,22,1054,112,True,Computer Science,144189431,G. Holmes,1382098662.0,A. Donkin,9419406.0,I. Witten,,,,,,,,,,,,,,,,,,,,,,,,,,,,,,,,,,,,,,,,,,,,,,,,,,,,,,,,,,,,,,,,,,,,
